work	date	issue	page	block	height	width	hpos	vpos	text	active_words	occurrences_words	unique_words
matin	1890-06-18	1	4	P4_TB00010	1056	920	1075	1181	léon lelong, dit d'artagnan, un forçat que la misère dfes temps a contraint à se faire simple pick-pocket, -vient de mettre pendant plusieurs mois en echec le flair des inspecteurs dés magasins du louvre. ce amble d'homme avait une habileté tellement grande que,quoique étroitement surveillé durant chacune de ses visites dans les magasins du louvre, il trouvait cependant' moyen d'y opérer des vols importants. le 9 avril dernier, m. l'inspecteur bouilhaud le surprit enfin au moment où, en compagnie de mme leyrsèle, sa complice, il dérobait 25 paires de gants et quatre coupons de soie d'une valeur totale de 477 francs 80 centimes. , „ t après bien des tergiversations, mme leyrsele se décida à faire des aveux et a raconter que d'artagnan, dont elle avait fait la connaissance dans un calé du boulevard, était son professeur de vol. elle l'accompagnait dans les magasins do nouveautés. d'artagnan préparait les marchandises à prendre, que mme leyrsêle, qui venait quelques mètres plus loin, engouflrait dans une grande poclie ad lioc ménagée dans 1 intérieur de son manteau. , lelong et sa complice ont comparu, hier, dorant la huitième chambre correctionnelle, présidée par m. jules mol eux. * m. le président a exposé les antécédents du prévenu, condamné à douze ans de travaux forcés pour faux et vol. le 28 septembre 1887. lelong, au milieu de pénis incroyables, s'évada de la guyane et revint en hate a paris s'établir pick-poket et voleur dans les magasins de nouveautés. . , . , , . le forçat a été condamné à six mois de prison et a la relégation. mme leyrsôle en a été quitte pour quatre mois d'emprisonnement.	pénis	1	1
gaulois	1890-06-19	1	1	P1_TB00047	2200	791	4267	1015	nous lui a fait de sérieuses propositions pour une tournée dans les etats-unis. quatrième pigeon. nous avons à bord une troupe de minstrels. cette nuit, vers une heure, une délicieuse mélodie nous attirait tous sur je pont. quelle ne fut pas notre surprise, et aussi notre joie, en voyant les minstrels massés devant la cabine d'eyraud, et donnant une sérénade à l'infortuné détenu. eyraud a répondu d'une voix étranglée, comme gouffé : « merci, mes amis, merci ! » une collecte, jaite parmi les assistants, a produit deux mille francs. les minstrels ont refusé de l'accepter, et l'ont remise tout entière à eyraud, qui s'est écrié : «ah ! si j'avais eu ça plus tôt, gouffé vivrait encore i » un éclat de rire général a accueilli cette exquise plaisanterie. cinquième pigeon. eyraud a fait, cet après-midi, une conférence sur l'affaire de la rue tronson-du-coudray, au bénéfice de gabrielle bompard. il y avait trois sortes de places : à cinq louis, à trois louis et à deux louis. pas de billets de faveur. certains passagers ont payé leur place jusqu'à cinquante louis. le succès du conférencier a été considérable. plusieurs fois les salves d'applaudissements l'ont forcé de s'arrêter. les dames surtout étaient charmées. il a fait, à propos de gabrielle bompard, une théorie sur la « femme-petit-démon », qui dénote une profonde connaissance du cœur féminin. les passages où eyraud stigmatisait le libertinage de l'huissier gouffé ont été bissés. l'infortuné détenu s'exprime avec une facilité et une élégance qui le désignent à l'attention de m. bodinier. sixième pigeon. ce matin, le capitaine du lafayette a rendu visite à eyraud. le malheureux prisonnier a dit au capitaine : « ah l vous voilà, vieux loup de mer ! » le capitaine a répondu : « si je suis un vieux loup de mer vous êtes un jeune loup de terre i » on ne saurait faire plus délicatement allusion aux exploits d'un criminel. après quelques instants d'entretien sur la mer, les tempêtes et l'art de la navigation, le capitaine a demandé à eyraud l'autorisation de se retirer, que le détenu lui a gracieusement accordée. le capitaine est enchanté de sa conversation avec eyraud, et déclare que, dans ses nombreuses traversées, il a rarement eu affaire à un passager aussi charmant. dernière heure. les six derniers pigeons n'ont pu nous parvenir. ils ont été dévorés par eyraud, qui avait manifesté le désir de manger du pigeon aux petits pois. tout nous porte à croire, néanmoins, que la traversée s'achèvera sans encombre, et qu'eyraud nous arrivera en excellente forme pour le rush dernier des assises. tout-paris	libertinage	1	1
lanterne	1890-06-19	1	1	PAG_00000001_TB000099	269	1057	5792	1698	s'est adoucie. la gitane ne se donnera pas au bout de sa danse ; elle ne se sent point tenue de troubler si profondément la sensualité des hommes ; par la liberté qu4 cette indépendance lui laisse, l'art renq'.{l en scène.	sensualité	1	1
lanterne	1890-06-22	2	2	PAG_00000002_TB000023	334	1024	418	3722	ni mes habitudes, ni mes goûts ne m'entraînent vers la contemplation des tableaux vivants et lès folies du libertinage sénile. j'aime le plaisir naturel, délicat, brodé, agrémenté ; je l'aime à deux — elle et moi — et si elle accepte tout, je ne refuse rien à la dame qui me passionne.	libertinage	1	1
radical	1890-06-23	1	3	PAG_00000003_TB000198	368	1027	245	7119	d.e brunes filles de ceylan, au type fin et délicat, de voluptueuses malabaraises et de provocantes danseuses venues de la malaisie faisaient l'attrait principal de ces fêtes tropicales. le champagne, le claret, le whisky les arrosaient.	voluptueuses	1	1
voleur_illustre	1890-06-26	1	3	PAG_00000003_TB000017	728	1328	1692	1700	les acacias qui bordent les talus sont en pleine floraison. leyr molle odeur de fleur d'oranger s'exhale dans l'air frais, mãªlã©e aux pa-rfums plus forts des lilas et des chã¨vrefeuilles qui foisonnent autour des maisons de campagne du voisinage et qui, par les glaces ouvertes, soufflent jusque dans le landau leurs voluptueuses haleines. au fond des vergers, des centaines de rossignols modulent des sã©rã©nades. leur chant est si puissant qu'il domine le bruit des roues et je trot des chevaux. cette nuit de parfums et de musique semble crã©ã©e exprã¨s pour servir de dã©cor ã  ces printaniã¨res amours. fabienne et georges fe sentent royalement heureux, et la plã©nitude de leur bonheur leur faittrouverducharme aux moindres dã©tails du paysage.	voluptueuses	1	1
gil_blas	1890-06-26	1	2	PAG_00000002_TB000214	308	1034	1562	7858	elle parlait avec des inflexions de voix très douces ; en même temps la pesée caressante du bras recommençait de plus belle ; de plus belle aussi, fa troublante et voluptueuse pression contre sa poitrine.	voluptueuse	1	1
temps	1890-06-28	2	2	Page1_Block8	4570	961	1121	356	ment que « la lippe autrichienne » caractérise la famille des habsbourg. la couleur des ievres est un peu rosée. les mains sont petites, les dcrfflfts lon£s et délicats, mais peaussés et ridés ; les pieds mesurent 18 centimètres et la taille 132 les •proportirms fie cette jeune mère étaient par- • faites, une miniature de jolie femme ; sa petite sta-_ ture pouvait passer pour le résultat de relations sexuelles préma urées ou de tout autre accident. mais, quand nous l’eûmes mise à côté de quelques garçons âgés de quinze à seize ans, et pris parmi , nos zanzibari, et ensuite à côté d’une femme indigène, il devint évident pour tous que ces myriïiidons représentent une race distincte. le 14, on repasse chez mazamboni et l’on fait la paix avec lui. il dit avoir pris les blancs pour des marchands d’esclaves et qu’il y a eu méprise. là on eut les premières nouvelles d’emin, que des indigènes avaient vu à bord de son vapeur quelques semaines après le de stanley de kavaili. chez mazamboni, les européens peuvent se livrer à des études ethnologiques bien au point de vue de la distribution des races dans l’afrique centrale. emin-pacha mais, sur cette route de retour au nyassa, ce ne sont plus seulement des cris de guerre qu’on entend. stanley a profité des bonnes des indigènes pour faire la paix avec la plupart d’entre eux. les voyageurs jouissent sans arrière-pensée de la beauté des paysages, du pays enchanteur qu’ils traversent, et, pour comble de bonheur, en arrivant sur un plateau qui domine le lac, on remet à stanley la lettre d’emin. le 29 avril, un noir jet de vapeur paraît à l’horizon. il grossit peu à peu. la coque d’un navire devient visible. dans le camp, ce sont des cris d’allégresse. le lendemain, le pacha débarque. un canot nous amena les visifeurs. a huit au milieu de l’allégresse générale, et après plusieurs salves de notre artillerie, emin-pacha entrait dans notre camp, accompagné par m. jeph- son, le capitaine casati et un autre officier. je leur serrai la main à tous, et demandai lequel était emin-paclia. alors un homme mince et assez petit, portant lunettes, attira mon attention par ces prononcées en excellent anglais : « je vous dois mille remerciements, monsieur stanley, et je ne sais vraiment comment vous toute ma reconnaissance. — ah! vous êtes emin-pacha? ne parlez pas de remerciements, mais venez, asseyez-vous. il fait si sombre ici que l’on ne peut pas se voir. » nous prîmes place à la porte de la tente. une bougie éclairait la scène. je m’étais attendu à voir un personnage à tournure martiale, grand et en uniforme égyptien tout râpé, et je me en face d’un homme maigriot, coiffé d’un fez, fort bien soigné, le linge éclatant do blancheur, parfaitement repassé et d’une coupe irréprochable. une barbe noire encore, mais grisonnante par encadrait un visage de type magyar, auquel des lunettes ajoutaient quelque chose qui pouvait rappeler un espagnol ou un italien. ce visage ne montrait aucune trace de maladie ou d’anxiété; tout au contraire, il indiquait un corps prospère et un esprit tranquille. tout à côté, le capitaine quoique plus jeune d’années, semblait anxieux, dévoré de soucis, vieux avant le temps. lui aussi portait des vêtements propres et le fez égyptien. un court résumé de nos incidents de voyage, des événements survenus en europe, des affaires dans les provinces équatoriales et de notre personnelle prit presque deux heures, après pour fêter l'heureuse rencontre, nous à la santé d’emin-pacha et du capitaine casati cinq bouteilles de champagne, présent de mon ami greshoff, de stanley-pool. on les reconduisit avec leur suite jusqu'au canot, qui les ramena au nous ne pouvons à notre grand regret les conversations échangées entre stanley et emin. stanley va droit au but ; il a des de son comité et du foreign office ; il veut les exécuter. emin hésite ; il estime que les instructions du khédive lui laissent une entière liberté. stanley insiste avec une impitoyable et puis, s’il tient le en grande estime, il lui paraît à certains indices que le pacha n’est pas le maître dans la province. mais ses arguments n’ébranlent pas emin ; stanley sent qu’il pas, je m’étais figuré qu'au bout d’une quinzaine nous marcherions tous au plateau, occuperions un convenable dans l’oundoussouma, où, après avoir tout fait pour installer notre monde en et confort, j’aurais couru vers l’arrière-colonne ; celle-ci une fois ralliée, nous aurions pris la route du zanzibar. mais le pacha m’inquiète. quand je lui parle du retour par la mer, il a une manière de taper sur son genou et de soui’ire, comme s’il « nous verrons, nous verrons! » il lui en coûte évidemment de quitter un pays où il était vice-roi. quant à casati, il est décidé à suivre le quoi qu’il fasse, et il le décharge à de ce qui arrivera. au fond, stanley ne pardonne pas à emin ses tergiversations. si le pacha avait été au rendez-vous à la fin de l’année 1887 — il eût pu y être — stanley n’eût pas perdu quatre mois au fort bodo ; il eût pu ramasser son arrière-garde avant la mort du major barttelot et le désastre de sa deuxième colonne.	sexuelles	1	1
rappel	1890-06-30	1	3	PAG_00000003_TB000330	463	994	4430	8703	» elle prétendait (mme de d.) qu'il avait agi ainsi, avec toutes ses conquêtes, par libertinage et vanité. le libertinage, je ne sais trop ce que c'est dans l'existence d'un homme de haut rang. j'ai vécu avec des gçns sagas, et je n'ai vu la débauche que chez ces pauvres ouvriers qui perdent'la raison daa3 le vin et bat-	libertinage	2	1
gaulois	1890-07-01	1	3	P3_TB00042	1734	779	4225	5389	gabale, à gilles de prays, un libertinage frénétiquese mêlait à ma soit de sang... eh bien, à la vue de cette malheureuse entant évanouie et mourante, mon âme s'est modifiée subitement. mon bras a été comme paralysé... j'ai donné ordre qu'on la mit au lit et que l'on prit soin d'elle. permettez-moi cette réflexion, m. le duc, on disait même presque que vous l'aimiez... non, caramia\... je la bais, au contraire! et pourtant, c'est vrai, quelque chose d'étrange, qui ressemble;! de l'air jctien, se mêle à ma haine. oui, je voudrais que cette maudite enfant fût morte, n'eût jamais existé; il y a quelque temps, je n'aurais pas hésité à lui enfoncer moimême un poignard dans la gorge, ou à l'étouffer, ou à l'enterrer toute vive: et maintenant, je ne ne puis me résoudre à la laisser mourir sans soins. j'ai leplus grand intérêt à sa mort: sa mort seule m'assure la sécurité; eh bien, je ne puis éonsentir à sa mort ! ici, nous sommes les maîtres ; que craignons-nous? il n'y a pas de refuge plus sûr eu europe. on sait que je viens parfois dans cette résidence mystérieuse. on peut soupçonner que je m'y trouve, mais nul ne me soupçonne d'un méfait quelconque, nul ne peut avoir l'idée de venir me chercher ici. quant à toi, tu n'es qu'un pauvre hère, de ceux qui disparaissent sans que l'on se préoccupe de leur défaite. tes créanciers eux-mêmes se garderont bien de te faire rechercher. ils ne comptent sur rien ! donc nous sommes libres ici, nous pouvons faire ee que nous voulons. qui donc nous arrête f car, toi aussi, tu manquerais du courage nécessaire pour frapper cette enfant. (a suivre.) simûk boubise	libertinage	1	1
gil_blas	1890-07-01	1	1	PAG_00000001_TB000178	782	1024	4432	4321	dans cette atmosphère nauséabonde qui met à ce pays de danse et d'amour un éternel nimbe morbide de typhus et de choléra, c'est, en effet, pour un étranger, une véritable surprise que le calme rayonnant de ceux qu'il y voit aimer et vivre. l'odeur troublante, l'odeur indéfinissable et mauvaise, il la retrouvera toujours, partout, même à l'alhambra, même au généralife, dans les grandes villes comme dans les petits bourgs, et il ne verra jamais, pourtant, dans cette peste, que la voluptueuse beauté des femmes et la contente tranquillité des hommes.	voluptueuse	1	1
le_pays	1890-07-01	1	3	PAG_3_TB000057	1212	1016	1214	7172	« le cobaye n'est d'ailleurs pas le seul animal qui pourrait servir ainsi à une destination aussi intéressante, le lapin, dont les facultés prolifiques sont si connues, serait certainement un excellent succédané du cobaye et fournirait un produit de haute marque, très apprécié des poseurs de lapins, qui se trouveraient ainsi à même de justifier une étymologie plus rationnelle. dès lors, l'australie n'aurait plus à offrir cent mille francs au pasteur qui communiquerait à ses légions de lapins la nostalgie de l'autre monde ; elle aurait mieux à faire; elle fabriquerait des tonneaux du liquide panacée qui viendrait faire concurrence, sur les marchés du monde entier, et même à la tribune de la rue des saints-pères, à tous les orviétans présents et à venir... à moins que le suc de testicule n'aille bientôt rejoindre dans les oubliettes de la thérapeutique l'inoffen-sive poudre d'yeux d'écrevisse. »	testicule	1	1
croix	1890-07-02	1	4	Page1_Block34	1563	1584	1033	2267	réception de tout l'ouvrage avant les verse versements échelonnés reconstitution complète da capital souscrit monsieur, j'ai l’honneur de vous faire une proposition que vous trouverez, je l’espère, très avantageuse. voici enfin réalisé le vœu souvent émis dans les congrès catholiques. un journal catholique l’annonce en ces termes : « vient de paraître, le tome v du dictionnaire des encyclopédie universelle des lettres, des sciences et des arts, sous la direction de mgr paul guérin, camérier de sa sainteté. l’ouvrage entier comprendra six volumes de i 200 à 1300 pages; (on commence à expédier le dernier aux souscripteurs). cette œuvre capitale, hautement approuvée, va enfin permettre au! catholiques de puiser leurs renseignements à d’autres sources que celles que leur fournit la libre-pensée... » en effet, la plupart des dictionnaires et encyclopédies, de nos jours, sont plus ou moins empreints de l’esprit anticatholique, répandent dans les familles des erreurs pernicieuses et faussent l’esprit de la jeunesse. ii s’agissait de remplacer, de détrôner ces ouvrages dangereux sous le rapport de la foi. nous obtenons ee résultat en publiant le dictionnaire lexicographique et encyclopédique le plus complet, le plus exact, le plus au courant de la science, conçu dans l’esprit catholique et marqué au coin de la sincérité. le moniteur de rome (si bien placé pour juger une pareille a signalé et recommandé chaleureusement cette œuvre, comme devant être encouragée et propagée par le clergé, les catholiques et les conservateurs de tous les partis, et lui a prédit un brillant succès, qui s'annonce et s'accentue en effet chaque jour. il arrive ainsi que la bonne œuvre devient en même temps une bonne affaire. les imprimeries réunies, auxquelles je me suis adressé, à cause de leur immense et parfait outillage, n’engagent pas moins d'un million dans cette vaste entreprise, après avoir constaté} d’après ia, «rente*ordinaire de tous iésdiction- ’naire%-'q*‘ onï obtiendrait, aprèâ la terminaison ôqjl’thivragqj.jia premieivécouleinent d'au moins trente mille exemplaires'(par ce, genre d’ouvrage m’adresse a des centaines do mille acheteurs), et nu’orf vènbrâit ftk»einfembi*nsïôtetab asà-'shsille exdtûplàirespar air, * r ;•*’s» or j voici l'ouvrage terminé. mes droits d'auteur étant ctoa tnoiffsisfranes hak exemplaire* ” ’ ’ ... - - 'her de la suite. ' la combinaison ; ipahcs (c’est te :üiauiiliane).; /. j  [ '■* • ' ' '■ • è ■ aurez ,droit : 1° à la possession',, dé; tous les. voîrnnedcdtr; dictionnaire, et vous les recevrez dans la quinzaine; 2° a la reconstitution du*capital que vous aurez souscrit,' 180 francs, au moyen de la moitié -de mei droits d’auteur que je vous abandonne, et qui seront constatés par les iiwentq^is semestriels de la société des imprimeries réunies.' vous serez donc en rolufhes, avant,d’avoir rien versé; de plus, vous recouvrerez votre capital par la participation à mes droits, d’auteur. vous aurez, de la' sorte, pour rien* je dictionnaire des dictionnaires, ouvrage d’une utilité quotidienne, et moi, j aurai tout de suite deux mille personnes d’élite et bientôt davantage associées â ma croisade, deux mille propagateurs d’une œuvre destinée à faire-un bien immense. ! j '* n.-b.— ca-joint un bulletin de souscription, dont l’engagement a peu d'importance puisque vous’ né deverveïser que la 15 octobre, et qu’à ce moment,après avoir été remboursé en volumes, vous ne serez pas loin de commence* à toucher le dividende auquel vous avez droit,, jusqu’à con- *-rénce du chiffre d« 180 fr. — on m’a fait remarquer qu’un grand nombre de personnes qui ont budget modeste-s’empresseraient de souscrire, si je leur tacilitais le paiement par plusieurs —*- *-**” * ** — x ‘'dés mandats et des coït le mé rends volontiers i, zdopte«ee» délais, ces termes de paiement, et je modifie, en conformité — les	coït	1	1
presse	1890-07-06	1	3	Page1_Block30	1681	920	4008	5012	interruption, jetaient des lueurs fantastiques sur ce paysage étrange. plongés dans l'extase de leur amour, ro bert et carmen avaient oublié le monde en tier. les convulsions de la nature ne troublaient pas leur félicité. la pluie, ruisselant sur le toit en feuilles de palmier de leur carbet, semblait un murmure berçant leur voluptueuse rêverie... : tout à coup, dominant le mugissement de la tempête, un coup de feu retentit. et aussitôt des cris furieux,.des hurlements, un fracas abominable, de vociférations sau vages! . _ deux, trois coups de feu !... une fusillade... puis la détonation sèche de décharges nour ries de revolvers. et un cri lointain, qu'on distinguait cepen dant malgré la distance, malgré la tempête : — aux armes l. —oh ! mon dieu, qu'y a-t-il? s'écria car men. robert s'était levé. au loin on entendait toujours : — aux armes! les clameurs grandissaient. -r-mort aux gardes-chiourmes !... mort!... tuons tout !... tuons ! une révolte de forçats ! a un mystérieux signal ^ tous les transportés s'étaient dressés sur leur lit de camp, et, ivres d'une colère habilement attisée depuis long temps, s'étaient jetés sur les portes peu so lides de leurs cases. ils s'étaient précipités sur les factionnaires, tous ensemble, comme un troupeau de bêtes fauves, sans se cacher, en hurlant, et ils les avaient étranglés. peu leur importaient tes. cris d'alarme et les coups de feu d'appel...	voluptueuse	1	1
debats	1890-07-07	1	2	P2_TB00006	1683	788	3535	5363	romantique bien plutôt qu'en style louis xiii. un exemple me fera comprendre. chez bergerat, le prince dit à son fils : j'ai toléré longtemps que, fol entre les lous, vous mésusiez du temps où tout veut que l'on [aime ! mais vous dénaturez la nature elie-mème, (jusqu'ici, la couleur est bonne.) et vos débordemens ont atteint le bas-fonds où le libertinage au crime se confond ! malheureux! cette enfant que ta débauche vile epouvante, meurtrit, traque de ville en ville, elle est ta propre sœur, et ton viol hideux, monstre, aux mains du bourreau nous jette tous [les deux. le même passage, chez gautier, est beaucoup moins violent d'expression. lisez-le, et vous sentirez comme le ton et la couleur eu sont plus justes et comme l'écrivain y arrive, sans effort, à la perfection du pastiche ; « monsieur, dit le prince, vos équipées dépassent les bornes, et vos déportemens sont tels que je serai f rcé d'implorer du roi, pour vous, la faveur d'un cachot ou d'un exil perpétuels. le rapt, la séquestration, le viol ne sont plus de la galanterie, et si je peux passer quelque chose aux égaremens d'une jeunesse licencieuse, je n'excuserai jamais le crime froidement médité. savez-vous, monstre, continua-t-il -en s'approchant de vailombreuse et lui parlant à l'oreille de façon à n'être entendu de personne, savez-vous quelle est cette jeune fille, cette isabelle que vous avez enlevée en dépit de sa vertueuse résistance ? votre sœur ! » acte 5. au château de la misère. blême décor qu'au premier acte. le vieux	libertinage	1	1
le_pays	1890-07-07	1	2	PAG_2_TB000078	174	1010	4840	1063	privé de cette amitié, il s'en dédom-l mage amplement. en l'agréable compagnie de sa voluptueuse droguiste.	voluptueuse	1	1
lanterne	1890-07-10	1	3	PAG_00000003_TB000021	146	1025	390	4474	par cette accablante chaleur et dans la voluptueuse digestion de la dorade, je ne demandais qu'à remuer le moins possible.	voluptueuse	1	1
lanterne	1890-07-10	1	3	PAG_00000003_TB000111	519	1027	3644	3925	dès le lendemain du crime, je devins amoureux de rosalie, amoureux éperdument. je songeai aussitôt à en faire ma maîtresse. mais le croiriez-vous? je me heurtai à une résistance entêtée et joviale qui exaspéra, redoubla ma passion. a chaque tentative de caresses, elle répondait par ces simples mots, qui prenaient dans sa bouche — ou plutot dans mon imagination-la suavité d'une rare et voluptueuse musique.	voluptueuse	1	1
