work	date	issue	page	block	height	width	hpos	vpos	text	active_words	occurrences_words	unique_words
temps	1884-06-14	1	3	Page1_Block15	3759	935	3073	4427	tre encore sur la terre des régions ou lù jùtyënté masculine est inconnue, où les enfants n’existeni qu’au regard de la mère, où,le père demeure caché - dans les limbes de l’anonymg. nous n’en sommes plus à ignorer sans doute que la monogamie n’est pas de règle universelle,: qifil ÿ à des lieu* où des hommes ont plusieurs femmes, où les femmèë ôfit plusieurs hommes ; nous soupçonnons vaguement qu’un état de promiscuité des sexes, d’unions de tous avec tous, sans distinguer, entre parents et enfants; eiitrc frères et sœurs, a dû les premiers rudiments de ' ia fàiiiillë; même purement materfiêlle. nous n’étions point fixés là- dessus par des documents péremptoires. m. ; gi- raud-teulon iîovts ' a rendu le service de'nous mettrë en contact avec des faits qu-il a patiemment rassemblés d’une' main érudite, et qu’il fait défiler sous nos yeux sans que nous ayons de peine à prendre, sinon de' lire, ni d’effort à faire, sinon de chercher à comprendre. soyons reconnaissants au patieiit auteur d’avoir autour d’une question de cette importance, on ne peut plus humaine, réuni les pièces du dossier qui nous manquait. m*. téu- lou (il a soin de nous l’apprendre) s’est aidé dans son entreprise de t’important ouvrage de m. le docteur j.-j. bachofen, de bàle, sur le droit (muterrècm) ; 11 a fait son profit des recherches de m. mac lennan sur la des ,anciennes tribus -, de mm. morgan, fison et howitt, sur le système des parentés malaises et touraniennes, sur le tableau des sociétés d’australie. son travail personnel n’en demeure pas moins considérable et d’une réelle portée. pero sonne désormais ne pourra s’engager dans le sujet qu’il n’ait consulté ce volume, où abondent les les révélations souvent imprévues, toujours suggestives. ‘ ' * i • m. teuton n’a pas voulu conclure. il s’est borné volontairement, et non sans mérite, car il est doux de formuler, au rôle qu’il avait assumé, celui de pionnier défricheur sur un terrain presque - inexploré encore jusqu’à cés derniers temps; c’est en de discrètes insinuations seulement, én de rapides conjectures qu’il nous indique le chemin par où mariage et famille ont pu accomplir leurs étapes et réaliser leurs transformations. l’auteur nous excusera si nous nous montrons moins réservé que lui à cet égard. nous en le faisant que notre responsabilité. le mariage et la famille nous semblent, comme toutes choses, partir de l'état de diffusion pour marcher vers l’état de particularisation. règne èdtre la nature et la société ; une même loi les goùverne : u n’y a pas deux uni- vèrs. nous voyons les autres et les systèmes d’aé- tres se dégager par concentration de la nébuleuse cosmique, les organismes se dégager lentement en se distinguant toujours davantage de l’oyulequi semble les confondre et les identifier. ainsi, de la promiscuité originelle des sexes se détachent d’abord des groupes qui se distinguent en le mariage par groupes des australiens, l’un des chapitres les plus intéressants du livre de m. teulon, est typique à ce point de vue ; je volontiers lumineux. au delà de ces groupements, encore grossiers et. retenant une forte part de communisme sexuel, apparaissent dans fhistoire des concentrations et des plus restreintes, lesquelles ne s’opèrent pas nécessairement par évolution sur un point donné : des sociétés périssent en effet, pivotent sur elles- mêmes ét s’arrêtent, à peine ébauchées, dans la voie d’un progrès qui les régirait toutes, sous ■ des différences accidentelles, si leur était partout la même et suffisante pour les pousser assez loin, au lieu de s’épuiser en elles dès les première? étapes, dès la première quelquefois. or, lé dernier terme de la particularisation c’est l’individu distinct, homme et femme, avec prédominance du mâle à raison de ce qu’il est mieux armé pour la lutte, plus dégagé en outre des soins immédiats et des conséquences de la génération : il n'accouché pas. cette seul© différence implique des résultats énormes; qu’on les suppute, ils vont loin dans tous les sens' plus de vigueur de corps, d’esprit et de volonté, moins de sujétion dans l’ordre des rapports sexuels et de leurs suites, ces deux faits la prédominance masculine dans le mariage ét dans la famille comme une conséquence pourvu; que le mouvement progressif dure assez longtemps pour l’amener au jour. (1) chez fisehbacher.	sexuels	1	1
rappel	1884-06-17	1	1	PAG_00000001_TB000162	698	1029	5593	7294	il n'eût pas existé, en ce moment, une torture au monde qui lui' eût fait avouer qu'il travaillait à la journée. elle lui avait mis dans le sang, cette riche et voluptueuse créature, sans le vouloir, — peut être en s'amusant à l'embrasement de ce jeune homme, et rien qu'en étant voluptueuse et wche devant lui, - le désespoir, un désespoir affreux, de ne plus avoir les millions de son enfance, de ne plus pouvoir acheter des bijoux, vivre, et payer des soupers! -.	voluptueuse	2	1
gil_blas	1884-06-20	1	1	PAG_00000001_TB000054	806	1053	1390	5681	mais il se peut aussi que, favorisé par les génies bienveillants, le joueur atteigne et saisisse victorieusement une délicieuse bouchée de viande , attendrie par une lente cuisson, aromatisée par des piments rares, pénétrée et imbibée des plus jus, et que de la sorte il savoure, pour le sou qu'il a donné, un mets de supérieur à tout ce qui est offert sur les tables des rois. mais pour jouir pleinement des voluptueuses angoisses que ce jeu procure, il faut être un délicat, connaisseur dans les arts de la cuisine, avoir extrêmement faim, et ne posséder	voluptueuses	1	1
echodeparis	1884-06-23	1	1	Page1_Block75	4326	823	4119	2295	.une chronique d'albert wolff, — sapho et ■ l'echo de paris. — ua chef-d'œuvre. — jeunesse'et arcoar. — xj'aitaession du sou venir; — fureut de goudeau. — les liar- ■ messes. — un « personnel». — l'enlurai- ■nure de nos jeunes au3. — kermesses t . bombances, beuveries. ~ vienne et l'ex-,. : position culinaire — la cuisine à paris; —v le bal et le baaquet, — illusion:-perdues/* , « si un peintre avàit envoyé au salon j une 1 œuvre d'art de la valeur de sapho. ' d'a-lphonse daudet, ils se seraient déjà  'réunis cinq cents pouf .lui voter la mé daille d'honneur, et dans quelques jours 'lè ministre lui apprendrait, aux applau dissement de la foule, que le gouverne-/ ment l'a promu à un grade plus élevé ; dans la légion d'honneur. si un musi-. cien avait écrit une partition do la va- : leur d'art de sapho, de daudet, on l'au- * rait traîné sur la scène et l'orchestre au rait cassé tous ses violons à force de ta-, pér dessus dans la fièvre do l'enthou-: siasme! le sculpteur qui aurait pétri dans, la terre une œuvre d'art compara-: ble à ce livre serait déjà chez le tailleur pour se faire preudre mesure d'un frac, d'académicien. l'auteur dramatique qui 'aurait écrit, pour une scène littéraire, ; tiner comédie parisienne comparable au. livre-de daudet aurait déjà encaissé deux,, cent mill?. francs de droits d'au teur, sans compter les billets, et deux ou .trois ministres seraient venus lui > donner l'acolade, dans les entr'actes, à, la comédie française. » ' ah l.quel enthousiasme vrai et pro fond yous avez mis dans cette admirable ^chronique* maître wolff, et comme toute ,l'affection, tout le sentiment dont vous 'ayez fait (preuve dans ces trois cent» lignés m'a ému,.moi, un jeune, qui avais lu feuilleton après feuilleton, chapitre -après chapitre, comme une grisettequi se passionne à un roman d'amour, le livre, le chef-d'œuvre (vous l'avez ainsi, nommé) avant qu'il parût. car il a été le baptême littéraire de l'echo de paris et nul soldat de lettresne fut jamais tenu sur les fonts baptismaux du temple pu- blic — pour être classique — par si ro buste et si remarquable éphèbe. ; i nos confrères n'avaient point daigné jeter un coup d'oeil sur le canard au quel daudet donna son œuvre mais, je ;rai dit déjà : « il est vrai qu'un journal boulëvardier ne doit citer que les élù- cuhràtions des cocottes publiant leur pirosé amoureuse et commerciale, ou lés- diva gâtions des cabotins hallucinés qui apprennent à molière le fond .de sa pen sée !» et j'ai toute une joie enfantine, une joie d'artiste, de sensitive, à répéter; .en quelques lignes ce que ce livre uni- que a da douceurs dans son amertume .et de vérité dans la faiblesse invraisem- tyablè de gaussin. certes, ils sont bien forts ceux qui raillent ce pauvre diable d'homme oui, d'homme, car il est pro- fondémè- • humain dans son amour, et l'avachissement de lafm n'est point rare parmi ceux qu'un dévouement continu, mitigé d'une sensualité perverse, ont, perdu— si, c'est se perdre que de vivre aivec le souvenir des sanglots et la brû lure des baisers. ~ eh ! oui, nous sommes des iàches. eh! oui, nous pleurons, parfois, nous nous traînons à genoux, cramponnés à la iobe, à la guenille de celle qui nous en serre, mais ces larmes-là — qui laissent au cœur uue trace — ce sont point les gouttes d'eau des rustres et des vulgai res; ét gaussin, faible, était jeune, ce que l'on ne sait plus être maioteuant/^ ah ! les névrosés du vingtième siècle se révoltent et les boueux en pardessus jaune sale ricanent ! les calmes et le.-; froids -sourient; d'aucuns disent : « mé ridional, toujours, ce daudet », et iîft mettent, dans cette phrase, un accent de boulevard qui n'a pas la sonorité cor- j diâle dè cela; de h:,5 f .r?l. i i axions, mes bons, on aime dans sapha eii'amour voyez- vous et malgré tout sera toujou/iï de mode, ' à moins que l'avenir ' ae soit ' ïk-tivê à ceus qui a'mx plus	sensualité	1	1
radical	1884-06-27	1	2	PAG_00000002_TB000231	213	1031	5747	6581	cette dignité sèehe et-froide guidant cette grâce voluptueuse et décente, frappa d'adoration et d'étonnément surtout la jplupart des assistants.	voluptueuse	1	1
echodeparis	1884-06-28	1	2	Page1_Block3	4702	914	74	267	trouver étiqueté dans le casier de ses relations, avoir son but et son utilité. très ambitieux, en effet, sous ces de hors d'humilité, massenet vise à la clientèle européenne. c'est pour cela qu'il remorque fréquemment les bar il ums d'artistes fracas, directeurs cos mopolites, éditeurs étrangers et faiseurs erotiques capables d'apporter leur son ifle trompa à l'éclat de sa lontaine re nommée. > s a.lva.yre. — l 'homme des monta gnes en son type le plus absolu, ce pe tit basque à la chevelure noire, trapu et barbu. artiste d'instinct et de tempé rament méridional, talent dramatique et mélodique, qui plaît très particuliè rement aux natures nerveuses. joint à un jeu chaud et vibrant une belle voix sympathique et timbrée qui traduit mer veilleusement son inspiration pleine d'enthousiasme et de spontanéité. se connaît non-seulement lui-même, mais ïtussi, comme saint-saëns, possède tous les maîtres, qu'il interprète en maître. double exception qu'il est bon de si gnaler. car il n'est point coutume, parmi .ces messieurs, de s'admirer mutuelle ment, ni surtout de le proclamer, évi tent de parler les uns des autres, et joignant de « s'ignorer » quand ils n'osent se débiner carrément. salvayre. vit au milieu d'un cercle d'artistes et d'amis, dont le meilleur est sa jeune femme, le compagnon intelli gent et dévoué de sa vie. guiraud . — une bonne, simple et honnête physionomie de bon garçon, avec sa chevelure blonde et son regard timide. pas intrigant du tout, travail leur et. très modeste. trois excellentes raisons pour être très aimé parmi les artistes, et très estimé, même de' ses ri vaux. professeur d'harmonie a,u con servatoire. godard . — grand et maigre, blond, avec le visage brun des égyptiens : un sphynx couronné de la toison d'or ! — le dieu d'une petite eglise composée d'amis et de parents, dont il ne sort guère. tous l'ont salué prodige dès l'age de douze ans, alors qu'il improvi sait sur le violon ses premiers bégaie ments artistiques, et sont demeurés ses môles, le croyant appelé aux plus hautes destinées musicales. compose des mélodies charmantes, très person nelles et très originales qu'il chante à ravir. ses trios et ses quatuors sont mar qués de qualités éîninentes, et les ,s œuvres plus considérables qui ont été applaudies au châtelet par tout les dilettanti parisiens, promettent au com positeur une large envergure. ne sort guère de son cercle, augmenté chaque jour d'artistes qui l'apprécient et l'ap plaudissent. widor . — grand, mince, élégant, des cheveux châtains, un nez aquilin et un joli sourire estompé d'une ombre de moustache. — l 'organiste chéri des dames, dont il partage les petits soins et la bienveillance avec le philosophe caro, son rival aimable. on se le dispute, on joue ses partitions, on chante ses ro mances, on prise par-dessus tout sa musique, qui n'est nulle part appréciée coiu'me dans les salons. widor, avec un tact exquis, sait me- ïier ses affaires, distribuant les compli ments, disant les éloges de façon à ne froisser personne — ce qui est essentiel chez ces jolies musiciennes à hautes prétentions — louant avec grâce le ta lent et la beauté, ôgrhtignant légère ment l'absente ou la rivale. juste ce «qu'il faut, rien de plus, assez pour sa tisfaire la jalouse, pas assez pour se brouiller avec 1' « égratignée » dans le c»8 très probable d'une indiscrétion. sait exploiter également les vieilles amies et «l'oublie pas qu'il doit à l'une d'elles d'avoir franchi les portes de l'opéra. d'ailleurs, sijle jeune maître se montre assidu dans les salons du pschutt, il n'en néglige point pour cela les influen ces salutaires. les réceptions de ferry, camescasse et autres gouvernants, et comptent parmi leurs fidèles. consta tons cependant que jusqu'ici cela ne lui a pas rapporté grand chose. mais on ne sait ce qui peut advenir ! certaines cul	erotiques	1	1
presse	1884-06-28	1	3	Page1_Block5	4632	820	916	358	1862-1882). la traduction parait dans une splendide édition, qui fait honneur à mm. rouveyre-et blond, illustrée de très fines gravures et de portraits qui nous font ad mirer les gracieuses physionomies dos prin cesses ilelena et béatrice. dès les premières pages, nous trouvons le portrait de la reine. s. m. victoria, avec ses cheveux lisses, séparés par une raie au milieu du front, avec sa cornette blanche 61 la cape noire qui encadre son visage froid et sévère, semble une de ces bour geoises dévotes dont on admire dans hoir bein le jeune et dans cranach l'indifférente rigidité, ta signature de la reine est d'une grande écriture, un peu tremblée, mais sèche, froide et digne dans l'ensemble. nous insistons sur ces détails, parce que, dans le livre, nous ne pourrons nous inté resser qu'à la personnalité de l'auteur, si nous sommes un peu philosophes. ; la reine victoria, souveraine do tant de régions que le soleil ne peut se coucher dans ses etals, ne nous donnera pas de curieux aperçus sur les discussionsintimes. dans ses grands conseils, sur. la constitu tion des diverses parties de son empire ; sba livre ne fournira nulle matière aux mé ditations des diplomates; nous estimons que les littérateurs ne peuvent guère- s'in-/ téresser à un ouvrage -sèchement écrit et' assez pauvrement pensé ; mai? quelle miner archi-millionnaire pour les psychologues, pbur m. paul bourget, par exemple, qui vient de nous donner un ouvrage de si pé nétrante analyse, l'irréparable, dont nous rèndrons compte dans une de nos prochai nes notices. dans les mémoires de la reine vicloria/ il faut étudier la feine victoria; — elle sèule. : l'auteur n'est pas un artiste; il ne sait pas analyser ses impressions et sait encore nkoins. les traduire. dans un journal qui va dfe 1862 à 1882 et qui nous raconte des. vbyagès et des séjours dans les pittoresques contrées de l'ecosse, au' charme si profond- et si mélancolique, nousne pouvons trou ver quinze lignes de description : « la val lée se montre dans sa plus grande beauté, illuminée par les rayons du soleil couchant, ; aussi chaud qu'en plein été. pas une brise! lie ciel devient de plus en plus rose; les collines au-dessous de .nous prennent'cette ; teinte chaude du ; soir qui [leur est particu lière. » pas un mot de plus. quelques pages ; plus loin, voici encore un-.essai d'e descrip-- tiion : « a un vallon sauvage,' couvert de^ bruyère, succède une colline gazonnée..' dierrière nous, la vde des collines étagées et, passant par toutes les nuances, du bleu , est/ vraiment splendide. nous nous arrêtons, pour prendre.le thé. » ii est impossible de, rêver une imagination plus aride, un esprit plus sec et plus étroit. ' : savez-vous quelles sont -les pré occupa-, tions ordinaires de sa majesté?. prendre le thé, faire apporter les jambons, veiller à la santé des princesses ; tous les soucis d'une: bonne bourgeoise qui écrit son journal; chaque jour,: d'une veuve profondément af-. fligée par la.mort d'un époux aimé, et qui ne sait exprimer sa tristesse ou sa douleur que par des exclamations entrecoupées,;: c'est horrible ! quel malheur ! quels re grets ! pendant que l'armée anglaise se bat à tel-el-kébir, qu'une foule anxieuse attend les iiouvelles, la reine est émue, mais émue seulement pour son fils, le brave duc de gonnaught, qui est à la tète de ses soldats. arabi, l egypte, ce sont pour elle des en nuis, passagers, des •troiïble-îôles sans im portance. en 1870, tandis que l'europe est ■haletante, la reine vicloria ne s'étonne, guôré; seulement elle jette à la france son coup de patte de vieille dévote.: « 2 octo bre. le docteur mucle'od a fait un splendide sermon sur la guerre; sans, nommer la france, il bn a dit assez pour faire com prendre à tout le monde sa pensée quand il; a dit comment dieu punirait le péché, la vanité et la sensualité ». la reine est égoïste; mais non pas roya lement, ma manière de ces borgia qui au-, raient;tué tout un peuple pour assouvir un caprice ; son égoïsine est bourgeois.et tem péré. il n'en emplit pas moins l'âme tout entière. a un moment pourtant, nous voyons s. m. victoria émue/ désolée et presque désespérée. la crise de nerfs n'est pas loin. c ; est quand elle apprend la mort du iprince' impérial. il faut avouer qu'il eût-été difficile : de ne pas verser une larme à la nouvelle de la-fin misérable d'un jeune' homme qui, la têtb pleine de rêves d'un' autre temps, ambitieux de se montrer di gne du trône, était allé auhout du monde chercher un peu dé gloire dans une.guerre pleine de périls. . nous n'avons pas parlé du fidèle serviteur john brown, dont le nona paraît à chaque page dans le livre; c'est que certains de nos: confrères ®htvttial-.à propos selon nous, j jeté dans le public des insinuations mal	sensualité	1	1
echodeparis	1884-07-01	1	1	Page1_Block48	618	804	4146	4592	et les maîtrise. grasse . ou maigre, femme d'hiver ou femme d'été, elle est impressionnable et fragile. par ces temps de grande chaleur' où .le'san«-' bouillonne et où la sensualité se dé-' chaîae,.il faut .ménager la femme,la mer et à.la montagne. les excès déplai sir ont ramolli plus de cerveaux de p&- risiens' et tué plus de parisiennes que î ï- choléra sporadique ou asiatique. n'est- ce pas vôtre, avis, ô philosophe. .igno.». tus?- . dubut de liforest. : » ~	sensualité	1	1
rappel	1884-07-02	1	3	PAG_00000003_TB000081	428	1005	1413	8143	le contre-projet accepte tous les points visés parle gouvernement et en ajoute quelques autres. il y ajoute des di positions ten dant à introduire dans la constitution le principe du suffrage universel pour toutes les érections et l'incompatibilité du mandat législatif avec les fonctions publiques. dans toutes les constitutions libérales de ce pays, ce dernier principe est écrit.	érections	1	1
debats	1884-07-07	1	1	P1_TB00021	1575	797	159	5483	homiourg. me voici installé à hombourg, au troisième étage du rilter's park hôtel. ma cbambre est vaste, éclairée et aérée. j'y ai tout ce qu'il me faut, même ce qui est bi rare dans les hôtels les mieux munis et le 3 plus opulens, une table de travail, sur cette table un encrier, dans cet encrier une encre nette et de densité utilisable. j'ai vue, au premier plan, sur la promenade et sur le parc. a l'horizon, j'aperçois le taunus dont les lignes de faîte se fondent dans une vapeur bleue. mes idées sont bleues comme la vapeur qui flotte sur les hauts monts. une ville d'eaux ou de bain de mer, une station d'hiver ou d'été, est un caravansérail plus ou moins élégant, où se débitent du soleil, de l'air pur, de la santé, de la joie et du bonheur. les acheteurs appartiennent à toutes les variétés de la classe moyenne et des classes riches. selon l'état de leur bourse, ils demandent plus ou moins de la précieuse denrée qu'ils sont venus chercher dans la ville d'eaux. les uns s'en procurent pour trois semaines, les autres pour trois ou six mois. mais la paix de l'âme et le bonheur sont des marchandises si rares et si fragiles qu'aucun endroit sur la terre n'en vend pour toute l'année, fut-ce à prix d'or, fût-ce aux plus riches. le golfe. d'antibes, visité du monde entier ; la divine et voluptueuse grenade, que personne ne con-	voluptueuse	1	1
gil_blas	1884-07-09	1	2	PAG_00000002_TB000201	159	1020	5861	7814	sa tête de fauriessê avait a la fois une expression de sensualité attirante, et de fierté allant jusqu'au défi.	sensualité	1	1
gil_blas	1884-07-10	1	2	PAG_00000002_TB000232	742	1035	4770	8800	— ecoute, je ne te trompe pas, tu es folle. je te dirai tout, tout ! et si tu crois encore que je mente, je te donnerai les preuves. c'est vrai, je viens de chez ma sœur. j'y ai vu mme de thervay. c'est une jolie femme, qui a un vieux mari ridicule. elle m'a fait quelques coquetteries auxquelles j'ai répondu,—question de politesse,— par quelques attentions. mais je suis prêt à jurer sur tout ce que tu vou-, dras que je n'ai pas un instant songé à devenir son àmant, et qu'aucune femme, ne saurait me faire éprouver les ivresses: gue-me teûçtq|: ta voluptueuse beauté,	voluptueuse	1	1
