work	date	issue	page	block	height	width	hpos	vpos	text	active_words	occurrences_words	unique_words
gaulois	1890-03-04	1	3	P3_TB00018	3067	776	2535	4276	maintenant,sur une mélodie très douce et comme religieuse qui semble s'évaporer du quatuor à cordes, les vieillards rendent grâce à dieu, tandis que le soleil se lève. leur lente mélopée marque la limite du style de l'oratorio dans le premier acte. voici que surviennent, en effet, aux sons de la plus voluptueuse musique, les jeunes philistines aux clairs atours, et les prêtresses de dagon, les mains pleines de guirlandes. un motif d'un envolement singulier se développe à leur approche. elles sont séduisantes et parées, engageantes et fausses. leur danse est magique en son étrange douceur. sur le theme berceur qui la constitue, l'instrumentation de m. saint-saêns prodigue des sonorités inattendues, inquiétantes et caressantes. des notes de harpe s'éveillent parmi le chant velouté des violons en sourdine, les bois égrènent leurs rires légers, les cors étouffent de mystérieuses confidences. une des prêtresses, au milieu de l'enchantement, est venue vers samson... ah ! comme il se trouble le juge d'lsraël ! elle si belle et : d'un charme si rare 1 un ancien essaye 1 vainement de mettre le héros en garde contre les séductions misérables de la chair. le péché le tente à en mourir. il est conquis; il est perdu. nous sommes, au second acte, dans les jardins de dalila, sous igs palmiers aux verts éventails de la vallée de soreck. samson va venir ; dalila l'attend, et elle nous l'apprend dans un air de forme très classique, et que je goûte assez peu. a ce moment paraît le grand-prêtre de dagon, qui vient exhorter la jeune femme à ne point fléchir, quoi qu'il advienne, et à ravir â tout prix à l'hébreu le secret de sa force. je note, dans ce duo, une sorie de strette à l'italienne, dont l'œuvre se lût, à mon sens, fort bien passée. mais le juge d'lsraël gravit la montagne; il s'avance dans la haute vallée, aux sons d'une musique enchanteresse, où les trilles des cordes frémissent comme la brise, où les instruments bruissent et soupirent. la sorcière de gaza s'élance à sa rencontre : elle est à ses pieds, elle le brûle de passion, elle l'énerve de ses étreintes. page vraiment inspirée, écrite tout d'un jet, d'une science si naturelle et si souple, qu'elle semble naître des sentiments et de l'action même. il serait difficile de citer une méiodie plus pénétrante que celle de dalila « un dieu plus puissant que le tien », si curieusement enveloppée d'un accompagnement tout félin, qui ondule et se glisse. rien de plus moelleux aussi que l'ensemble final, où les lents arpègements des harpes ajoutent aux tenues des violons uqe infinie langueur. enfin, le fort a succombé : il a livré son secret... d'horribles supplices l'attendent. dans la prison où il est enfermé, le malheureux tourne la meule, les yeux crevés, l'âme dolente. les plaintes des hébreux, par lui trahis, captifs par sa faute, arrivent jusqu'à lui, cruellement. la scène se déroule dans un accablement de tristesse. c'est peut-être ici, après le duo d'amour, ce qu'il y a de plus haut et de plus poignant en ces trois actes. sur ce douloureux épisode, le décor change :	voluptueuse	1	1
liberte	1890-03-05	1	3	PAG_3_TB000096	315	1079	3759	4519	mme bossy, chargée du rôle assez difficile de dalila, n'a peut-être pas la voixsuffisante pour bien le rendre musicalement : elle a cependant dit, avec un rare sentiment scéni-que, la phrase voluptueuse à l'aide de laquelle elle entraîne samson à sa perte.	voluptueuse	1	1
xixe_siecle	1890-03-05	1	2	PAG_00000002_TB000157	745	1023	5782	1001	connu et un peu banal : amonn, viens aider mai fàie, mais une phrase de dalila de mélancolie, de haine et : se,pourrait-il.que. dans son ccenf l'àmottr elu.pel',du sa puissance? le duo, avec ses cris passionnés, ses farouches élans, ses contrastes et ses combats de sentiments, âvec, par-dessus tout, la phrase voluptueuse et lyrique de (lalila : mon cœur s'ouvre à ta voix, comme s'ouvrent les [leurs, est trop connu pour qu'il soit nécessaire d'en redire lès' multiples beautés. < le tableau de la prison a produit une impression très profonde à cause même de la sobriété grave de l'effet, le contraste et l'accord entre la honte de samson et la	voluptueuse	1	1
debats	1890-03-08	1	3	P3_TB00016	3950	811	956	3139	messieurs les candidats viii. m. andré theuriet voici, dans ma bibliothèque, les œuvres de m. andré theuriet, voici du moins les plus courtes, les moins composées et arrangées, c'est-à-dire les meilleures. je vais les mettre ici, à côté d 'aucassin et nicolette, chantefable du douzième siècle, où l'on voit nicolette se relevant au milieu de-la nuit de mai et marchant dans la rosée. de l'autre côté, je placerai deux petits volumes antiques: un théocrite, avec moschus et bion ; puis tout ce qui reste de la pastorale latine. ces différeos auteurs du temps passé représentent assez bien ce que m. theuriet. aurait été sur terre, si les circonstances l'avaient favorisé. c'est du pur theuriet, du theuriet beaucoup plus pur que celui de la revue des deux mondes. je crains que ses livres à lui ne soient pas appelés à vivre aussi longtemps que ceiix-là; mais c'est qu'il est venu dans une . époque où l'étroit cerveau d'un flûteur 'champêtre ne suffit plus pour faire des ■œuvres harmonieuses. depuis théocrite, les temps sont changés. sentir finement le charme des choses naturelles et de la solitude, se délecter d'un paysage: sobre où les crêtes d'une montagne lointaine sont aperçues entre les branches des pins, se plaire aux sources silencieuses cachées dans les ronces, suivre les ébats des pâtres, hommes de sens éveillés, mais de peu d'intelligence et de volonté faible, faire parler sans cesse l'amour, et n'apereevoir dans l'amour qu'une sensualité ingénue. mettre seulement ses soins à s'abstenir, dans tout ce qu'on dépeint, d'affectation et d'ambition ;—cela, qui est le lout des pastorales antiques, semble un _ peu maigre aujourd'hui. qr, m. theuriet est un bucolique tombé en pleine époque de romanciers. c'est, en. deux mots, toute son histoire et tout-son malheur. il s'applique terriblement pour se mettre au ton de ses voisins et de la revue des deux mondes. il avait le goût des oaristys, de scènes de baisers à l'ombre des meules, de foin et des arbres, et il a raconté de longues intrigues, des adultères, presque des 'incestes ; h était l'homme des légers épb sodés qui tournent court comme un lézard rentrant sous l'herbe, et il a .fait des études complètes, circonstanciées, en beaucoup de pages ; enfin il avait très peu de-choses à dire (charmantes d'ailleurs), et il a fait trente volumes... i. cependant la bucolique, au temps où l'onne rougissait pas d'en faire, était un genre délicieux.., r .. ; ;. — .ce qui la remplissait, .c'était,, d'une part, la contemplation paresseuse de la nature sauvage; d'autre part, la langueur des sens, mêlée d'ardeurs et de regréts. c'est ce qui remplit aussi m. theuriet. littéralement, il a sur la nature et sur l'amour les mêmes idées que théocrite et bion; il n'y voit pas plus de malice. et ceci .l'a condui t à écrire des rp.mang agréables, mais, qui pourraient fifre de segrais. d'abord, il., a un talent de peintre délicat et minutieux. il dit quelque part : « cela eût donné.l'idée d'un joli' tableau à un peintre de genre.»'; et, ce' tableau, il le fait lui-même. sa'touche est à la fois contenue et aisée... elle correspond à la pfé'cision,émue qu'avait le pinceau dé son ami bamien-lepage. le moindre détail y a sa valeur i:t donne de la grâce au récit. ..vous vous rappelez la. gaucherie avec laquelle le pauvre germain lafrogne, dans les deux barbeaux, demande à sa cousine laurence de l'épousèr. la jeune fille'est assise sur lé tabouret de piano, tenant une rose : ... je ne suis pas un beau parlèùr'et je	sensualité	1	1
gaulois	1890-03-08	1	1	P1_TB00010	2468	777	1025	1033	semblait avoir deviné les vagues soupçons qui tourmentaient pontual, car, un jour qu'ils étaient restés en tète-à-tête, elle amena la conversation sur les tricheries auxquelles beaucoup de femmes ont recours pour accroître le volume de leur chevelure. quant à moi, déclara-t-elle, je suis sans peur et sans reproche, car tous mes cheveux m'appartiennent. en même temps, d'un geste brusque et hardi, elle enlevait son peigne, et toute sa magnifique chevelure ruisselait en ondes soyeuses presque jusque à ses pieds. après le coup de théâtre de ce délicieux échevèlement, roger de pontual fut tout a tait conquis. il n'eut plus qu'une pensée dominante : devenir maître et seigneur de la jeune russe, afin de jouir tout à son aise de la voluptueuse beauté de ses cheveux d'or. mais sacha, malgré ses étourderies apparentes et ses libres allures, était une honnête fille. pontual comprit bien vite qu'elle ne se donnerait qu'en justes noces. si mlle yassilieff était pauvre, il avait, lui, de la fortune pour deux ;il possédait cent mille francs de rente et un château dans les environs de paris. ' il pouvait donc se permettre de se marier selon ses goûts et il se décida à demander la main de sacha. ,toute heureuse de cette aubaine inespérée, mme vassilieff la lui accorda, sur-le-champ, et sacha ratifia avec empressement la promesse de sa mère. elle ne mit à son consentement qu'une condition, c'est qu'elle garderait avec elle une paysanne petite-russienne qui l'avait élevée et qui lui servait de femme de chambre. la célébration du mariage suivit prompte ment ces accords et, le soir de la cérémonie, lorsque les époux, en route pour florence, s'arrêtèrent à dijon pour y passer leur première nuit de noces, ce fut la savante petite-russienne qui présida à la toilette de la jeune mariée. elle peigna, lissa et natta les beaux cheveux d'or puis quand elle eut achevé de coiffer sacha, elle lui dit en russe : vous pouvez être tranquille, toutest en ordre et il ne se doutera de rien. car, hélas ! les beaux cheveux d'or étaient faux... mais les nattes additionnelles étaient d'un ton si semblable à celui de la courte et authentique chevelure de sacha, un habile coiffeur*les avait si artistement attachées brin à brin, dans les dessous, aux racines des cheveux naturels, qu'elles paraissaient merveilleusement vivantes et qu'on aurait juré qu'elles ne faisaient qu'un avec la mignonne tète de la jeune mme de pontual.	voluptueuse	1	1
gil_blas	1890-03-10	1	3	PAG_00000003_TB000411	573	1032	1375	7042	elle aussi était belle de sa jeunesse et de sa joie. es hommes qui chargeaient des fardeaux ou qui se hâtaient vers leur travail, les coudes écartés, bousculant la oule avait pour elle au passage un regard de désir. et ils grognaient dans leurs moustaches leurs adrairnlions grossières, ces mots de rue qui font monter le rouge au front des 'emme:;;, avel: un peu d'ellroi et une voluptueuse douceur.	voluptueuse	1	1
liberte	1890-03-10	1	2	PAG_2_TB000170	1036	1094	635	7332	ses, qu'il a goûtées dans ses bras; la phrase voluptueuse revient ; mais transformée en une moquerie sardonique du plus étrange effe,t. « voilà enfin, le leit-motiv m, diront les néo-wagnériens ! mais, bonnes gens, bien avant wagner, le procédé du rappel de-certains motifs caractéristiques était inventé. ce n'est pas le système à outrance dn leitmotiv qui attache une sorte d'écriteau musical au dos de chaque personnage, qui fait que wagner est un grand musicien. il avait du génie dans le vaisseau fantôme, dans le tannhaeuser et dans lohengrin, sans faire un usage immodéré du leit-motiv; il en a encore, je le concède, dans les maîtres chanteurs et dans la tétralogie, non pas parce qu'il applique rigoureusement son système; ïnais parce que, malgré son système, il conserve son imagination, et son tempérament de musicien.	voluptueuse	1	1
gil_blas	1890-03-11	1	1	PAG_00000001_TB000183	1348	1040	5734	6051	les romans de maizeroy ne sont pas appelés à orchestrer les rêveries solitaires; ils sont destinés bien plutôt à accompagner les duos amoureux. la peau, qui est le titre de son dernier volume , pourrait être celui de son œuvre entière qui est l'hymne de l'amour charnel, le poème de la possession, iille chante le plaisir, avec une fougue sans cesse rajeunie, du premier roman au dernier, le racontant dans ses joies, ses rancœurs et ses peines. l'adorée en est l'hymne, le boulet sa tragédie, et les deux amies' le livre. d érudition. ou y rencontre même des idylles : lucien hardanges fait parler le libertinage à peu près ainsi que fortunio l'amour. ce sont des poèmes, en effet, que les romans de maizeroy; ils bercent comme une musique plutôt qu'ils n'obsedent comme une étude; ce sont des mélodies exécutées par un artiste merveilleux sur un sujet invariable, comme paganini évoquait des mondes de sensations sur la seule corde de son violon.	libertinage	1	1
debats	1890-03-15	1	3	P3_TB00015	3992	815	976	3005	messieurs les candidats ix m. ferdinand fabre il me serait difficile d'expliquer cette impression ; peut-être même ne vaut-elle pas seulement d'être dite, et je ne la respecte que parce qu'elle est naïve. la voici : j'associe, je ne sais comment, le souvenir pénible et fort, que laissent les romans de m. ferdinand fabre avec la senteur âcre que les feuilles dû lierre froissées laissent dans la main. ce n'est pas le parfum d'une fleur fleurie, où la sensualité trouve à se réjouir; non, c'est quelque chose qui, sans être agréable, a du charme à force de ne ressembler à rien d'autre. cette senteur, plusieurs personnes, dont je suis, y trouvent quelque délice, mais ne sauraient persuader à autrui qu'elle est, en effet, délicieuse. elle est originale, voilà tout, et il est original de l'aimer. oui, ce m. ferdinand fabre est assez bizarre. il y a de la puissance dans ces fictions exemptes de romanesque ; de la puissance dans cette dramaturgie heurtée ;,de la puissance dans ce style. comment ne pas le reconnaître? et tout de même on sent bien que cette sorte de génie a quelque chose de douloureux , d'inachevé, d'estropié. d'où viennent ces traces de mutilation dans un écrivain très indépendant, à demi campagnard, et que l'abus de l'esprit critique n'a pas stérilisé comme il arrive à d'autres? quel est le sortilège qui empêche cet artiste si bien doué de créer avec aisance et joie ? peut-être celui-ci : quand on traverse les quartiers misérables, et qu'on regarde les pauvres d'un peu près, on est frappé avec force de cette idée de contrainte et de resserrement qui était jointe, pour les anciens, à l'idée de pauvreté. yoilà, si vous passez lard devant la fenêtre d'une femme qui repasse du linge, toute lasse et malade, voilà, en effet, le refus et la contrainte, refus de sommeil, contrainte au travail. il suffit de lever les yeux vers cette fenêtre pour que cette contrainte, par sympathie-, pèse aussi sur nous, rabatte soudain à terre nos désirs et nos rêves commencés, pour que la pauvreté de cette inconnue appauvrisse notre âme. or il doit en être de même avec la pauvreté en esprit , dont il est parlé dans l'evangile, c'est-à-dire avec le goût de la privation. le paradoxe chrétien consiste à faire de cette amertume une joie. je suis riche de ma pauvreté, libre dans ma servitude et puissant parce que je suis faible. saint paul, saint françois-d'assise, l'auteur de vlmitation, arrivèrent à cet épanouissement dans le sacrifice. mais combien d'autres sont restés à mi-chemin de cette sainteté complète l ils renoncèrent, mais non joyeusement; pauvres, ils se sont sentis pauvres. pour eux, lé christianisme n'a pas été une religion sereine. m. fabre a sympathisé avec ceux-ci. lia exprimé le sentiment de la pauvreté en esprit du chrétien nu, opprimé, et qui soupire intérieurement. il l'a fait avec une sincérité d'où lui vient, toute sa force tragique. mais justement sa sincérité fut telle qu'en les peignant il s'est fait l'un d'entre eux. 11 a trop mis du sien dans ses ouvrages ; le malaise qu'il a si bien rendu, il en a subi la contagion : l'àcreté de la feuille de lierre froissée lui est restée aux doigts. de là ce quelque chose d'appauvri, de timoré, d'inharmonique, si éloigné du beau câline où s'élaborent les œuvres parfaites. voilà donc, d'une part, la source d'où est venue sa forte sève ; et voici, d'autre part, sa plaie, son entaille souffrante. i. m. fabre ne s'est pas ingénié pour trou! ver des sujets étranges ; il a pris ceux qui s'offraient à lui, tout naïvement ; il n'est	sensualité	1	1
lanterne	1890-03-16	2	2	PAG_00000002_TB000048	468	1044	2544	5477	de son côté, la paillardière avait pris une petite main qu'on ne lui refusait pas, et tout près, tout près, il se réjouissait des étonnements de la comtesse. la torle se leva, et tandis que la musique résonnait, voluptueuse et rythmée, tandis que miranda, personnifiée par rosita mauri, exécutait au milieu de ses gracieuses compagnes les pas les plus érotiques, prenait les poses les plus excitantes,	voluptueuse	1	1
justice	1890-03-20	1	4	PAG_00000004_TB000181	70	902	1402	3221	asl, lu montmartre «t 48, ru« notre-dame-des-victoires {derrière la bourse) ouvert ù partir a* c n. sa coït jusqu'a t h. i«. mm. tt féut excepta prix ; otnq centimes par lettre	coït	1	1
lanterne	1890-03-20	2	3	PAG_00000003_TB000002	181	1023	298	455	terrible encore : choix avait eu les parties sexuelles presque complètement arrachées : elles ne tenaient que par un lambeau de chair que l'on dut couper séance tenante.	sexuelles	1	1
xixe_siecle	1890-03-20	1	2	PAG_00000002_TB000236	290	1060	1448	7222	- a l'auptosie légale qui, conformé- ment à la loi, ne peut-être opérée que 1 vingt-quatre heures après la mort, reprit georges, la frigidité et la rigidité cadavé- 5 riques rendent toute recherche illusoire.	frigidité	1	1
univers_illustre	1890-03-22	1	2	PAG_00000002_TB000012	1709	972	228	2251	ah 1 s'il en était ainsi de vous, mesdames! mais non, il vous faut être diverses à chaque saison, et ce lis, qui était plus beau et mieux paré que salomon dans sa gloire, vous ne l'enviez pas parce qu'il n'avait qu'une seule robe 1 est-ce à cau?e de nous, ô mon dieu! est-ce notre fatal libertinage qui pousse ainsi nos charmantes compagnes à varier sans cesse leur parure, afin de nous apparaître toujours nouvelles ? eve, leur commune mère, passait sans vêtements sous les regards charmés d'adam; il est vrai que c'était au paradis et que satan ne troublait pas encore les âmes. mais depuis lors, depuis que dieu les a condamnées, en signe de châtiment, à cacher leur nudité, en ont-elles assez abusé, les coquines i je n'entreprendrai pas ici une histoire de la toilette des femmes à travers les siècles, je laisse cela aux membres érudits de nos académies; ce leur sera un moyen de faire leur cour aux belles dames qui se pressent aux séances publiques de l'illustre corps ; mais je vous avouerai qu'à chaque tournant de saison je me sens pris d'un grand émoi alors qu'il me faut, en ma qualité de chroniqueur, aborder la question des chiffons. cette fois, cependant, je m'empresse de vous le dire, il m'est arrivé une véritable bonne fortune. un hasard a fait tomber entre mes mains la lettre qu'une parisienne écrit à une de ses amies de province, et cette lettre, mesdames, vous initiera bien mieux que je ne saurais le faire à tous ces mystères charmants et troublants qui consistent à tirer de la soie et de la gaze, du velours ou même du simple drap, des effets inattendus, des oppositions piquantes, imprévues, magnifiques ou spirituelles.	libertinage	1	1
debats	1890-03-22	1	3	P3_TB00018	1298	788	1811	1345	l'amour est ce qui remplit presque tout ce théâtre lyrique. lorsque galathée de statue devient femme, l'amour s'insinue aussitôt dans sa chair toute neuve (la scène d'ailleurs est une des plus charmantes que m. barbier ait conçues), et elle descend à peine de son piédestal qu'elle chante déjà : jo t'aime!... que dis-tu?... je t'aime !... mot char[mant ! l'amour!... oui, je comprends... et je sens en moijmême mon cœur... qui bat plus vite... et s'éveille en aimant. voilà l'entrée dans la vie; et chaque héroïne, durant sa brève existence de poupée musicale très fragile, ne dira pas grand chose d'autre. toujours; je t'aime! et des étreintes, et des enlacemens, et pas de complication intérieure, ni de combats, ni d'angoisses ; mais une langueur abandonnée que la musique de m. massé, de m. ambroise thomas, surtout de m. gounod, rend plus énervée et plus soupirante encore. mais cela ne me renseigne pas du tout sur l'âme de m. jules barbier, car je vois bien que cette sensualité ne lui est pas foncière, et qu'il la croit seulement convenable et appropriée au genre de l'opéra.	sensualité	1	1
gil_blas	1890-03-24	1	3	PAG_00000003_TB000397	362	1028	1353	7447	on est tenté de croire à la perversité d'un homme qui exerce occultement un pouvoir si tyrannique. rien n'ôtera de l'esprit populaire la certitude que l'agent des mœurs fait servir son autorité iscrétionnaire à la satisfaction de son libertinage ou de ses rancunes.	libertinage	1	1
intransigeant	1890-03-24	1	3	Page1_Block2	1067	801	87	333	séance du §1 dw». sur la demande, de plusieurs iconseillers de la banlieue,.le conseil invite l’administration à faire toute diligence auprès des pouvoirs publics pour que, dans le pins ï)ref délai, un consoïl des prud hommes soit crée ftu ■cîiôwiôü onton de suinf pénis et aux autres cantons suburbains. conformément aux pétitions qui lui ont été adressées et aux résultats d’enquete, le donscil autorise le sectionnement de sainfr ilaur en quatre sections électorales. la motion suivante est ensuite votée : le conseil général, renouvelant sa délibéra- îion du 26 décembre 1839, invite le préfet de police à faire respecter les lois et règlements concernant l'affichage, et à donner à ses instructions la plus large publicité. le conseil général autorise la commune de saint-ouén à percevoir un droit de 50 centimes par cheval sur les voitures servant au transport des voyageurs, les jours de courses, et stationnant sur les dépendances de la. grande voirie sur le territoire de cette commune. séance mercredi prochain. e. b. _ -----	pénis	1	1
