work	date	issue	page	block	height	width	hpos	vpos	text	active_words	occurrences_words	unique_words
univers_illustre	1891-07-11	1	9	PAG_00000009_TB000007	1468	972	347	2790	c'est maintenant d'un roman nouveau que nous voulons dire, en hâte, quelques mots. ici, la brièveté nous sera plus facile, car nous ne sommes point d'avis que, pour parler d'une oeuvre d'imagination, il y ait lieu d'en résumer l'intrigue. ce faisant, ne va-t-on pas plutôt contre le plaisir du lecteur en diminuant sa curiosité. nous ne vous raconterons donc point l'histoire a'huguette. cette huguette — mmo huguelte yincelles, — est la très moderne et très séduisante héroïne d'un livre récent de j. ricard. son seul nom, qui baptise si joliment le volume, a, dès l'abord, de quoi retenir et charmer. il est rare et précieux ainsi que la femme qui le porte; il correspond bien à elle, en même temps qu'à l'art subtil, vibrant et élégant tout ensemble de m. ricard. donc, le nom, d'abord ; puis la femme. celle-ci est singulièrement vivante et attirante, dans son étrangeté naturelle, si l'on peut ainsi parler, dans son chic quelque peu voulu et factice, mais bien personnel tout de même, dans sa sensualité raffinée, dans son tempérament à la fois capricieux et réfléchi. oh ! elle existe, elle vit, elle sent, et même elle aime, — encore qu'elle en soit quelque peu amoindrie. c'est qu'en effet, répétons-le, elle est bien femme, en dépit de l'audace de ses allures et de son langage. elle est si réelle et si vraie que, pour peu qu'on ait le sens de la femme telle que l'ont pétrie, suivant la diversité des êtres, les moeurs élégantes de notre fin de siècle, on la devine avant de la voir agir, et l'on croit à tout instant entendre le son de sa voix. tout en elle, s'a personne, ses toilettes, sa parole, ses idées, est particulier, et brillant, et attirant. il n'y a que par certaines émotions, certaines mélancolies, certains regrets, qu'elle rentre dans la destinée commune. elle n'en est que plus complètement et plus sûrement ensorceleuse. si je ne parle que d'elle pour vous signaler son roman, c'est qu'elle y rayonne à chaque page, qu'elle y met partout son charme capiteux et troublant. les sensations, les faits et gestes, les descriptions même — et il y en a auxquelles on peut prédire un fameux succès, entre autres celle d'une chambre et d'un cabinet de toilette tendu de crêpes de chine nuancés et brodés — semblent une émanation, un prolongement de sa personne. et, par cette constatation, je crois faire le plus complet éloge de l'artiste qui a su réaliser cette incarnation de son rêve.	sensualité	1	1
echodeparis	1891-07-12	1	1	Page1_Block24	1006	794	2532	3790	nant le premier l'exemple aux générations à venir? ceux qui connaissent tes portraits de danton, spécialement lés esquisses qu'en surprit david dans les nuits de la conven tion, n'ignorent pas comment l'homme peut descendre du lion au taureau, que dis-je? tomber au sanglier, type sombre, abaissé, désolant de sensualité sauvage. voilà une force nouvelle qui va régner toute-puissante dans la sanguinaire épo que que nous devons raconter ; force molle, force terrible, qui dissout, brise en dessous le nerf de la révolution. sous l'apparente austérité des mœurs républi caines, parmi la terreur et les tragédies de l'échafaud, la femme et l'amour physique sont les rois de 93. on y voit des condamnés qui s'en vont sur la charrette, insouciants, la rose à la bouche. c'est la vraie imago du temps.'	sensualité	1	1
lanterne	1891-07-12	1	1	PAG_00000001_TB000069	411	1027	2499	3379	fidèles à l'enseignement du saint-siège et aux leçons de l'expérience écrit à son adresse une feuille jésuite, nous professons que l'erreur, même, purement doctrinale, ne peut se répandre sans produire des fruits empoisonnés; nous croyons en outre que le blasphème public, l'outrage à la religion, les attaques contre l'autorité, le libertinage de l'esptit sont funestes non seulement aux individus, mais à la société elle même.	libertinage	1	1
siecle	1891-07-14	1	2	Page1_Block30	1891	800	1900	5494	saurait aimée, et, forte de son amour* elle supporterait vaillamment l'adversité. maintenant elle avait foi en lui ; jamais sa confiance solidement affermie ne, l'ef fleurerait d'un soupçon. il l'aimait, oh! oui, il l'aimait d'un amour sans bornes, elle avait trouvé une issue par une pe tite porte basse, percée dans la muraille» alerte, elle se dirigeait à travers champ vers grressat. la fraîche brise du matin, qui glissait sur la terre, calmait ses nerfs irrités par une longue tension, coulait dans son sang igné ses frais et balsamiques efflaves. une seule impression subsistait, celle du dernier baiser, et elle marchait, les yeux voilés, sous ses paupières mi-closes, s'abandonnant à la sensation ineffacée de ces lèvres attachées aux siennes. aucun aûtre désir cependant n'alarmait sa chas teté ; elle restait pure, idéalisant encore la sensualité irrévélée de cë premier contact, de ces initiales rumeurs de la chair ; la chair, cette sournoise qui berçait la rêve rie de la jeune fille.d'une caressante poésie, chuchotait bien bas,dans le frissonnement d'un souffle de volupté, l'impérieuse vo lonté de notre essence. une alouette s'éleva dans les airs, et elle se rappela cette champêtre hyménée de la mare au diable, lorsque germain,le bon heur assuré, laisse sommeiller sa compa gne jusqu'au lever du soleil, et voit dans cette alouette qui monte vers les cieux la voix de son coeur rendant grâcea à la pro vidence. elle s'agenouilla, voulut prier comme lui, mais aucun remerciement ne put aller de sa bouche vers ce dieu qu'elle voulait adorer. elle entendit venir de loin une voix plaintive qui ressuscita les douleurs de la nuit. elle se remit en marche. lorsqu'elle aperçut la ferme, ce grand	sensualité	1	1
gil_blas	1891-07-16	1	3	PAG_00000003_TB000289	728	1023	2451	7405	car, pour un homme, tout le charme de l'amour est dans ses commencements, — si souvent inquiétants ou gênants pour les femmes.— les mains ne tremblent, la gorge ne se dessèche, dans les angoisses voluptueuses d'une véritable impatience, qu'au début des liaisons. on peat encore être heureuxpar lasuite.maisi'émotion divine des premières curiosités d'un amour inapaisé, l'homme n'en retrouve l'équivalent que dans d'autres aurores de passions. et que dire quand il s'agit d'une femme telle que l'on n'en a jamais possédé ?	voluptueuses	1	1
lanterne	1891-07-16	1	2	PAG_00000002_TB000070	606	1027	4624	749	le rameau magique avait donné son coup de baguette à notre conversation : tout naturellement, assis côte à côte sur le banc du gaisberg, nous nous mîmes à parler de l'amour. la voyageuse en parlait avec le positivisme aimable, la liberté séduisante des italiennes, et, de plus, en femme qui avait fait, pour son compte, bon nombre d'expériences. je me rappelai alors les signes de croix de la montée, et je lui demandai respectueusement comment elle et ses compatriotes accordaient si facilement le libertinage et la dévotion.	libertinage	1	1
monde_illustre	1891-07-18	1	10	PAG_00000010_TB000015	912	1799	2579	4145	sa personne la seule normale, celle de jolie et charmante poupée parisienne, d'un cœur mesuré, d'un tact souverain, avait pris certainement la haute direction de son être en ces difficiles épisodes d'un début de mariage. mais l'autre, celle qui à chaise-dieu après le départ de serge se troublait, mettait la volupté dans le souvenir chaste de l'idylle, celle qui s'éclipsait aux premiers jours des fiançailles mais qui se mani- festait dans la tendre et enfantine lettre à serge, celle-ci ne devait-elle point, à la révélation du mariage, passer par de voluptueuses transes, par des affres de sensualité qui l'ébranleraient bien autrement, et qui la ranimeraient de nouveau?	sensualité, voluptueuses	2	2
radical	1891-07-18	1	1	PAG_00000001_TB000110	252	1029	4735	2715	chez elle, une obsession était née, exaspérante, douloureuse et voluptueuse à la fois. elle s'impatientait des intervalles toujours trop longs espaçant les bonnes heures des rendez-vous.	voluptueuse	1	1
echodeparis	1891-07-19	1	1	Page1_Block16	3946	807	904	854	permet de traiter paris de babylone, de gomorrhe et de capoue, en profitant, tout bas, de cette même licence qu'ils con damnent si haut. — c'est la qualité dè votre libertinage que dédaignent quelques étrangers ! répli qua l'un de ces gentlemen et ce n'est que par curiosité qu'un anglais sérieux ef fleure, en passant, vos trop futiles plai sirs. les nôtres, chez n,|us, sont, vrai ment, d'un confort supérieur. — tenez : et, à grands traits, ils se mirent l'un après l'autre à nous esquisser cette orga nisation, si connue aujourd'hui, de la traite des vierges : cette exportation, par jour, d'une moyenne de trente.â cin quante enfants de huit à treize ans, cette mise en coupe réglée de toute virginité, de toute pudeur humaine.-ils s'étendirent en savantes variations sur le viol et sur les moyens dont on se sert, là-bas, pour l'ac complir commodément, soit en certaines demeures de londres, soit en certains vieux châteaux anglais perdus dans les brumes. chambres matelassées, oubliettes perfectionnées, anesthésiques et voitures de sûreté défilèrent sur leurs langues avec une verve sinistre qui eût confondu ann radcliffe. c'était par milliers et par mil liers qu'ils évoquaient les victimes de l'hy pocrite lubricité de leurs compatriotes, et, chose étrange ! ce n'était que cette hypo crisie qui paraissait les indigner. — bah ! répondis-je, un peu surpris, — voilà bien les poètes ! .ces-abus se passent à londres comme à pétersbourg, à new- york, â vienne, ici même, et dans toutes les grandes villes. c'est le droit du sei gneur, demeurant toujours le même et se monnayant, à présent, en droit du patron sur « ses petites ouvrières », du proprié taire sur ses bonnes, du passant sur les affamées. c'est le progrès. la faim, l'iso lement, les mauvais traitements de la fa mille, la paresse, le pavé, les guenilles, l'exemple, l'idée d'un bien-être, d'une sorte d acre vengeance sont partout des moyens qui dispensent les libertins d'em ployer la force. ceci est éternel, et les chiffres fournis par les statistiques européennes sont tels qu'il sera difficile d'y remédier de long temps. paris, je vous assure, n'a que faire de chambres matelassées, et . personne, même, ne trouve nécessaire de prier un orgue de. barbarie de jouer sous les fe nêtres, comme dans' fualdès , pendant l'instant psychologique, attendu que les parisiennes ne jettent'pas les hauts cris pour si peu. elles s'en vont, leur salaire en poche, en chantonnant ii bacio, les cerises ou tant pis pour elle! et tout est dit. — je ne vois donc pas pourquoi vous reprochez à paris lés facilités qu'il offre, au contraire, à vos assouvissements. • • l'un de mes intôrlocuteurs, avec un sourire pâle et fatigué, secoua la tête : — a paris, les jeunes filles, les enfants ne crient pas, dites-vous?... ehl c'est là, justement, ce que plusieurs connaisseurs, et nous, entre- autres, nous leur repro chons,-!^.., voilà bien les français avec leurs sens d'oiseaux ! pour quelques inno centes privautés,-quelques jeux d'enfants, quelques faveurs banales, les voilà se croyant des princes de la débauche ! en vérité, nous sommes plus... sérieux. ■ — ah ? répondis-je. après un moment de silence : — au fond, — continua tranquillement celui des deux promeneurs qui venait de parler, —pour connaître et comprendre, les préférences passionnelles d'un peuple, la nature, enfin, - des sens dont son orga nisme, en général, est pénétré, je dis qu'il n'est pas inutile de méditer, d'approfondir les impressions dominantes que laissent dans l'esprit, à cet égard, les œuvres de- son exprimeur favori, de son poète na tional. ce que « chante », en effet, celui-ci, les autres l'accomplissent — ou rêvent de l'accomplir. voyons : en france, vous avez votre victor hugo, par exemple, dont les œu vres crèvent de santé, de morale convenue et de solennelles vieilleries : tous le lisent. donc, la dominante des préférences sen suelles de la majorité des français est ex	libertinage	1	1
echodeparis	1891-07-19	1	1	Page1_Block25	3954	805	3338	836	» —ah ! plût aux dieux que mes lèvres, inharmonieuses, ne fussent que des lèvres collées aux charmes meurtris de ta blanche poitrine flagellée i qu'au lieu d'être nour ries du lait céleste,elles le fussent du. doux, sang de tes douces petites blessures ! que ne puis-je les sentir avec ma langue, ces blessures! et goûter, depuis ton sein jus qu'à ta ceinture, leur faibles gouttelettes! que ne puis-je boire tes veines comme du vin et manger tes seins comme du miel !... que ta chair n'est-elle ensevelie dans ma chair i » —ainsi,*conclut-il, l'énorme, l'immense succès de ces vers dans toutes les classes de la société anglaise prouve—comprenez- le, de grâce ! -r-que ces images sont les çré- férées de nos sens, de notre imagination, de notre tempérament■. national : en d'au tres termes, c'est ainsi que nous... aimons, que nous comprenons principalement les plaisirs do l'amour,- et, par conséquent, c'est ainsi-que nous les réalisons , quand notre fortune nous le permet. — hein ? m'écriai-je. — mais, sans doute! acheva paisible ment le jeune gentleman : pourquoi pas? ces milliers d'enfants et de toutes jeunes filles enlevés, achetés et exportés chez nous, servent, je vous l'atteste, à nous procurer le genre de délices voluptueuses dont parle notre, poète national ; nous épui sons, parfois, sur leurs personnes,-la série des plus •douloureux raffinèments, faisant succéder aux tortures des tortures plus subtiles. et si la mort survient, nous sa vons faire disparaître ces restes inconnus. l'enivrant spectacle de leurs souf frances et de leur beauté nous procure des ravissements qui vous sont lettre close, et, lorsqu'on les a goûtés une fois, on ne se soucie plus de ces autres transports qui vous sont suffisants. ' si vous croyez que je plaisante, rappro chez, en esprit, de tous les vœux exprimés dans les vers nationaux de swinburne, ces précautions que je viens de vous spé cifier, ces chambres matelassées des châ teaux perdus et des maisons un peu som bres de l'angleterre (de celles où l'on ne pénètre pas sans de longs détours) et vous concevrez sans effort que ce n'est point, comme à paris, pour étouffer des mari vaudages, des enfantillages, des viols et des minauderies, que quelques-uns de nos vieux et blasés industriels ont fait ces frais de tapissiers. ils mettent leur swinburne en action, car'ils sont pratiques et ils par tagent de tout point l'avis du poète car- lyle, qui déclare « préférer désormais au poème 'écrit, le.poème çgi ». ' — le fait est, répondis-je après un mo ment de stupéfaction, — le fait est que vos compatriotes ;ne pourraient- se procurer que bien difficilement à paris et en france des joies de cet acabit : notre décadence en ferait bien vite une question de cour d'assises, et je ne trouve pas, s'il faut tout dire, qu^l y ait lieu de nous .blâmer de notre infériorité à cet égard. d'ailleurs, l'angleterre n'a pas le monopole de ce genre — d'amour. aux yeux de quiconque a voyagé sur notre planète, ay ant quelques notions, d'histoire ancienne, ces sortes d'excès sont de tradition à l'ordre du jour chez bien des peuples. en perse, dans l'inde, en turquie d'asie, en russie, dans tout l'orient et de nombreux parages de l'amérique, ces tristes horreurs sont ba nales, sont dans les moeurs, au point que tel civilisé qui s'en choquerait ne se ferait même pas comprendre. elles sont dans la nature humaine , paraît-il, et, même ici, bon .nombre de moralistes qui jette raient, à ce sujet, feu et flammes laisse raient percer ,à leur insu, dans leur style, on ne sait quelle jalousie de n'en avoir point tâté eux-mêmes quelque peu, faute de ressources suffisantes. regrets qui formeraient le plus clair de leur indigna tion contre vos richards. mais une réflexion console, de ces turpi tudes maladives et révoltantes : c'est qu'au dire de la seience, qui le prouve, elles réussisent assez mal aux tempéraments de ceux qui s'y adonnent. vos . bons vieux millionnaires-qui, pour quelques livres,	voluptueuses	1	1
lanterne	1891-07-19	1	2	PAG_00000002_TB000195	1124	1023	5811	4588	la comtesse, avec des épaules superbes dans la splendeur de sa chevelure dlunde, éparse, était adorable ainsi, des seins opulents affaissés à peine sous leur propre poids, une hanche pluâ accusée par la pose nonchalante, le ventre gras, mais d'un ton si pur. pour l'allant maintenant sans forces;, quel délice encore, que de refaire en imagination les voluptueuses étapes tantôt marquées par ses lèvres; que de les marquer de nouveau du regard au.antque le permettait la courte-pointe d'ailleurs voilant a peine le beau ot-ps — oh ! l'impérissable souvenir pour le jeune homme, qui comprenait aujourd'hui la femme de trente ans ; il l'avait sous les yeux le fruit suave, dans toute sa maturité délicieuse; u lavait savouré de longues heures, sitôt'écoulées ! il souhaitait, vain désir, d'y mordre une fois de plus avant de s'en aller, pour ne point revenir peut-être 1 car, hélas! que deviendrait, avant peu, cette liaison du bohème sans un sou et de la mondaine riche?.	voluptueuses	1	1
echodeparis	1891-07-22	1	1	Page1_Block23	4138	813	993	990	sépultures. mais la mauvaise semence germa dans le sol complice. elles éclo- sent, elles s'érigent, elles sont belles, elles sont délicieusement odorantes, les assas sinées: et voici que, dans le jardin, mes regards s'émerveillent et s'épouvantent de leurs revivances épanouies et de mes crimes en fleur t » . ayant entendu cela, je dis, très sérieu sement: — croyez bien que je ne vous blâme en aucune façon d'avoir assassiné un certain nombre de jeunes femmes. si, d'en tuer plusieurs, il n'en devait plus rester sur la terre, il serait prudent d'hésiter devant une extrémité aussi décisive ; car, enfin, on ne saurait nier qu'il est des heures où nous ne revoyons pas sans joie un sou rire, même hypocrite, à des lèvres qui s'entr'ouvent sous le ruissellement des cheveux, pareil à un torrent de fauve au rore ou de noire nuit orageuse. mais comme, grâce à dieu, il est ici-bas beau coup plus debellespersonnes que, mêmeen une vie bien remplie, et en des bras mieux remplis encore, on n'en saurait étreindre, il n'y a aucun mal à en. supprimer, de temps en temps, quelques-unes, qui, en fin, abusèrent, jusqu'à un excès vraiment déconcertant, du droit de trahir que leur concédait notre mansuétude! donc ne croyez pas, jeune fou, ou, plutôt, adoles cent doué d'une si saine raison, que je sois enclin à désapprouver vos férocités vengeresses; d'autant moins que, sans nul doute, vous n'avez pas manqué, lors que vous étranglâtes, de laisser glisser vos mains cruelles vers les jeunes gorges qui, sur le point d'avoir la frigidité des albâtres, en avaient déjà la résistance. la seule chose qui me surprenne, c'est que vous versiez des larmes en ce jardin où fleuris sent d'équitables vengeances, et vous der. vriez, ce me semble, exulter de joie parmi vos justices accomplies. il cria : —semblable à un sauvage qui piétine des ennemis morts et massacrés, et massacrés encore, j'ai longtemps éclaté de rire parmi les vaines résurrections des traîtresses; et je disais : « oui, oui, vous ressemblez à des fleurs, oui, oui, monstres, vous êtes charmantes encore, et vous êtes belles et vous sentez bon ; mais il n'en est pas moins vrai que je vous ai tuées,bien tuées, et que vous ne nuirez plus jamais aux ten dres coeurs des amants. » ah ! combien je me trompais. même mortes, les détesta bles maîtresses ont trouvé le moyen en core d'être désolantes et destructrices ; et je suis la victime de leurs mânes éclos. —expliquez-vous i implorai-je, effrayé. — oh ! écoutez ! écoutez ! dit-il. dans ce jardin qui me vit exercer de légitimes vindictes, des ailes si légères, blanches, roses, dorées, d'où planait une poussière de soleil, voletaient autour de moi, sur mon front, sur mes yeux, sur mes lè vres, et leur frôlement à peine m'était exquisement doux. ( — c'étaient, dis-je, des papillons ? —non, c'étaient mes songes et mes rêves, et mes espérances même après les déses poirs, et mes illusions même après les illusions déçues ; ce n'était pas plus des papillons que ces apparences de fleurs ne sont des fleurs; c'était, épars au soleil, tout ce que le cruel amour m'avait laissé de cœur, d'esprit et d'âme. eh ! bien, — ah ! c'est pour cela, pour cela que je pleure — les horribles amantes que je croyais avoir si bien tuées, les perfides femmes ressus- citées en perfides calices, ont, de leurs vé néneux parfums, dispersé, chassé, fait mourir mes rêves, mes rêves, mes rêves, et je pleure à jamais dans le jardin sans ailes ! catulle mendès. reproduction interdite, ' i échos	frigidité	1	1
gil_blas	1891-07-22	1	1	PAG_00000001_TB000166	578	1019	4749	3880	mais quoi ! est-ce qu'un des personnages du remarquable livre par où vient de débuter le fils d'alphonse daudet, m. léon daudet; est-ce que, dans germe et poussière, un colonel intelligent ne reconnaît point que « dans l'amour d'une mère pour son fils d'un père pour sa fille, après des siècles de non-habitude incestueuse, peut s'introduire un grain » de sensualité ; le colonel, lui. prononce : « de ce qui ne devrait pas y etre »?	sensualité	1	1
gil_blas	1891-07-23	1	2	PAG_00000002_TB000002	1003	1014	424	567	egalement cachés dans notre coin avec noirmont, nous savourions le gracieux spectacle, car mon ami et moi, après dîner, nous avons l'âme bonne, et rien ne saurait nous être plus agréable que la vue voluptueuse du bonheur d'autrui. c'est en même temps consolant et digestif. madrid d'ailleurs avec sa vieille bâtisse, son escalier caché dans une tourelle garnie de lierre, ses pelouses brumeuses, est un cadre charmant pour un roman discret. marco pourrait encore entonner son refrain dans le même décor qu'ont rendu célèbre les filles de marbre d'antan. c'est vieillot et bonhomme. au loin, la marche de ragotzky arrivait généreuse et fière, par bouffées, scandée par des tziganes invisibles.	voluptueuse	1	1
gil_blas	1891-07-25	1	3	PAG_00000003_TB000023	194	1023	290	3300	est-ce donc en luttant d'égoïsme et de sensualité que vous espérez les conquérir ou les dominer ? lors même que vous y parviendriez, je vous plaindrais !	sensualité	1	1
