work	date	issue	page	block	height	width	hpos	vpos	text	active_words	occurrences_words	unique_words
temps	1890-10-16	1	3	Page1_Block12	3656	967	1195	4442	académie de médecine le secrétaire perpétuel donne lecture des letu-ea de candidature de mm. richelot et lucas-cham- . pionnière, qui so portent candidats à la place vacante .dans la section de pathologie . m. kelsh, professeur au val-dè-grâce,' adresse à l’académie une lettre de candidature à la place vacante dans la section de pathologie la correspondance comprend encore, un compte rendu adressé par la légation du mexique sur la mortalité de mexico au mois d’août dernier. - notions d'hygiène. — le ministre de l’instruction publique a. décidé, par un arrêté en date du 12 août dernier, que douze conférences d’hygiène seraient faites, chaque année aux élèves de nos classes de philosophie. le programme, de ces conférences a été rédigé f ar la commission des réformes à apporter dans enseignement secondaire classique, commission à laquelle sont dues les innovations apportées à l’hygiène des établissements scolaire et les développements donnés aux exercices physiques. m. proust, professeur d’hygiène à la faculté de médecine de paris, a rédigé, pour les maîtres et pour les élèves, un petit volume qui renferme, sous une forme claire et abrégée, les notions indispensables sur les 'divers points du programme, prescrit. il passe successivement en revue l’eau, l’air, les les maladies transmissibles an point de vue dé leur genèse, de leur propagation et de leur la salubrité des habitations, etc. cet comble la lacune que l’arrêté ministériel a eu pour but de réparer dans l’éducation de nos traitement des ulcères de la jambe par l’autoplastic italienne. — m. p. berger présente deux malades chez lesquels il a' guéri par l’autoplastie pratiquée parla méthode italienne des ulcères delà jambe qui avaient résisté à tous les modes de traitement. dans le premier cas, et par quatre opérations successives, m. berger a reconstitué les téguments sur toute la circonférence do la jambe en quatre lambeaux cutanés soit à la cuisse soit à la jambe ou à la cuisse les troubles trophiques :du pied et les raideurs ont disparu et le membre est redevenu tout à fait apte à la marche. le second malade avait des ulcères incurables des deux jambes siégeant au centre de cicatrices foi't étendues do brûlures. m. berger a comblé une. de ces pertes de substance en y transportant un lambeau emprunté à la cuisse correspondante. le résultat est aussi bon que possible. l’autre jambe doit être prochainement opérée de la même façon. le tabac, cause de la dépopulation de la france. — dans les nombreux discours prononcés dans les académies, toutes les causes de la et tous les moyens efficaces de la combattre ont-ils été signalés? la société contre l’abus du ne le pense pas et signale, par l’organe de son . vice-président, m. le docteur dujardin-beaumetz, à l’académie de médecine une lacune regrettable, n s’agit de l'influence néfaste du tabac sur les do la génération. elle rappelle que dès 1878 la société a mis au concours la question suivante : « rechercher, en s’appuyant sur des faits bien si l’usage immodéré du tabac exerce une influence néfaste : 1° sur l'aptitude des à la procréation; 2° sur la constitution et la santé de leurs enfants. » les mémoires reçus ont tous répondu affirmativement. en dehors de ces mémoires, la société contre l'abus du tabac signale encore à l’académie observations propres à éclairer la question. 1° dans un rapport au ministre do l’intérieur, lu à l’académie de médecine dans la séance du 24 mai 1881, le rapporteur, m. le docteur lagneau, s’exprime ainsi : «mm. ségalas, béhier, martin- damourette, cordicr, jacquemart et bodros ont des cas de frigidité remarquables chez des fumeurs qui ne recouvrèrent leur virilité qu’en de tabac. » a la suite de ce rapport, l’académie de médecine a adopté à l’unanimité un ensemble de conclusions parmi lesquelles la suivante : « l’action nuisible du tabac est démontrée par un faisceau de faits et d’inductions dès à présent acquis à la science. » la société rappelle aussi que le docteur brochard s’exprime ainsi que suit à ce sujet : « je suis que, dans beaucoup de famüles, l’usage du tabac est la véritable cause du petit nombre d’enfants que ton y remarque. l’influence néfaste du tabac se fait également sentir sur la vie, sur la constitution des nouveaux-nés et sur les personnes exposées à respirer la fumée ou les du tabac. un autre praticien distingué a que l’influence de l’abus ne pèse pas seule	frigidité	1	1
intransigeant	1890-10-17	1	2	Page1_Block47	1513	806	3371	5237	suite d’actions d’éclat, ses cajzaârades sincèrement, sans arricre-pe.nsée, « bien qu’il : eut passé sur le dos de et où les officiers «fêteraient assurément prochaine, de sa à la soiis-lieutcnance ? qu’alléguer contre cés. arguments amicalement, non dans la banalité encourageante d’uu chef s’adressant à un inférieur! jacques renonça donc à son idée qu’il n’aurait d’ailleurs aucun raoyen de transporter du domaine des vœux dans.celui de la pratique. mais quels remords, que ses rendez- vous, ses tête-à-tête, avec la baronne, tous les jours, à présent, dans le calme de paris, rempli de troupes en formation, de gardes nationales évoluant, de battant le pavé, de marias qui la discipline relâchée de quotidiennes sorties du jusqu’au soir, tard, profitant du surcroît d’occupation qui incombait au colonel,-désigné pour le chapeau de noires du brigadier, et souvent au ministère de la guerre en conseil, mme de chagrenon exigeait qu’il lui tout son temps de liberté. passaient encore les dîners en cabinets particuliers dans le3 grands restaurants, }es heures voluptueuses écoulées dans l’appartement loué eu ville par l’avocat, mais ces débauches — car l’âmour n’entrait pour rien'dans ces clandestines des amants, et seuls leurs sens étaient en jeu — mai3 ces débauches	voluptueuses	1	1
liberte	1890-10-17	1	1	PAG_1_TB000068	176	1081	3672	5859	notez qu'il ne s'agit pas ici d'une boutade. l'académie de médecine discutait hier et constatait les cas de frigidité pro-	frigidité	1	1
presse	1890-10-17	1	1	Page1_Block21	5667	967	2989	1063	un adversaire déclaré du parlementarisme et un partisan résolu de la revision. . son discours qui était un développement de la ré cente interview publiée par y eclair, a été inter rompu à chaque instant par des bravos. un grand nombre de citoyens ont posé à naquet des questions auxquelles le député du cinquième, arrondissement a répondu à la satisfaction de la grande majorité de la réunion. le citoyen antomarchi ayant cru habile de placer les questions sur un terrain tout à fait personnel, notre ami andré lefèvre, dans une vive réplique, a exécuté ce maladroit adversaire. notre ami larcher a présidé la réunion avec la plus grande impartialité, laissant à tous les ora teurs — et ils ont été nombreux — la plus grande liberté de parole. • . ; ' a onze-heures et demie, plusieurs ordres du jour ont été présentés. les ordres du jour de blâme ont été impitoyablement repoussés. l'ordre du jour . finalement l'ordre du jour suivant a été voté à l 'unanimité moins cinq voix : « les électeurs de la première circonscription du cinquième arrondissement, réunis salle octobre, le mercredi 15 octobre, après avoir entendu le ci toyen naquet rendre compte de son mandat et ses explications sur -la situation politique, approuvent ses votes à la chambre ainsi que sa conduite poli tique et l'invitent à poursuivre une politique nette ment républicaine, révisionniste et réformatrice. » la réunion a été levée aux cris mille fois répétés: de: vive naquet! vive, la république 1 ; au quinzième arrondissement la réunion d'hier soir le groupe républicain socialiste révisionniste du quartier saint-lambert et le groupe des travailleurs républicains révisionnistes de javel se sont réunis, hier soir, 104,= r.ue. des entrepreneurs, au salon des familles, pour s'entendre sur. la date de la réunion publique dans laquelle le citoyen georges laguerre, député du quinzième arrondissement, rendra compte dè son mandat.. .le bureau a été formé des citoyens ratisse, pré-, sident; cherioux et galibardy, assesseurs ; ingé et petitroux, secrétaires. v' - ; ■ 1 après un débat auquel ont pris part- les citoyens cherioux, apté, bâtisse, galibardy, maillochon, maximilien - georges, ' beauchery, ■ » delamarche, ingéjwin'terholter, jaudlin, couronne, dubois, etc., mission ; a été donnée aux membres du bureau d'or- ,.ganiser la réunion publique pour la date la plus, proche. . l'ordre du jour avant de se séparer, les deux comités ont voté, l 'ordre du jour suivant à l'unanimité : « les comités républicains révisionnistes-des' quartiers saint-lambert et javel, réunis le 15 oc tobre, 104, rue des entrepreneurs, au salon des far milles, protestent, de la. façon la - plus énergique- contre les compte rendus déloyaux -de là réunion du 11 octobre, commjiniqués à la presse par leurs adversaires ; .« ils affirment qu'à cette réunion où moins do 350\ personnes étaient présentes, assistaient beaucoup d'étrangers -à l'arrondissement. la carte d'électeur n'était même pas exigée,'et il suffisait de verser la somme de -20. centimes pour avoir accès dans la salle ; .. . . ..... « ils affirment également que l'ordre du jour voté; contre leur député, et publié par .les journaux du ministère, n'a obtenu qu'une soixantaine de - suffra- ■ ges et qu'il eût été repoussé par une majorité écra sante, si la contretépreuve eut été. mise aux voix..» ljaffichage de cet ordre du jour dans la deuxième , circonscription du quinzièms arrondissement a été voté par les comités.' , petite bourse dot seir ,3 0/0 . . :... ......... ; ' 93 71 1/4, 53 3/4. turc ... .i. ... 18 30,25. t banque ottomane;..... .620 62, 617 81, 618 12. egypte '490 62. . : rio-tinto............. 616 25, 611 87, 613 75. i extérieure............ 75 25/32, 21/32,11/16. ' hongrois............. 90 1/4, 9/32. portugais.. ;...'i 61 1/16. la question du joïïb „1,e tabac et la dépopulation ' bien curieuse, la séance d'hier à l'académie de l'ecole de médecine. . i on y parlait encore et touj,ours de la dépo pulation et de ses ; causes jconnues-.et à con naître. : m. dujardin-bêaumetz avait cru faire une récente découverte. il s'était demandé si l'a r bus du tabac n'atténuerait pas chez l'homme la faculté do la procréation. il avait été encouragé dans ses recherches par des observations de. médecins bien con nus. ces derniers avaient remarqué « des cas de frigidité remarquables -chez des fumeurs qui ne recouvrirent leur virilité q.u'en s'abste- nant de tabac ». . il n'en fallait pas davantage pour accuser la nicotine de dépeupler la france. et m. dujardin-beaumetz se livra, pour se convaincre, à une série d'expériences per sonnelles, non sur lui-même, mais sur des animaux prolifiques. ■ ' , ; i ii prit deux coqs et douze poules dans des. conditions. identiques de race, d'âge et de nourriture, et il les divisa en deux.lots. . l'un des coqs était placé la nuit dans un poulailler où brûlaient lentement 6 grammes, de tabac. les œufs des deux lots furent mis à couver,; et la proportion des poulets qui ont éclos. a été de beaucoup plus faible dans le lot du coq. nicotiné, de même que la mortalité de ces premiers a été plus considérable. cela a suffi et, publiquement, m. dujardin- beaumetz a prononcé hier contre l'abus du tabac, un violent réquisitoire ; publiquement; il a signalé aux pouvoirs publics les terribles ravages du scaferlati. mais pendant qu'il s'escrimait, en termes fort éloquents d'ailleurs, m. brouardel, dou cement se levait dans son fauteuil et murmu-. rait : « et l'allemagne 111 » gette interruption a suffi à démonter l'ora teur. les membres de l'académie qui suivaient avec une visible satisfaction l'argumentation de m; dujardin-beaumetz, ont écouté d'une manière distraite la fin de son discours. chacun s'est en effet souvenu..que.l'alle mand, plus fumeur que le français, plus in toxiqué que lui par la pipe et les longues sta tions dans les estaminets, est reconnu très prolifique. - et la discussion a fini en fumée.	frigidité	1	1
siecle	1890-10-18	1	2	Page1_Block5	3786	842	206	290	monda, et pousse, lui aussi, le cri touchant de jocelyn : o.mon dieu 1 que la terre est pleine de bonheur i je sais avec quelle prudence il faut user de ce mot, l'inspiration. trop souvent il sert a légitimer les pires erreurs, les lieux communs les plus fatigants, à remplacer l 'idée juste par le mensonge des motsvides, des vaines périodes, des banales déclama tions. mais cependant, on ne le peut nier, il existe des hommes, des poètes, chez qui le jaillissement de la pensée se produit avec une spontanéité merveilleuse et, ra pide, se façonne à l'instant même son expression nécessaire. de tels artistes, tout de passion et de rêve, ne sauraient admettre le travail pa» tient et obstiné : ils ne sont jamais de ces amoureux de la forme, de ces enragés de style qui peinent, qui souffrent pour la réa lisation parfaite de l'œuvre. mais la séré nité de leur essor, l'éloquence naturelle de leur langage, la pers»asioa de leur génie et sa divine inconscience, voilà de quoi nous rendre indifférents aux fautes de goût, aux incorrections de style qu'ils peuvent roya lement se permettre, lamartine est le type même de ces poètes insoucieux de la perfection matérielle ; sa langue, incorrecte parfois, souvent confuse et lâchée, trahirait son profond génie poé tique, si ce génie ne la fleurissait à toute minute d'expressions émues, d'imageshar- monieuses et riches, et aussi de ces rythmes charmeurs, aux voluptueuses caresses, que mous ne pouvons entendre sans en subir le suave enchantement. et ici l'on peut citer au hasard: repose toi, mon âme, en ce dernier asile, ainsi qu'un voyageur qui, le cœur plein d'es- . i poir, s'assied, avant d'entrer, aux portes de la ville, et respire un moment l'air embaumé du soir... ■ * -* » tl peut-être même, en dépit du charme que 'nous trouvons encore à ces strophes mélo dieuses, nous est-il impossible de compren dre quelle douceur on dût leur trouver lors qu'elles furent dites pour la première fois. depuis cette mystique et si tendre harmo nie, d'autres voix, belles et nombreuses, ont chanté pour nos oreilles, d'autres poètes nous ont étonnés et ravis : hugo et sa symphonie fantastique, pleine d'éclats de foudre et pourtant aussi de souriantes chansons ; beaudelaire et sa musique trou blante, tantôt amèrement ironique, tantôt éperdue de passion douloureuse, où de maladives extases s'interrompent de san glots, plus désespérés que ceux où les lit térateurs ont coutume. puis sont venus les oeuvres des parnassiens, orfèvreries de sons et d'images, et les hautains symboles de mallarmé, et la sérénité majestueuse de leconte de lisle, les larmes, les prières tremblantes de verlaine. mais, pour bien comprendre ee que fut lamartine, quelle nouveauté aub>ime. apparaissait dans son œuvre, il faut se reporter au lendemain des grandes guerres, des effroyables héca- tombes^ du farouch® exode militaire em plissant l'europe de la fumée des batailles, et songer à l'état des esprits dans une na tion épuisée d'hommes et d'argent, vaincue, dépossédée de sa force et de ses ambitions. partout des ruines: dans le tumulte des mê lées, au milieu des plus sombres tragédies politiques, l'art semblait disparu, lalittêraj ture morte. on cherchait une croyance et un espoir, et le désir commençait à sourdre, en cette société, lasse, d'oublier enfin les révolutions et les guerres, de se reprendre à- vivre, à aimer, à rêver, à interroger l'âme «t la nature. c'est alors que s'éleva le beau cantique de lamartine. le poète fut la voix attendue, la parole vivante de son pays et de son temps. aujourd'hui; nous le saluons de nouveau, parce sue nous comprenons la grandeur, l'excellence très unique de son rôle. après l'avoir sans (loute quelque peu méconnu, l'opinion de ceux qui lisent, le culte des fervents de la poésie st de l'art, reviennent vers ce noble esprit, vers && grand cœur, et nous pouvons redire les vers qu'il adressait jadis à lord byron : vient reprendre ton rang dans ta splendeur | première, parmi ces purs enfants de gloire et de lumière que d'un souffle choisi dieu voulut animer, et qu'il fit pour chanter, pour croire et pour | aimer 1 alfred ernst	voluptueuses	1	1
gil_blas	1890-10-19	1	2	PAG_00000002_TB000141	240	1029	3794	3214	l'enfant se plaignait de ressentir de vives souffrances aux joues, au cou, et aux parties sexuelles : celles-ci portaient — détail horrible — des blessures qui paraissaient provenir de morsures.	sexuelles	1	1
gil_blas	1890-10-19	1	2	PAG_00000002_TB000145	417	1031	3800	4185	le jeune bayonnat — antoine, et non joseph — questionné de nouveau, a déclaré que son agresseur lui avait mordu les parties sexuelles pour l'empêcher de crier. il lui avait serré la gorge avec le foulard qu'il portait, les blessures qu'il avait au cou, dit-il, provenaient de ce que l'individu lui avait appuyé la tête sur les cailloux en le maintenant pour qu'il ne pût bou-	sexuelles	1	1
lanterne	1890-10-19	1	2	PAG_00000002_TB000081	279	1033	2514	996	ce praticien constata que le jeune bayonna portait au cou des marques de strangulation et avait les parties sexuelles blessées, comme si elles avaient subi des morsures. en outre, la jambe gauche était cassée.	sexuelles	1	1
gaulois	1890-10-20	1	1	P1_TB00050	2438	777	3353	4907	les centenaires on s'amuse comme on peut, et chaque époque a ses distractions favorites. les érections de statues, et surtout les centenaires sont, en ce moment, le plaisir àla mode. nous y excellons, et aucun peuple ne peut rivaliser avec nous dans l'art de dresser un bronze à quelqu'un, et de l'inaugurer congrûment en présence des autorités. les pessimistes auront beau crier, tant qu'il y aura chez nous des cérémonies officielles, la vieille gaieté française ne disparaîtra pas complètement. des conseillers municipaux réunis sur une belle estrade, le préfet, le maire, quelques instituteurs laïques, une demi-douzaine de sociétés de gymnastique, un bon orphéon, le tout entouré de drapeaux tricolores, il n'en faut pas davantage pour combler de joie des populations entières. joignez à cela le délégué du ministre, parfois le ministre lui-même, et le représentant de m. carnot. partout où m. carnot envoie un représentant, il n'y a pas moyen de s'ennuyer une minute. c'est une justice à rendre à m. le président de la république qu'il choisit toujours pour cette délicate fonction des gens gais, de bonne humeur et éminemment sympathiques. il en a un grand choix qui ne cessent de parcourir la france en tous les sens. la solennité terminée, on décore, en général, deux ou trois amateurs, ce qui n'est pas le moindre attrait de ces réunions de famille. depuis quelques années, les centenaires semblent être plus en faveur auprès du grand public que les simples inaugurations de statues. en province principalement, ils sont très recherchés. il existe, dans la plus petite bourgade, un employé spécialement chargé de se tenir au courant des gloires locales, et de ne pas les perdre de vue un instant. dèsqu'ily a matière à centenaire, on prévient le gouvernemént et les orphéons. l'employé qui laisserait s'écouler un centenaire sans avertir serait immédiatement destitué. ces places sont fort recherchées à cause de la décoration. il est préférable, pour fêter un centenaire, que la centième année soit révolue, mais ce n'est pas indispensable, et il n'y a pas grand mal à avancer la fête de deux ou trois ans, et même davantage. on terme les yeux, d'un commun accord, sur ces petites tricheries qu'excuse un légitime enthousiasme. nous renonçons à décrire l'allégresse de la ville de mâcon lorsque, il y a quelque temps, le bruit courut que lamartine	érections	1	1
liberte	1890-10-20	1	2	PAG_2_TB000187	466	1087	1703	7106	ce n'est plus ici la note sensuelle et voluptueuse de gounod, ni de massenet ; c'est l'expression de l'amour immaculé de ce naïf et héroïque guerrier, qui chante cette phrase si noblement sereine : « j'ai gardé mon âme ingénue à la fiancé inconnue. » la simplicité de cet aveu, loin de faire sourire, met comme une auréole au front du vaillant libérateur de brunehild.	voluptueuse	1	1
rappel	1890-10-21	1	3	PAG_00000003_TB000294	976	1007	4491	7344	mais, en même temps aussi, par un choc en retour de son autre amour, il eut la vision délicieuse et soudaine du jardin de saint-james et d'eveline. il respira le parfum de l'aubépine et des roses, el celui-là, plus enivrant, qu'exhalait eveline. il la vit, comme si elle fût trouvée là, présente et se blottissant contre lui, dans la transparente et voluptueuse séduction de sa beauté. il allait lui dire qu'il était libre ; et cette beauté serait à lafml défaillit de plaisir et aussi de honte, il était vaincu et s'abandonnait, sans plus regarder en arrière, au vertige de son cœur et de ses mns. de nouveau il baissa la tête et laissa tomber de sa main celle de la jeune fille.	voluptueuse	1	1
debats	1890-10-22	1	4	P4_TB00044	566	1564	1089	2727	enrichisses-vous nm ri! #% f r. à gagner in 5 jours àla bourse âïes mhh m le capital èst remboursé en cas d'insuccès. i ecr. banque syndicale, £7, rue laffîiie, paris ! affaiblissent, viril, pertes , onanisme , etc. guérison. traite ds d* g.dc vivier s. eaveloppe.7, b.sétaslop 01.2 à 1 li, ctpar correjp. y 8 maison fondée en 1575 fihfffiw iu3itîi paris, 32, bqul 4 des itaueks.	onanisme	1	1
radical	1890-10-22	1	1	PAG_00000001_TB000152	334	1033	1471	7619	celui qui avait vu cette femme si belle et qui l'avait reproduite avec une si chaude passion, était follemçnt épris et sa grâce voluptueuse faisait tout comprendre, si elle ne faisait pas tout excuser.	voluptueuse	1	1
voleur_illustre	1890-10-23	1	12	PAG_00000012_TB000035	917	1311	1694	3346	pensã©e, les sens par les sensations, elle l'ã©puisã©, elle l'accable bientã´t comme toute jouissance trop complã¨te d'une voluptueuse fatigue, et lui fait rendre en peu de vers, en peu d'instants, tout ce qu'il y a de vie intã©rieure et de force de sentiment dans sa double organisation. la prose ne s'adresse qu'ã  l'idã©e; le vers parle ã  l'idã©e et ã  la sensation tout ã  la fois. cette langue toute mystã©rieuse, toute instinctive qu'elle eoit, ou plutã´t par cela mãªme qu'elle est instinctive et mystã©rieuse, cette langue ne mourra jamais! elle n'est point, comme on n'a cessã© de le dire malgrã© les dã©mentis successifs de toutes les ã©poques, elle n'est pas seulement la langue de l'enfance des peuples, le balbutiement de l'intelligence humaine ; elle est la langue de tous les ã¢ges de l'humanitã©, naã¯ve et simple au berceau des nations, conteuse et merveilleuse comme la nourrice au chevet de l'enfaut, amoureuse et pastorale chez les peuples jeunes et p'asteurs, guer-	voluptueuse	1	1
