work	date	issue	page	block	height	width	hpos	vpos	text	active_words	occurrences_words	unique_words
journal_de_toulouse	1845-02-03	1	2	Block4	0	0	0	0	on annonce que les fonds secrets seront présentés jeudi prochain mme la grande duchesse olga nicolaïevna. . par le ministère. - cn morde. de naples, le 9 janvier : m. duchâ(el a , dit-on , fait connaitre à un assez grand nombre glace a la paix profonde qui règne dans font le royaume, s. m. de députés que la chambre serait dissoute après la session et que a résolu de faire une réduction annuelle de 400,000 ducats dans les les érections générales auraient lieu eu novembre prochain. dépenses de l'armée. .- evidemment ceux qui se sont abstenus de voter pour ou con- le 31 décembre on a ressenti à :dessine (le légères secousses tre le paragraphe de l'adresse, relatif à l'indemnité pritchard, ne de tremblement de terre qui ont duré assez long-temps. voulaient pas!renverser le ministère; s'ils eussent voulu le renverser, ils ne se fussent pas abstenus. en s'abstenant, ils manifestaient sim- les journaux anglais publient une longue correspondance plement une dissidence sur un acte particulier de la politique ministérielle. cela est si vrai que l'honorable m. darblay, qui s'était échangée entre le comité des directeurs de la société des missions abstenu de voter, s'est réuni ce matin aux membres (lu parti con- de lomlres et m. guizot, relativement à taïti. on n'a pas oublié servateur , et a déclaré qu'il soutenait avec eux et comme eux le que les respectables missionnaires, au moment du voyage du roi ministère. c'est à la fois de la logique et de la loyauté. l'exemple des francais cri angleterre, sollicitèrent l'honneur d'être admis à de m. darblay sera suivi, nous n 'cri doutons pas. a l'heure du présenter à s. m. une adresse sur ce sujet. oit sait aussi qu'il ne danger, il n'y a plus de dissidence, et tout le monde se rallie autour l'ut pas possible d'accéder à leur requête. la société, par l'organe de àl-11. tidman et freeman ses secrétaires, demanda alors qu'il de son drapeau. - la commission du budget s'est occupée dans ses deux derniè- lui fuit permis d'envoyer en france truc députation de quelques .m. res séances des crédits réclamés pour augmenter les traitements (les membres, afin de soumettre son mémoire au roi des français. fit savoir à m. de saint-aulaire que le roi le chargeait agents extérieurs du service politique. les ambassades suivantes guizot les directeurs de la société qu'il ne lui était pas possible recevraient des augmentations. berne serail porté de 50 à 60,000 d'informer ie recevoir tune députation ayant pour objet de soulever unequesfr. ; bruxelles , de 60 à 70,000 fr. ; constantinople , de 120,000 à tion politique du ressort de soit gouvernement, appelé à la discuter. 125,000 fr. ; madrid , de t 50 à 180,000 tr. ; naples de 90 à les directeurs ont donc pris le parti d'adresser le mémoire en ques100,000 fr. les légations d'athènes, de buenos-ayres, darmstâdt, tion à m. guizot, en le priant de le mettre sous les yeux de lisbonne , bio-janeiro , weymar , bogota et les secrétaires d'ams. -ni. bassade de londres , berne , bruxelles et hanovre , recevraient nous n'analyserons pas ce long manifeste, dicté par un zèle trop aussi une augmentation de traitement, ardent pour n'être pas quelquefois aveugle. les pétitionnaires déla commission commencera demain l'examen du budget des dé- butent en déclarant qu'ils n'ont qu'un but : faire un appel à l'h ipenses de t'instruction publique. manité et à la générosité du roi des francais dans l'intérêt du peu- on a distribué le rapport fait au ministre des finances pour pie souffrant de taïti, et ils terminent en suppliant s. m. de reconstater les résultats de la fabrication et de la vente du tabac , noncer au protectorat de ce petit royaume. tels qu'ils ressortent des comptes présentés pour i'année 1 8,13. la voici la réponse de m. guizot : consommation du tabac a été (le 16,990,000 kil. qui ont procuré e paris , le 31 décembre 1841. au trésor une recette de 104,3685000 fr. déductiou faite (les remises des débitants. le bénéfice réel de l'état a été de 77,368,000 e messieurs , » m. le comte de saint-aulaire m'a transmis avec la lettre que fr. en y comprenant une augmentation de 5,558,000 fr. dans le capital de la régie et diverses&cettes accessoires. vous m'avez lait l'honneur de m'adresser , cri date du 16 de ce mois, le mémoire adressé au roi des français , qui accompagnait - m. le maréchal ministre de la guerre, considérant que la plulettre part des délits d'insubordination sont commis par des militaires en cette e bien qu'il me fùt impossible d'adopter les conclusions de ce état d'ivresse, vient d'inviter , par une nouvelle circulaire , les mémoire , ou ntème de reconuaitre l'entière exactitude de quellieutenants-généraux commandant les divisions à punir avec tonte repose, je n'ai la rigueur de la discipline les hommes surpris dans cet état , afin ques-uns des faits et considérations sur lesquels ildont la teneur est hésité à soumettre à s. m. ces documents , d'éviter à la justice (les conseils de guerre d'avoir à statuer si fré- pas si conforme anx sentiments d'humanité , de modération et de toléquemment sur des crimes ou délits que lette funeste passion fait rance qui ont toujours iniluencé la politique de son gouvernement. commettre. le roi en a été vivement ému, et il me charge de vous informer -m. arago a retiré sa démission (le membre du conseil général qu'il est charmé de découvrir dans cette heureuse conformité un rie la seine, sur les instances d'une députation des électeurs qui nouveau motif d'espérer que les missionnaires placés sous votre iiirection emploieront tous leurs efforts à aider les autorités, chargées l'ont nommé. - mardi, il y a eu spectacle à la cour. l'assemblée était, com- d'exercer le protectorat français à taïti , à l'accomplissement de trle toujours, nombreuse et brillante. le corps diplomatique tout l'eeuvre de la civilisation, qui doit être le but de leurs travaux. « je n'ai pas besoin d'ajouter que les missionnaires, de leur cûté, entier, ainsi qu'un grand nombre (le membres des deux chambres, assistaient à cette réunion. le roi, entouré de sa famille, a laquelle peuvent compter sur l'appui et -le boit vouloir des autorités frans'était jointe mme la princesse clémentine, arrivée dans la journée çaises. ii agréez, messieurs, l'assurance de ma haute considération , mense à paris, a été accueilli avec les plus vives acclamations par la salle entière. les ministres, cri grand costume, sont entrés quele signé, gurzot. e crie, minutes avant sa majesté, et ont pris place immédiatement la société des missionnaires anglais ne s'est point contentée après les ilrinces et les princesses. la représentation se composait du contenu de la lettre de m. guizot ; elle a répondu au mide la ,11,uelle , qui a été exécutée par les artistes de l'académie nistre : royale de musique avec leur talent et leur ensemble habituels. ou « monsieur, nous avons l'honneur de vous accuser réception de avait d'abord résolu d'intercaler dans celte pièce les pas des jeunes voire dépêche du 31 décembre, adressée aux directeurs de la société danseuses viennoises ; mais on a renoncé à cette partie du pro- des missionnaires de londres, en réponse à leur mémoire à s. m. le gramme, leurs majestés avant manifesté l'intention de voir au théà- roi (les frausris dans l'intérêt de la population souffrante de taïti. tic rrième de l'opéra l'exécution de ces danses curieuses. l'es directeurs nous chargent d'exprimer leur profond regret que ce le; spectacle ne s'est pas prolongé tard, et à onze heures le roi soit l'intention du gouvernement du roi de perpétuer le protectorat et la reine étaient rentrés dans leurs appartements. celte soirée a de file... » présenté une physionomie pleine d'iutérèt. des députés de toutes les nuances, advçrsaires politiques, se trouvaient confondus les uns cour d'assises ue l'orne. à enté des autres, échangeaient ensemble des conversations amicaparricide. les, et semblaient oublier pour quelques heures leurs dissentiments le 22 novembre 1841, entre cinq et six heures dit matin,jeande la veille et leurs luttes du lendemain. on reniai que, eu général, que les invitations du roi, (le même que celles de m le duc de francois lainé, boulanger à la carneilte, arrondissement de dontnnemours, sont adressées aux hommes politiques saris distinction front, était occupé à travailler dans l'intérieur de sa boulangerie , d'opinions, que lai même réception gracieuse est faite à tous, et lorsqu'il fut atteint par un coup de feu tiré de l'extérieur, à travers qu'on y évite toujours les moindres allusions à la politique mili- une croisée, à une distance de trois ou quatre mètres. malgré la douleur et la perte de sait, qui s'écoulait par de nomtante.	érections	1	1
courrier_gard	1845-02-04	1	3	PAG_00000003_TB000019	403	871	51	3523	ht. 11 trouve encore dans les champs, soit sur les nr-b[.es> soit à terre, assez d’olives qui y ont été ou-; on peut en ouvrir plusieurs , et l’on ne verra les unes que l'enveloppe de la nymphe , tandis ^ majeure partie , malgré leur piqûre, n’en ren-aucune trace. demander comment cet insecte la'r se transformer en mouche, tantôt dans l’olive, iin p dans la terre , c’est demander à la providence hajd*ces mystères qu'elle cache à notre intelligence. ** est permis de penser que c’est là une prépuce pour la conservation de l’espèce.	prépuce	1	1
presse	1845-02-13	1	1	Page1_Block42	1655	1024	1116	4295	de temps qu'il n'en eût fallu à un cheval ordinaire; il bouscula et démolit sur son passage cette haie mobile de braves bourgeois qui se promenaient paisiblement autour des boutiques de la place baudoyer, et entra danslepalais. ; là il interrogea suisse et sentinelle. le suisse croyait bien avoir vu rentrer m. de la mole le matin, mais il ne l'avait pas vu sortir. la sentinelle n'était là que depuis une heure et demie et n'avait rien vu. ■ ; il monta tout courant à la chambre et en ouvrit la porte précipitamment, mais il ne trouva dans la chambre que le pourpoint de la mole tout lacéré, ce qui redoubla encore ses inquiétudes. alors il songea à la hurière et courut chez le digne hôtellier de la belle-etoile, la hurière avait vu la mole; là mole avait déjeuné chez la hurière. coconnas fut donc entièrement rassuré, et comme il avait grand faim, il demanda à souper à son tour. coconnas était dans les deux dispositions nécessaires pour bien souper, il avait l'esprit rassuré et l'estomac vide; il soupa donc si bien qne son repas le conduisit jus qu'à huit heures. alors, réconforté par deux bouteilles d'un petit vin d'anjou qu'il aimait fort et qu'il venait de sabler avec une sensualité qui se trahissait par des cli- gnemens d'yeux et des clapemens de langue réitérés, il se remit à la recherche de la mole, accompagnant celte nouvelle exploration à travers la foule de coups de pied- et de coups de poing proportionnés à l'accroissement d'a mitié que lui avait inspiré le bien-être qui suit toujours un bon repas. cela dura une heure; pendant une heure coconnas par courut toutes les rues avoisinant le quai de la grève, le port au charbon, la rue saint-antoine, et les rues tizon et cloche-percée, où il pensait que son ami pouvait être revenu. enfin, il comprit qu'il y avait un endroit par le quel il fallait qu'il passât, c'était le guichet du louvre, et il résolut de l'aller attendre sous ce guichet jusqu'à sa rentrée. 11 n'était plus qu'à cent pas du louvre, et remettait sur ses jambes une femme dont il avait déjà renversé le mari place saint-germain-l'auxerrois, lorsqu'à l'horizon il a- | perçut devant lui, à la clarté douteuse d'un grand fanal	sensualité	1	1
presse	1845-02-14	1	4	Page1_Block37	299	1155	3033	2893	d „- r p n ,ss. e rap , lampes et bronzis^ uec h™. ancienne maison mavdiw. pi coït «nccessenr. • z.as8pss * - } labxpes solaires sans mécanisme, brûlant tout* dites carcel garanti*». | espèce d'huile sans odeur ni iumée. lampes a compensateur sans mécanisme, pouvant la nettoyer soi-même. éclairage codsplet, pour billard, à jo francs; pour salle à manger, 35 fr. lustres, pendules, candelabres et flambeaux.	coït	1	1
constitutionnel	1845-02-18	1	2	Page1_Block12	1633	1138	1335	3318	tique. un jour, triste et bourrelé d'inquiétude , il errait dans les rues. il rencontre un vieillard , couvert de haillons , à la face amaigrie. a le voir, on le devinait sans peine : il avait faim. mallet s'émeut, s'appro che et le reconnaît. ce malheureux , c'était un instituteur qui lui avait donné autrefois, alors qu'il était encore enfant, le peu d'instruction qu'il possède.!! luiparle.ilen appelles ses souvenirs, il apprend que son ancien professeur est tomb^ dans le plus complet dénûment. il n'est pas riche lui-même, maisau moins il adu pain,et ce pain, il veut le partager. il em mène le vieillard, il le loge sous son toit, il le nourrit à sa table jusqu'à l'heure de sa* mort; qui eût pu croire alors que mallet, devenu quelques mois après, le reçéleur attitré d'une bande de voleurs, s'engageait dans la route funeste qui l'a conduit au déshonneur et au crime ? ■ l'affaire mallet est une,date mémorable dans l'histoire des associations de malfaiteurs. elle clot la liste de ces bandes redoutables qui ont tour- à-toùr comparu devant lé jury et dont les méfaits sont antérieurs à 1843v depuis lors, il faut le dire, les crimes ont en général un autre ca ractère. ils sont plutôt individuels que collectifs. la révélation* a brisé le pacte qui unissait entre eux les criminels. les plus dangereux, les plus habiles, notamment, évitent avec soin les relations nombreuses. ils craignent toujours de rencontrer un dénonciateur dans leur com plice. la force , qu'ils trouvaient naguère dans ces réunions, où les ennemis de l'ordre social incitaient en commun leur expérience et leur audace, ils la puisent désormais dans leur intelligence, dans leur activité. ils agissent seuls le plus souvent, et, par cela même, si leurs crimes sont moips fréquens , ils courent en revanche moins de danger. c'est ce qui peut rendre à leur égard l'action de la police plus difficile, moins efficace. néanmoins, plusieurs bandes auront encore à rendre compte à la justice de leurs ténébreuses machinations. la bande des auvergnats, celle du chantage viendront, avant doui mois, l'une à la cqur d'assises, l'autre à la police correctionnelle, nous initier à des mé faits nouveaux. cette dernière surtout nous prépare, dit-on, des révéla tions f<?rt singulières. il n'est bruit au palais que des faits vraiment in - croyables qui jaillissent à chaque instant de l'instruction. il faudrait créer des mots; il faudrait inventer un langage pour décrire les procé dés fabuleux au moyen desquels l'escroquerie exploite le libertinage ; l'art do la filouterie, à ce qu'on assure, ne saurait aller plus loin. n'ou blions pas d'ailleurs que les débats auront lieu à huis-clos : laissons re tomber sur cette affaire l'épais brouillard qui doit recouvrir les sentines de la gomorrhe moderne. il nous est arrivé plusieurs fois d'adresser à l'administration de la po lice des reproches sérieux. n'hésitons pas à lui décerner les éloges qu'elle mérite. sa vigilance, sa fermeté rendent chaque jour des services signalés à la sûreté générale. deux repaires célèbres dans les annales du crimo ont été explorés à l'improviste, et la population qu'ils recélaient se trouve placée tout entière sous la main de la justice. on a réussi à	libertinage	1	1
le_censeur	1845-02-19	1	2	Block11	0	0	0	0	c'est un gouffre de perdition, une fange, un lieu organisé pour le libertinage (page 150), un monstre horrible : monstrumhorréndum (page 257). mais le séminaire ! un calice de pureté, une fleur immaculée, une tour d'ivoire ! les preuves fourmillent dans les mains de m. l'ancien vicaire-général ; il les entasse comme des montagnes les unes sur les autres. nouveau titan, il metossa sur pléion pour escalader cette forteresse impure qu'on nomme l'université. il n'a que l'embarras du choix. il serait par trop lourd de tout citer. tenons-nous-en aux preuves les plus attendrissantes. la vérité est dans la bouche des enfants, se^on les paroles : sinite parvulos... page 115 : « un enfant, victime de son libertinage, disait à sa mère , au moment d'expirer entre ses bras : « maman, je vous prie d'inviter mm« » n... à retirer son fils du collège, car il mourrait bientôt comme moi.u l'habile dialecticien craint qu'on ne lui oppose l'adage : testis unus , testis nullus. vite, qu'on amène un autre enfant dont la déposition étaie la précédente. page 128 : « nous étions chargé de la direction des séminaires, et un homme respectable vint nous demander une place pour un jeune orphelin qui était depuis quelques mois au collège royal. pour nous intéresser en faveur de cet enfant, il nous lut une lettre qu'écrivait l'élève à une tante chargée de son éducation : « vous avez voulu faire de moi un bon sujet, » lui disait-il; mais si vous [ne voulez pas que je me perde, hâtez-vous de » me retirer de ce cloaque d'impuretés et de tous les vices.» voyez encore le séminaire habilement opposé au collège : l'un distille le vice, l'autre contient seul le baume topique que l'on peut appliquer sur les plaies faites par le venin de l'université. et comme cette accusation est bien placée dans la bouche naïve de ce petit rhétoricien déjà trèsfort sur l'usage des tropes ! quel est le père de famille qui ne serait touché, ému, attendri et prêt, après un pareil témoignage, à sortir son enfant de ce cloaque d'impuretés 'dans lequel on ne se fait pas « scrupule de lire avec héloïse tous des romans les plus immoraux ? » ( page 129. ) on ne saurait trop vite fuir cet antre de l'université dont le monopole n'est que le privilège « de pouvoir enseigner impunément toutes les doctrines les plus immorales comme les plus irréligieuses. » (page 575.) hâtez-vous;, hâtez vous, pères de familles ; croyez-en l'abbé cattet, retirez vos enfants des collèges. fuyez , mais ayez bien soin de chercher un refuge dans ces précieux asiles qu'on appelle des séminaires. c'est là qu'à l'abri de la soutane fleurissent toutes les vertus, la piété, la pureté, l'humilité, etc., etc. c'est là qu'on façonne les bons citoyens en livrant les inspecteurs de l'académie à la risée des écoliers et en les jouant sur le théâtre dans un exercice de distribution de prix. ( page 411. ) c'est là seulement qu'on forme de bons latinistes, car il est bien reconnu, d'après une expérience indiquée par notre écrivain, que les études des petits séminaires sont supérieures à celles des grands collèges royaux (page 181.)	libertinage	2	1
