work	date	issue	page	block	height	width	hpos	vpos	text	active_words	occurrences_words	unique_words
figaro	1900-06-05	1	4	Page1_Block28	1918	814	1746	4952	veuve. les sanglots, qu'elle s'efforçait de contenir, soulevaient ses jeunes seins. la malheureuse comprenait l'immen sité de sa faiblesse. il passa en elle et sur elle un désespoir bibliquement tra gique dont l'artiste tout d'artifice et d'é tude qu'était balrand ne put se défendre d'admirer la charnelle beauté. trop généreuse pour rien reprocher à l'homme qui l'avait entraînée, elle s'abî mait sous le cri d'effroi et de désolation — hélas trop tardif! — de sa conscience. ce qui restait de virginal en cette âme charmante pleurait la flétrissure et la déchéance de son corps. jamais tant de remords rie succéda à tant de confiance, tant de douleur à si peu' de faute— car la -faute entière venait bien de léonce, préméditée lentement, savamment, sans une minute de pitié. balrand tenta de consoler marthe par les plus tendres caresses. la beauté voluptueuse de cette magnifique souf france les rendait bien sincères. il put reprendre la jeune fille dans ses bras sans qu'elle opposât de résistance. vaincue, elle courba la tête sur l'é paule de l'écrivain ; et celui-ci l'entendit, toute frémissante, pleurer contre sa poi trine, tandis qu'il respirait le fin et capi teux parfum de ses cheveux. d'un mot, le, romancier aurait pu con soler cette dolente créature, l'apaiser, la relever. ce mot lui monta jusqu'aux lèvres- dans la froide jouissance que lui procu rait son exécrable cabotinage, il eut l'é nergie de ne pas le prononcer et de cons tater en passant, avec une orgueilleuse satisfaction morale, l'invincible empire de sa volonté sur les meilleurs mouve ments de son cœur. . . .. « ah ! pensa-t-il, si pauline me voyait en ce moment, elle ne me trouverait plus si bon jeune homme ! » c'était sa lâcheté qu'il célébrait. la rustique liberté de son éducation	voluptueuse	1	1
gil_blas	1900-06-05	1	2	PAG_00000002_TB000239	621	1030	2575	8200	elle avait, semblait-il, oublié taureaux, arènes et. toréadors. dans l'engourdissement du tiède hiver, plus une lueur sanglante ne passait devant ses yeux entr'ouverts. ses paupières, lourdes d'amour,ne se levaient que pour des visions voluptueuses — et, alors, elle se pendait au cou d'edwards, dont la continuelle complaisance ne se lassait pas. il trouvait la torera absolument pareille à toutes les autres femmes et, malgré ses soins amoureux, il la méprisait un peu.	voluptueuses	1	1
journal	1900-06-05	1	5	PAG_00000005_TB000013	690	1027	261	3767	i dans les périodes révolutionnaires, les hommes modérés et de convictions profondes qui font passer les intérêts de la nation avant les convenances personnelles risquent fort d'être méconnus ; tel fut le sort du maréchal. la monarchie l'accusait de libertinage d'esprit ; la convention l'envoya devant le tribunal révolutionnaire. condamné à mort. sa modestie dont il avait donné tant de preuves le sauva de l'échafaud ; lorsqu'il fallut monter sur la fatale charrette, par politesse, il laissa passer devant lui malesherbes et ses compagnons d'infortune. la voiture se trouva pleine : «retire-toi, vieux marèchaii, lui dit le bourreau, ton tour viendra pdus tard. » et son tour ne vint pas ; le 9 thermidor mit fin au régime de pane qqi tyrannisait la france.	libertinage	1	1
lanterne	1900-06-05	1	2	PAG_00000002_TB000217	528	1026	4715	8448	— mâtin, tu as llne jolie jambe. elle, contre toutes convenances et en toute saison, portait des chaussettes, comme une cocotte. c'était si commode et d'une si jolie sensualité pour un regard d'homme ! elle releva sa robe. les chaussettes noires coupaient, au mollet, une peau blonde et satinée. — eh ! tu as du mollet, ma chère; plus que moi	sensualité	1	1
presse	1900-06-05	1	3	Page1_Block20	4257	799	2520	561	mercredi 30 mai. — « hrnnsel et gre- tel », à l'qpên-cbmique. — quel opéra, dans les décors de carré, ne semble pas un chef-d'œuvre ! la société protectrice des musiciens lui devrait une médaille : quelle délicieuse révélation ce. fut que joseph areeson soleil levant sur le désert, ses petits palmiers grêles sur les cadmiums roses de l'aurore t'et, depuis, orphée, louise, une suite de tableaux follement artistes... hœnsel et gr.etel se joue dans une forêt de; gustave doré, qui semble retouchée pa'r jean veber, dessinée par le premier 'et peinte par le second, la forêt où les enfants cueillent la fraise ét sont dévorés parles ogresses. lîfes enfants mlles riotton.et; de cra- eonnè, deux gosies.-qui sautent à:perdre aleine, qui chantent en faisant des ron-: des et qui tiennent; la scène durant tout l'opéra ; (>retel est exquise, ello s'étale, elle s'aplatit sur l'herbe' avec une gami- nérie riéusèj elle bondit comme ùh ^éûno chat et c'est elle qui:délivre llîensel de la cago à poulets où l'ogresse l'engraissait. dire que tout cela n'est pas très enfan tin, ce serait mentir, maiala musique est brillante et l'ogresse c'est delna. a che val sur nn balai, lançant les mots ma giques qui la grisent, elle emplit la scène, de ses bonds : elle est un sabbat à elle seule s «telle saute, l'horrible vieille, elle chevauche, et toute l'horreur de ses ma melles pendantes, de ses cheveux d'herbe grise, de ses fanons et de son bonnet phrygien posé sur le côté comme le bon net des femmes ivres, danse la carma gnole des sorcières- ivre de jeune chair au scinde la forêt magique que les.f.ollets ont traversée, elle fait le chahut symbo lique sur son balai, dégingandée, boitil lante, infâme, et s'envole dans les airs pour retomber essoufflée et branlante..., ivre. - : par instants, on oublie d'écouter la voix splendide de delna pour l'admirer, étrange artiste qui sait atteindre à la perfection sans effort, sans truc, grâce au sêul génie de.la scène qui en fait une épique tragé dienne, une « bouffe » inoubliable. j eudx 31 juin.— deux heures du matin, au bois. — il a plu, il a beaucoup plu, les bastringues montmartrois de la rue de paris sont des îlots dans la boue, la rue de paris est devenue la « vallée des larmes ». • '  - v - ' certains coins du bois sont délicieux par ce temps, on y va plntô.t.qu'à l'expo sition ; on s'arrête d'abord à madrid,- puis à la cascade, et l'on revient par le lac. l'allée du tour du. lac, ce matin, est comme un ruban d'ocre sur le crêpe, des buissons, les fourrés so couronnent d'une broderie découpée de feuilles, sur le fond du ciel gris et mat comme un satin de chine, on croirait un volant de dentelle espagnole agité par un vent humide et lourd. et toute l'humidifê qui monte du sol est lourde, des crapauds chantent -au loin et le parfum des àcacias tombe comme un manteau parfumé. les roues caoutchoutées font jaillir des fusées de boue claire dans le rayonnement affaibli des lanternes et l'égouttement des arbres met des claquements de lèvres,- comme autant de chut ! discrets, sur les feuilles. les lanternes s'éteignent faute d'huile et il semble que le ciel s'éclaire déjà de l'au rore qui va naître, une aurore d'hiver, salie, terne, délayée dans les layures d'une nouvelle ondée qui s'apprête. . v endredi 1 er juin. — l 'inauguration du pavillon rodin, la bodinière, un hall tendu de jaune où la lumière pénètre à grands flots sur les marbres et les plâtres, une première impression de fraîcheur et de repos. tous les enlacements du baiser, la vo lupté de l'étreinte et toutes tes ardentes et voluptueuses étreintes, les confiances, les abandons du corps mais — surtout — les fatigues d'après la possession, et la triste pensée qui fait mal sous le front,- non pas, la 'jalousie, mais, la ' crainte, le ▼agué effroi de savoir que l'étreinte n'est que passagère. . et sur ces soçles^'toutes' ces. sublimes pâmoisons sont le plus beau poème qu'on, aitfait à l'amour.-oh ! pas l'amour com pliqué,; raffiné,, mais: ardent, fou,.'exas péré .du plus violent désir, et les marbres qui palpitent semblent roses. quant au balzac, il yaut;mi.eux rie pas le regarder, réellement; on l'a. placé au centre de l'exposition, bien entendu : on a eu tort, il a l'air d'un épouvantail à moi	voluptueuses	1	1
temps	1900-06-05	1	3	Page1_Block9	2442	930	3091	235	délégué du ministre de la guerre, le contre-amiral bayle, délégué du ministre de la. marine» .lo d’artillerie de. marine berriardy, délégué du ministre des colonies, lé préfet du departement et .de nombreuses notabilités. quand le voile est tombé, mettant à nu le ; dû au sculpteur hamar, à qui lé ministre de l’instruction' publique, à conféré dans cette les palmes académiques, m. le myre de viiers, président du comité, a prononcé un discours dont nous publions les principaux passages : de tous les généraux qui ont illustré notre, pays, rochambeau fut, sans contredit, celui dont les eurent les résultats les plus considérables ; d’autres ont remporté des succès plus éclatants, conquis en quelques mois de -vastes empires ; mais leur œuvre fut éphémère, tandis que le maréchal, en forçant lord corn- wallis à capituler, assura la fondation de la des etats-unis dont- le développement rapide,, la richesse, la puissance provoquent l’admiration du monde. les débuts de notre-compatriote faisaient prévoir les hautes destinées qui lui étaient réservées : nommé à vingt-deux ans, pour sa brillante conduite au siège de namur, il prit ensuite une part active aux -de maestricht et de'malion; a clostercamp, sous les ordres du marquis de castries, il détruisit le corps du prince ferdinand;- soixante officiers de son d’auvergne tombèrent sur le champ de bataille _ et» parmi eux, le chevalier d'assas. guéri de ses blessures et promu maréchal de camp, rochambeau consacra les loisirs de la paix aux études de tactique et de stratégie ; on lui doit'la substitution del’ordre mince à l’ordre profond qui fut le point de des transformations apportées par napoléon-dans .l’art de la guerre et, lorsque le vainqueur de yorktown vint le voir en-1803, il lui présenta .ses officiers dans ces termes : •> maréchal, voici vos élèves. » sa réputation militaire était européenne, son talent d'organisation incontesté ; aussi fut-il choisi comme, le ' plus digne de commander l’expédition aventureuse en* voÿée au secours des américains. transporter-6,000 hommes sur des navires à voiles, au delà de l’océanien traversant la flotte anglaise; les débarquer, les mener au combat, détruire l’adversaire, présentait d’énormes difficultés. rochambeau les surmonta à force de et d’audace. messieurs, dans les périodes révolutionnaires, les hommes et de convictions'profondes qui font passer les intérêts de la nation avant les convenances risquent fort d’ôtre méconnus; tel fut le sort du maréchal. la monarchie l’accusait de libertinage la convention l’envoya devant le tribunal condamné à mort, sa modestie dont il avait donné tant de preuves le sauva de l’échafaud ; lorsqu’il fallut monter sur la fatale charrette, par politesse, il laissa passer devant lui malesherbes et ses d’infortune. la voiture se trouva pleine : <■ vieux maréchal, lui dit le bourreau, ton tour viendra plus tard. » et son tour ne vint pas; le 9 mit fin au régime do sang qui tyrannisait la france. . ■ ’ en 1807, rochambeau s’éteignit plein de jours et de gloire. faits divers	libertinage	1	1
aurore	1900-06-06	1	1	PAG_00000001_TB000027	560	540	42	2689	c'est eus qui se ruent aux matches do boxe ou de lutte et qui applaudissent à tout rompre quand l'un des athlètes a reçu quelque mauvais coup et crache avec ses dents un filet rose. c'est pour eux qu'un de leurs bas amuseurs traçait,dans l'une des feuilles qui se sont donné pour mission de chatouiller leur sensualité pornographique et sanguinaire, ce tableau des abattoirs où pas un détail de cruauté lubrique n'a été épargné. c'est eux qui voudraient voir ressusciter les combats de gladiateurs de la rome de la décadence et dont les femelles, suaves vierges de ëurne jones, exquises et fragiles spiritualités à la rossetti, n'hésiteraient pas, comme les vestales ou les matrones romaines, à don- ner, pollice versa, le signal du massacre, et à respirer de toutes leurs narines roses et frémissantes la fade odeur du sang,	sensualité	1	1
gil_blas	1900-06-06	1	1	PAG_00000001_TB000012	402	1024	269	3796	si quelque voluptueuse princesse exotique l'espéraitf il y aura encore de beaux jours pour les aventures romanesques et galantes. il n'est qu'un violon de plus, mais à coup sûr, le plus énergique ; son silence fait trou ; et ses reprises dominent de plus belle la mélodie maltresse.	voluptueuse	1	1
gil_blas	1900-06-07	1	2	PAG_00000002_TB000289	263	1036	2544	9255	— evidemment, pensait-il, cette jolie petite voluptueuse veut voir si mon sang est aussi rouge que celui de mon prédécesseur fernandez. j'aime mieux ça que ses çal'esses;, te commençais à la	voluptueuse	1	1
aurore	1900-06-09	1	1	PAG_00000001_TB000125	255	555	1764	4597	à cette époque où l'on va goûter loin de paris les joies du repos et de la lecture, nous conseillons à nos lecteurs d'emporter le livre à succès du jour, le dernier roman .de. georges lecomte : la maison en /leurs, récemment paru chez fasquelle. c'est un roman d'amour osé, dramatique, charmant, d'ironie exquise et de grâce voluptueuse et [d'un intérêt ©i vif que, après l'avoir fûm- 1 mènent on se le quitte plus.	voluptueuse	1	1
justice	1900-06-09	1	3	PAG_00000003_TB000140	254	547	2350	1566	la « ilevue sensuelle » jouée actuellement au diran japonais, étant le panégyrique dola femme chacun veut voir tout ce que la sensualité a de bon, de beau, de puissant, de sublime; et rien n'évoque mieux l'amour passionné, le charme des sens, que les chansons chantées par l'exquise thérèse d'orgoval, la commère d» eett» revuo qui attire à montmartre les provinciaux et étran- gers curieux de connaitre les sensations fémini- nes exaltées par lo poète gaston ilabrekorn.	sensualité	1	1
debats	1900-06-11	1	3	P3_TB00044	1697	919	4009	3915	ce sont ces pages éparses, écrites au jour le jour sur les sujets lés plus variés, que m. guy de charnacé réunit sous le titre dé notes d'un philosophe provincial (perria et g 1; in-18 dexi-295 p.). ce n'est pas seulement à ses collaborateurs et à ses lecteurs habituels que plaira sou nouveau livre : tous les lettrés que eharment les qualités de style, tods ceux qui font cas du bon sens et des justes idées morales noblement exprimées, trouveront, a la lire, autant de profit que d'attrait. pourquoi napoléon perdit la bataille de waterloo, tel est. le titre d'une brochure (in bde 16 p.), où m. emile le maout, imprimeur à cherbourg, s'attache à établir que lés véritables causes de la perte de l'inoubliable bataille furent moins les fautes des lieutenants de l'empereur que lé temps épouvantable qui marqua les combats des jours précédents et surtout la nuit du 17 au 18tjuia 1815. ce fut ce véritable déluge qui, ayant fait différer l'heure de l'attaque, le 18, sauva l'armée anglaise et perdit la nôtre. a l'appui de sa curieuse étude, l'auteur invoqué les travaux de-son aïeul, lè savant charles le maout, le premier météorologiste qui; après avoir constaté l'influence dès'déchargqs d'artillerie sur l'atmosphère ait aindiquê tes moyens de produire artificiellement la pluie. soiis ce titre : les voluptueuses et las hommes d'action (ôllendorff; in-18 de vi-265 p., 3 fr. 50), m. achille segard se propose d'étudier, avec impartialité, d'un côté les artistes de lettres qui se sont désintéressés des affaires publiques ; d'un autre côté, les j écrivains moins égoïstes qui ont essayé d'avoir une influence sur les idées générales de. ce temps. mm. anatole france, pierre loûys, jean lorrain, ferdinand brunetière, maurice barrés et edouard picard, tels sont les.noms qui figurent en. tête des six monographies réunies en ce livre de eonciencieuse analyse. ils suffisent, de reste, à faire présumer le réel intérêt d'une œuvre-que m. achille segard a composée avec l'unique désir de « faire mieux connaître et presque toujours mieux faire aimer les écrivains qu'il a choisis ».	voluptueuses	1	1
liberte	1900-06-11	1	1	PAG_1_TB000120	900	1001	3296	6430	en fait de métaphysique, il se contente de ce gracieux fatalisme de fivc o'clock, si répandu de nos jours, dont s'accommodent à merveille la nonchalance et l'avidité des ambitieux paresseux.tandis que ses aspirations sont toujours aussi loin- taines et aussi vagues, andré tourette, dans la vie réelle, dégringole d'étage en étage, de milieu en milieu. ses maîtresses successives, que ce soit margot walker, blonde divette, gabrielle favart, pseudo-femme du monde hissée par la main gauche jusqu'à la fortune et par la main droite jusqu'aux honnèurs d'une mondanité plus ou moins interlope, pau-lette sillery, grande gamine vicieuse ét dégingandée,satisfont à la fois sa sensualité et son amour-propre.	sensualité	1	1
echodeparis	1900-06-12	1	3	Page1_Block45	1396	816	4094	5594	pansait le cœur d'oubli. il avait ia ? complète illusion d'être seul avec elle dans la. nature, apaisée .et recueillie, de vivre là pour elle seule, d'être son seul pro tecteur. et parce qu'elle se livrait à lui sans nulle défense, fa plus innocente deb caresses, même une caresse furtive qu'elle n'eût pas sentie, lui paraissait l'a bus indigne, la rupture honteuse d'un pacte de foi mutuelle.^ l'amour qu'il éprouvait pour elle en de tels instants était pur de tout désir autre que la joie de la regarder. illa regardait sans fin. toutes les plaies vives de son âme en étaient ci catrisées. il sentait renaître une force, une énergie invincibles de vivre. h était jeune,, des images voluptueuses traver saient ses pensées,mais ne les troublaient pas. la possession lui semblait ne pou voir rien ajouter à cette félicité. le jour dédina. une flèche de soleil perça le feuillage des yernes, mit sur le front si blanc de mlle de varanges une paillette d'or. elle eut un frisson de peau, un mouvement imprécis de son bras vite retombé, pour chasser de son visage cette - lumineuse tiédeur. mauriceau n'eut .qu'à. se pencher très peu pour que l'ombre de son buste ramenât la fraîcheur sur ce beau front de neige. et, le rayon disparu, il garda cette attitude de vigilance in quiète, tout ému de bonheur à l'idée que . le sommeil d'armande était encore plu»; frais et plus tranquille dans son om< bre...	voluptueuses	1	1
figaro	1900-06-12	1	2	Page1_Block26	291	787	4195	6475	de délicates et. émouvantes nouvelles d'amour^ de passion tragique, tout em preintes de nature^ de sensualité et de poé sie avec l'art si humain-qu'on lui connaît^ tel est le livre que le maître cont.eur camille lemonnier vient de publier chez ollendorff, sous le titre : c'était l'eté.	sensualité	1	1
justice	1900-06-12	1	2	PAG_00000002_TB000236	254	551	2991	4530	lés tirailleurs et leurs femmes se saisirent du cadavre de chanoine, l'attachèrent avec des cordes et le traînèrent dans la brousse voisine. on ie frappa de nombreux coups de baïonnette et ds crosse de fusil. une femme lui arracha les parties sexuelles ; une autre lui coupa les poignets, les oreilles, le nez, mille horreurs, quoi. puis, horriblement dé- chiqueté, ils l'abandonnèrent en pâture à la hyène.	sexuelles	1	1
lanterne	1900-06-12	1	1	PAG_00000001_TB000030	782	1025	1473	1826	en vraies charmeuses, les mains sont différemment voluptueuses et attirantes, selon les saisons. l'été, c'est le règne aimable des manches courtes, des gants ajourés; libre, la main s'évade d'un volant de dentelle, apparaît toute blanche; elle ne craint pas de se montrer pour soutenir une oui: brelle, relever une mèche de cheveux : dans l'atmosphère tiède elle est heureuse ainsi qu'une belle fleur; les ongles luisent au soleil comme des agates, le poignet fin laisse voir sa courbe harmonieuse; la chair est douce et moite, aisément frémissante; c'est le	voluptueuses	1	1
temps	1900-06-12	1	2	Page1_Block25	3927	959	3069	3965	a propos de là loi heinze qui u’entend qu'une cloche n’entend qu’un son : c’est là un vieux principe que no doit plus guère aujourd’hui l'acoustique, mais qui, en dehors d’elle, reste aussi vrai que le jour où la sagesse des nations s’est avisée de le découvrir. et je trouve une preuve nouvelle de sa vérité dans la façon dont on nous a renseignés, en france, sur l'attitude do l’opinion allemande àl’égarddela célèbre loi heinze, ne nous a-t-on pas représenté cette loi comme contre elle l’unanimité absolue des vieux et jeunes, etdes peintres, et des de quiconque avait souci des intérêts de l’allemagne? ne nous a-t-on pas affirmé que, seule, la masse inculte des cléricaux du centre, à l’encontre du vœu profond de toute la nation, à réclamer le vote d'une loi qui, votée, aurait pour résultat de rendre la pratique des arts tout à fait impossible? or, je ne sais pas ce qu’est au juste la loi heinze, ni dans quelle mesure elle menace la pratique des arts ; mais semainesqueje viensde passer sur les bordsdu rhin n’ont permis do constater, à ma grande que l’opinion allemande était loin d’être aussi unanime sur cette loi qu’on nous l’avait dit. j’ai lu, en effet, dans les journaux des nuances'les plus opposées, toutes sortes de lettres etd’interviews notables qui non seulement ne tiennent pas le vote de la loi heinze pour un coup mortel à l’art de leur pays, mais qui, au nom même des intérêts de cet art, verraient avec plaisir qu’elle fût votée. voici, par exemple, une lettre écrite à un rédacteur delà revue franco - allemande de munich par l’un des plus délicats lettrés allemands et un homme que personne ne saurait accuser d’obscurantisme clérical, le critique et historien adolphe bartels. et je citer dix autres écrivains, qui ont exprimé en faveur de la loi heinze, des avis plus formels encore peut-être que le sien ; mais son avis se trouve accompagné, dans sa lettre, de considérations qui méritent, je crois d’étre méditées, môme du cas particulier qui les a voici donc ce qu’écrit m. adolphe bartels : monsieur, ce que vous venez de dire dans la revue franco- américaine, un de mes amis me l’a dit, maintes fois déjà, dans ses lettres, mais je ne puis décidément pas modifier ma façon de penser. vous êtes — pour préciser quelque peu le contraste de nos deux points de vue — vous ôtes un doctrinaire libéral, je suis, moi, un réaliste en matière de politique. vous sou tenez que l’art doit toujours être libre, ou, plus exactement, que l’art doit jouir du droit de libre concurrence, tandis que moi, après un long de la critique, j’ai rompu avec le principe du laisser faire, laisser passer dans le domaine de la comme dans tous les domaines, et j’en suis arrivé à souhaiter une sorte de protectionnisme s’étendant jusqu’aux œuvres d’art. lorsque, sur cent romans qui paraissent, dix sont expressément or- duriers, une quarantaine douteux (c’est-à-dire « sexuels » sans une profonde nécessité intérieure), quarante autres simplement banaux, et que les dix derniers, seuls, possèdent une valeur artistique quelconque, ma conviction est que ces dix sont hors d’état do soutenir, par eux-mô- mes, la concurrence des quatre-vingt-dix sans compter que, parmi ceux-ci, se certainement des œuvres choyées d’une toute spéciale par les éditeurs les plus riches et les plus influents. nous devons donc découvrir un moyen de venir en aide à ces dix bons romans, et j’estime que c’est déjà un moyen de leur venir en aide que de rendre le métier un peu plus difficile aux auteurs et éditeurs qui spéculent sur des effets . étrangers à l’art, ou tout au moins de leur inspirer un pou d’inquiétude. les hommes dont je parle n’ont absolument en vue que de faire des affaires; et, certes, ils en ont tout à fait lo droit ; mais ils doivent aussi se résigner à être traités en hommes d’affaires, n’avons-nous pas aujourd’hui une loi contre l’usure? et, bien que cette loi ne puisse, en aucune façon, améliorer notre situation sociale, no la tenons-nous pas pour indispensable ? quant à craindre que le véritable artiste risque d’être confondu avec ces gens-là, c’est ce que, à mon avis, nous n v avons absolument aucun motif de faire, à la condition que le jugement dépende d’esprits compétents. personne jamais n’aurait eu l’idée de prendre wagner ni hebbel pour de simples hommes d’affaires, et chacun, au reconnaît tout de suite de simples hommes d’affaires en m. lindau ou m. biumenthai. je sais qu’on peut citer un ou deux écrivains qui sont en quelquo sorte sur la limite de l’art et du commerce, — tel notamment m. sudermann, — mais la n’en reste pas moins des plus faciles à établir, en règle générale. c’est au nom de l’art, c’est à son profit que je réclame des mesures de répression contre ce qui en est la contrefaçon. vous nous moi et tous ceux qui pensent comme moi, do faire trop bon marché de l’art : vous vous trompez, et c’est vous, au contraire, qui n’appréciez pas l’art véritable à son juste prix... . prenons maintenant la chose de plus haut. oui,	sexuels	1	1
