work	date	issue	page	block	height	width	hpos	vpos	text	active_words	occurrences_words	unique_words
gaulois	1896-05-29	1	3	P3_TB00034	1458	924	3137	3849	chez le couturier il est minuit, et je sors de chez le couturier. heure bizarre, me direz-vous ! rien n'est bizarre, vous répondrai-je, de ce que la mode adopte et impose. or, la mode en a décidé ainsi : tout paris, actuellement, va che \ le couturier après son dîner. il est vrai que ce couturier a élu domicile chez m. marchand, aux folies-bergère, et que ce sont mm. p.-l. fiers et jacques lemaire, accompagnés (c'est le mot) par m. victor roger, qui lui ont donné son billet de logement. ce couturier, qui est un couturier très chic, possède tout un personnel féminin délicieusement costumé par landolff, demoiselles de magasin, mannequins, vierges et même demi-vierges et demoiselles car ij tient toutes sortes d'articles. et, pendant que clients et clientes entrent et sortent, dans un amusant brouhaha, choisissent des étoffes, se font prendre mesure, tout le gracieux personnel susindiqué va, vient, court, danse, se démêle en de voluptueuses farandoles, qui s'égrènent le long d'escaliers éclairés par mille feux chatoyants. c'pst d'un coup d'œil exquis et en même temps c'est d'un modernisme très étudié, quoique très fantaisiste. la mise en scène, d'ailleurs, est de mariquita ; c'est tout dire. mlle villars est infiniment gracieuse dans le personnage de la mode, et m. eugenio, en grand couturier, est d'une svelte élégance. avant de se rendre au derby, au grand steeple et au grand prix, il faut aller che% le grand couturier, c'est tout indiqué. le spectacle se termine par l'araignée d'or, le ravissant conte féerique de m. jean lorrain, que j'ai revu avec un très vif plaisir. c'est, je le répète, un des spectacles les plus artistemeut suggestifs que nous aient donné les folies-bergère. mme liane de pougy y est toujours fort applaudie, ainsi que m. dhurmer. la musique de m. edmond diet, surtout au second tableau, est vraiment très distinguée, très expressive. plaisir des yeux, plaisir de l'esprit, les folies-bergère nous gâtent.— adrien vély.	voluptueuses	1	1
gil_blas	1896-05-29	1	1	PAG_00000001_TB000268	302	1025	5728	5032	« c'est un peu fort, songea-t-il, lorsqu'il put voir clair dans le tourbillon de ses pensées. suis-je donc condamné par le libertinage paternel à devenir incestueux ou à moisir dans un inutile célibat ? »	libertinage	1	1
journal	1896-05-30	1	1	PAG_00000001_TB000036	353	1049	1423	4486	car il joue un grand rôle, le ridicule, en tout ceci ; et elles ne se doutent pas, ces évaporées à façons garçonnières, du mépris hautain, quoiqu'indulgent, en lequel les tiennent les vraies femmes — celles qui aiment, et font de la sensualité seulement le corollaire de l'amour.	sensualité	1	1
journal	1896-05-30	1	1	PAG_00000001_TB000164	880	1037	4689	1561	pourquoi bdelliphrontidas eut-il, un jour, l'idée de jouer à contresens de son jeu habituel? c'est ce .qui n'a pu être éclairci, les uns ayant prétendu qu'il avait en cela exécuté les ordres d'une secte obscure venue de syrie et aux mystères de laquelle il s'était fait initier, les autres soutenant qu'il était de lui-même arrivé au dégoût des représentations voluptueuses pour en avoir, atteint la suprême expression, et certains enfin, les plus subtils, dont je suis, donnant pour sublime motif à son acte extravagant une pensée de grand artiste qui voulait trouver du nouveau et remporter un triomphe contre la nature ellemême.	voluptueuses	1	1
journal	1896-05-30	1	6	PAG_00000006_TB000394	161	1029	2593	7193	lis dînèrent en tête à tête, et la « niniche » gratika alexandre d'une comédie amoureuse et d'un libertinage immonde.	libertinage	1	1
journal	1896-05-30	1	6	PAG_00000006_TB000427	54	690	4818	7926	elle soupira, voluptueuse :	voluptueuse	1	1
echodeparis	1896-06-02	1	1	Page1_Block32	4243	790	3404	954	et d'acrobates. j'adore les saltimbanques. et, en qualité de grande curieuse de leurs tours, je vois avec ennui l'école anglaise substituer de plus en plus ses goûts assez grossiers à nos traditions plus élégantes. en matière de clownerie tout au moins, les anglais sont d'une corruption fâcheuse et d'un esprit brutal et mauvais. je n'en veux.d'autre preuveiqûe le succès obtenu par certains des derniers « numéros » a la mode à paris. les sœurs barrison sont, certes, délicieuses, j'en conviens la pre mière. mais, si, on va au fond du plaisir que leur vue procure aux hommes, on trouve que ce plaisir-consiste- à mêler l'idée de la volupté que' peut donner la femme à l'idée de.l'extrême jeunesse, de l'âge de-« cour d'assises ». c'est là tout l'artifice de leurs cpstuines de babys, de leurs petites culottes .qu'elles montrent, de leurs « capelines.» de/petites filles et de leurs gestçg d'entants. mais - c'est bien autre chose quand il s'agit des excen- irics anglais. l'arlequin italien et le pierrot français, qui avaient détrôné le polichinelle, cynique et déjà cruel, sont des masques élégants, naïfs, tendres, spi rituels, bons au fond, malgré les tours qu'ils se jouent pour lés beaux yeux de colombine. uexcentric anglais retourne au polichinelle, mauvais homme. je voyais, ces jours-ci, deux de ces excen- trics , très adroits. c'était bien autre chose que les hanlon-lee, qui n'étaient qu'affo- lést ceux-ci sont brutaux en leurs jeux. a la « calotte » innocente des masques français et au coup de pied... quoique part, qui n'est que comique, ont succédé des coups de trique à pleine volée. gro tesques d'allures, ces acrobates anglais se crachant au visage, se tirant les che veux et is barbe d'où ils rétirent des' poux, se frappant le crâne avec des planches qui s'y brisent, se donnant des coups de maillet sur la tête et, finale ment, y. plantant unie hache. je sais bien qufe tout ceci est pour « de rire » et que ces adroits saltimbanques ne se font pas de mal. ils né courent même pas-les dàngèrs que courent les gymnasiarques classi ques, qui peuvent toujours se casser un; brasou unejambe en tombant delà « pyra mide ». mais l'idée qu'ils évoquentest une ' idée de laideur et de cruauté. la fantaisie de leur esprit est sans malice. ils rië montrent pas la form^humaine per fectionnée par l'entraînement et l'adresse : tout au contraire, ils dissimulent leur adresse, qui est grande, sous des dehors gro tesques, laids, n'étant jamais si parfaits que lorsqu'ils sont monstrueux. bossus, affublés de grosses têtes ou de crânes en pointe, à la façon des idiots, s'ornant du faux ventre de falstaff, le masque anglais par excellence, avec leurs cheveux roux et rares, qui ne sontpas la houppe amusante du clown classique, vieux d'aspect,ce sont, en réalité,des caricatures qui n'auraient pas beaucoup à faire pour être effrayantes. et, j'y insiste, ces pitres sont plus méchants que gais : l'idée de la douleur est sur eux, comme dans l'imagination détraquée des sadiques.- je ne voudrais pas, à propos de saltimbanques, habiles et braves gens sans doute, faire par trop de morale cha grine.. mais prenons garde que, derrière une altération de notre goût, il n'y ait quelque chose de plus et comme, un re tour à.de mauvais instincts. on juge enr core mieux l'esprit des hommes à savoir leurs amusements qu'à savoir comment ils mangent. l'art des masques et des acrobates fran çais n'est-il donc pas exquis ? quand bien même la vue des beaux athlètes en mail lot et celle .des danseuses dévêtues inspi rerait des idées de volupté, la volupté n'est pas chose blâmable quand il s'y mêle l'idée esthétique de la beauté. mais, là aussi, il y a quelque chose à reprendre à la mode d'aujourd'hui. renîarquez-vous que le costume des danseuses tend à rap peler moins la nudité qu'à donner l'image du désliabilllé, avec l'habitude' prise de leur donner des bas qui vont jusqu'à la cuisse, dont la chair semble apparaître par quelque surprise? le déshabillage est plus polisson que voluptueux. et un effort est à faire pour que notre .art se sauve de l'indécence, fût-ce. en reve nant aux images les plus hardies de la beauté voluptueuse. la beauté est un re mède au libertinage qui finit par en altérer la notion sacrée. colomba.	libertinage, voluptueuse	2	2
xixe_siecle	1896-06-02	1	1	PAG_00000001_TB000201	279	1033	5711	2338	que peu erotiques parurent excessifs aux gens pudibonds de l'endroit. nous avons vu cette année, et nous avons admiré au salan du champ-de-mars, son monument à molière, destiné à la ville de pé{enas.	erotiques	1	1
journal	1896-06-03	1	3	PAG_00000003_TB000091	374	1021	2475	491	licat, de placer gracieusement dans leurs niches de satin ces deux globes d'albâtre aux contours exquis. voilà 1 artiste rêvpe qu'est mme desaime, faisant saillir les hanches voluptueuses qui soutiennent les admirables dessous chiffonnés avec art par ses doigts de fée et que l'on ne se lasse d'admirer dans ses salons, 15, rue de la paix.	voluptueuses	1	1
gaulois	1896-06-07	1	1	P1_TB00009	3772	920	270	1933	un jeune attaché d'ambassade, olivier du prat, est l'ami, dans le sens le moins platonique du mot, de.la baronne ely de carlsberg, épouse morganatique d'un archiduc. cette liaison, qui n'avait guère été pour la baronne qu'une aventure où son cœur ne s'engageait pas, se rompt un beau jour, et olivier, dépité, se marie. il n'est pas heureux en ménage. sa femme l'aime mal, jthaladroitement. le temps et l'absence n'ont pas guéri le jeune homme, et, justement, un itinéraire de voyage de lune de miel prolongé l'amène avec sa femme à cannes, où la baronne ely de carlsberg passe l'hiver. mais, sur cette même côte d'azur, il retrouve également un ami, et cette rencontre, avec les événements dont elle est la conséquence, fait toute la tragédie de yldylle tragique. c'est qu'aussi olivier du prat n'est pas un ami vulgaire. pierre hautefeuille est pour lui un frère tout court, après avoir été un frère d'armes pendant l'année terrible. pierre, de son côté, l'aime profondément. rien de surprenant, donc, si ces amis, en leur tendresse inquiète, lisent dans l'âme l'un de l'autre, et ce que m. bourget a précisément décomposé avec une admirable maîtrise, c'est le travail d'investigation auquel se livre olivier, l'enquête étrange qu'il conduit pour arriver à la découverte de cette vérité que pierre .hautefeuille est l'amant d'ely. terrible révélation, car elle inflige à olivier une double torture : en même temps que l'infortuné souffre cruellement de voir lui échapper pour jamais celle qu'il n'a pas pu oublier, c'est un tourment non moins infernal pour lui de penser que son ami pierre hautefeuille, la nature la plus tendre, la plus sensible qui soit, est entre les mains d'une coquette qu'il croit sans cœur. comment, en effet, dans sa fatuité masculine, peut-il admettre qu'une femme dont il n'a pas été aimé d'amour puisse donner toute son âme àun autre? très sincèrement donc il plaint pierre hautefeuille et c'est sans arrière-pensée qu'il sollicite un rendez-vous d'ely afin de lui reprocher tout le mal qu'elle va faire à pierre, « cet être sans défense». avec quelle indignation vraie, une fois en présence de son ancienne maîtresse, ne lui criet-elle pas qu'elle agit lâchement ? hélas i un instant après, c'est lui le lâche. un reflux de sensualité lui bouillonne au cœur devant cette femme qu'il sait, qu'il voit éprise d'un autre. un vertige se saisit de lui. il veut la serrer dans ses bras. elle se dégage, elle a peur, elle cherche une protection. elle crie : « pierre ! pierre! » et olivier, à cet appel qui le fouette comme un remords, s'appuie de ses deux mains, défaillant, à un meuble, puis brusquement il s'enfuit, « du pas épouvanté d'un homme qui a failli succomber à la tentation d'un crime ». ce crime qui l'a tenté, c'est un crime d'amitié non moins monstrueux que ces crimes d'amour dont l'auteur de yldylle tragique s'est fait autrefois le juge d'instruction pénétrant et ému. l'œuvre dont je parle est donc le conflit entre l'amitié et l'amour. je n'ai pas à vous dire l'issue de ce duel, préférant vous laisser la grande jouissance d'en lire le merveilleux procès-verbal dans une œuvre passionnante, mais il me sera permis d'insister sur la grandeur originale du sujet abordé. l'amitié n'est pas un thème familier aux romanciers contemporains. gela tient peut-être àce que l'écrivain moderne ne croit guère àla vivacité de ce sentiment dans nos générations guéries du don quichottisme et par conséquent aux sacrices, aux immolations qu'il peut commander. a paris, l'amitié s'appelle le plus souvent camaraderie ! l'ami, c'est « l'excellent bon » des comédies de mm. meilhac et halévy, qui prêtera à la rigueur son cheval, plus rarement sa signature à l'autre non moins excellent, mais' qui aura bien de la peine à ne pas consoler la bien-aimée de ce dernier, pour peu qu'il ne soit pas tout à fait découragé par la donzelle. l'amitié, à paris, c'est trop fréquemment l'égoïsme à un. il a donc fallu une grande hardiesse à m. bourget pour faire deux vrais amis, dans le sens presque antique du mot, de deux parisiens qui vontbeaucoup aux courses,se promènent en yacht et jouent au tennis. ces deux types d'un autre âge étaient difficilement présentables à notre scepticisme. l'auteur d'une idylle tragique a victor ieusement emporté l'obstacle. l'amitié d'olivier du prat et de pierre hautefeuille nous lire des larmes aussi douces des yeux qu'au temps lointain où nous traduisions dans virgile l'épisode de nisus et d'euryale.	sensualité	1	1
gaulois	1896-06-07	1	4	P4_TB00024	1077	1581	3535	3895	/pjw'x j. chabaud, concessionnaire. vdome/ établissement splendide et de tout ler1 er ordre. iliuil i uuii l vdome/ établissement splendide et de tout ler1 er ordre. ouvert du 4 or juin au 30 septembre. maladies : rhume, laryngite, bronchite, asthme, congestion et engorgement des poumons, phtisie pulmonaire, rhumatisme chronique, névroses, affections cutanées, etc. eau minérale arsenicale. salles d'hydrothérapie ch-ï.-ss.bi.dl casino dans le parc theatre, café, cercle, salons de lecture, concerts reduction de 25 %> sur les prix du tarif du 20 août au 30 septembre. savoh - parfum poudre de riz eau de toilette ockey-club ltjbi catalogue franco 55, rue s te -anne, 65 traité du d r g.-du rétrécissement,impuissance, onanisme et ses suites, nflect secrètes, etc. guerison et préservation. v ôoopag. 200 ag. 3 fr. —3 à 5 h.et par correspondance, 7, b'sébastopol, f a exquise eau minérale i| h § | g|§ se tabsue de si lih bicarbonate de soude, acidulée, alcaline, action puissante sur ta digestion, anémie, goutte, larynx, gastralgie.diabète.foie, poumons, vessie. médaille d'or, paris 1855 ; londres 1862 ; et diplômes d'hona. blankenber&, 31. rue des fnahcs-esujigeois. paris. bassin 3de vichy l* meilleure pour ôtre bue cher sol. 20 fr, la caisse do 50 litroau s -iit.au propriétaire, w. larbaud-st-yorro.i'harieucieu à vichy.	onanisme	1	1
figaro	1896-06-08	1	2	Page1_Block45	6656	826	4199	292	question du ministère livré à la. réaction} du ministère prisonnier de la  droite.'m, méline a i;épondf; très simplement qu'il n'é tait le prisonnier de' personqe, ' dju'il- appli quait sa politique, qu'il gouvernait selon ses principes et ses idées, qu'il ne dédaignait au cun concoùrs, mais qu'il ' tfen ' achetait au cun. lç temps se réjouit que l'occasion art été offerte aq gouvernèment de faifelfes dé.c)aratj[pnç d'une certaine 'jmport.aiîèe. la plus précise de toutes., a tété, celle, du président du conseil, disant, avec une'borçn® foi crâne et confiante : « je plante .toqti dra peau au milieu de la-chambre,et j, r àcccpte le concours de toutes les bonnes volontés;.. » paroles excellentes et courageuses' qui fépon? dent au sëntiment public. : si le- - mînistèi'e veut durer, s'il veut rendre à' son parti le très grand service de durer, il n'a pas à se préoccuper des individus, pour écouter les uns, pour raniener les autre$. il n'a qu'à par ler net et ferme. viendront alors à lui tous ceux qui plà-> cent au premier rang les intérêts vérita bles du pays, et non seulement ils seront la majorité dans la chambre, conamé'on l'a vu samedi, niais encore, comme on l'a vu également le même joui», ils se» ront la majorité du parti républicain. lie liseur. gambetta tnttowi : •j , 0 • <rj - : pendant ces deux derriipres sçfiiajne.s, on s'est préoccupé de savoir conjnîehtv exactement, qg,mbetta, ét^it it)prt, qe part et d'autre, des témoior^es-, dés ar r gun^ents ont été fpurnis, qui n'ont point ponyaincyi. la question demeurerait'dtinp irrésolue, incertaine, s} l'idéé ne flj'étah yenue d'interrp^er qajnbetya ipl-même, d'évoquer sa présence, à j'aide d'wn cqé- dium. et cette idée' n'est point 3 .ussi étrange qqe, tput d'abord, elle apparaît., qri.nqus a,'depuis quelque temps, rendu fp.ipj r lière cette., courge vers j'jn;visible, ain^i qpe me le disait, hier notre 3,mi jules bois, historien de ce .rjouvetnent, l'at traction et la pierre d'achoppement du spiritisme est justement sa, prétention d'entretenir un commerce de pensées ayee les morts les plus illustres. bien n'est plus tentant. nous ressemblons tous à pauj qui, malgré jes prohibition? de moïse, alla consulter la pythoqisse d'endpr qui lui. fit apparaître l'ombre dè samuel. de nos joljrs, allan gardée .s'imaginait interviewer tantôt jeanne d'arc, tantôt voltaire, tantôt saint jean.*. bien d'autres encore. et clest s'oiis leur dictée qu'il rédigea ces deux» ouyragejs qui sont l'evangije du spiritisme ; lis ià- vre des esprits, le jjivre des médiums. l'exemple du maître a été suivi par des disciples souvent plus illustres que lul m, camille flamroariqh, si.je.ne.ine trompe, conversa longtemps avec coper nic; sardou prit intérêt à jiâtir, d'uno main automatique, sur iq^papier, de pe tits palais ; dont l'architecture - étrange flmpîoyaït <?omme moellons des notes de musique, l'académicien, saint-etenë taillandierj eugène nus et j'é^iteur di- dier se mêlèrent à ces séance^ gui fnrçn't certainement jes plus brillantes du spiri- .tisme, à cau^e, il se .pourrait, du mérité de» évqqateuç&- ■ dans-ùne revue- spirite r -/'4«?ex pn-â pu lire, récemment, une explication -dek bolides attribuée à biaise pascal jet gui n'était pas tout à fait insipide.. .goïnb'ieh aussi d'oeuvres posthumes de musset, dé hugo, de lamartine!... mais comme, d'après les croyants eux-mêmes^ le dé- furit se ressent toujours du médium, c'est-à-dire de celui par qui il arrive àse manifester, le mort presque, toujours est inférieur-au vif. les loisirs de jersey, entre.vacqùerie, mme de girardin et hugo, se peuplèrent de fantômes. d 'adr mirables vers, cette fois (hugo n'était-il pas là ?), s'exhalaient du bois des guérit- dons devenus tout à coup prophétiques. dans ses miettes de l'histoire, vacqùerie nous raconte cette époque troublant». on était ivre de miracle. mais lorsque paris reconquit les exilés, vacqùerie recommunia avec le scepticisme; et lè procès-verbal de ces curieuses séanr ce^ où le mystère fut entendu, vu, même touché comme les plaies du christ par l'apôtre hésitant, ce procès-verbal, vac qùerie le termine parce mot, plus mé lancolique que cruel, d'un demwcroyant ! « j'ai toujours trouvé saint thomas bien crédule.» en ces dernières années, lady caith- ness, duchesse de pomar, avait mis à la mode les causeries fa.milières avecles fan tômes. dana son palais d'holyrood, ave nue de wagram, une chapelle secrète était réservée pour recevoir comme èn un boudoir pieux la voluptueuse reine d'e cosse marie stuart, celle que la> duchesse croyait être son ange gardien, lady caithness vécut des heures consolantes dans cette gracieuse illusion» ella nè communiquait pas toujours directement avec la beiné; elle se servait alors des facultés médiumniques d'une femiriè pour qui l'au-delà est plein de bontés 6t qu'elle avait attachée à' son secrétariat mystique : mmo rodière. •• _ . c'est eçtte mme rodière que, toujours conseillé par jules poi^ je suis allé voir. -. , ■ v . s . je l'ai trouvée dans ]e petit rçz t d^ chau,ssée qu^ùe habite, rue des dame^ c'est une femme de cinquante ans envi* ropide taille moyenne, un peu yoûtée, ayant l'accent méridional très prononcé? le mobilier de la pièce où elle me reçoit iqst quelconque. — vous voulez causer avec gambetta ? eh bien, nous allons essayer. >». elle approche un guéridon» s'assoit à un bout, moi en face d'elle. sur fô table une lampe, dn papier, un crayon et u9 alphabet, et l'on m'explique : h mes de* mandes le tribun répondra oui en frap pant trpis coups dans la. table : pan, pan pan; deux, coups seulement voudront dire non. pour les phrases, j'emploierai l'alphabet : du bout d» mon crayon j'in diquerai chaque lettre; lorsque j'errai atteint celle qu'il faut * retenir, qambetta m'en avertira en frappant ^ tcible. c'est i'ensembje d§ ce? lettres qui fqrmera -l^ phrase. ainsi donc, e'est compris !... l'on com mence. mais, auparavant, une dernière recommandation, importante. , il faut éviter de prononcer le mot de « mort ». les-esprits, paraît-il, n'aiment pas cela : .ils prétendent n'être point morts,- avoir simplement quitté la terre, j'en-tiendrai compte. .mais la séance est commencée. les mains appuyées sur l'acajou, mme ro dière évoque gambette,-eu© le prie, le supplie dçsë manifester.-ïmuui -fait va loir que ce n'est poiat v«ùp,e fiuria-	voluptueuse	1	1
le_pays	1896-06-08	1	3	PAG_3_TB000120	271	726	1622	9358	^<5 renfermant h t'inlcneur ni fcasort, ni caoutchwjc t!,yanl. mé-t!jo accord «juo la vulve t)uniop fi^tarichéito ws wvo est m''<r<jtt)tie mm franco 90 imw	vulve	1	1
presse	1896-06-08	1	2	Page1_Block9	1787	801	1681	200	positivomert, «surtout chez les faibles et les aerteax, r r.st un ^ntimect tout •autre que la sensualité banale qui les pousse vers les lemmes un peu mures. in capables d amier seulement par la chair, ii> -d-e liotnei du tieto 1 ci m uite, i mut ci m peu u^i tlenicp la n ti trasse. la inere. la pent e idvlle, toute de bleu pale, dont lesheios om mimpan et a femme,doit donc tie latak a ittioubl a , elle 1 est bieni'oi. fonzette aune sœur, diane lefier. manee a un etre qu elle detestc. dont elle dit : « c'est le fonctionnaire dans ce qu il a de haïssable, une redingote et du ruban rouge etrien dedans. as-tu jamais retourné un hanneton séché, dans une allee de jardin? on croit trouver la bére : il n'en restait que deux ailes ! » sa trentaine savoureuse attire invinci blement marignan, qui, d'un autre côté, plaît a la jeune femme par sa jeunesse, par sa fraîcheur, même par ses ignoran ces. et mentalement l'officier établit des comparaisons. toute menue, toute frêle, sa buzette ne vit que pour lui, devant le mon le elle c t embarrassée, tandis que le geste de diane est si aise, elle est si ii ij l sanlt 1 lie ement - belle que -les . hommes, tout en la désirant, se disent : « je n 1 \eiai pm 11s jusqu'à elle. » us 1 c e t u tout une sensation ex quise a amour propre satisfait, d'orgueil contente, qui gonfle la poitrine du lieute nant lorsque, revenant du concours hip pique avec, sa belle-sœur, il l'embrasse passionnément dans le coupé qui les ra mène. et ce baiser les unit encore dans l'ascenseur qui monte à l'appartement cle diane. mais suzette, qui se trouve là, voit le couple et pense mourir de honte et de chagrin. lés deux époux se séparent; bientôt, pourtant, d'une miséricorde in-	sensualité	1	1
presse	1896-06-08	1	1	Page1_Block56	1770	795	3388	4899	l'enfant la presse, en somme, avec son air sceptique, est, neuf fois sur dix, tout ce qu'il y a de plus sentimental. les jour nalistes, voire les interviewers, sentent leur cœur battre au moindre récit atten drissant. aussi avons-nous vu les jour nalistes, voire les interviewers, pleurer sur le sort de ce pauvre petit dont la mère tenta — peut-être pour de bon! — de se donner la mort. sur la mère, on ■s'apitoyait peu... elle connut la joie d'être adorée, le bonheur de briller: elle vit des hommes souffrir et chanceler à la cruauté de son dédain ; elle goûta toutes les voluptueuses jouis sances que procurent la jeunesse et la beauté... le poison l'eût-il tuée, qu'elle avait assez vécu; l'eût-il défigurée, qu'elle avait assez ébloui. mais l'enfant, le pauvre petit être qui, orphelin avant la lettre, ne devait jamais savoir la douceur des maternelles ca resses, aurait donc à rougir, plus lard, de celle qui l'a mis ail monde, — avoir un nom sanglant en même temps qu'un 'nom flétri?... . la douloureuse fatalité a fait verser des flois d'encre; nombre de nos con frères se sont émus sur le destin du bam bin, ont pleuré sur son avenir toutes les larmes d'encre de leurs plumes sanglo tantes... n'eût-il pas mieux valu, puisque la ■presse est la toute -puissance, puisqu'elle règle la morale al commande à l'opinion, n'eût-il pas mieux valu, je vous le de mande, que journalistes et interviewers s'élevassent, tous ensemble, contre l'o dieux préjugé qui inflige aux petits êtres innocents t'héniage .ê.vs .iwntes de fa- millel - louis b esse.	voluptueuses	1	1
