work	date	issue	page	block	height	width	hpos	vpos	text	active_words	occurrences_words	unique_words
siecle	1859-10-23	1	3	Page1_Block13	3284	807	4274	879	la questi0x l1 pets grâve, aàlh une annonce, c'est de dépasser par les faits l'at- tento du visiteur, en n'exagérant ni la quantité ni le bon marché des objets annoncés. ce - prin cipe , le seul professé par la maison du tapfs rouge, explique ses brillans succès. nous citerons quilquesprix au hasard: velours de laine, la robe, par 8 mètres 19f.(h> 10,000 pièces de fantaisies pour ro bes depuis 1 35 taffetas unis et faç., (etoffe de 7f.) 4 94 châles longs brochés, tout laine.. 79 s — — fd cachemire 150 » jolis manteaux (double face) 3» » fourrures (la parure complète)... 29 a robes de chambre élégam. garnies 25 * chemises en toile de l'inde brod. 3 9® services de saie (12 couverts)...... 24 » toile fine de hollande, la pièce de 25 mètres 45 » tapis carpettf s, valant 50 fr., à 29 » nous signalerons tout particulièrement un* affaire de tapi3 de table, jtyie louis xv, très beaux et très tllches; vendus 39 fr» au lieu de 70 fr., leur prix réel. articles pour hommes. 3,000 paletots élégans et chauds à 39 £. » 2,000 robes de chambre en laine et ouatées à 15 » 50,000 chemises, devans en piqué % fts 20,000 — dev. en fine toile. 4 ti 10,000 — tout en toile fine. 8 99 choix de draperie ponr vétemens sur mesure. rue du faubourg saint-martin, 67 et 69. —seule maison et fabrique bb tkbnaox, 2, rue des fossés-montmartre, à paris. la maison ternaux est la plus importante dans le commerce des châles : elle offre ^u coït sommateur les plus beaux produits de france«t l'avantage du prix de fabrique. sur demande, on expédie en provinee franco^ — etoffes poub ambublbmens. la maison de nouveautés de la tour-saint*. jacques, 88, rue de rivoli, vient de mettre en vente : 400 pièces algériennes, 1 m. 40, à lf.95 300 pièces reps broché ^aife^à 4 -90 jàspés pour tapis d'appatfiéûieris à.. «... 1 • jjs moquettes pour tapis d appartenions à... 4 90 2,000 foyers haute laine,- grande taille,à. 9 75 500 tapis de table reps broché laine à.... 7 75 2,000 rifleaux vénitiens, h 1 2 m., à 1 90 2,000 rideaux vénitiens, h r 2 m. 50, à... 2 75 2,000 rideaux brodés, h'2 m., à 2 25 2,000 rideaux broiés, h r 2 m. 50, à 2 90 1,200 stores vénitiens, h r 3 m., à....... 4 75 1,200 stores brodés, h r 3 m., à 9 » 1,000 pièces mousseline broch., bordure, à » 4qt — cachemires des indes. aux villes de france, rue vivienne, 51, etrfre richelieu, 10i.—cachemires longs et carrés, dë- puis les plus si mi-, les jusqu'aux plus riches pris môrqués en chiffres connus. — m. laroze, rue neuve des-pp/ ( 'îls-champs, 26, en renfermant dans six capsules ovoïdes les elémens de la médecine noire officinale, n popularisé ce purgatif, le plus sûr, le plus facile a prendre, sans odeur ni saveur. il convient à tous les tempéramens, à tout âge, sans changer ûé régime, sans précaution préalable. ' ^redressement des dents et des mentons dé« vws, pi-t jacowski, 5, rue de l'echelle, paris. obëëès est éëéijjmmii du 21 octobre —m guesville, 25 ans, r. de sures» nés, il.— mme v 8 chapard, 80 ans, r. des moulins, 18.—m. bourtel, ^5 ans, boul. poissonnière, 14.—m. jacquet, 28 ans. r. st-denis, 359. — mme letellif-r 41 ans,-r métiiknontairà, 57. — mme brunei. 81 ans! r. chariot, 6 —m. lemetrie, 37 ans. r.st-martin 220. — mine lebon, 58 ans, r: du fbg-st-antoiïne, 67. — m. lonzième, 26 ans, r. iopm*urt 38 —m ne mal- reue, 34 ans, r. d'arcole, 13 — m cuilin 78 ans, r. cassette, 17.—mme ance, il ans, r,ue la harpe, 137	coït	1	1
constitutionnel	1859-10-27	1	3	Page1_Block14	6562	889	2555	493	[ le plus illustré de tous les chasseurs de - îhamois est sans contredit l'empereur maxi- ' nilien y d'allemagne. ce, prince étrange : ut d'abord pour sa famille un sujet de grar rés * inquiétudes : il semblait frappé d'idio- isme. jusqu'à l'âge de cinq ans, il demeura muet; alors seulement.0n>put-lui faire pro-s ntoncer quelques paroles ; mais jusqù'àdouze, ins il bégaya, balbutia d unè manière indis tincte. on avait perdu tonte éspérancé de ' foir son esprit se développer , quand la lat'urè/ par un suprême effort, le tira dé; :et engourdissement. la forcé prodigieuse le son -aïeule, la princesse polonaise cim- )ui^a (i), èt l'ardente nature de «a mère, ; a voluptueuse eléonore de portugal, tra vaillèrent de leurs influences cachées sa par osseuse compleiion. son entendement se ■éveilla, comme en sursaut^ du léthargigu.e sommeil où il languissait; le futur emperbur ;e ptssionna subitement pour les chmniques, es livres de chevalerie, la peinture, l'archi- cctlire, la musique, l'art de lâ qu'errer t,a héologie, la médecine, la magie noire, que i >on père-voulait lui fàirè apprendre, turent . nise's de cêté sa force prit un tel accroisse ment qu'il tordait avec ses m'àiûs uneseritr- :e defer i ,pomrae.si elle eût^té e'n'carton. a « me agilité -merveilleuse dans t'ousles exerci se du côrps, il joigpàîtuôe^d.pce quiétôn- aait. et déconcertait, j es plus ,',^ardi'. nul/ jeutrètre, ne poursuivait aussi intrépide- nent le bouquetin et le chamois. il aimait jeaucoup à s'habiller comme les tyroliens, ï porter le justaucorps de drap vert et.le, :hapeau pointû'que ce peuple affectionne! lie malingre personnage, qui semblait cpn- kmgé à un .silence éternel,, paria bientôt piatre ou cinq langues, et il montra au- ;ant de courtoisie auprès des dames que l'impétuosité - à' là chasse r , qûe* ! de bra- \ ^oure dans lçs. batailles. loin dè fuir 1^ langer, il.le!.cherchait avéc line heroï- lue imprudence, et même av,ec une fol? c démérité. .aussi les chroniqueurs nous iisa,nt-i!s quei.ié. prince aventureux se mit; , odzé fois en péril ae mort pendant sa jeu nesse, et quaraote-qiia'-re fois pendant son ige inùr. £n~ mainte occasion,, il ne, fu| sauvé que par les plus ètonnans hasards. « nous ne raconterons point toutes les séènes xiù la ror.tune semblale prendreéous sa pro tection, tnais bous le suivrons à ta chasse du jbc^iquetin- et du chamois, sur les hauteurs qvie drape là potehtille dès rochers, avep constellations de blanches étoiles; que parfume le geum rampant, avec «es fleurs dè pourpre.__ * la première  de. ces aventures inquiétant tes eut lieu dans l'halberlhal ; gêné par ses crampons, il s'enchevêtra les pieds et fit une chute horrible. si ton ç'était pas venu | |à son aide, si on ne l'avait pas tiré de la po sition dànge'reuse-ôà il se trouvait, il eût 'certainement péri; ' aticu'n chemin ne f effrayait, aucun obs* taclç ne l'arrêtait'. ces ébèuletrie'ns de terri  1 et de neigedès pierres roulantes ,faillirent îplusieurs fois l'emporter. a in. m , à.helkopf, taans la vallée inférieure de^rinn , 'uô frag-, i îm'ent'dc ro'c,detacbé par ïïne'ptuie violente, îe hlessa aux deux tendons d'achille / -et feon. épieu solidement fixé le préserva .seul - [de la mort. un autre jour le roc s'écrou\a ■sous ses pieds : il n'eut que la temps de jsaisir tftie f^ïte liroussaill'e ; où il dèmeu-' •ir^ ipejqdu qu^qu'es. minutesi ^q- -styrie>,. |dn veneur quf le précédaitsjuï yn.glacier, trôula dans l'abîmé'; le prince; averti par., 'cette catastrophe, s'arrêta court et changea da.direction.. maii .l'accidentmé plus iërri-* ble qu'il éprouva eut lieu dans le massif de hauteurs nommé la muraille de saint-maf- tin.. ■■ .«. ■ ,. .'■■■ - £1166 forment en réalité une espèce de muraille, car elles s'élèvent perpendiculai rement au <lesgus de l'inn ; jusqu 'à cinq ■ oents mètres. çà et là, elles projettent dans la vallée d'imposans contreforts qui sont, ^ comme la montagne, d'une nuance gris- jçlair'. ma^inqiliep/çoijrsju/vant un \9ham0js , pàrqù les anfractuosités^acettç'cpurtinena- ■ tntellè.deyaoçàitde'béaiiçouplësaiitresçhâv 'seurs, car 41 vôùlait toujours -se distinguer, toujours briller au premier rang,et-ne pou* vait .voir faire un -tour périlleux sans avoir ! fie désir, de l'imiter, .de.^e surpasser'mème; pour obtenir radmiratioii des spectateurs; ; comme -il gravissait un escarpement des plus 1 abrupts, le pied lui glissa tout à coup. > mais, par unb.qnheur extraordînaire^aulieu d'être précipité dans le vallon, il tpmba sur une corniche, où il demeura suspendu entré .la terre et le ciel. impossible de remonter vers le sommet; aucune issue, ni à droite, ni à gauche. les courtisans'inquiets firent des 'efforts inouïs pour l'atteindre, et,n'yréussis- sant pas, donnèrent l'alarme, dans, les-jia- . me'aux dîaleatour.: les plus agiles noonta- fnards furent mis en réquisition. mais le liëû tait inaccessible. une journée se passa, et ,i; lâ nuit vint'shspendre les tentatives de sau- vetàge. le ilendemiain toute la contrée était ■ en rumeurl on .accourait au pied de la ; n^draille; (jn délibérait, on plaignait rim- • prikdent'soluverain', gue semblait menacer unb mort cruelle iét inévitable, la mort,par 1 la faim. i\ ', m le clergé; suivant son babitudè , voulut implorer lè secours du ciel. il ordonna des. prières daûs toute' la vallée, sonna les clo- . chës, céléhra des imesses; enfin l'abbé de ; wiltau, organisa line procession, :en tête de; laquelle il m'arçha, le saint ciboire à la main le prince entendaitles chants, lessup- plicatiqnâ inutiles, voyait se dérouler au-des sous de lui le pieux cortège, qui semblait r célébrer sés funérailles plutôt que de lui apr ' porter le sjalut. la foule s'arrêtà r devant la .. corniche oji il attendait la mort. le prêtre lui; • montra le salut* sacrement, et dit une messe. hélas ! la lumière baissa de nouveau, le so leil plongea derrière les hautes cimes, l'om bré et la tjristesse montèrent peu à peu du . fond des vallées. ' lé matin du troisième jour,* l'empereur; ' exténué de faim, s'apprêtait à la mort et : levait les yeux vers le ciel, comme vers son donner refuge, quand tout à coup il aper- çut un chasseur; de chamiois au sommet de là muràille. le hasard seul l'avait con duit. en ce lieu, attendu- qu'il ignorait la '!pôfeifion critiqse de maximilien. —oliél que faite!s-vousdonc làî luicria-t-il. — je regarde ét j'attends; mais l'attente : mè semblé un peu longue, car je suis où : vous nie vôyez aepuis quarante-huit heures. — et pourquoi ,vous êtes-vous planté dans un pareil endroit? - • . 4-j6 ne in'y suîs point plante, comme vous dites ïe pied'm a glissé sue le roc,-et * j'ai rou'é ;i bien malgré moi, jusqu'ici. 1 — diable ! répliqua oswal zips, ce ne -se ra pasune petite affaire que de vous en, ti rer, mais j? ne voudrais pas laisser un cama rade daps la p;riue. e' au«?i*ftt il m 5 -ni 1 on rve.-nro de defeen- ùt'^t)>t, uii'-tt, if.f-: tes, il exécuta - le puruieux trajat. oa .cû! (1; jsilt 1 pl;:ç.iit quatre uuu dau» i. de sçs et le» brisait d'un snul coup; eile en- fouçait un clou avéc soa poing en guise de mar- teauv '	voluptueuse	1	1
figaro	1859-10-30	1	1	Page1_Block24	1491	981	1143	1865	née sur les marches d'un trône, elle serait princesse par sa beauté, par sa grâce et par son intelligence. la beauté est plus qu'un don, c'est une vertu, surtout chez las princesses. la beauté est quelque chose de reli gieux, de sacré. rien n'est plus absurde que de lui faire la guerre au nom de la morale. quiconque croit en dieu doit rencontrer un divin mystère dans ces yeux brillants comme des étoiles, secrets et profonds comme les bois et les ileuves ; dans ces chevelures blondes ou brunes, qui rappellent tantôt la parure dorée des champs, les rayons du soleil, tantôt les ombres voluptueuses de la nuit. la vue d'une belle femme fait naître l'envie de prier. les ca tholiques, qui ont compris tout ce qu'il y a d'aimable et de sensé dàns leur poétique religîô'qy i-ôn bien pensé ainsi. ces belles saintes, peintes par les grands artistes, sont des œuvres essentiellement religieuses. la princesse marie nicolaewna, second des sept enfants, aînée des trois filles de nicolas, empereur de russie, ressemble beaucoup à son père. elle a la beauté souve raine et harmonieuse des statues de la grèce antique : formes élégantes et puissantes à la fois, démarche gra cieuse, traits d'une régularité suave, teint de marbre de paros, cheveux blonds comme les avait aphrodite. c'est une beauté homogène et sympathique à la fois, qui séduit et qui charme. la vie de la grande-duchesse marie a toujours été d'une grande simplicité. isolée de son père, de sa mère, de ses frères et de ses sœurs, jouissant d'une grande influence, elle ne se môle point à la politique, elle ne fait aucun bruit. elle se fait aimer, et c'est sa seule ambition. c'est	voluptueuses	1	1
presse	1859-11-08	1	3	Page1_Block66	464	799	3288	6337	maladies des femmes. m , lachapelle, maîtresse sage-femme, pro- fesseurd'accouchement.traitement (sans repos ni régime) des maladies desfemmes, intlammations, suite de couches, déplacement des organes, cau ses fréquentes de la stérilité constitutionnelle ou accidentelle. les moyens de guérison, aussi sim ples qu'infaillibles,employés par m* lachapel- le,.sont le résultat de vingt-cinq années d'études et d'observations pratiqués dans., le traitement spécial de ces affections.—m m * lachàpèlle re coït tous les jours, de 3 à 5 heures, à son cabinet. t7,r. du monthabor,près les tuileries, à paris, t	coït	1	1
constitutionnel	1859-11-12	1	3	Page1_Block4	915	820	115	6191	aviit d'abord paru devoir être amputé jambe. c'est le sergent-major l.abaste, du mê me corps,.et.noa le caporal rczter, à qui le fait dont il s?agit est applicable. tous les dtux, il est vrai, étaient occupés à pratiquer un ■'trou au parquet inonde de la salle des séances, pour faciliter l'écoulement des eaux, lorsque ce parquet, entraîné par la chute de la charpente du dôme, s'abîma et les ensevelit sous ses débris;, mais ce fut le ser gent-major labaste, père de famille, en effet, comme on l'a dit, et non le caporal rozisr, qui est célibataire, qui eut la jambe prise et , brisée sous une barre de fer,«où il resta long temps dans un état d'indicible souffrance, avant 4e couver être délivré. quant au cipural rozier. qui, au moment de la chute du plancher, et en même. teints que deux ■■■■employés du palais, partageait avec le sergent-rndj r lai)-s te les pénis de u po sition, un débri de «uarpente, tombant verti- ci'ein^nt sur lui, glissa sur soi casque, et les éclats lui labourant, le. corps depuis le dos jus qu'aux talons, lui arrachèrent ses vêteraeas et une partie de la peau, mais ne lui fracturèrent	pénis	1	1
tintamarre	1859-11-13	1	4	PAG_00000004_TB000068	418	477	2859	653	que diles^vousydans le petit morceau ci-dessus, de la voluptueuse image enfantã©epar ce cerveau en ã©bullition : â« les sirã¨nes conjurant la perte de m. empis? â» — cependant, ã  mon avis, une choseencore bien plus jolie, c'est la confiance que doit avoir m. de biã©ville d'ãªtre fort agrã©able ã  m. empis en le dã©fendant de cette maniã¨re!	voluptueuse	1	1
siecle	1859-11-15	1	2	Page1_Block16	3706	820	2766	1194	< messieurs, la guerre de l'indépendance s'est ter minée sans que les justes désirs des italiens ni cet^x de l'empereur napoléon fussent accomplis ; mais, même à villafranca , l'empereur a reconnu le droit . des peuples et la nécessité de reconstituer la natio nalité de l'italie. ' . » une grande partie de cette diflicile entreprise a été laissée à notre jugement et à notre prudence, puisqu'il a été convenu qu'on ne rétablirait pas par la force et' contre la volonté des -populations le* princes que leur' conscience inquiète a déterminés a abandonner: leurs' trônes. cn nouveau principe de droit prévalait en faveur dé l'italie, qui. selon les pa roles de l'empereur, devait être rendue aux ita liens, et au heu de rester un champ ouvert aux am bitions et, aux rivalités des étrangers, devait être mise en-situation de pouvoir concourir à l'état poli tique général comme membre'indépendant et libre de ta famille des peuples européens; i , » les peuples de< l'italie centrale, qui avaient re couvré leuistiroitsj'oiitsuapprêcier sainement cette nouvelle condition politâquevet favec une prudefice •remarquable, à laquelle l'europe a applaudi avec raison, ils ont tracé te chemin et les limites du mou vement national.- •«<<»! w. , » ils ont organisé leur liberté, et, au moyen de rq- piésentans réguliôreinent^lus, ils ant constitué les pouvoirs et- manifesté-leurs vœu&-légitimes d'un'e manière sotennetlb.- vous, messieurs, avec< cet ac cord unanime qui, avant de se faire jour dans vos délibérations, existait dans les comicea électoraux et dans l'esprit des populations, vous avez décrété la déchéance de la dynastie des bourbons et l'an nexion de ces provinces aux etats du roi victor- emmanual. » la déchéance fut'prononcée parce que les sou venirs de leur mauvais gouvernement, l'aversion universelle, l'alliance des princes fugitifs avec i ' au triche, les anciennes affinités et les nouveaux inté rêts qui les enchaînent à cette puissance rendaient leur restauration incompatible non-seulement avec le sentiment national, mais encore avec les condi tions d'ordre moral qui sont l'unique fondement dè toute autorité soude, et durable. > l'union avec le piémont fut votée parce quë l'intérêt de la pairie italienne était plus puissent que celui des autonomies provinciales sur l'esprit des populations, convaincues que l'union n'éiait-pas une nécessité du moment, mais bien une nécessité permanente de l ordre et de la paix ; parce quo, seul un etat fort pouvait assurer l'indépendante de l'itaj lie et donner à l'europe une véritable garantie de repos. » c'est donc par égard non-seulement pour leur propre utilité et satisfaclion, mais aussi pour l'or- dre européen, que les italiens ont préféré aune harmonie artificielle de forces qu'ils croient inconr çiliables le plan d'un etat libre et fort, capable en temps de paix de bien régler jes élémens nationaux, et, en temps de guerre, capable de défendre son indépendance; d'un e'.at possédant en paix et en guerre un véritable équilibre de forces. » le principe de la volonté nationale, le droit des populations de régler leurs affaires intérieures d'une manière compatible avec l'ordre général de l'eu rope, ont été pratiqués .dans ces provinces avec constance et modération. l'analogie des conditions où se trouvaient les différents etats libres de l'italie centrale conseilla aux gouvernemens une ligue destinée à pourvoir aux besoins d'une défense com mune contre des dargers communs, et à représen ter l'unité future dei> destinées de l'italie. b quant au gouvernement de ces provinces, i'ai la conscience, messieurs, de l'avoir exercé ■ confor mément au bpt pour lequel il m'était confié, en en courageant et réalisant, autant qu'il dépendait de moi, les vœux,exprimés par l'assemblée; en sur veillant avec une extrême sollicitu le les a-memens, symbole et soutien de notre ferme volonté.; en maî- trisant les partis politiques ; en maintenant l'ordre et en le rétablissant là où il fut tout à coup troubu pour voir âe réveiiier ies haines féroces que les gou vernemens passés avaient attisées, et que la liberté e*t l'esperance avaient astoupies. » noire ; mouvement poiwqu s a surmonté des épreuves difficiles ; mais u est de la prudence hu maine. messieurs, de songer que les péri s vaincus ne préservent pas dos pénis que ravenir peut ame ner. la paix va être, signée à zurich, si elle ne l'est déjà ; *03 droits des -princes sont réservé?; mais en; . même temps l'empereur napoléon, protecteur cons tant de la cause italienne,.garantit indirectement l'indépendance de nos votes sn empêchant toute possibilité d'intervention-étrangère. , » notre situation poétique est donc, quant à l'eu txjpe, la même qu'après la paix de villafranca» et même, ti l'on y regarde'bien, etle est -meilleure mais la nécessité veut qu'elle doive rtster dans l'in certitude actuelle pour un espace de temps dont nous ignorons la durée. quulque grandes que soient les garanties qu'a données jusqu'ici l'attitude des populations, nous ne devons pas oublier que cette attitude, en pareilles circolstanees, est déjà, un exemple plutôt unique que raie dans l'histoire, et	pénis	1	1
