work	date	issue	page	block	height	width	hpos	vpos	text	active_words	occurrences_words	unique_words
debats	1851-10-05	1	1	P1_TB00022	1681	911	2985	5293	tout à l'heure-ce que je pense des larmes, par trop faciles, que lu bohême a fait couler. m. henry murger tire un certain parti de eette association de jeunesse grelottante, de pauvreté malsaine, de gaité douteuse, de libertinage réel et de gourmandise hyperbolique, qui est la donnée de son roman. mêlez le tout, et appelez cela schaunard, marcel, rodolphe et gustave colline, un peintre, un poëte, ua musicien, un bibliophile, et vous aurez ce type à plusieurs têtes avec le même liabit, la même bourse vide, le même logis litigieux, le même appétit incommensurable, qui reparait sans cesse dans la série de ces divertissantes ébauches, toujours le même, « et jamais nouveau. » une autre source du rire, dans l'ouvrage de m. murger, c'est le paradoxe, mais le paradoxe mené crânement, le fouet à la main, et sautant par-dessus les maisons, les montagnes et les précipices. avec ces deux élémens, un type uniforme et un paradoxe effréné, m. henri murger a fait son livre. la scène de monsieur dimanche. descendue de son piédestal aristocratique et tombée dans la loge du portier, la fable de tantale jouée derrière la devanture de gorcehet, la scène d'harpagon et de frosine remontée de quatre ciages, et par-ci par-là, le sac de seapin s'ouvrant pour quelque tour de son métier, n'y cherchez rien de plus ; mais c'est beaucoup, car les sources où m. murger a puisé sont éternelles comme le rire lui-même. toujours on rira d'un créancier éconduit, d'en gourmand malmené, d'un avare mis à l'épreqve par un emprunteur avisé, d'un tour de gobelet joué finement; oui, toujours.. mais ici ii faut s'entendre. la même scène peut appartenir au plus haut comique, comme dans le festin de pièt re, ou au comique bourgeois, comme dans l'avare, ou n'être pas comique .du tout et être simplement bouffonne, comme dans le livre de m. murger. m. murger n'est pas comique, il est bouffon. qu'il ne s'en formalise pas. la farce est vieille comme le monde. le burlesque a eu de tout temps son public, un public immense; et marraontel fait remarquer justement qu'entre cette farce primilive-de l'avocat patelin, qui fut un ersai avorté de comédie véritable, et la comédie du menteur, il s'est écoulé près de deux siècles, remplis presque ex-	libertinage	1	1
presse	1851-10-05	1	4	Page1_Block57	121	1520	1749	2980	syphilis, maladie» de la prostate, onanisme et . ses sotte», etc. , . ) e. franco (contre mandat), chei ed. garnot. ttbr., qnai des aognstlnij 21, et l 'auteur, à son cabinet médical, (onde démoli quinze ana. a paru , rue richelieu, 41. consultations de bit. à midi et d* si s h. traitements et coaraltailou par correspondance. (affranchir).	onanisme	1	1
debats	1851-10-08	1	4	P4_TB00043	1035	1553	1781	3931	&widè de® mmiades 9 par m. goeury-duvivier * & de le faculté de paris, ex-médecin dit bu-. de bienfaisance, ei-chirtirgien-mâjor, officier du mérite militaire, etc., etc. iwantici indispensable aux personnes atteintes de itétrécissenients, itctentlon tl'urlrae, catarrhe, calculs, perles néniiaaies, ïni£sui*suiice, syphilis, maladies de la prostate, onanisme et se* suites, etc. 1 vol. in-8, ii« édit. ligures, 5 fr. et 8 fr. 50 c, franco (contre mandat), chez ed. garnot, libr., quai des augustins, 21, et l'auteur, i» ko el eublnct méditai, fonde depuis quinze eus, a paris, rue itichelieu, 48. consultations de s 6 ls. à raidi et de » i s h. traitements et consultations par correspondance. {affirançliirî. isjz fsfw' r-&w 111111 perfectionné - simple, élégant, solide, économique, facile à porter, à emballer, à manœuvrer, à rafraîchir, pour faire, 5 au gaz pur ; eau de scltz. eau de vichy, soda wateit, limoxadfa gazeuse, vin de champagne, etc. < seltzogêne-d fèvre,de3 bout. 15 f. seltzogène-d.fèvre, de 2 bouu 14 f. ld. moins élégant, 12 fr. 50 c. id. moins élégant, 12 f. poudre, trois cents bouteilles, 20 f. il poudre, deux cents bouteilles, 15 f. • centralisation de tous les.autres systèmes d'appareils à eau de seltz, depuis 1 franc jusqu'a 21 francs, et poudres préparées pour tous les systèmes, v v lu	onanisme	1	1
debats	1851-10-11	1	4	P4_TB00035	508	1550	215	4687	fàt&ume des malades 9 par m. goeury-duvivier ❖ & s de la faculté de paris, ex-médecin du bur. de bienfaisance, ex-chirurgien-major, officier du mérite militaire, etc., etc. g manuel indispensable aux personnes atteinte» de rétréois»ement», rétention d urlne, catarrhe, calculs, pertes séminales, impuissance. syphilis, maladies de la prostate, onanisme et ses suites, ètc., 1 vol in-b°. 2« édit. figures, 5 fr. et 6 fr. 50 c. franco (contre mandat), chez ed. garnot, libr., quai des augusuns, 21, et l'auteur, h son cabinet médical, fondé depuis quinze ans, a paris , rue richelieu, «. consultations de o b. à midi et de « à ô b. traitements et consultations par correspondance. (affranchir). trois chinoises aux petits pieds i 7 cïïîjtiràèïkes ). m. chcwc-atai , ses deux femmes et sa belle-sœur, reçoivent tous tes jours, de midi à cinq heures, de sept heures à dix heures du soir. (i fr.) 53, rue vivienne. —lntérieur chinois, musique chinoise, romances. 33, rue vivienne. (l fr.)	onanisme	1	1
le_corsaire	1851-10-11	1	2	PAG_2_TB000023	49	930	2162	1017	» c'est le libertinage enfin raccourci, ^	libertinage	1	1
presse	1851-10-11	1	4	Page1_Block82	36	834	3954	4000	maladiei da la prostate, onanisme et ses suites, etc.	onanisme	1	1
debats	1851-10-15	1	4	P4_TB00039	1273	1559	1734	4006	guide des malades, par m. goeury-duyivîer * & ? 4c la faculté de paris, ettniédecin du bur. de bienfaisance, er-ohirargien-major, officier du mérite militaire, etc., etc. manuel iiiriimix'tikable aux personnes atteintes de ketrécissements, ttétentlon d'urine, catarrhe, calculs, ~ l'crtc» séminale», impuissance, syphilis, maladies do la prostate, onanisme et ses suites, etc. 1 roi. in-b°, 9* édit. figures. 5 fr. et 6 fr. 50 c. lraneo (contre mandat), chez ed. garuot, libr,, quai dos augustins, 91, et l'auteur, ik son cnblnct médical, fonde depuis quinte ans, a paris, rue iclelielu«, 41. consultations de c b. à midi et de s à & h. traitement* et consultations par correspondance. (afirancliir). bti« ist-aonort 1 , 598(500 moins 2), «a premlerétaeè. d. fèvre. professeur de mathéhitiqïïes et de chimie, etc. ses.tzogène-d, fèvre l'eltfecrmtié y simple, élégant, solide, économique, facile à porter, à emballer, 0 manœuvrer, à rafraîchir, pour faire, au gaz pur : eau ue bex.tz, eau i>e viciiv. »oi»t wjteb. i.imon.ide «azeuse, vin »e ciiajupauae. «le. seltzogéne-d fêvrb.deï bout. 15 t.[]seltzogbxe-d.ffivre, de2bout 14 f. ld. moins éle&mt, 12 fr. 50 c id. moins élégant, 12 f. i'ouuuë, trois cents bouteilles, 20 f. pocdue, deux cents bouteilles, 15 t. centralisation ( de tous les autres systèmes d'appareils à eau de seltz, ' depuis i franc jusqu' 4 2i francs, et poudres préparées pour tons les systèmes, «sssaî®» avis gratuits. l'oeuvre des familles présidée par 51. l'archevêque de paris, sollicite du travail et des emplois pour ses nombreux patrooés. s'adresser lous les jours, de nuit à dix heures du matin, à m. itémare, membre du conseil supérieur, rue saint hyacinthe-salut-mlchel, as {affranchir.)	onanisme	1	1
le_corsaire	1851-10-16	1	2	PAG_2_TB000063	100	1360	680	4731	cuité des sexes et ce libertinage légal que nous promet le phalanstère de fourier et successeurs.	libertinage	1	1
le_pays	1851-10-16	1	1	PAG_1_TB000107	527	1241	2663	6623	le pauvre says comprit mon exclamation sans qu'on la lui expliquât, il s'éloigna en souriant tristement. notre compatriote de chandernagor avait bon c?ur; il s'empressa de donner deux bananes au bengali, lequel les accepta avec joie. il nous tourna le dos, s'assit au soleil et mangea avec sensualité la maigre pitance qu'on lui avait donnée. pendant que j'observais avec intérêt mon pauvre says, je dis à ali :	sensualité	1	1
siecle	1851-10-16	1	1	Page1_Block70	1586	796	2532	5625	1669, c'est-à-dire cinquante-huit ans à peu près ' avant l'époque où commence l'histoire que nous allons raconter. mais c'est surtout vers la fin du quatorzième siècle qu'avignon était spiendide à voir. phi-, lippe le bel, qui avait cru donner à clément v et à ses successeurs des gardes, une prison et un asile, leur avait donné une .cour, un palais et un royaume. c'était bien en effet une cour, un palais et un royaume que possédait cette reine du luxe,, de la mollesse et de la débauche, que l'on ap pelait avignon ; elle avait une ceinture de mu railles qu'avait nouée autour de ses flancs re bondis hernaudy do herodia, grand-maître do l'ordre do saint-4ean-de-jérusalem ; elle avait des prêtres dissolus qui touchaient le corps du christ avec des mains ardentes de luxuro; elle avait de belles courtisanes, sœurs, nièces et concubines des papes, qui arrachaient les dia- mans do la tiare pour s'en faire des bracelets et des colliers; elle avait enfin les échos de la fontaine de vauclase qui répétaient amoureu sement le doux nom de laure et qui la ber çaient au bruit des molles et voluptueuses chan sons de pétrarque. il est vrai quo lorsqu'à la sollieitation de sainte çrigitte de suède et de sainte catherine de sienne, grégoire xi quitta avignon, en 1376, et partit pour rome, où il arriva le 17 janvier 1377; il est vrai qu'avignon, déshérités de sa splendeur, tout ên .gardant sçs armes, qui sont de gueules à trois clefs d'or posées de face et soutenues par une aigle avec cette dévise : ungilibus et ros tris, ne fut plus qu'une veuve	voluptueuses	1	1
constitutionnel	1851-10-17	1	2	Page1_Block7	2173	817	1115	296	adresser les félicitations que mérite votre coura geuse conduite pendant les troubles dont celte ville a été le théâtre dans la soirée du 8 courant. . l'envahissement des forges par. une bande de perturbateurs qui poussaient les cris: aux armes! vengeance ! on égorge nos frères ! allait peut-être devenir le signal d'une sédition terrible, si, aidé d'un très petit nombre de collègues et d'ouvriers, fidèles, dont je regrette de ne pouvoir rappeler ici les noms, vous ne fussiez parvenu, après une lutte corps à corps , à vous rendre maître du ces énergumènes et à comprimer toute émotion dans l'atelier. par cette énergique initiative, vous vous êtes acquis des titres sérieux à la reconnaissance de l'autorité, de l'établissement auquel vous ap partenez, et des ouvriers eux-mêmes qui, appré cient certainement aujourd'hui toute l'étc-ndue du service que vous leur avez rendu. votre attitude devant la justice n'a été ni moins digne, ni moins ferme, et m'a inspiré pour votre caractère une,estime toute particulière. je suis héureûx, monsieur, de vous l'exprimer au moins, et d'y joindre l'assurance de ma consi dération distinguée. le préfet de l'allier, de chabnailles. : moulins, le 12 octobre 1851. m, le directeur des mines à commentry. monsieur, dans la soirée du 8 courant, et pendant que, sur la place de commentry, s'accomplissaient des scènes de désordre qui ont failli avoir des consé quences funestes; en l'absence de toute impulsion supérieure, puisque vous-même, monsieur !e di recteur, étiez absent en ce moment, un certain nombre d'ouvriers des mines, en tète desquels se trouvaient m. fialin, chef mécanicien, et m. ra- guenette, caissier de l'établissement, sont veuus se mettre à là disposition des autorités et de la- gendarmerie, pour leur prêter main-forte. je ne veux pas lai: ser passer cet acte de dévoù- ment.aux lois, sans remercier les.citoyens qui l'ont accompli, et ont ainsi donné un exemple trop rare encore, malgré les pénis dont la société est menacée. . veuillez, monsieur le directeur, me servir d'in terprète auprès de ces courageux ouvriers, et les assurer de la reconnaissance du gouvernement. agréez, monsieur le directeur, l'assurance de ma considération distinguée. . , le préfet de l'allier, de ch arnailles. le messager de l'allier, où nous puisons ces deux lettres, ajoute que le gouvernement vient d'accorder une gratification à la bri gade de commentry, en récompense de sa belle conduite. nous avons l'espoir, ajoute ce journal, qu'une récompense sera également accordée- à m. ferrière. tous les hommes d'ordre y applaudiront. ' l. boniface.	pénis	1	1
presse	1851-10-18	1	3	Page1_Block5	1594	775	1632	931	danemark. - c openhague . — on lit dans la gazetteme cologne du 16 octobre : a dans la séance du conseil d'hier. mm. les mi nistres w. moltke, r. moltke et kœtz ont donné leur démission, et le roi l'a acceptée. ils ont pris cette résolution parce qu'ils n'ont pu s'accorder avec leurs collègues sur les alfaires gênérales de l'etat. » ' '' '' ' _ ! konvelles des départemens. . ei ite-et-lom.— la feuille réactionnaire de ce département (le journal de chartres) se trouve dans une position assez singulière, p-r suite du procès intenté contre elle ; par le.ci toyen eugène lambert, de brou, et que doit plaider, b chartres, le 12noyembr, me augus- terivierre, avocat du barreau de paris. an nombre des griefs reprochés au journal de chtrtres, figure celui d'avoir publié une ordonnance de mise en prévention rendue,par la chambre du conseil de cmleaudun, — la quelle devait rester secrète jusqu'au jour du procès. '   ' ' !r on se rappelle que, dans son audience du il octobre, , le trihunafcorrectionnel do coït m«r condamna le gérant du démocrate du rhin en mm) irancs d'amende, pour avoir publie, le 23 septembre, une ordonnance en tf-rtu de la quelle, le numéro du 26 avait été saisi et devait ê're saisi dans tous les lieux où i| serait trouvé. - il s'agissait, pour le dêmwate du rhin, de la publicité d'une affaire personnelle qui, p»r conséquent, ne pouvait nuire en aucune façon h des intérêts individuels. — malgré cela, il a été condamné. l'action dirigée contre le jmrnnl de char tres, par la partie civile, est d'une similitude frappante; .elle a de plus un caractère beau coup plus grave. — non seulement, lé journal réactionnaire aurait commis une contravention	coït	1	1
debats	1851-10-19	1	4	P4_TB00038	1127	1506	1773	4131	tkbitismmwt du docteur ch. illdßistit, ; médecin de la faculté <!o paris, maître en pharmacie,, ex-pharmacien des hôpitaux de in ville do paris, professeur dç médecine et de botanique, honoré de médailles et récompenses nationales, etc., etc. les guérisons nombreuses et authentiques obte- aujourd'hui ou peut regarder comme résolu le nues à l'aide de ce traitement sur une foule de ma- problème d'un traitement simple, facile, el, nous les guérisons nombreuses et authentiques à l'aide de ce traitement sur une foule de randonnées comme incurables, sont des prot'.na non équivoques de sa supériorité sur tous les moyens employés jusqu'à ce jour. avant cette découverte, on avait à désirer un qui agît également sur toutes les qui fit sûr dans ses effets, exempt des qu'on reprochait utcc justice aux mercurielles. problème d'un traitement simple, facile, el, nous pouvons le dire sans exagération, infaillible conire toutes les maladies secrètes, quelque anciennes ou invétérées qu'elles soient. le traitement du docteur albert est peu facile à ouivre en secret ou en voyage, et sans aucun dérangement : il s'emploie avec un égal succès dans toutes les saisous et dans tous les climats. consultations gratuites eue montorgueil, 19, ancien 21, paris. traitement par correspondance (affranchir). gene] fàwide ese® malades, par m. goeury-duvivier * & 0 de 1* faculté de paris, ex-médecin du bur. de bienfaisance, ex-ghirargien-major, officier du mérite militaire, etc., etc. 4 xsanuel indispensable aux personues atteintes de rétrécissements, rétention d'urine, catarrhe', calculs,— perles séminales, impuissance, syphilis. maladies de la prostate, onanisme et ses suites, etc. 1 vol. in-8, s« édit. figures. 5 fr. et 6 fr. si) c. iraneo 'contre mxndat), chez ed. garnot, libr., quai des auguxtius, 21, et l'auteur. a son cabinet médical, fondé depuis quinze ans, a paris, rue rlchclun, 11. consultations de o il. à midi et de 8 à & 11. traitements et constatation* par correspondance. (affranchir).	onanisme	1	1
constitutionnel	1851-10-20	1	3	Page1_Block21	1900	820	1805	5215	pas que mi bazin , en lisant cela | pas si- l'instant « reconnu et . salué retz comme un maître, sauf ensuite à le con 'tredir-e®n bien des' cas> s'il-y-avait lieu; ■■ mais l'historien qui rencontre, dîèsiès- iprei- • 'miers -pas,- 'dans le 'shjet : qu'ilmraite; > nn tel observateur et peintre pour devancier, et ; qui n'en- tire sujet' que 'ae s'efforcer, à jout-- iamoindrir ,.et, à toutéteindre.après.lui, me jparàlt faire preuveid'un esprit de taquinerie , je| de chicane. qui l'èxclui; à l'instant de la large voie ; dans > la carrière. notez que ltete en peignant explique, fit que la raison pbli-- .tique et profonde des dioses se glisse dàiis l'e trait de son pincéau. ; apré§ céè jïtiatre4rre- v mières années delà régence; durant lesquel les le mouvement d'impulsion .donne .par le cardinal de, richelieu continua de pousser le* vaisseau de l'etat sans qu'il fût besoin d'im-' primer:de secousse nouvelle, «après ces qua tre années de. calme! parfait; «de sourire et d'indulgence, on entre, san^ s'en apercevoir d'abord, dans de noùyelîtè;;eaux, et' un nou veau souffle peu à peu se fait sentir : c'cst le souffle des réformes,-des révolutions. d'où vient-il?.à : quelle occasion? quels firent les minces sujets qui amenèrent des secousses si violentes.?,/c'est ce que ,retz excellé à nous rendre, et ces pages de ses mémoires, qu'on pourrait intituler : comment les révolutions commencent , tiennent à la fois, par leur hau teur et par leur fermeté,' de bossuet et de montesquieu. ., : , j , < « 11 y a plus de douze cents ans que la fran ce a des rois, dit, retz; mais ce? rois n'ont pas toujours gté ^absolus au point qu'ils le sont, i» mt dansitm résunié rapidtt;et bril lant, il cherche à montrer que si-là monar- cliie française n'a jamais été réglée et limitée par des lois, écrites, par des chartes^ eomme les royautés d'angleterre etd'aragoia, il avait toutefois existé dans les temps anciens'un sage milieu «que nçs pères ^velent trouvé entre la licence des rois et le libertinage des ;peuples. » ge,sage .et- juste,milieu qui;;ensfrance, atou-i jours été plutôt à l'état de vœu, de regret ou d'e9pérauce, qu'à îl'état de pratique réelle-	libertinage	1	1
debats	1851-10-23	1	4	P4_TB00045	300	1508	2569	4357	voies urihai3es. qb gares gérératebrs guide des malades, par m. goeury-duym e r * 3 de la faculté de pans, ex-medecin du bur. ue bienfeiaance, ei-ollnirgien-major, officier du mente militaire. etc., etc ! manuel indispensable aux pirsonuei atteiotea de ketnaciaaemeota, kéleatlon d'urine, catarrhe calcula' perte- séminales, impuissance. syphilis. maladies de la pro.tate, onanisme et -es salles etc! l'aniàîm 'l'  flgur i s ,' sf l  •£, 50 ,°- ï ane î ! co  tre ««<!«), ch« ed. garuot, lihr , quai daa aurusum, 31, et i auteur. à «on cabinet médical, fonde depuis quinze aux, a pana, rue rlrbrlitn al couxultalions de o h. à midi et de * a b b. traitement-,tcommimtionspu dorr«pond«« la^cto)!	onanisme	1	1
le_pays	1851-10-26	1	3	PAG_3_TB000026	1693	1237	3914	459	méditatif, qui sait se garder de tous les engouements, qui n'a jamais mordu à aucane idéologie creuse, et semble employer tout son empire sur lui-même à se préserver des influences extérieures et passagères. c'est d'un bel exemple. j'aime à voir un artiste repousser ainsi les tentations qui viennent chuchotter à son oreille. cela prouve qu'il est en fonds d'arguments pour réfuter tous les sophismes. la fête donnée à rubens est l'ouvrage le plus important de m. leys cette année. l'ordonnance de la composition est assez satisfaisante; les figures y sont répandues avec grâce plutôt qu'elles ne sont énergiquement groupées. ce qui fait défaut, peut-être, c'est un rentre d'intérêt rattaché à un centre d'action quelconque. ces hommes, ces femmes, sont rassemblés là pour donner lieu à un tableau. ils sont à l'artiste plus qu'à eux-mêmes. rubens, le roi de la fête, on l'aperçoit au second plan, relégué dans le demi-jour, et réduit, comme les autres figures, à-un rôle secondaire. tels sont néanmoins le pouvoir de l'exécution et la magie de la couleur, que l'on oublie ces défauts et que l'on se laisse aller à l'impression produite par cette toile. l'esprit s'amuse et l'?il se régale avec une sensualité raffinée devant ce tableau divertissant, peint si grassement, avec une touche si vive, si originale; la lumière rebondit joyeusement sur de chatoyantes étoffes; l'accessoire devenu partie principale ressort avec une vivàcité singulière, et ces mosaïques de têtes blondes ou brunes, écloses dans les empâtements d'une couleur généreuse, resplendissent et s'allument sans crudité comme les fleurs d'un bouquet richement varié.	sensualité	1	1
