work	date	issue	page	block	height	width	hpos	vpos	text	active_words	occurrences_words	unique_words
temps	1896-09-12	1	2	Page1_Block19	3543	951	3142	643	paaots nous allons avoir au jardin d’acclimatation une exposition et un concours de chats et exotiques. on fait appel à tous les on les prie d’envoyer les plus beaux spécimens qu’ils possèdent de la race féline, leur promettant des prix et des mentions vous avouerai-je que l’annonce de cette m’a laissé froid? j’ai une dent contre les chats. les chats sont de terribles chasseurs qui guettent longuement, patiemment, la femelle sur son nid, saisissent le bon grimpent lentement sur l’arbre et la j’ai eu bien des chats, jamais je n’ai pu les corriger de cette habitude. elle leur a passé dans le sang. on me dit qu’en revanche ils chassent les souris et les rats. je le veux croire ; mais, si j’ai vu quelquefois mes chats s’amuser d’une qu’ils avaient prise, la laisser fuir pour lui remettre la patte sur le corps, et poursuivre longtemps ce jeu cruel, combien n’en at-je pas surpris épiant les pauvres petits oiseaux de mes arbres et saccageant leurs nids? je m’écriais, comme le dupuis des sonnettes : « mauvaise bête ! mauvaise bête ! » mais que faire à cela ? il eût fallu, pour préserver mes pinsons ou mes merles, envoyer une balle à ce misérable gredin. oh ! je l’aurais fait avec une joie féroce, point de ces amoureux fervents ni de ces savants austères qui, selon baudelaire, adorent les chats dans leur mûre saison. mais on me le bras. ce pauvre minet, il était si gentil et si câlin ! on éprouvait à lui passer la main sur le dos, à fourrer les doigts dans ses poils, un plaisir de sensualité voluptueuse. le soir, il se cachait sous le lit, et, quand on commençait à il sautait sur la couverture et se sous l’édredon, les yeux à demi fermés et ronnonnant tout bas. comment se priver d’une bête si caressante? caressante, je le veux bien, mais perfide et carnassière. jamais je n’ai pu voir l’aile d’un oiseau tomber d’un arbre qu’avait escaladé un chat,sans tressaillir d’horreur et de colère contre cet animal malfaisant. a paris, mon dieu, passe encore ; ce sont des bêtes de luxe, et il paraît qu’il suffit de leur odeur pour écarter delà la horde des petits rongeurs. on le dit tout au moins; et je ne le conteste pas, bien que je n’en aie jamais rien cru. mais à la campagne ! s’éntendre éveiller tous les matins par les hôtes charmants de ses arbres et se dire : combien ce gredin de chat m’en a-t-il mangé cette nuit? au moins ai-je cette consolation que les chats des voisins n’entrent pas chez moi. j’ai de terribles chiens qui ont la haine innée du chat. mon chat les connaît, se méfie d’eux et ne les voit pas plus tôt approcher qu’il grimpe à un arbre, et du haut de sa branche les nargue à plaisir. les chats du dehors ne sont pas prévenus. le chien bondit sur eux par derrière et les net. on trouve le lendemain dans un taillis le lamentable cadavre et je me dis à part moi avec un rire de vengeance satisfaite : un de moins i celui-là ne dévorera plus d’oiseaux. le chat, voyez-vous, je ne le trouve charmant et ne l’aime que lorsqu’il vient de naître, jusqu’à cinq ou six mois environ. il a des mouvements d’une grâce exquise, il n’est encore ni un voleur ni un assassin. plus tard c’est une bête à je dis cela et n’en extermine point. mais, à coup sûr, je n’irai pas voir l’exposition du jardin d’acclimatation. vouiez-vous mon dernier mot : le chat n’aurait point d’utilité pratique si l’on n’en pouvait faire d’excellentes gibelottes; j’ai bien dit : d’excellentes gibelottes. sganarelle.	sensualité, voluptueuse	2	2
echodeparis	1896-09-14	1	1	Page1_Block38	2803	782	4148	2313	petits jeux ui e grosse nouvelle a bouleversé le monds des lettres : m. meilhac vend soa billard. ls- billard de m. meilhac n'était pas un meubîe ordinaire ; c'est en jouant la série américaine et la poule au cazia que le maître composait ses pièces ; la vente de cet ustensile de tra vail annonce la rétraite d'un prince du théâ tre ; m. meilhac, qui jouait au billard comme lucign biart lui-même, renonce à la scène pour se consacrer à la lecture-; mieux vaut tard que jamais. eu général, les gons de lettres ont un jeu préféré, un jeu symbolique, en quelque sorte, de leur beau talent. on voit en effet l'influença que. le carambolage eut sur- l'œuvre de m. meilhac ; l'homme.qui a écrit froufou ne cre vait pas les tapis. ainsi m. françois goppée joue au croquet, le jeu de la famille ; il ne rate pas un arceau; c'est l'homme des chemins tracés. par contre, m. brunetière'a un faible pouï la toupie hollandaise ; c'est avec une impé tuosité pareille et une pareille logique qu'il s'élance parmi le3 gens de lettres et les idées, cogne à droite, cogne à gauche, saute ici, rebondit là ; et c'est ainsi qu'il nous apparaît^ ronflant et bruyant, sonore et néanmoins hollandais. m. bourget préfère le billard anglais ; son analyse hésite, sautille de clou en clou, de douleur en douleur, avec le bruit vain et char mant de la bille de verre cherchant ua nu méro où se fixer. m. zola, auquel ou a prêté, à tort, l'inten tion d'introduire le jeu d'échecs à l'académie, ne s'attarde pas à « pousser le bois ». le ro buste auteur des rougon-macquart veut la grand air et ne se plaît qu'au jeu du cochon» net. * m. rod ne perd jamais l'occasion d'inter venir dans le3 jeux de quilles, tandis que m. theuriet se manifeste au jeu de grâces, un peu suranné. en quel jeu s'affirmerait le cosmopolitisme de m.loti,sinon dans le zanzibar ? le jeu de fléchettes semble créé tout exprès pour m. jules leinaître. maurice donnay est habile à mettre dans lt mille ; il n'a jamais raté une grenouille ; à lui le jeu de tonneau.. marcel prévost recherche la sensualité ua peu mystique du bilboquet. au tennis mondain, hervieu et vaniêreia se renvoient la balle ; galiban, infatigable, fouaille le sabot de l'actualité. plus triste, m. maeterlinck agite sans cesse l'éternel deuil du domino ; et la mélan colie du loto berce m. rodenbach. m. jules renard joue au jeu d'eloi renouvelé dos grecs ; tandis qu'au casino m. làvedan suit les petits chevaux. enfin nous n'oublierons pas m. berthelot, si bien servi au jacquet par sa promptitude à occuper les places vacantes. dis-moi à quoi tu joues, je te dirai qui tu es. bill sharp.	sensualité	1	1
gil_blas	1896-09-14	1	2	PAG_00000002_TB000235	304	1033	4871	6984	un spiritualismé hypéresthésié, trouble, affolant fait la magnificence, qui épouvante, de ces peintures de sentiments et de sensations où se touchent, semble-t-il, les frontières d'un surhumain de sensualité mentale.	sensualité	1	1
lanterne	1896-09-15	2	1	PAG_00000001_TB000140	176	1014	5652	1377	pie, agréablement maigre, avec de petits seins très durs, de jolies cuisses, et les deux voluptueuses lignes de l'aine fort attirantes.	voluptueuses	1	1
lanterne	1896-09-15	2	2	PAG_00000002_TB000089	1135	1053	3521	5370	quelque valse bouffonne qui fait vibrer les carreaux des fenêtres ainsi qu'au passage d'un régiment. on a beau chanter à tuetête des refrains orduriers de corps de garde, écraser les verres au plafond, harceler de quolibets et chatouiller les femmes, qui se renversent parmi les coussins rayinés, madame ne se fâche pas, se contente de sourire, de reluquer à la dérobée— avec une sensualité qui coule au fond de ses prunelles grises — le lieutenant poi&nol, un ancien sergent-major, dont les moustaches cirées la troublent malgré elle. ! elle a une vieille passion tenace et que rien n'éteindra pour le galon et le panta- ; ion rouge. ..: on ne voit dans sa chambre que des 1 photographies d'officiers, jaunies pour là plupart et datant de loin, en uniformes oubliés,, et, quand le général passe la bri- .1' gade en revue sur la place d'armes, elle s'étale invariablement au premier rang d 0>8 badauds, en toilette sérieuse de douairière et avec un châle de l'inde aux	sensualité	1	1
journal	1896-09-18	1	3	PAG_00000003_TB000153	592	1028	3511	3691	les blondes, fraîches et rosées, supportent à peu près toute la gamme des nuances : je leur conseille cependant d'éviter celles d'une tonalité trop crue. les brunes feront valoir leur carnation dorée en les encadrant de vert éteint, de jaune et de rouge ; mais cette dernière couleur doit être employée avec modération, car elle est un peu dure et moins seyante que le vert, qui s'harmonise adorablement avec les tons ambrés ; au milieu de la mousse voluptueuse des dessous, les rubans verts ont une note attendrie pleine de séduction.	voluptueuse	1	1
petitparisien	1896-09-18	1	3	P3_TB00078	902	778	123	5725	ses préparatifs terminés, i! ne lui en fallut pas davantage pour l'exécuter. saint-aubin connaissait à merveille le plan de la propriété du marquis à la rue vaneau et du pavillon luxueux qui lui servait de petite maison et de lieu de fêtes et de rendei-vou». il en connaissait aussi la destination. plus d'une fois il avait assisté 14 à de véritables orgie». le marquis aimait le plaisir, les femmes, tranchons la mot, le libertinage et la débauche, mats élégante, entourée de luxe, dans l'éclat des lumières et au bruit de la mousquoteric du champagne. 11 aurait fait bonne figure aux soupers du régent, à côté de madame de p3rabère ou de ta marquise de prie où sans doute quelqu'un de ses ancêtres avait dû se trou- ver. tout autre était son frère georges qui ne savait rien des saturnales de la petite maison de la rue vaneau et qui eût essayé d'en détourner son ainé. mais l'ardeur de son sang, l'emportement	libertinage	1	1
debats	1896-09-19	1	3	P3_TB00002	1857	911	301	2493	a côté de tout ce qui a été réalisé en si peu d'années pour  l'amélioration matérielle de l'east london, il faut rappeler ce qui a été fait pour l'éducation des classes ouvrières les plus déshéritées et le peoples palace et toynbee hall, où les étudiants d'oxford et de cambridge, installés là, font des lectures populaires et, enfin le musée de bethnal green, destiné à donner au populaire la sensation dès belles éhoses et à éveiller les goûts et les vocations artistiques. les salles étaient à peu près désertes à l'heure où je visitai ce musée. seuls, quelques enfants malpropres, nu-pieds, les panta- ! lons déchiquetés, jouaient autour des vi-. trines où les petits personnages en porcelaine de saxe souriaient précieusement dans leurs attitudes mièvres. a côté d'une voluptueuse statuette de glodion, une jeune mère, déjà étiolée, assise sur une banquette, donnait son sein amaigri à un nourrisson blafard,, envëloppé dans ses langes souillés. et je coipparais ces images de la vie riante à cette misère. dans l'est de londres c'est surtout le décor qui change, la foule qui s'y meut a souvent cet aspect hâve et sordide. plus d'un intérieur qu'on entrevoit, noir et rempli de loques, dément la façade du logis. le marché juif, dans petticoat, avec ses échoppes obscures, ses étals de bouchers aux viandes douteuses, et dont le seul aspect soulève le cœur, ses sombres visages d!ôrient, ses femmes ridées, et ses vieillards,: qui semblent toucher à l'âge des patriarches, ferait encore les délices d'un rembrandt et d'un . callot. et pourtant on constate en ces dernières années, grâce aux efforts publics et privés, une légère diminution du paupérisme. a lon- liverpool, dans toutes les grandes villés, les anglais ne désespèrent pas de faire mentir un jour ce titre du livre de henry george, d'une ironie si redoutable : progrès et pauvreté'. j. bourdeau.	voluptueuse	1	1
gil_blas	1896-09-21	1	1	PAG_00000001_TB000176	100	1025	5773	4650	romantique, en la sensualité bourgeoise qu'émeut tant l'actrice.	sensualité	1	1
journal	1896-09-21	1	1	PAG_00000001_TB000055	532	1033	1381	8556	enfin, voulez vous toute ma pensée ? la littérature d'une époque est toujours plus morale que ses mœurs. aucun livre n'égale en libertinage les conversations courantes, dans le monde comme dans le peuple. vous parlez de la jeunesse et des dangers que l'affiche ou le journal lui font courir : écoutez les entretiens de ces collégiens ou de ces ouvrières, <mtre eux	libertinage	1	1
figaro	1896-09-22	1	4	Page1_Block28	2565	793	2452	2260	gymnase : la famille pont-biquet (reprise). •le gymnase a fait hier sa réouverture avec une reprise. c'est un usage qui devient général. quand j'aurai dit une fois de plus qu'aux, reprises je préfère les-nouveautés, il ne me restera qu'à constater que le ,choix de celle-ci, la fa mille pont-biquet , est fort heureux. vau deville par l'extravagance d'une fable outrée, la famille pont-biquet confine à la comédie par une observation parfois fine des mœurs de la bourgeoisie de province, et l'ensemble forme un spec tacle agréable. la pièce fut donnée, il y a cinq pu six ans, au vaudeville. elle y réussit. c'est qu'elle est vraiment drôle, l'aventure des pont-biquet! le chef de la famille est un procureur de.la république qui a pour gendre.son substitut, la raynette ; pour femme, une vieille dame assez revêche, et, déplus, une jeune fille, gabrielle, fian cée à un professeur, jacques dubois. or, là raynette, quoique magistrat, est assez farceur. amateur, de phrénologie, il a découvert que son beau-père était por teur d'une protubérance dénonçant un tempérament amoureux et que sa belle- mère, de son côté, était romanesque et accessible , aux passions sentimentales. en gendre parfait, il s'amuse à lui en- voyér 'des déclarations brûlantes, signées robert, et il s'éjouit fort à voir la dame, ni plus ni moins qu'une jeune anda- ïouse, passer ses soirées au balcon à attendre, une fleur à la main, un amou reux, chimérique./quant à pont-biquet, il serait d'un libertinage moins plato nique s'il n'était afflige d'une assez étrange infirmité, cas pathologique à l'usage des vaudevillistes. il suffit qu'il se soit approché de l'autel de vénus pour rester sourd assez longtemps. et comme il faut, à l'audience, avoir l'oreille ouverte pour faire condamner le pauvre monde, cette infirmité le gêne fort et tempère ses ardeurs. mais, si l'amant de mme pont-biquet est un être imaginaire, il n'en est pas de même d'une certaine carmen, qui fut la maîtresse de jacques, fiancé de mlle pont-biquet, et qui, en apprenant qu'il va se marier, accourt dans l'intention de « faire de la musique ». carmen, descen due à l'hôtel de la petite ville, a prévenu jacques qu'il ait à s'y rendre dans la soi rée. jacques envoie, à sa place, la ray nette, qui n'est pas fâché de la commis sion. or, carmen est mariée. elle a épousé un « phénomène », dagobert, un « homme-poisson », qui, néanmoins, est jaloux et mari peu complaisant. sachant que sa femme avait un ren	libertinage	1	1
lanterne	1896-09-24	2	2	PAG_00000002_TB000055	559	1027	2464	2040	la délicieuse petite baronne était d'autant plus tourmentée du désir de frissonner au contact d'une belle barbe, qu'elle était complètement privée de cette douce sensaiion au domicile conjugal. les joues sacerdotales du baron n'étaient pas moins glabres que l'intérieur nacrée des délicates ostendes qu'il arrivait parfois à la voluptueuse petite baronne de déguster en cabinet particulier, en caressant avec béatitude une jolie barbe selon son cœur. le pauvre baron avait beaucoup à souf-	voluptueuse	1	1
petitparisien	1896-09-24	1	2	P2_TB00006	1440	780	1007	5219	vous aller voir, monsieur, comme elle va sagement se coucher, cette grande demoiselle. l'enfant, toute somnolente, se laissant tomber sur son épaule. c'est vrai pourtant qu'elle est assommée, ce soir... cette petite. vous trouvez, n'est-ce pas ? 11 avait l'air tout à fait inquiet. allons, monsieur, vous n'allez pas vous faire du mauvais sang pour une indisposition de rien du tout... ... tous les enfants ont des malaises comme ça... le lendemain, ils sont gais comme pinsons... si je savais... en allant au théâtre, je préviendrais un des médecins de service... fis sont très complaisants... pour l'enfant d'un artiste, il viendrait tout de suite. je vous dis de ne pas vous inquiéter. je vais coucher la petite, vous faire diner, et vous vous en irez tranquillement... ça ne risque rien, puisque je ne bouge pas d ici. l enfant s était reprise à tousser, d'une toux pénible et enrouée. oh ! ce n'est pas la grippe, c'est quelque coup de froid qu'elle aura attrapé... il en raut si peu... elies prennent chaud, elles sont en moiteur, elles restent un moment dans un courant d'air, entre deux portes, et ça y est. tout en parlant, elle déshabillait l'enfant, la mettait au lit et, quelques minutes après, elle revenait avec une boisson chaude. maîa ne dormait pas encore et, en levant ses yeux gonflés parla fièvre, elle vit s'approcher mme pacaud. c'est très bon, disait la femme de ménage en remuant la cuillère dans la tasse, et en faisant mine de goûter le breuvage avec une sensualité engageante.	sensualité	1	1
siecle	1896-09-25	1	2	Page1_Block35	1840	798	964	4616	- celuirci, du reste, s'accusait encore mieux, chez cet adolescent d'une ving taine. d'années, par l'ensemble, de ses (raits, qui conservaient ie reflet de tou tes lés passions caractéristiques de sa* race : l'effronterie, la violènce,- la.cupi dité, l'astuce,-la perfidie, une sensualité effrénée;, ; le mépris dès hommes èt.des dieujç — tout cela voilé,'au besoin, pa^ la forte dose de dissimulation et d'hypo crisie innées chez ces gens en dehors de toutë loi ët' de toute morale commuriësi ^.s d'àdam; abrutis ou loups intelli gents..y . a.', . '  la maigreur nerveuse de son buste et de ses cuisses se dessinait sous'un jus taucorps de epir à l'épreuvè,' sinon de la balle, du. moins ,<lu, sjtyle't ét dé jà dagûe, etjous une paiçe de/gr^gùës dè velours jcràmoisi, par» les ..crevés ..desr j-quelles une doublure de soiè, défraich : e, s'échappait en 7 j cette pài'tie.. dé son costumé, -r: sous traite sans .doute à. quelque, élégant, car valiérj —-jurait singulièrement avec-les inisèràbîe/ebpadrillés^ i^u.ise laçaient sur ses jambes, nues et avec un de ces cha peaux effarouchés, hérissés de plumes de coq, — chapeaux sans nom^ sans forme, sans raison d'être, ruines arro gantes et désespérées dont un des héros de çe récit devait immbrtaliser plusïard la splendide nonobstant, il n'eût point fallu sourire dé ce contraste;' * - > v-, ; le jeune bandit avait,'en effetdçqùoi imposer' sïleûcedux railleurs.	sensualité	1	1
echodeparis	1896-09-26	1	2	Page1_Block36	1641	796	3324	5609	et les ferronnières de perles, la tourmente des pensées montait en folie. sa respira tion. s'oppressait douloureusement. alors, pour avoir de l'air, d'un geste, elle ouvrit la croisée. l'orage approchait,gonflant les tentures avec des plaintes d'âmes mortes. le vent furieux éteignit la lampe brusquement. yvonne ne s'en aperçut point, l'air fraîchi de la nuit calmait sa lièvre ardente. pen sive, elle s'accouda sur l'appui de marbre de la fenêtre, devant cet arno qui pleurait dans les ténèbres;.elle s'accouda désespé rée, comme tant d'autres s'accoudèrent autrefois, comme tant d'autres s'accoude ront encore, en de3 soirées perdues ou exaspérées d'hystérisme ou tragiques jus qu'au gol gotha, — car, hélas telles sont nombreuses, elles sont légion, elles sont l'humanité tout entière, lésâmes qui ne possèdent point la somme de joie qu'il leur faudrait pour pouvoir supporter la crucifixion de la vie. au dehors, c'était l'enivrement équivo que d'une soirée d'avril. sur son visage, comme des caresses physiques, défail laient les rafales brûlantes' de l'orage qui s'approchait et, dans leurs tourbillons, ces effluves violents, ces effluves ineffa bles charriaient encore tous les parfums trop forts, toute la sensualité mortelle des pays traversés,depuis la grèce aux iles de fleurs, depuis les côtes dorées de la sicile. cependant, sur le quai, des jeunes gens passèrent en chantant. une mandoline de sérénade accompagnait spécieusement leur chanson fatiguée. a leurs voix si claires yvonne comprit qu'ils devaient être bien jeunes. leur chanson troublante par lait d*amour,debieii-aimée,de lèvres volup	sensualité	1	1
liberte	1896-09-27	1	1	PAG_1_TB000084	547	1004	1257	6870	en reprenant le rôle de samson, m. lafarge y a retrouvé son succès du théâtre des arts de rouen, où m. verdhurt nous conviait, il y a quelques années, à entendre la première représentation en france du bel ouvrage de m. saint-saëns. le grand duo d'amour du second acte lui a valu les plus chaleureux applaudissements, qu'il a partagés avec mme héglon, une belle et captivante dalila, pleine de charme pervers, de voluptueuse attirance.	voluptueuse	1	1
gil_blas	1896-09-28	1	1	PAG_00000001_TB000145	575	1024	5725	2006	mentant leur influence, leurs relations et leurs sinécures. et, contrairement à ce qu'on pourrait croire, ils ont eu rarement des malheurs conjugaux. pourquoi ? c'est que toujours ils ont pris pour épouses des personnes de leur monde, élevées elles aussi dans des principes rigides, et laides et disgracieuses, incapables d'éprouver une sensation voluptueuse et qui considéraient les rapports sexuels comme une pénible corvée.	sexuels, voluptueuse	2	2
constitutionnel	1896-09-29	1	2	Page1_Block47	414	800	4386	2574	f* rt f* f rîr fptff rr ilg n'étaippï pis encore àssg? gpj§ pqur qpe dps qpgervatiéhs (jqpum.entées sljr ie§ charmés de ïa princesse' — dont ûn rèput^'it à bondpoit l'inyincibilitë c'ruél- le én matière 4 ? amour rrr, pussent faire pqpjet de leurs* propos libërfrïté' 'ilë'se contentèrent bpup le moment'dp désha biller avec une sensualité cynique quel- ques -u 'n'es des dàhs'eufe'es dont'lës ver- tûëétâtent moins f^û'phes et 7a ré-	sensualité	1	1
lanterne	1896-09-29	2	2	PAG_00000002_TB000032	233	1017	1439	4265	peut-être le joli sourire qui errait maintenant sur ses lèvres voluptueuses se serait-il glacé, si alice avait pu voir une légère embarcation qui glissait sans bruit dans le sillage de la sienne.	voluptueuses	1	1
le_pays	1896-09-29	1	2	PAG_2_TB000117	1187	1100	4976	2140	les promenades de la princesse por- j phyric d'lzlau, dans le grand salun, ressemblaient assez au voyage de certaines étoiles mantes qui paraissent laisser après elles un sillon d'or dans le firmament. piltcr.'ton et \\'intertcld n'avaient pas encore ose introduire dans leur conversation le llulli de la princesse. il leur semblait trop naturellement impossible que cette nébuleuse s'aceomodat du ciel de leur lit. ils n'étaient pas encore assez gris pour que des observations documentées sur les charmes de la princesse ? dont on reputait à bondt-oit l'invincibilité cruelle en matière d'amour ?, pussent faire l'objet de leurs propos libertins. ils se contentèrent pour le moment de cléslla-bilier avec une sensualité cynique quel-ques-unes des danseuses dont les \'er-; tus étaient moins farouches et la hj-- putation moins facile à perdre, étant déià perdue par avance.	sensualité	1	1
petitparisien	1896-09-30	1	2	P2_TB00034	1439	776	163	5203	était devenue de la sauvagerie. maintenant il était à portée de tout ce qu'il avait si ardemment convoité,.— et il passait à côté de tout cela sans oser y atteindre. il possédait cet argent pour lequel il avait été assassin. ii le tenait, il le comptait, il s'en hallùcinait... c'était un rôve des mille et une nuits... mais il s'apercevait que ce n'était pas tout. avec sa fortune, dans tous les rendezvous de luxe et de plaisir où il se coudoyait avec des femmes jeunes, belles, des femmes 3ui le soir, dans leur toilette de bal passaient emi nues, le grisant de leur parfum. oserait-il jamais leur dire ce qu'il entendait murmurer partout autour de lui, oserait-il jamais les tenir dans ses bras comme faisaient tous ces hommes, pas plus jeunes, pas mieux hàtis que lui!... et c'était un véritable supplice pour cet impulsif aux désirs irrésistibles, aux appétits insatiables... un supplice où, cependant, il courait comme à une voluptueuse torture. ce fut, contre lui, la force de gabrielle arménis. depuis qu'elle évoluait savamment, d'abord éveillant son attention, puis excitant sa curiosité, enfin irritant son désir, elle avait bien vu dans quel trouble elle jetait ce tacitune aux yeux chaque jour plus étincelants sous leurs épais sourcils. et puis, elle l'avait bientôt jugé. cet homme aux larges épaules, au front bas, à la toison épaisse, à la lèvre rouge, au cou de taureau, cet homme qui avait la lourde carrure d'un lutteur, lui rappelait aussitôt ta vieille histoire de samson et de dali la. eh bien, il s'agissait d'être d&lila et de dompter cette brute sur laouuho, son père	voluptueuse	1	1
gil_blas	1896-10-01	1	1	PAG_00000001_TB000127	1033	1021	4760	6689	plusieurs fois amarante retourna chez moi. je ne la voyais jamais entrer, je n'entendais même son pas hardi, je ne sursautais jamais à son vif coup de sonnette, sans me remémorer cette première étreinte si .brûlante et si désordonnée. c'était un supplice charmant, un bourreau enjôleur qui s'imposait a ma sensualité craintive maintenant, mais encore impatiente. se punissait-elle d'être si fragile au désir en se refusant la naturelle satîsfaction? se vengeaiteme, physiquement du moins, sur moi, des cruautés bien plus profondes de l'autre, qui s'était contenté, dédaigneux, de l'ignorer désormais ? et ces repentirs qui suivaient ces crises haineuses me faisaient les lui pardonner toujours comme à un èfnfant malade un jeu mauvais.	sensualité	1	1
