work	date	issue	page	block	height	width	hpos	vpos	text	active_words	occurrences_words	unique_words
gaulois	1870-01-03	1	3	P3_TB00013	2631	781	1055	2554	le général jomini a donné les meilleures leçons pour régler, diriger, accélérer et par conséquent pour diminuer la guerre. ace titre, il est surtout digne d'attention : car cet écrit, bien qu'il soit le panégyrique d'un homme de guerre, n'est rien moins qu'un plaidoyer en faveur de l'institution. voici comme l'auteur parle de la guerre, dans les quelques belles pages qui servent d'introduction à son travail : « la guerre a été le premier état naturel de l'homme à l'origine des sociétés... on partait chaque printemps. chaque fleur de génération, chaque élite nouvelle s'envolait à son tour, à travers le monde et par les vastes espaces de la terre habitable, comme disait homère. on allait tout droit devant soi, au hasard, à la découverte, selon les versants et les pentes, à la rencontre d'un meilleur climat, d'un plus beau soleil, en quête des terres fécondes, des moissons et des vignes, là où il yen avait; on avait pour droit sa passion, sa jeunesse, l'impossibilité de vivre ou l'on était, le droit du plus jeune, du plus fort, du plus sobre, sur les races voluptueuses et amollies. la tactique et l'art reparurenten italie avec la eenaisgapge, pour trouver l'habileté jointe au courage, et l'un et l'autre su service du droit, il faut longtemps attendre; on ne se voit un peu consolé des horreurs et des carnages de religion du seizième siècle, que lorsqu'on voit henri iv conquérir en héros son royaume, et maurice de nassau maintenir par l'épée sa libre patrie... fr-les premières guerres de la hé solution, nées d'un sublime élan, enfantées des entrailles du sol pour le défendre, pour repousser l'agression des rois, nous reportèrent un moment aux beaux jours de l'héroïsme antique; elles dégénérèrent vite, même en se perfectionnant en s'agrandissant outre mesure au gré du génie &t fin l'ambition du plus prodigieux comme du plus immodéré .eg oitaine des temps modernes. « depuis lors, sans doute, il y eut encore, et nous en avons vu quelques mémorables guerres... mais elles n'ont produit pour les vainqueurs que des résultats incomplets, peu décisifs, chèrement achetés, et elles n'ont mis en lumière aucun génie ; l'enthousiasme n'a pas duré et la pensés pacifique a fait chaque jour des progrès que l'émulation industrielle, dans les odieux moyens de destruction, certes pas de nature à ralentir. la bon sens et l'humanité crient trop haut et par trop de bouches pour d'être pas entendus. il devient évi dent que si lu gusirs a été le premier état naturel de l'homme barbare 5 qqa sj elle a été le triomphe et la gloire de quelques esprits prééminents, l'élément nécessaire et l'instrument de grandeur des nations souveraines et des peuples rois, la paix avec tous les développements qu'elle comporta, est la fin dernière des sociétés humaines civilisées. » léon dommartin.	voluptueuses	1	1
siecle	1870-01-08	1	1	Page1_Block370	1927	809	2623	5285	l'orage. elle en était arrivée à ne plus craindre ni la lueur des éclairs, ni le bruit du tonnerre, mais elle n'en était pas encore arrivée à en recevoir une joyeuse perception. jacques mérey fut donc assez étonné, ,cet orage ayant éclaté dans des conditions de vio lence telle qu'il ne se souvenait pas en avoir entendu un pareil. jacques mérey fut donc très-étonné de voir la jeune fîlio non-seule ment , n'éprouver aucune crainte, mais en core manifester une sensation de bien être étrange. les portes et les fenêtres étaient fermées selon l'habitude, pour ne pas établir de cou rant d'air; mais era alla droit à la fenêtre et l'ouvrit juste au moment où un éclair combiné avec un coup de tonnerre effroya ble éclatait au-dessus de la maison. l'éêlair et le coup de tonnerre avaient été telle ment simultanés que le docteur s'élança et tira eva à lui, croyant que le tonnerre allait tomber sur la maison même ou tout proohe d'elle, .mais, dans ce mouvement presque involon taire, eva s'arracha de ses mains et courut à la fenatre en criant : — non, non, laisse-moi voir les éclairs; laisse moi entendre le tonnerre, cela me fait du bien. elle écarta les liras et elle aspira cet air tout chargé d'électricité avec un bonheur que trahissait la sensualité de sa pose et de son visage. s?s traits s'illuminaient comme si elle eût été en communication avec la flamme cé leste. - on eût dit que l'orage se répercutait dans cette chétive créature et doublait ses forces. en ce moment, et comme le docteur la lais sait maîtresse absolue de ses actions, elle se dirigea vers l'orgue, l'ouvrit, et, d'une manière incomplèie sans doute mais suffisante pour en reconnaître la principal motif, elle joua- le fa meux air de cimarota, devenu son air favori. le doc|eur écoutait dans l'étonnement, presque dans l'admiration ; il ignorait, ce qui a été reconnu depuis, les aptitudes étranges	sensualité	1	1
le_pays	1870-01-09	1	1	PAG_1_TB000243	215	1040	5652	7957	et gustave aymard me serra la main avec une larme dans les yeux et une sensualité tout antropophagique sur les lèvres.	sensualité	1	1
liberte	1870-01-24	1	2	PAG_2_TB000130	1806	1029	1776	6712	fabuleuses posaient parfois presque une couronne sur son bonnet phrygien. félix, le frère de pallas, épousa successivement trois filles de rois.? un jour pallas, ironiquement peut-être, propose un décret destiné à réprimer le libertinage des matrones avec les esclaves. aussitôt le sénat, extasié d'admiration, affolé de reconnaissance, vote louanges, honneurs, plus quinze millions de sesterces à l'auteur de ce décret magnanime. des flatteurs le faisaient descendre de pallas, l'antique roi d'arcadie; cet arbre généalogique est solennellement inauguré par les pères conscrits dans la même séance. sur la proposition d'un descendant des scipions, ils rendent des actions de grâce à ce valet libéré de claude, qui, « né des rois, voulait » bien sacrifier sa noblesse au bien public, » et n'être qu'un des serviteurs de césar. pallas acceptant les honneurs, refusa l'argent, se disant i( content de sa pauvreté première »... ce stoïque amant de la pauvreté étaitquatre-vingts fois millionnaire. ?tacite, rapportant l'anecdote, a ce petit rire sec et triste qui le prend chaque fois qu'il raconte une flagornerie sénatoriale avortée et tombée à plat; ? l'adulation tournait -parfois à l'adoration : cette valetaille avait sa prêtraille. lucius yiteliius, le père de l'empereur, avait fait placer les bustes dorés de pallas et de narcisse parmi les images de ses dieux pénates..	libertinage	1	1
figaro	1870-01-25	1	2	Page1_Block10	1961	856	236	5485	xxiv — une, deux, trois... proposition honora ble. quatre, cinq, six~. d'un homme de poids. sept, huit, neuf... à la nuit. dix, onze, douze... par l'intermédiaire d'une fem- -me blonde. treize, quatorze, quinze... au su jet d'une jeune fille brune. la dame de trè fle est-elle bien une jeune fille brune ? par bleu, oui... c'est rosette... c'est une chienne de fille... ainsi grommelait la veuve imbert, pen chée sur les cartes graisseuses qui lui ser vaient à interroger l'avenir. son front jaune distillait une sueur alcoolique. le chat ron flait. quant à la bouteille d'anisette, elle avait rendu l'âme, t, en ce moment, un froufrou de jupes tra versa l'espacé. la veuve se retourna, poussa un cri'extasie, se dressa les mains jointes ét; •de 'sa bouche immense, laissa fuir ces sylla bes ravies :  — madame clorinde !!! puis, elle retomba sur son fauteuil, éblouie, palpitante. il lui sembla que sa loge était inondée de rayons etque la lune en personne y.opérait son entrée. > c'est que, pour cette âme boueuse, clo rinde était l'incarnation de la femme supé rieure. elle l'avait connue toute petite fille ; elle l'avait vue manifester, dès l'âge le plus tendre, ses instincts erotiques et commer ciaux ; elle avait étudié les progrès die sa corruption précoce, et bien des fois elle avait murmuré en hochant sa tête vénéra ble : — cet enfant-là ira loin ? la prédiction s'était accomplie. et maintenant, les yeux baignés de douces •larmes, madame imbert sé'rappelait le temps où clorinde, simple repasseuse, k âgée de quinze ans, s'attardait déjà chez les mes sieurs seuls à qui elle reportait du linge le lundi matin, et déposait chaque semaine à la caisse.d'épax'gne des fonds qui n'étaient pas uniquement dus au blanchissage. elle se souvenait de l'avoir escortée dans des guin guettes de barrière, et d'y avoir admiré' sa tenue. jamais clorinde ne s'était galvaudé^ jamais elle n'avait écouté les propos de ces	erotiques	1	1
figaro	1870-01-25	1	2	Page1_Block42	1991	886	1993	5447	partie quadruple, et trahit à la fois cinq ou six heureux mortels. sa froide habileté, sa présence d'esprit et surtout son activité phénoménale plongeaient la veuve dans un enthousiasme délirant.clo- rinde devint son idéal : elle en rêvait la nuit; elle la proposait en exemple à rosette ; elle se répétait vingt fois par jour : — ah ! pé- cairo l ah ! triple imbécile que je suis ! pour quoi, étant jeune, n'ai-je pas imité clorinde ! regrets insensés. imiter clorinde n'eût pas été dans les cordes de la veuve. la na ture s'y fût opposée doublement. d'abord, elle avait toujours été horrible ; en second lieu, elle aimait trop les mili taires. on ne naît pas impunément sous le soleil du midi. a vingt ans, ses veines provençales charriaient des flots de làye ; celles de clo rinde n'avaient janiais contenu que de . la lymphe. chez la veuve, le libertinage avait été une passion, pour clorinde c'était un moyen. '' aussi, désormais édifiée sur le néant des voluptés terrestres, l'ignoble matrone con templait son adroite cliente comme un fruit sec de saint-cyr contemplerait un maré chal de,france,' avec surprise et admiration, avec respect et envie. en clorïndè, elle sa luait la prostitution triomphante, la honte çousue d'or, le vice à son apothéose, et quand elle la vit entrer dans sa loge, elle se pros terna ou peu s'en fallut. clorinde répondit avec une simplicité char mante aux génuflexions de la veuve. elle le la contraignit doucement à se rasseoir, et même, honneur ineffable ! elle prit place à côté d'elle. ' après quoi, elle se mit à causer de choses 'indifférentes. madame imbert commença par l'écouter d'un air recueilli en aspirant de toute la lar geur de ses narines les parfums d'ambre, de musc et de poudre de riz qu'exhalait sa visi teuse. elle supputait intérieurement lé prix de sa robe, de ses dentelles et de ses joyaux. en additionnant le tout, elle arrivait à un total énorme, et, malgré elle, à chaque ins tant,- elle murmurait à demi-voix ;	libertinage	1	1
debats	1870-01-31	1	3	P3_TB00001	4017	814	65	257	d eux exerce par la masse de ses fonds, et plu w effective est la protection dont jouit le plus humble de ces travailleurs dont les services sont l'objet même de la compétition. le fait décisif pour le bien-être de 1 ouvrier, c'est la lutte entre les capitaux qui se disputent les bras. tout accroissement de ces capitaux ajoute quelque chose à la valeur vénale du travail des populations, et au lieu que celui qui vil de son labeur matériel puisse en etre opprime, il en tire au contraire le droit de lever plus haut la tête et de tenir à plus haut prix sa collaboration. de là suit, messieurs, qu'un des plus grands services qu'on puisse rendre à une société industrieuse, au point de vue des intérêts des populations ouvrières, c'est de favoriser 1 accroissement du capital, et aussi de faire en sorte que le capital existant ne soit point atteint par le débordement des consommations improductives qui 1 anéantiraient. .. , „ dieu sait de combien de maniérés et sous combien de figures se montre et s'assouvit le démon qui pousse aux dépensas improductives , favorise qu'il est par les passions toujours promptes a se déchaîner.. il tourne sans cesse autour de nous a la piste d'une proie qu'il puisse dévorer : qucerens guem devoret. les dépenses improductives disproportionnées a l'étendue des ressources des psupies détruisent la substance dont ils vivent, et finissent, après les avoir affamés , par les démoraliser. les dépenses improductives , voila le vampire qu'on a si injustement signalé dans la personne du capital. malheureusement le genre humain est trè3 enclin à s'y abandonner. l'ambition et l'orgueil, maladies funestes , auxquelles les etats même les plus civilisés sont sujets, précipitent les peuples dans le dérèglement des consommations improductives en leur faisant, par exemple, entreprendre des guerres que rien ne nécessitait, ou des constructions de luxe comme fut le versailles de louis xiv. pour satisfaire leur vanité ou leur sensualité , les individus ne sont guère moins sujets à s'y laisser aller. les dépenses improductives, qui par nature détruisent ou amoindrissent le capital des nations et des individus, doivent être comptées parmi les plus grands obstacles au progrès social et politique et les plus formidables ennemis des classes ouvrières. l'économie politique remplit un devoir lorsqu'elle les réprouve et les dénonce. l'heureuse influence du capital se depemt peutêtre mieux que je ne l'ai fait jusqu'ici au moyen d'une autre formule, celle qui consiste a due que le capital augmente dans une très forte proportion la puissance productive de l'homme. par ces mots : la puissance productive de vhomrne, il faut entendre une chose qui est visible, tangible et pondérable. c'est, dans chaque industrie en particulier, la quantité de produits qui répond au travail moyen d'un homme. en supposant une filature de coton qui produise une seule sorte de fils, ce'qu'on nomme le_ numéro 30 par exemple, la puissance productive de 1 homme dans cet établissement serait le nombre total de kilogrammes de fils produits dans lannee, di visé par le nombre des collaborateurs, en ramenant tous ceux-ci, par un calcul qui se conçoit aisément, au type d'un homme valide. ainsi la puissance productive de l'homme se représente, dans la filature, par un nombre de kilogrammes de fils de tel ou tel numéro; dans 1 industrie des forges, par un nombre de quintaux ou t de kilogrammes de fer en barres de tel ou tel échantil lon déterminé; dans la culture du coton, par un | nombre de kilogrammes de coton en lame ; dans la mouture, par un nombre de kilogrammes de farine la puissance productive de l'homme primitif, de l'homme dépourvu de capital, et, par suite, travaillant à peu près avec les seuls instrumens qui font partie de son organisme même, est tellement faible, que c'est une humiliation pour 1 orgueil naturel à notre espèce. la puissance productive de 1 homme ne devient considérable que lorsqu'il est armé d'un capital. plus le capital s'accroît, plus la science perfectionne les formes qu'il revêt, quand il est a 1 état d'outils ou de machines, et plus la puissance productive se développe. , , un des écrivains qui ont rendu compte de 1 exuosition universelle de 1867 faisait remarquer que, si l'on devait faire à la main les fils de coton que fabrique l'angleterre seule, au moyen des me tiers si narfaits dont sont pourvues les filatures de manchester, de glasgow et antres lieux, il n'y faudrait guère moins de 100 millions d'hommes. or, quelque exceptionnel que soit le développement de la filature de coton en angleterre, je ne crois pas qu'elle y occupe 1 million d'ouvriers. la conséquence de la grande puissance productive qui résulte de l'assistance fournie par le capital c'est tout naturellement l'abondance ala place, de 'la pénurie. pour dire la même chose autrement, c'est une grande masse des différentes choses répondant aux différens besoins de l'homme, qui est mise àla disposition de la société pour se répartir entre ses membres ; c'est le bon marche des produits, car abondance et bon marche sont synonymes ; l'un va parallèlement a 1 autre. ainsi, la présence du capital sur de grandes pronortions au sein de la société rend accessible a un nombre toujours croissant d individus et de familles les consommations qui, primitivement, étaient réservées à un petit nombre de privilégies, et aussi d'autres consommations qui, dans les temps anciens, étaient inconnues meme aux plu 3 favorisés parmi les hommes, , , dans les temps primitifs, ei meme a des époques peu éloignées de nous, la puissance productive de l'homme était tellement limitée que, meme en soumettant le grand nombre a un travail accablant , tout ce quhl était possible d obtenir pour l'immense majorité de la société, c était une ration insuffisante de denrées alimentaires grossières, et d'autres objets de première nécessite dans l'ordre actuel des choses, qui est caractérisé par la puissance du capital, la detresse de 1 immense majorité cède graduellement la place au bien-èlre, et une proportion toujours plus forte des membres de la société parvient a la richesse	sensualité	1	1
