work	date	issue	page	block	height	width	hpos	vpos	text	active_words	occurrences_words	unique_words
figaro	1900-03-16	1	4	Page1_Block21	6597	784	2531	321	se termine par un éclat de colère. elle est, j'y insiste, admirable. et ici, le ta bleau d'histoire est d'une absolue préci sion. cependant, après le départ de l'empe reur, et exaspéré qu'il ait repris sa pa role, le duc se décide. ii partira. et, pour donner le signal convenu à flambeau, il pose sur la table du cabinet — cabinet où napoléon a séjourné — le petit cha peau de bataille d'austcrlitz, que l'archi duchesse lui a fait avoir en secret et qu'il a caché à tous. or, metternich, inguiet de la scène qui a éclaté entre le duc et son grand-père, a voulu ve nir parler secrètement et sévèrement au jeune prince. il a la clef de son apparte ment. la nuit est venue. le cabinet n'est éclairé que par les rayons de la lune quand metternich y entre, et il y est seul; lé duc est rentré dans sa chambre. et voilà que le ministre aperçoit, sur le meuble, là où napoléon le plaçait d'ha bitude, ce chapeau de bataille, qui jeta plus d'éclairs qu'une couronne. il lui parle. il exhale sa haine contre le césar si longtemps vainqueur. et, tout de même, ce chapeau éveille des souvenirs qui le troublent... je le revois encore, dit-il, nôtre ennemi; il me semble que, comme autrefois, me retournant, je ver rais le grenadier de garde à sa porte. et, se retournant, metternich aperçoit en effèt un grenadier français de faction... c'est flambeau. en ce grognard,, qui est parisien,,un gavroche a survécu. et flambeau a eu cette gaminerie, péril leuse mais qui l'amuse, étant chargé du srevice du prince, de s'habiller en grena dier pour monter la garde à sa porte. halluciné, metterniclr appelle. le duc arrive, une bougie à la main. la vision disparaît, d'autant plus que. flambeau se sauve par la fenêtre, ravi du tour qu'il a joué à metternich. celui-ci veut frapper un grand coup. ce grand diplomate pense, comme le rodin d'eugène sue, qu'on agit mieux sur les hommes par des moyens moraux que par des moyens matériels. il ne pourra pas toujours empêcher un archi duc d'autriche de quitter vienne par surprise. il faut le dégoûter de son rêve impérial. et, dans une scène qui est en core parmi les plus belles du drame, met ternich dit au jeune homme que, s'il ne veut pas qu'il essaye de régner en france, c'est qu'il le sait incapable d'être le suc cesseur de napoléon. où sont ses traits énergiques, son masque de césar, sa lière-volonté?... vous n'êtes qu'unpauvre enfant, débile, que tout effort brisera, un enfant de race autrichienne, bien plus fils de l'aimable et frivole marie-louise que du grand soldat qu'elle n'aima pas ! metternich traîne le prince, pâle et se débattant, devant une psyché qui reflète sa pâleur, et le prince, épouvanté, brise la glace et tombe évanoui devant elle... a cet acte, d'une émotion intense, suc cède, comme un repos, le joli tableau d'un bal masqué, que metternich donne dans un pavillon en ruine du parc. la mise en scène en est charmante. chez metternich, comme chez nombre d'hom mes de son temps, l'austérité des princi pes conservateurs s'alliait avec le joli libertinage d'esprit du dix-huitième siè cle. ce n'était donc, dans ce bal et sous l'œil complaisant de l'hôte, que groupes de danseurs et d'amoureux. marie-louise est (venue elle-même là et laisse un galant lui parler de trop près. le duc, par un hasara aussitôt regretté, sur prend l'intrigue et, emporté d'un « coup de colère corse », rompt, en rompant avec sa mère, le dernier lien qui l'at tache à l'autriche. cependant lui-même est en veine de galanterie. il fait une déclaration à l'archidtichesse. de plus, nous avons vu, dans une scène ex quise, au second, acte, une jeune fille quiiest venue prendre congé du duc de reichstadt. c'est la lectrice de marie- louise, qui la renvoie à.parme. thérèse — c'est son nom, mais on l'appelle « la petite source » à cause du murmure de sa jolie voix —aime le ;duc, qui l'aimerait s'il ne se défendait contre tout amour sérieux'. quand elle entre, il. est en train de lire les lettres d'amour des belles da mes de vienne éprises de lui. « je dé chire », dit-il à chaque épître parcourue. et, quand il renvoie à parme — comme hamlet renvoie ophélie au couvent — la petite source qui venait prendre congé en demandant des yeux qu'on lui dit de rester, il murmure : « je déchire »... un cœur tendre, cette fois, et non un chiffon'de papier. or, petite source n'est pas partie, et le duc lui donne rendez- vous pour la nuit même. mais il n'ira pas au rendez-vous. heureux de se savoir aimé vraiment, il partira plus fort pour l'aventure. car il a rendez-vous avec les conspirateurs, et flambeau, qui dans ce bal s'amuse à se promener en uniforme et qu'on prend pour un plaisant, sans voir le mal qu'il a à contenir sa fureur quand de jeunes écervelés insultent l'em pereur, le conduira au lieu du rendez- vous, un coin du champ de bataille de wagram. c'est par jeu et par une ironie dernière que le duc a voulu qu'on crût qu'un empereur avorté pouvait se conso ler en devenant un don juan, et préférer la conquête des femmes à celle des royaumes. pour dépister les policiers qui suivent les pas du duc, l'audacieuse camerata a employé un truc de comédie. elle res semble à l'imberbe roi de rome. elle prend son costume et, sous le masque, tire à elle les espions. le due a pu quit ter le bal. et nous voici, au cinquième acte, dans un magnifique décor, sur un tertre d'où l'on découvre la vaste plaine de wagram. flambeau est là, rayonnant, avec quelques amis sûrs et le fils de son em pereur. on va partir, quand une mau vaise nouvelle arrive. c'est l'attaché français qui l'apporte. au bal, il a relevé l'injure adressée à napoléon. il ne trahit pas, certes, son gouvernement. mais il reste français et tient que napoléon et la gloire de son pays ne. font qu'un et qu'on ne touche pas à l'un sans toucher à l'autre. l'insulteur, c'est le frère de petite source, et ce frère — l'attaché le sait — a connu le rendez-vous donné par le duc. il ira et tuera l'amoureux surpris. le duc est en sûreté; mais la camerata qui joue son rôle? le duc veut retour ner sur ses pas et la défendre. on dis cute son désir. le temps se perd, et voici la camerata qui arrive à franc étrier. qu'on parte ! crie-t-elle. la police, pré venue, est sur mes pas. — et petite source ? — elle n'est pas venue. — et le frère ? — hé ! le frère, dit l'amazone, i) a tiré son sabre, j'avais le mien : je l'ai tué. ceci enchante flambeau, maître d'armes de l'héroïne. mais c'est sa der nière joie l	libertinage	1	1
petitparisien	1900-03-16	1	2	P2_TB00030	1753	788	4157	2383	théâtre sarah-b«rnhardt vaiglon, drame efl six acte* et en vers par m edmond hoeteao. u y <1 quelque* jours, mon collaborateur laan froito a rappelé, dans ut» article documenté, te événements essentiels de la courte distends du flls de napoléon 1 né au* tuileries en 1811, salué du titre de roi de roino, acclamé par tout nu peuple, il meurt & vingt et ua ans, avec le litre de due île reichsladt, colonel autrichien, au fond du palais de sehrrnbrbnn, à vienne, chez son grand père, l'empcieur d'autriche, dont il était, ao u unique sorte, le prisonnier. il ux-urtde la phtisie ou du nantir, (te deux maux peut-être à la fois, non pas usé par la débauche ou seulement victime d'une constitution faible et délioate. u meurt, surtout, las d'une lutte qu il était impuissant à soutenir contre la destinée, et parce qu'il se sentait incapable de jouer le rôle qu'il aœbuiouuait : il meurt de sou rêve. un écrivais contemporain, m. pouvillon, dans une pièce de théâtre qui n'est pas sans intérêt, «fie a été représentée, u y a un an. au nou-, veau-théâtre, a fort bien montré que ce n'était ni l'abandon de sa mère, ni ua libertinage prématuré, ni même la haine du prince de méritas nlel», t ennemi implacable des napoléon-, qui avaient tué te « fila de t homme ». » non, lit-ri» es n'est pas là qu'il faut chercher le vrai drame où se débattit le duc de reichsladt. le drame, il le portait en lui, dans ses hésitations, dans ses doutes, dans son imputeanoe à jouer le ràlo auquel le condamnait une hérédité écrasante. l'imitation de napoléon fui son rêve oi .son supplice. lé portrait du grand homme, fixé à son. chevet, faisait ses puits sans sommeil. l'épopée de la grande armée qu'on lui faisait apprendre et récite par cceur, sans doute d'aprè- une édition corrigée ad usurn archiaucis , brûlait son sang, le consumait en ardeurs stériles. et t! ne faut pas croire que les circonstances seules toi aient manqué pour réaliser son rêve ; si sites avaient été favorables, c'est lui qui aurait manqué aux circonstances. avec ses pauvres ailes atrophiées, sans plumes, l'aiglon n'aurait jamais pu prendre son vol. » et ce n eut, pas tout « le n'est pas seulement contre les fatal ibis extérieures, contre son milieu, contre son éducation que se débat 1 infortuné prince : if lutte contre son hérédité maternelle, contre ht moelle de ses os, contre le sang de ses vois as. u veut tuer en lui le habsbourg qui le gêne et, lentement, mûrement, c'est fe habsbourg qui le tne. » le duc se lève ton» te» matins dansfattitude d'un héros : c'est le al» de ! homme, de napoléon, li « couche tous les soir# dans la peau d'un bon jeune ho ni me : c'est le 1 flta de marie-louise d'autriche.	libertinage	1	1
justice	1900-03-17	1	1	PAG_00000001_TB000056	197	548	1226	992	les fidèles de l'eglise, les oé ruina ristes, les jésuites, les assomptionnistes, les lazaristes, les liquoristes, tous les propagateurs de l'abrutissement par l'al- cool, 1 onanisme et la lecture de» jour- naux nationalistes sont dans la conster- nation.	onanisme	1	1
justice	1900-03-17	1	1	PAG_00000001_TB000065	112	547	1229	2595	... mène à la folie furieuse, au crime, au suicide, excite au libertinage des mceùrs et, arec lui, engendre la para- lysie générale ou le ramollissement.	libertinage	1	1
lanterne	1900-03-17	1	1	PAG_00000001_TB000077	556	1030	2380	2792	mais, lors de l'aventure que je veux confesser, je débarquai en plein mois d'août. il me semble que la rue parisienne n'est jamais aussi voluptueuse qu'en été, surtout vers la fin du jour : les femmes portent des toilettes claires et fleuries; leur chair est moite, leur démarche alanguie, leur visage pâmé, dans la chaleur qui monte de l'asphalte; et puis, elles se sentent entourées, frôlées, convoitées, par des. milliers et des milliers d'étrangers qui ne viennent à paris que pour l'amour.	voluptueuse	1	1
lanterne	1900-03-17	1	1	PAG_00000001_TB000083	992	1023	2368	7855	après un dîner sommaire, je me dirigeai vers un music-hall. la nuit close renforçait mes pensées- mauvaises. les joues et les veux brûlants, je me trouvai dans le promenoir. et j'entrepris de fixer mon choix. par moment, je m'interrogeais : « est-ce toi? est-ce bien toi? tu n'es pas fou? » et j'avançais toujours dans le mal. j'écarlais de ma route les figures importunes qui se dressaient en obstacle : le visage rieur et confiant de ma compagne de vie, les faces candides des enfants, tout ce* qiy m'était apparu comme les raisons mêmes de l'existence. je résolus d'élire une belle et voluptueuse statue de chair, de viçage et d'allure aussi modestes que possible. le hasard facilita ma tâche. il fit passer devant moi une créature qui ressemblait à mon idéal de beauté plastique, comme une naïve copie rappelle l'œuvrc originale. après un court dénat., je l'emmenai.	voluptueuse	1	1
gil_blas	1900-03-18	1	1	PAG_00000001_TB000070	717	1029	2538	3080	des hâudriettes, l'infatigable « dénicheur de perles », a trouvé un nouveau joyau pour enrichir la couronne de france, j'entends cette délicieuse couronne de vénus, dont chaque fleuron est une jolie femme. camille de changis est une blonde aux yeux d'émeraude, avec une merveilleuse chevelure aux reflets sanglants d'aurore boréale, un sourire délicieux comme le sourire d'une rose, la plastique à la fois sévère et voluptueuse de diane chasseresse. camille de changis se destine au café-	voluptueuse	1	1
journal	1900-03-18	1	4	PAG_00000004_TB000238	775	1031	3535	8431	lise évoqua la sensualité qu'elle imaginait au temps des fiançailles. sa fierté n'avait jamais désiré l'amour, mais puisque l'amour s'offrait à elle, elle l'accueillait d'un émoi heureux. a trente ans, elle avait lu des romans et des faits-divers, entendu des histoires. elle ne donnait pas dans le sentimentalisme bleu et rose des adolescentes,mais il lui était advenu de rêver à des ibonheursprécis.andré, par exemple, l'avait toujours troublée, parce qu'elle le savait un homme adoré. des anecdotes ne lui avaient pas échappé sur margot walker, sur gabrielle hervard, sur d'autres, sans doute.	sensualité	1	1
gil_blas	1900-03-19	1	4	PAG_00000004_TB000003	443	1023	435	871	enfin, la flamenca, sœur de carmen, qui nous apparaît sur la scène en une pantomime tragique, égayée d'une musique voluptueuse qui nous lefait oublier ia de , bizet, agrémentée de danses espagnoles, exécutées par une troupe de gitanos et de gitanas, pittoresquement accoutrés, que le manager marchand recruta à séville parmi les premiers danseurs du pays.	voluptueuse	1	1
temps	1900-03-19	1	1	Page1_Block18	4086	934	224	1238	bulletin de l’étranoer l’obstruction au reichstag , l’obstruction au reichstag allemand ! qui eût imaginé cela il n’y a pas dix ans eût passé pour atteint d’aliénation mentale. l’obstructionnisme, à dire d’experts, ne sévissait, ne pouvait sévir que sous le régime parlementaire arrivé à son apogée. c’était la rançon des bienfaits de l’ordre constitutionnel tel que l’angleterre l'a pratiqué depuis des siècles. parnell et biggar en furent les inventeurs à westminster. au capitole de washington, depuis longtemps lès minorités obstinées mettaient en œuvre ce qui s’appelait la flibusterie iflibuslering). et c’était tout. ces naïves illusions se sont dissipées. en deux ou trois pas de géants, l’obstruction a parcouru la terre. devant elle toutes les portes des assemblées — parlements couverts de la glorieuse patine des siècles, congrès investis de la puissance d’une grande démocratie, chambres' plus modestes, purement représentatives ou simplement consultatives, — se sont ouvertes à deux battants. bruxelles a connu les grands jours du piétinement sur place. vienne a vu, voit encore, tantôt l’intarissable faconde d’un orateur dévorer douze grosses heures d’horloge de la séance, tantôt les délicieux acolytes panteutons de mm. wolf et de schœnerer ou la queue antisémite de m. lueger et du prince aloys liechtenstein transformer la paisible enceinte du parlement în une arène de pugilat et de lutte à main plate. a rome, on a commencé par mettre les urnes à mal afin d’empêcher que, de leurs flancs, comme la boîte à pandore, ne sortent trop de maux, imparfaitement corrigés par l'espérance de nouveaux scrutins, puis l’obstruction s’est systématisée et canalisée contrôle ministère pelloux. il était écrit que berlin n’échapperait pas à l’épidémie. c’est fort délibérément et en pleine connaissance de cause que les socialistes et les radicaux ont résolu de recourir à ce suprême moyen de défense. la loi ilçinze, destinée, d’après ses auteurs, à prévenir la licence des mes et les excès de la pornographie, mais qui; suivant l’opposition, porte sournoisement une atteinte irréparable à la liberté de l’esprit, de l’art, de la presse, a le don de provoquer d’in- apaisables colères. une vive agitation, à la tête de laquelle se sont mis d’illustres savants, d’éminents écrivains, de grands artistes, a remué l’allemagne. mommsen est allé protester avec virchow auprès du chancelier de hohenlohe. hauptmann â 2$?cé, comme sudermann, quelques imprécations contre la tyrannie du cléricalisme, catholique et protestant. au fond, cette lex ileinze , c’est, dans le domaine de l’esprit, exactement la même entreprise que les agrariens sont en train de mener à bien dans le domaine de la matière avec leurs amendements au projet sur l’inspection des viandes. d’une mesure d’hygiène qui visait à assurer la santé publique au moyen d’un contrôle sérieux, la ligue agraire a fait une mesure de prohibition qui privera la population ouvrière d’un aliment nécessaire en excluant des marchés allemands les viandes d’origine étrangère. d’une mesure de moralité publique qui était censée assurer la décence des rues et le respect de l’enfance en proscrivant certains grossiers ou subtils appels à la sensualité le centre et ses alliés vont faire une mesure de guerre contre la liberté de penser. on conçoit qu’un tel dessein, à soi seul, provoque les résistances passionnées des libéraux. on conçoit mieux encore que leurs alarmes grandissent et que leur irritation s’aigrisse en voyant se dérouler l’accomplissement graduel d’un plan de réaction dont bismarck, aux plus beaux jours de son ardeur contre-révolutionnaire, n’aurait pas voulu entendre parler. l’extrême droite dévoile trop sa pensée de derrière la tête. ses triomphes mêmes sont autant d’avertissements. elle a commencé au landtag de prusse par faire prévaloir contre l’intérêt général l’intérêt égoïste d’une classe en rejetant le projet de canal de l’elbe au rhin. elle a continué en inaugurant la prohibition de l’importation des viandes dont le menu peuple ne saurait se passer et que l’élevage national ne saurait fournir. elle poursuit en se ruant sur les libertés idéales, sur les droits do la pensée, de l’art, sur l’esprit lui-même qui ne souffre pas d’entraves çt qui se plaît à souffler où il veut. devant l'effrayante unité de ce plan de campagne, qu’exécutent non seulement les féodaux et les piétistes de l’èxtrême droite et les cléricaux catholiques du centre, mais aussi les dé-	sensualité	1	1
debats	1900-03-20	1	1	P1_TB00023	1041	895	5009	1427	qu'en apparence. mais notre musique ne lui plut point; il n'admira que les décors et la danse, et jugea avec goldoni que nos théâtres étaient « le paradis des yeux et l'enfer des oreilles ». l'albé cancellieri fréquentait l'lnstitut. c'est là qu'il fit la connaissance d'un académicien qui voulut à toute force lui montrer le palais-royal : « dans ce lieu, dit l'ecclésiastique, on voit, on apprend, on déguste tout ce que l'industrie, l'habileté, la sensualité humaine peuvent concevoir de plus parfait ou de plus étrange. le jour, on peut s'y promener sans danger; mais, le soir,il est envahi par plus de six mille femmes qui rivalisent d'élégance, car c'est là le rendez-vous de tous les débauchés. on y boit, on y chante, on y fait de la musique, on y joue très avant dans la nuit. ce désordre est toléré parce qu'il a été jugé nécessaire dans une cité pleine de militaires, d'étrangers et de libertins. partout ailleurs, -la décence est absolue. saint augustin, ajoute lé bon abbé, n'a-t-il point, au surplus, justifié cette tolérance dans sa cité de dieu , où il écrit : « facit meretrix » in mundo quoi sentina in navi et cloaca in pa» latio »?	sensualité	1	1
lanterne	1900-03-20	2	1	PAG_00000001_TB000089	700	1033	3520	1376	pitalité laponne, préférant peut-être à l'odeur du musc celle de l'huile de phoque, rahee à point ; j'ai partagé, au brésil, le hamlfc des créoles qui, paresseuses, ne tournent jamais la tête, même pour vous sourire, et attendent des hasards du bercement le baiser ; les écharpes des almées m'ont enveloppé de leurs brises; les négresses d'aden, que surveille un vieil homme enturbanné, ont dansé devant moi leurs voluptueuses pantomimes, puis, languissamment, se sont couchées, groupe nu et noir, tableau vivant d'ébène; et ce soir, si je n'étais venu souper avec vous, je serais parti pour le dahomey.	voluptueuses	1	1
lanterne	1900-03-20	2	3	PAG_00000003_TB000091	734	1030	3418	594	fenetre. pour réapparaître bientôt, vêtue d'un peignoir rose, sur le perron, et me souhaiter la bienvenue. elle était grande et mince, mais bien modelée, admirablement moulée d'ailleurs dans le peignoir dont elle se drapait en faisant plaquer avec une sorte de vanité lascive, l'étoffe lisse et soyeuse sur la rondeur voluptueuse de ses hanches. et, la voyant si belle, à côté d'un mari si laid, je compris pourquoi le docteur chabert avait fui la ville et ses attraits pour s'enfouir dans ce castel perdu au milieu des bois sinistres de la sologne. il craignait les amis complaisants. il voulait posséder sa femme en entier, à lui seule. c'était son droit.	voluptueuse	1	1
temps	1900-03-20	1	3	Page1_Block104	1672	940	3010	6241	partitions, c’est marie-madeleine que je veux dire. gette conversion rappelle la conversion de racine ; en. a-t-elle tout le sérieux et ? on est tenté de le croire à l’examen de la terre promise. car, autrefois, même lorsqu’il s’attachait à traduire en musique la bible ou l’evangile, m. massenet restait un musicien d’amour ; il ne pouvait concevoir d’œuvre sans qu’une femme en fût la figure principale; par la tendresse et la sensualité qu’il y insinuait, les sujets les plus sacrés devenaient des sujets très profanes, dette fois, rien de pareil. aucune femme en cette aventure, et pasunmotd’amour. dans la vulgate, il a choisi l’un des passages les plus austères-, et le. texte n’en a été orné grâce illicite : il s’est servi des paroles mêmes du livre saint. la terre promise con- tiènt trois parties. la première, intitulée moab, dit l’alliance que dieu lit avec moïse sur le mont horeb, et la promesse divine selon laquelle, au delà du jourdain, une contrée fertile sera aux enfants d’israël ; elle dit encore le d'obéir au seigneur, la malédiction à ceux qui n’observent pas ses et la prospérité réservééàceux qui sa loi. la seconde partie, jéricho, conte la prise de la ville infidèle par les israélites, l’écroulement de ses murailles au son des sept trompettes, et l’anathème lancé contre l’impie qui la voudrait relever de- ses- ruines. la chanaan, célèbre la joie dn peuple élu entrant dans la terre promise et. chantant llhymne de reconnaissance:àl'eternel... de ces trois parties, la première me semble de préférable aux deux autres. elle contient une phrase de moïse — phrase que m'» noté avec une rare ampleur. — expressive, et ; simple, enveloppée d’un accompagnement; ex- quis par là eauleur poétique et ta- sonorité ;c’est là. dii massenet d’autrefois»', et . du» meilleur massenet à mon gré; pour peu que l’on m’y pousse; je dirai crue ïe donnerais nonreetuni-	sensualité	1	1
xixe_siecle	1900-03-20	2	1	PAG_00000001_TB000017	3193	1029	287	5826	ce qui donne, avec cet accueil que lui font le public et la presse, une importance capitale à cette 'satire, c'est qu'elle est impartiale. m. brieux a dit ce que, souvent, j'ai dit ici même : que le pire de la situation, c'est que les hommes de loi sont, individuellement et hors de la profession, des gens le plus souvent honnêtes. ce qu'il dit des juges, je le dis aussi des avoués, il y en a, à paris, un bon quarteron. mais il y a des coquins dans tous les métiers. cette réserve faite, il est certain que je confierais mon portefeuille un jour où il est bien garni à la plupart des avoués, sans reçu, et certain qu'on mele rendrait intact quand je le demanderais. leur journal qui parle du projet de centenaire avec quelque complaisance, fait observer que les que les avoués d'aujourd'hui — qui gagnent, d'ailleurs, des millions — n'ont rien de la pédanterie et de la crasse des procureurs du répertoire classique. ils sont gens du monde, de façons courtoises hors de leur étude, parfois dans leur étude même. ils sont galants. on cite, dans le monde galant)- les exploits amoureux de quelques-uns et jusque dans les aristocratiques coulisses de l'opéra. ils y en a qui aiment les arts et s'y connaissent, même en leurs dernières curiosités. les collections erotiques de tel avoué sont renommées. il y en a de très lettrés. ils ont même eu des poètes dans leur corporation. il est vrai que l'un d'eux, protot, que cite le figaro, si les vers qu'on lui attribue sont de sa façon, ne lut, malgré un certain talent, qu'un grossier et immonde pornographe. mais il y en a qui ont taquiné la muse avec plus de décence. comment se fait-il donc que ces hommes qui, individuellement, ressemblent à la moyenne des bourgeois riches de paris, jouissent d'une impopularité effroyable, malgré, je le répète, ce qu'ils ont souvent de qualités privées et malgré ce fait que quelquesuns ont été des hommes vraiment admirables ? comment se fait-il que la célébration du centenaire de leur ordre a paru une sorte de défi et que presque tout le monde se soit dit : « le centenaire de son abolition sera bien plug oeau encore ! »	erotiques	1	1
gil_blas	1900-03-21	1	2	PAG_00000002_TB000214	411	1037	3664	7257	tant des marbres splendides. peut-êtrel'engourdissementde marthe lui laissait-il assez de pensées encore pour qu'elle pût se dire que nadège avait raison et que l'amour est une divine chose, tandis que pour la première fois, elle apprenait à connaître la ferveur voluptueuse d'une bouche éprise de sa chair frémissante.	voluptueuse	1	1
