work	date	issue	page	block	height	width	hpos	vpos	text	active_words	occurrences_words	unique_words
figaro	1902-10-09	1	4	Page1_Block52	1961	802	3340	5005	' m'attirait par ce qu'il laissait entrevoir d'élévation morale, de droiture et aussi de sentimentalité discrète. j'étais sensible à ses épigrammes les plus légères et flattée de ses lïommages délicats qui ne ressemblaient guère à ceux des jeunes seigneurs demonentou- rage. sa gravité paternelle m'inspirait le respect et la confiance. je bavardais intimement avec lui comme je ne l'eusse pas fait avec une femme. mais je le voyais si rarement ! * plus tard lorsqu'il eut renoncé à ses hau tes fonctions administratives et'se futeréé des distractions intelligentes — il pei gnait, il s'essayait à des critiques d'art—, je le rencontrai plus fréquemment au théâtre, aux expositions, dans les rares salons où l'on cause, et même chez moi où l'on papotait. il s'y ennuyait et ne me. le cachait point. je lui savais gré de con sentir à l'étourdissement de ces babilla ges pou'r l'échange, durant l'offre d'une tasse de thé, de quelques paroles aux-, quelles son esprit aimable et cultivé don nait tout de suite une élévation dépas sant la portée de mon ordinaire régal intellectuel. ce fut par lui et grâce à lui que se dé veloppa en moi un dégoût croissant pour mes relations de la première heure. mais au bout de combien d'années, pen dant lesquelles je menai cette existence agitée, vide et creuse, semée de périls, et dont parfois le souvenir m'est si pénible! ii il m'est parfaitement désagréable de me rappeler les menus incidents de ma vie mondaine. et je le dois cependant si je veux m'expliquer la transformation qui s'opérait en moi peu à peu, et l'âge aidant sans doute. ma frigidité commençait à fondre comme un glaçon aux feux de l'été'pro che. je me trouvais plus sensible aux assauts des flirts, et j'en eus de l'épou vante, car aucun des hommes auxquels	frigidité	1	1
figaro	1902-10-09	1	3	Page1_Block3	6459	823	114	491	dogville i %% c'est la ville du monde la plus peuplée : elle compte à peu près quatre : cents millions d'habitants !... sa supér- • ficie est dé quatré-vingt mille kilomètres , carrés. elle se trouve dans le texas. elle n'a pas d'histoire, étant dénuée d'anna listes, — car les habitants de dogville .sont illettrés absolument : des « cyno mys », vulgo « chiens de prairie ». fcette étonnante cité animais, que les débats nous décrivent de la façon la plus curieuse, est un immense territoire où des monticulès, des tertres, émergent de place en place sur la prairie. le terrier au cynomys se compose d'un long tun- < ïiel qui aboutit à de confortables cham- . bres. c'est là que ce rongeur passe des jours agréables. la principale préoccupation, une fois la dc- 'meure construite, c'est de manger. mais c'est aussi de ne point s'éloigùer trop du domicile : le chien de prairie n'a pas de moyen d'at taque, et, comme défense, il n'a d'autre res source que la fuite. il est donc prudent. il ne b'aventure au dehors que durant la journée ; c'est un animal diurne. au fort de l'été, il sort le matin et le soif; durant la grosse cha leur il reste chez lui, faisant la sieste. partant à la recherche de son repas, il com mence, dès qu'il émerge hors de son enton noir, par inspecter les alentours. pour mieux voir, de plus loin, îl se dresse sur son arrière-train, allonge le corps, et les bras au côté, ou bien croisés devant sa poi trine, il regarde, il écoute, il hume le vent. il regarde de tous côtés, s'orientant tour à tour dans des directions diverses, très attentif aux opérations des voisins, très attentif aux événements du quartier. quelque circons tance l'inquiète-t-elle ? d'un geste rapide et alerte, son corps souple s'enfonce dans le tunnel. mais l'animal ne disparaît pas totale ment. a demi abrité déjà, il se retourne pour voir si le danger est pressant, s'il lui faut gagner lé fond de sa demeure. et selon les circonstances, ( il reste en observation ou bien .il-plonge. il est plein de curiosité. et il dis cerne assez vite les événements dangereux de 'ceux qui font plus de bruit que de mal. le ,long des voies ferrées, il n'éprouve'aucune crainte à voir et à entendre passer les trains lies plus rapides. si donc tout est tranquille, le cynomys b'aventure et s'installe doucement à '.ronger des touffes d'herbe. et admirons .qu'il ait le sentiment de la solidarité. au moindre péril, le voici qui pousse un cri •d'alarme et tous ses camarades décam pent avec lui : à chaque entonnoir on •voit disparaître un petit corps qui se tor- iille nerveusement... mais, au texas, l'homme est irrité contre le cynomys, qui occupe trop de iplace et saccage par trop la contrée. ii ai'est question de rien moins que de dé truire dogville : une immense guerre se iprépare, qui'sera terrible... les buveurs d'eatr , '*** lés buvëùrs d'eau ne sont pas des rméchants, comme un fâcheux apoph- thegme le voudrait faire croire. us sont, le plus souvent, des gens soucieux de leur santé. la médication par l'eau a fait de grands progrès dans ces dernières .années' et ''' les médecins hydrologues nous font entrevoir un doux avenir où .l'on ne sera plus malade, en vérité, que quand on l'aura bien voulu. ■ la liberté signale l'importance consi dérable d'un congrès d'hydrologie qui s'est tenu récemment à grenoble. le docteur eobin y a prononcé unrnagis- tral discours d'où il appert que la pauvre humanité souffrante est en bonne voie de guérison : grâce aux procédés de la chimie biologique, on peut aujourd'hui lire dans les actes inti- jnes de la vie cellulaire, matérialiser cette force jusqu'ici insaisisable qu'on nomme l'ac tivité vitàle, mesurer les aptitudes fonctiop- ïielles des divers organes, enfin, fixer les pre miers, linéaments de l'acte morbide, de cet iacte antérieur à la lésion, qui la prépare ou la conditionne et qui, purement fonctionnel, est encore modifiable par la thérapeutique. d'un autre côté, la chimie biologique per met de reconnaître le mode d'action des eaux minérales et des climats. elles montre com ment se modifient la nutrition et les échanges intra-organiques qu'elle comporte, sous l'in fluence de ces agents. elle pénètre lemystère ■de leurs effets curateurs. * ii ne s'agit donc pas de boire de l'eau tort et à travers. mais on étudiera vos cellules organiques et tout de suite on vous dira ce qui leur manque, dans quelle mesure cela leur manque et où cela se trouve. alors, vous boirez de ,l'eau scientifiquement, telle eau spéciale, et vous serez guéri. le discours de m. robin — que j'au rais voulu savoir mieux résumer — a • obtenu le plus vif succès, et le savant professeur a été acclamé .« comme prési dent d'honneur à vie des congrès d'hy drologie », revendiquons la valse a, propos du concours de valse qu'a organisé, l'autre, jour, le dix-hui tième arrondissement, la journée pose cette petite question digne d'intérôt : « quelle est l'origine de cette jolie danse? où l'a-t-on dansée d'abord ? » musset la croyait allemande. ce pas sage de la confession d'un enfant du siè cle est célèbre : ... quelques valseuses se livrent avec une bî voluptueuse pudeur, avec un si doux et si pur abandon, qu'on ne sait si ce qu'on res sent près d'elles est du désir ou de la crainte et . sji, en les serrant sur son cœur, on se pâme rait ou on les briserait comme des roseaux. l'allemagne, où l'on a inventé cette danse, est à coup sûr un pays où l'on aime. or, la journée n'est point de cet avis. elle revendique la valse comme une in vention de nos aïeux. la journée s'auto rise, dit-elle, pour avancer ce fait, de « manuscrits du douzième siècle » qu'elle a étudiés. « manuscrits du douzième siè cle », c'est un peu vague : un peu de précision là-dessus aurait été, sans doute, amusant. toujours est-il que la valse fut dansée à paris pour la première fois le 9 novembre 1178 ; elle était déjà connue en provence, sous le nom de volta. venue de provence à paris, elle fit les délices de nos rois et de leurs cours. etc. donc la valse est française, — et la france est donc « un pays où l 'on aime », comme (lit musset... renan licencié isintermédiaire des chercheurs et' des^curieux a retrouvé, aux archives na tionales, dans le dossier de la faculté des lettres de paris, les notes relatives à	voluptueuse	1	1
journal	1902-10-09	1	4	PAG_00000004_TB000216	723	1027	4837	7008	il y a des surprises, en effet, dans le spectacle charmant de parisiana : les auteurs, deux parisiens véritables, ce qui est moins fréquent qu'on ne croit chez les auteurs de revues, nous ont fait d'abord la surprise la plus agréable du monde en nous donnant une pièce ultra-moderne, étourdissante de fantaisie et de verve, pailletée de mots imprévus, et ce qui vaut encore mieux, riche en trouvailles scéniques. merci, messieurs, cela nous change ! enfin, voilà donc une revue qui pétille, mousse, éclate et fuse comme du champagne, du champagne extra-dry, s'il vous plaît. car s'ils dédaignent — avec raison — la basse gaudriole, dont tant d'autres abusèrent, mm. lafai'gue et mougel savent donner à leur dialogue alerte et à leurs pimpants couplets un ragoût de libertinage tout à fait régence. c'est décolleté, déshabillé, parfois, mais cela demeure	libertinage	1	1
lanterne	1902-10-10	1	2	PAG_00000002_TB000059	467	1039	2466	2651	ces croyances et ces coutumes sont si fortement ancrées dans une certaine classe de la société que beaucoup de personnes croient que les « rapports sexuels sont inutiles, la conception étant un don de dieu et des esprits ». c'est pour cela que beaucoup de malgaches préfèrent d'abord avoir une fille, car si leur paternité s'arrête là, il leur sera encore possible d'avoir une descendance plus éloignée.	sexuels	1	1
presse	1902-10-10	1	4	Page1_Block55	1310	800	4210	5442	rivée vous -rôdez- autour de ce monastère, pourquoi enfin vous m'avez caché que françois était chartreux-..., car vous ift saviez... . — gela ne vous regarde pas... et puis, sans doute, oui, je le savais.-apres ! al lez-vous. me reprocher de n'avoir pas voulu vous troubler, bien inutilement, en vous-révélant la présence^ ici, de votre., ancien ami ?.. — il était plus-simple de n'y pas venir. vous mentez donc. pourquoi avez-voua presque exigé ce voyage ? allons, dites. elle le regarda, sans répondre, les yeux très grands de peur, le visage très calme pourtant. brusquement,'dans l'esprit de jean, qui,. lui, n'était pas enclin aux obstinés mira ges, la lumière se. fit, totale. la. vérité ■faillit nette, précise. quel autre motif qu 'une sensualité vicieuse, que le désir certain de revoir cet homme,qui lui était défendu, de relever par le 'sacrilège le goût de- ce caprice, diessa-yerde sa beauté sur es pfbw*'® ^ ca-moine.^ . ; ; ■. . •- : il ignorait iv, s voies qu'elle avait prises, il no doutait pas' du but--désiré. 11 le 1m dit, la voix rauque do colère contenir brièvement il conclut : — g'était -bien inutile'de tente nouvelle malpropreté. vous' dey'' naître françois...,	sensualité	1	1
echodeparis	1902-10-11	1	4	Page1_Block3	4354	808	90	414	— le manjuds et la mamuisô de castelbajac bot quitté récemment leur propriété de. la seùn&-inîérieure, pour retourner dans le gers au château de caumont, oùse trouve le fa meux haras, d'où sont sortis de si bons che vaux. — a territet, une des dernières manifesta' tians mondaines a été la soirée donnée par le colonel et mme corbin ; le maître de la mai son a lait représenter «ne très spirituelle va- vue : caux non ascendant dont il est- l'au teur.. la pièce était jouée par une troupe d'a- mateurs, mlles joannès, sgouta, dont nous avons annoncé le retour à paris » de chon ; mm. pierre de fouquiôres, faye .sage, au! y ont été excellents. ■ — au château d'aigubehe,' mme martineau de saint-philippe a fait représenter la char mante comédie de yerconsin : têlêrnaque. les protagonistes mondains : m&rqui&e. de sercey, .mme montrauxoy, mlles martineau; . mm. îe, marquis d<j la plagnolle, marquis de secoey. martineau, etc., ont été ta?ès applau-  dis.. • . . — les derniers jours de septembre et cette première quinzaine d'octobre ont été mar qués, «n lot-et-garonne, par une série de iêtes très réussies. m- et mme bracq de la- peyrièpe coït donné une soirée en leur châ teau du mirai! ; mme de la bruyère, un co tillon, en son château de peyreguilhat ; au commencement du mois, le marquis et la mar quise de poyen ont fait -jouer la comédie en leur hospitalière demeure de barry. remarqué dans ces. différantes réunions ; .m., mme et mlles cornélis de witt, le capi taine et mme de la bruyère, vicomte qt vi comtesse de luppé, baronne et mlles de a- leprade, comte et comtesse de ferrand, baron ne et allies roger drouilhet de' sigalas, m, et mme .chapelain de cambeyres, baron et ba ronne andré de brianson, m. et mme de véy- ran, mme et miles .de batz-txenquelien, m. et mme, d'aiigiars, mme et mlle nismes, vi comtesse de gissac, m. st mme bridiers ; mm., le vicomte' de périgny, de vitruves, etienne, jean et girard drouilhet de sigaias, d'adhémar, lieutenant de marmiès, du 9' chafc asurs de galard-terraube, nismes, de fayol- 3e, h. et l. de sèze, de montbà, de roquemaur rel, lieutenant de lapstyade, etc., eto. ' chasses. - — le imarquis' de l'aigle a commencé la e&rie de ses chasses- à courre en forêt de compiègne. le rendez-vous 'était fixé au puits d'orléans. un dix-cors à 'été servi par le comte de l'aigle, 'après deux heures de chasse. laisses-courre pat labrisée et vivet. les honneurs du pied à la reine isabelle ii. (présents : la reine isabelle ii, duchesse al modovar del valle, comte de parcent, m,.alt- manu, marquis et marquise de l'aigle, comte et comtesse de l'aigle, comte de colbert, comte et comtessa f. pillet-will. comte et mlle ' foy, comtesse de courcy, com tesse f. et mlle de montebell^ comte et com tesse a. de carné, comte et mlle d'evry, comte d'hautpoul, colonel de fontenilliat, m. e.. thurneyssen, m. c. de salverte, mme de fr-ézals, m11$ de breda, prince a. de broglie, ibairon h. de seroux,. commandant decazeg, commandant chavannés, baron merlin,comte du bouchage, capitaine leclerq, m. de royer, capitaine et mme marco, mme f, outrey, comte à. d'orsetiti, lieutenant mure, lieute nant de royer, lieutenant de séreux, m. et mme loonen, m. a. remy, m. et, mlle sallan- drouze de lamornaix, m. georges remy, m. j. thuroeyssen, mme léman, m, et mme de- bruxelles. ■ . '' ' ■ mariages. — on vient de célébrer, dans le finistère, le mariage de mlle marie de kerdrel, ' fille du' comte:dé kerdrel, conseiller, général du finistère, avec le baron albert de furgy,lieu tenant au 48° d'infanterie. témoins de la mariée : le vicomte de kerdrel, son frère, et le comte de .piuvié, son onclë; .d.u marié: le colonel de séné et m. de tinseau. — qri vient .de célébrer, dans, le pas-de- calais, le-mariage du baron de plouy avec mlle marie de florimond. — le 1b octobre; en l'église notre-dame- ïles-oiamps, ■ aura lieu le mariage de m. an dré jacquemont, avocat à la cour d'appel de paris, avec mlle marthe blazy, — a saint-louis-d'antin, m. félix bricteaux; a épousé mlle gabrielle weertsj fille du pein dre bien.ponnu.. — dans le- pas-de-calais, cm vient de célé brer i 'uj u qa du popite. raoul d'abzaç avec mlle mathildè de taffln. • ' — on annonce les fiançailles de m. paul mignot de jayetang, principal clerc de m. roger berlin, avoué & paris, avec mlle mar guerite .d'ausnourg. ; , necrologie. • les ob sèqu es dp mme sipière, née arch- fleacon, apf~gw célébrées -hier, à dix heures, en l'église de la maheleine. le deuil était conduit par mm. le coffite du bourg de bozas, chaix-d'est-ange et le ba ron joseph du .teil, ses petits-fils. au nombre des assistante, nous citerons : m1m. le marquis de choiseul-prasliq, le comité de puyséyur, le vicomte, de saini-géniès, le baron de ^lesnard, henry durangel, le mar quis d'auray de saint-pois,, le général de	coït	1	1
echodeparis	1902-10-12	1	1	Page1_Block19	5713	813	65	1395	— la gloire ! prononça avec un sou rire délicieux, où un charme de mélan colie corrigeait -l'amertume, la giocosa yérs qui foutes les adulations affluaient dans ce palais romain immense et déli cat où elle venait de chanter devant une foule voluptueuse et patricienne, — la gloire ? elle est si intense et si fragile pour nous autres l que reste-t-il de nous, une fois que les deux ou trois généra tions qui nous écoutèrent sont mortes ? un nom-sur une partition... et pour les éluçs, quelques stances éparses dans le livre d'un poète ». j'étudiais du regard -cette italienne blonde, à la. voix raffinée et violente, créature d'art et d'amour. et j'admirais cette bouche si menue, sachant exhaler les notes larges et profondes qui tradui sent, en la pureté du langage musical, ces sanglots, ces spasmes, ces caresses que bégaie notre maladroite et sincère humanité. — la gloire; même lorsqu'elle se don ne, a pour nous des, railleries impré vues... elle nous joue des comédies à son. tour... tenez, je me souviens d'une qui avait venise pour décor. j'en fus, à la fois, l'héroïne et la spectatrice. » vous connaissez l'adorable théâtre de la fenide ? j'y avais été appelée pour créer vofelia , de garuzzi. j'étais arrivée de londres, tout exprès, avec ma mère qui me gardait aussi jalousement que le dragon des hespérides, et ma femme.de chambre, une française, valérie, blon dinette et délurée, de taille exiguë, qui se coiffait comme moi, et dont le plaisir le plus vif était de pouvoir me dire : « mademoiselle, on m'a encore prise au jourd'hui pour vous ! » *** . « dès mon entrée dans les coulisses, j'entends un machiniste s'écrier : «que s ta e bupna per la portantina». sur prise, je me retourne vers notre directeur qui, après m'avoir regardée des pieds à la tête, me dit en souriant : « cet hom me a raison. vous ne dépassez pas le poids... quatre hommes vous enlèveront facilement dans la chaise à porteurs ». et il m'expliqua qu'il y a quelque vingt ans, la patti craignant d'aller au théâtre en gondole (l'humidité pouvait nuire à sa voix), il avait, fait descendre des combles ce meuble -exquis et délais sé, 1 qu'au xviii e siècle la saint-hubert! avait fait construire à son usage. depuis la-fantaisie de la patti, il servait de nou veau à la prima donna du moment, — quand elle était assez svelte pour s'y glisser. 7 ;» je ne me le fis pas dire deux fois et, dès le lendemain, je savourai le.joli ré gal de m'abandonner au rythme d'épau les nonchalantes à travers les « calles » mystérieuses qui rappellent les conspi rations et les carnavals. derrière et de vant. moi se renouvelait sans cesse un cortège d'enfants qui criaient avec leur accent mouillé du lido : « e viva la pri ma donnai... le giocosa!... la bella zogial... » » ah ! si vous aviez vu le regard que nie jetait valérie, au retour ! etre ainsi véhiculée lui paraissait, sans doute, à elle, parisienne, un agrément d'une sa- yeùr ignorée, — et m'imiter en tout était sa préoccupation constante... *** ' a ce fut vraiment un soir de gala que la première de cette ofelia, de garuzzi, ce jeune maestro.dont on goûtait la mu sique, surtout à cause des passions qu'il suscitait et de sa jeunesse insolente. nombreuses es pressées, les gondoles aboutissaient aux magnifiques escaliers de marbre baignés par les eaux lentes du canal grande. » dans les loges aussi coquettes que de pimpants éventails louis xv, les « brava » couraient toujours plus sono res. hélas ! noms éphémères, nous vi- . vons de ces rumeurs ; et notre bonheur, notre,santé même dépendent de ces fra giles. satisfactions, qu'une minute ap porte.et. qu'un caprice détruit. aussi, je n'oublierai jamais la délicieuse caresse de cette ovation... a la fin du dernier acte, je déchirais et décapitais les fleurs des plaines (je-les prenais dans ma folie pour les rivales qui m'avaient arraché le cœur du prince de danemark), puis, dans l'horreur de ma cruauté vaine, je décidai de me laisser aller au cours du fleuve, vêtue de ces cadavres ennemis et pardonnés... a ce moment, les gran des dames vénitiennes profitèrent de mon si/ence et de mon allongement près des joncs mortels, pour augmen te/ mon fardeau de corolles avec toutes les fleurs de leur corsage, qu'elles me jetait en trépignant d'enthousiasme. mais cela ne leur suffit pas encore. elles m'envoyèrent les bouquets de leurs loges et la giocosa dut faire un véritable effort pour se dégager du tom beau parfume où le délire d'un soir avait enseveli là légendaire ofelia. . ■ *** ■ » ma mère m'attendait dans mon « ca- merino », enthousiasmée, elle qui était souvent sévère pour moi : « la patti n'a jamais eu autant de succès que toi i tu' es en passe de devenir une grande actrice. » puis, se tournant vers valé rie, qui s'était faite plus pimpante que jamais : « allez chercher, ditrelle, la portantina. » » un quart d'heure s'écoula. jetais prête et impatiente. ma camériste ne rentrait toujours pas. enfin, elle réap parut, très essoufflée, avec une allure joyeuse, quoique un peu contrite, que rendait plus piquante son accent fau bourien : » — chère mademoiselle, je suis ab solument désolée... je vous assure que ee n'est vraiment pas de ma faute... dès flue je suis arrivée à la porte, j'ai trouvé	voluptueuse	1	1
debats	1902-10-13	1	2	P2_TB00010	1878	921	3987	5911	môme, s'il répondait à un changement de la pensée, produire un bon effet ; mais c'est au hasard que le versificateur jette un décasyllabe symétrique contre un décasyllabe asymétrique. le galimatias rythmique est absolu. j'aurais bien des critiques encore à faire mais j'aime mieux, pour prouver que m. de croisset peut devenir un bon versificateur, comme j'ai dit qu'il pouvait devenir un bon dramatiste, finir comme j'ai commencé, par une citation que j'estime à sa gloire. chérubin, celui du premier acte, fait la théorie du libertinage : on doit être galant, impertinent, cruel. héroïque, moqueur, enflammé, redoutable, muser avec le pied des daines sous la table; on doit toujours en poche avoir un billet doux, pour un oui, pour un non, se jeter à genoux; suivre celles qui vont en confesse à la brune, errer dans des iardins mouillés du clair de lune; etre sentimental à la fois et pervers, passer toutes les nuits à leur faire des vers; etre un jeune animal déplaisir et de proie; i surtout ne pas sortir sans échelle de soie; etre le séducteur que toutes voudraient voir, dont les vierges languissamment rêvent le soir; avoir toujours dans l'âme une neuve espérance,. faire tous les maris eo qu'ils sont tous en france ; avoir pour seule loi la loi de son désir; ne jamais perdre une minute de plaisir; avoir le rire aux dents et les yeux pleins de flammes; etre amoureux toujours et de toutes les femmes; trouver à tous les yeux des regards séduisants; etre un homme, être jeune; enfin, avoir quinze ans. et, cependant, ce n'est pas pour écraser m. de croisset; mais je ne puis m'empêcher, par amour de l'art, de relire le couplet du don juan de molière : «... pour moi, la beauté me ravit partout où je la trouve, et je cède facilement à cette douce violence dont elle nous entraîne. j'ai beau être engagé, l'amour que j'ai pour ma belle n'engage point mon âme à faire injustice aux autres; je conserve des yeux pour voir les mérites de toutes, et rends à chacune les hommages et les tributs où la nature nous oblige. je ne puis refuser mon cœur à tout ce que je vois d'aimable, et dès qu'un beau visage	libertinage	1	1
figaro	1902-10-13	1	4	Page1_Block24	1504	815	62	5388	deuxième partie iii •— suite — ■ . • sans doute ma mine dépitée, et dé- goiitée un peu, traduisait mes secrètes pensées, car elle me valut cette apostro phe : , '— vous êtes difficile, ma mie ! prenez garde qu'à poursuivre le «mieux» on passe à côté du « bien » sans s'en aperce voir. •— mais je ne recherche rien, je ne de mande rien, fis-je d'un ton bref. ' •— si, me fut-il : répondu nettement : votre être tout entier crie après le bon heur qu'il n'a jamais connu. mais tout vous trahit, ma chère ! la fébrilité de vos ■gestets, la langueur triste de vos regards, la tendre ingénuité de votre sourire, et vos dédains, et votre orgueil, et jusqu'à , vos colères lorsqu'on vous dit que vous êtes belle l — encore ! — oui, encore. et cela s'explique. vous n'avez pas vécu. votre corps n'a pas subi les fatigues de l'amour, ni les divines flétrissures de la maternité. la frigidité de vos sens a conservé à votre chair son grain velouté de marbre, votre frugalité a maintenu vos lignes dans un équilibré harmpnieux. a ce point que, pour beaucoup de personnes, vous parais sez, et vous êtes réellement, d'une dizaine d'années au moins, plus jeune que votre reproduction interdite.	frigidité	1	1
gil_blas	1902-10-13	1	1	PAG_00000001_TB000088	698	1019	2447	8161	eva moraines, notre belle et radieuse eva, étincellera sur la scène de la scala dans la revue de p. l. fiers, dont on dit déjà merveilles. elle personnifiera parysatis, l'héroïne voluptueuse du roman de mme dieulafoy, la reine persane souverainement belle, qu'une exquise légende orientale dcvne comme rivale à vénus elle-même ; elle sera également le « porte-bonheur » et nous apparaîtra en des costumes suggestivement décolletés. mais, c'est tout bonnement le paradis de mahomet qu'on s'apprête à nous montrer!	voluptueuse	1	1
