work	date	issue	page	block	height	width	hpos	vpos	text	active_words	occurrences_words	unique_words
presse	1891-04-24	1	3	Page1_Block14	2511	939	135	4183	presse étrangère nous rappelons que les eitations que nous ldisons ci-dessous sont extraites de journaux paraissant en même temps que nous, aujour- fhui jeudi. question ouvrière on mande de vienne au daily news : malgré que le gouvernement ait recommandé aux patrons autrichiens d'agir de concert et de refuser an congé à leurs ouvriers le 1 er mai, les manufac turiers ne paraissent pas disposés à s'entendre et se- •; ion les lieux on a recours à des moyens différents pour résoudre la difficulté. les manufacturiers de produits textiles de briinn, voyant qu'ils ne peuvent refuser le congé, ont consenti à accorder la journée du 1 mai à leurs ouvriers, mais comme ce jour tombe le vendredi, ils ont résolu aussitôt ne pas les laisser travailler le samedi, attendu que celàne vaut pas la peine de remettre les machines en mouve ment pour une seule journée; ce qui signifie priva tion de salaire, pendant trois jours, vendredi, samedi et dimanche. gette proposition ne sera pas très fa vorablement accuedlie par les ouvriers de briinn. la charité et les banquets le daily telegraph rapporte que sir julian eoldsmid, membre de la chambre des com munes, a fait remarquer hier à un banquet que la coutume de se réunir dans des ban quets pour participer à des œuvres de bien faisance était assez bizarre et qu'on trouve rait certes un emploi plus judicieux des som mes que coûtent ces dîners d'apparat. un des sonvives, m. cyril flower, également mem bre de la chambre des communes, à répondu que ces réunions procuraient l'occasion d'en tendre développer des vues originales sur les questions d'intérêt public par des orateurs de îalent, comme sir julian goldsmid. les sous criptions recueillies à la suite de ce banquet se sont élevées à la somme de liv. st. 2,465. les dépenses pour l'afrique on lit dans l'italie : ■ le rapport de la commission générale du budgèt, sur la demande d'une allocation supplémentaire de 3 millions pour l'afrique, porte que la nécessité de ce crédit est prouvée spécialement par le renché rissement des vivres. la commission générale est d'avis que l'on peut, dans nos possessions, produire le fourrage néces saire pour les chevaux de l'administration [militaire et que l'élevage du bétail prospérera de nouveau dans la colonie de la mer rouge. les étrangers en alsace-lorraine on lit dans la correspondance de strasbourg, organe officiel : l'arrêté du 5 février de cette année concernant ^introduction de cartes de déclaration ou de séjour étant entré en vigueur le 1 avril courant, presque tous les étrangers établis dans le pays ont fait leur déclaration aux directions d'arrondissement ou aux érections de police. _ l'autorité avait fait établir des formulaires spé ciaux qui ont beaucoup facilité les demandes en ob tention des cartes de séjour.	érections	1	1
temps	1891-04-25	1	1	Page1_Block29	1631	943	190	6562	in ‘ paul reçut la première de ces deux lettres à paris. il avait quitté les vannes le lendemain du jour où il avait brusquement dit à mlle de. si- mont qu’il l'aimait. il ne l’avait revue qu’à l’heure du lunch. elle était descendue de sa chambre un peu tard, alors que tout le monde était à table; elle avait embrassé son père et fait à paul un petit salut de la tête accompagné d’un: «bonjour, monsieur.» elle n’avait point l’air d’avoir mal dormi : son teint avait un pur éclat, ses yeux riaient, et paul, qui l’observait avec un f >eu trop d’insistance, réfléchissait gravement à 'empire que les femmes, voire les plus ont sur elles-mêmes. lui, qui n’était qu’un homme, se sentait inquiet, nerveux et avait fort à faire pour ne pas le laisser voir. heureusement, m. de simont, selon son parlait abondamment ; paul put,.flonc se renfermer dans un silence consolateur,'* et, tout çn adorant du regard les joues roses et les yeux charmeurs de renée, caresser son cher espoir, èé de la veille. le jeune homme partit à trois heures; on le conduire en voiture à la petite gare de s***, et, comme, avec une dernière et instante pression de main, il disait adieu à la jeune fille, elle lui répondit, en le regardant en face, très sérieusement : — nous vous donnerons bientôt de nos — parbleu ! s’écria m. de simont, qui n’avait rien compris, nous sommes gens de revue. paul prit le train, et, seul, dans un coin du wagon, tandis qu’il tordait sa moustache, il avec une voluptueuse , surprise que sa main.droite, au contact de la main de renée, avait conservé un peu de ce subtil parfum reproduction et traduction interdites.	voluptueuse	1	1
gaulois	1891-04-26	1	2	P2_TB00040	1420	780	4256	5503	la cheminée, amusez-vous bien... atout à l'heure. elles_ sortirent toutes deux. resté seul, andré se sentit une gêne subite. il s'avisaqu'unparfun singulière! délicieux flottait dans l'air,et se mit àle respireravecune sensualité avide. qu'était-ce que ce parfum ou ces parlums, car il y en. avait plusieurs, et, comme il cherchait ic les analyser, il lui parut que c'était le souffle d'huguette qui pénétrait en lui, effleurait ses lèvres... il ferma les yeux, une griserie prenait son esprit. ah ! combien il l'aimait !... la gène que lui donnait sa solitude augmentait, il se leva, marcha dans la pièce, examinant les choses avec une émotion très douce, posant avec précaution ses pieds sur le tapis, comme si faire du bruit dans cette chambre eût été un sacrilège. il s'arrêta devant la cheminée, une manière de vaste meuble lait en angleterre, avec de mignons casiers, contenant tout un monde d'objets d'art exotiques ou français.de petits socles portaientdes statuettes exquises au-dessus de volumes aux' reliures singulières, en étoffes anciennes, en peaux de serpents. au centre des ca- ; siers qui, de chaque côté, montaient très! haut et se terminaient en deux arcs re-j naissance, une tête de femme, vieux' marbre adorablement ranci parles siècles, souriait d'un suggestif sourire pensif. (a suivre ) j. ricard	sensualité	1	1
lanterne	1891-04-26	2	1	PAG_00000001_TB000152	261	1022	5726	7142	oh ! ces étreintes de l'âme, plus ardentes et plus voluptueuses que celles du corps ! cette 01hon toute idéale de leurs cœurs dont il l'avait bercée en la consolant ! quelle dérision !	voluptueuses	1	1
petitjournal	1891-04-26	1	1	Page1_Block15	1542	812	981	4143	propriétaire riche et ne devant rien à per sonne. levé avec le soleil,'il ne restait jamais oisif et dépensait de longues heures à sur veiller sesgrangers, à soigner ses vignes, à visiter les chalets qu'il possédait en monta gne, il avait une voix de fausset aiguë et ra geuse, dont les grêles intonations contras taient avec sa robuste corpulence; ses gestes étaient brusques, son humeur irritable; il affichait de grandes prétentions autoritaires, qui en imposaient aux étrangers, mais dont sa femme ne s'effrayait aucunement. elle sa vait à quoi s'en tenir sur son caractère plus entêté que ferme et se jouait de ses colères, comme une mouette se rit de l'orage. mme mauricette roche était tout l'opposé de son mari. elégante, enjouée et coquette, elle avait une nature affinée et un esprit assez cultivé. de taillé moyenne, svelte et souple avec des épaules tombantes, des bras potelés et une poitrine agréablement étoffée, elle ne manquait pas de séduction. on ne pouvait pas dire qu elle fût régulièrement jolie, mais elle possédait de la grâce et du charme. sa peau très blanche faisait ressortir à souhait la rougeur de ses lèvres, la caresse humide de ses yeux couleur noisette, l'arc mince de ses sour cils bruns. ses cheveux châtains ondés en ca draient délicatement l'ovale de son visage et quand elle riait, ce qui arrivait souvent, son rire creusait dans l'une de ses joues une fossette où. disparaissait à demi un petit signe noir. sa mère était vénitienne et la jeune femme devait à cette origine la vivacité étourdie, le goût du plaisir, le mélange de dévotion et de sensualité qui distinguent les filles de ve nise. fille, d'un notaire des environs, elle était orpheline lorsque simon roche l'avait ren contrée dans une partie de campagne. elle lui avait plu et il s'était décidé presque aussitôt	sensualité	1	1
lanterne	1891-04-27	1	2	PAG_00000002_TB000267	526	1035	3563	6979	— c'est vous qui le feriez ce déshonneur pour recouvrer votre liberté, pour vivre à votre guise, comme vous le dites. pour aller vous jeter dans les bras d'un amant, pour courir les intrigues, pour vous vautrer dans le libertinage ! ah ! c'en est trop. vous vous tairez et vous m'obêirez. demain, nous irons au parc-saint-maur, à la villa du grand-chêne. -- vous êtes prévenue.	libertinage	1	1
rappel	1891-04-27	1	1	PAG_00000001_TB000205	171	1000	5573	8390	il sortit et revint presque aussitôt, tet nant par le licou le baron marchant pénis forment avec ses pieds entravés.	pénis	1	1
temps	1891-04-27	1	2	Page1_Block27	2491	941	2111	5680	homme. il passait en son temps pour un don juan, il possède encore de beaux restes, etm. de porto-riche, pour nous le nous fait assister à deux scènes épisodiques bien singulières. c’est le jour de mme fériaud ; elle reçoit dans son salon, mais elle n’aime pas que le8 visiteuses voient son mari, car elle est persuadée que ses bonnes amies veulent le lui prendre. elle n’a pas si tort : voici deux femmes du monde, mme de chazâl et mme henriet, qui ont insisté pour serrer, avant de partir, la main au maître de la maison ; on cause, et l’une d’elles, mme de chazal, le tirant à part, lui dit à brûle-pourpoint : . — vous savez, le petit entresol où nous avons passé de si charmantes heures, il y a deux ans, est libre. — je ne le suis plus, répondit-il. c’est ensuite le tour de mme henriet qui lui dit ou à peu près : — vous savez ; quand vous voudrez... — justement, répond-il, je pensais à vous ; il faut <jue je vous fasse un cadeau. il tire un objet de sa poche et le met dans la main de la dame. elle regarde : c’est un numéro d’omnibus, le 59. — il faut prendre ses numéros, dit-il avec une impertinence plus que cavalière ; vous avez le 59. il n’est pas qu’à moitié fat, le monsieur. s’il se dérobe ainsi, c’est d'abord qu’il a quarante- cinq ans ; c’est aussi, c’est surtout que sa femme y a mis bon ordre. il est médecin et de plus physiologiste ; il sent bien que l’heure est venue de dételer. mais germaine est si câline, si séduisante ; elle est aussi, nous le savons par de discrètes mais transparentes allusions, si en ses façons de caresser, qu’il s’oublie à tout bout de champ, et sans la contenter. il lui en veut, il la gronde ; elle boude, et puis elle met une certaine robe qui l’habille si bien que le pauvre homme n’y résiste pas, et c’est à et baisers de pleuvoir, et plaintes de recommencer, et voilà huit ans que tout cela dure ! germaine a pour le moment bien du chagrin, car c’est depuis huit ans la première fois que son mari va la quitter pour quinze jours. ah 1 ce voyage à florence ! s’il y renonçait!... mais non, son honneur de savant y est intéressé ; elle le sait, elle se résigne. c’est à huit heures l’heure du train... et à six, elle met sà robe, la robe que vous savez... elle est si insinuante, elle se coule avec des chatteries si voluptueuses autour de son mari, que le pauvre homme écrit au pour envoyer sa démission. — non, il ne faut pas, lui dit-elle ; demain, je te connais, tu m’en voudras. — eh! non. et il l’embrasse, la rembrasse, et elle bat des mains, triomphante, heureuse.,.	voluptueuses	1	1
constitutionnel	1891-04-28	1	3	Page1_Block10	3478	808	926	1942	théâtre (subventionné) de l'odéon. — amoureuse, comédie eu trois actes, en prose d'e m. g- orges de porto-biche. voici une œuvre audacieuse et d'une curieuse sonorité littéraire. on so re gardait un peu étonnés, hier à l'odéon entre critiques habitués â la ii«olditê ries dramaturges, en écoutant ce di logu6 neuf et violent, cette psychologie écorcheuse, si différente des etudes â fleur de peau des bourgétisants mo dernes. lë cocteur fémud, uri ex-donjua niste, î près avoir croqué des paniers pommes de tout âges, s'est relire dans le uiatrimoriium pour y goûter les joies placides du loyer;, malheureusement, il a épousé une demoiselle gfrmaine qui apporte une belle ardeur d'amoii-- reuse et n'entend point souper du pot au-feu ordinaire. après huit ans de mar âge; la fringale de ceile petite folle n'est point assouvie, et elle se plaint de ne plus avoir sous la dent que les miet tes d'un gâteau entièrement quenotté. le médecin assagi répond à ses appels de chatte malade que s'il iui faut abso lument un ma (ou, elle peut en élire un autre que lui, qui a maintenant renoncé aux gouttières. justement vit dans le ménage un artiste un peu épris deger- maine; il arrive a temps, quelques se condes après une scène rageuse entre les deux époux, et il finit, — entière ment, — le souper de fériaud. mais « l'animal est mélancolique après l'amour », dit un poète latin; et ladémenteérotique s'aperçoit, après la consommation de son. crime, qu'elle n'aime que son mari. elle lui a voue l'ir réparable malheur qu'elle vient d'inter poser entre eux, mais, par un phéno mène physiologique souvent remarqué chez des individus inférieurs à 1 hom me, le mari trouve à sa femme un .goût d'adultère si émoustillant qu'il lui par donne. laissez-moi vous chicaner,mon cher porto-riche. croyez-vous que la mis sion de l'épouse au foyer conjugal soit d'exacerber la sensualité du mari, et d'être pour lui la plus corrompue des maîtresses? il mespmhleque la com munauté des aspirations, la cré iion de la famille par la maternité, l'asso ciation des cœurs èt des esprits pour la vie régulière du foyer sont le seul but, le seul pur et noble but dés mariages bénis par l'eg ide je rois.sansdevoir être a censé de pu ritanisme (mes lecteurs-correspondants me reprochent trop souvent le défaut contraire), que les petites fères du dodo ne constituent pas la seule raison d'être des ménages respectables. ceci dit, j'ajouterai sans tnauvaisa grâce, que « amoureuse » est une des trois ou quatre pièces les plus littérai rement intéressantes qu'on nous ait of fertes au théâire depuis dix ans. , par mme réiane <;ui est vraiment la première comédienne de ce temps et par m. dumény qui n'a poirt son égal au théâtre français, l'interprétation e«t vraiment supérieure. quant à m. calmette. on peut êt e aussi mauvais qu« lui à limoges, mais c'est bien difficile. *	sensualité	1	1
xixe_siecle	1891-04-28	1	1	PAG_00000001_TB000082	405	1031	2683	8109	attendu d'autre part que l'outrage public à la pudeur ne peut se concevoir qu'à l'égard des personnes qui n'ont pas voulu concourir aux actes immoraux dans lesquels on le place, et que pour l'admettre à rencontre des auteurs d'un libertinage réciproque, il faudrait imaginer une offense envers des individus qui ne l'ont pas ressentie et leur accorder une protection qu'ils ne réclament pas et dont ils sont indignes.	libertinage	1	1
debats	1891-04-30	1	3	P3_TB00001	3084	824	65	296	et qui, lorsqu'ils mettent au net leurs pages d'écriture, sont obsédés, comme les moines longtemps tourmentés par le diable, de rêves apocalyptiques et de visions cornues. il y a beaucoup de savoir-faire dans leur rhétorique. les frères cadets de vast-ricouard sont presque tous, comme ils disent, trô3 « talentueux ». m. paul alexis a pas mal de bons élèves, et je ne sais trop lequel mériterait d'être le premier de la classe. les cahiers d'expressions sont très bien tenus. les mots abstraits sont toujours, assez régulièrement, mis au pluriel ; l'emploi judicieux de la préposition en a été sagement médité par ces doux disciples. seulement la décrépitude est venue prématurément, avec les rides, les infirmités, 1 inévitable bégayement. le naturalisme est devenu quelque peu apoplectique et poussif. il parle en bredouillant, avec des gestes désordonnés. le vieux levain de romantisme dont il n'a jamais pu se débarrasser, lui remonte au cerveau, donne à ses gestes une ampleur comique, gonfle et boursoufle ses métaphores. je n'en veux pour preuve que les accès de cauchemar et l'étonnante précocité verbale de m. albert aurier, l'auteur de vieux. sen récit, bien que l'action se passe platement à châteauroux, est une fantasmagorie de maillots couleur de chair et un arc-en-ciel de chairs couleur de maillot. on dirait que l'intérieur de son crâne est tapissé avec des affichesréclames des folies-bergère. ce ne sont partout que « gorges poudrederizées, mollets maillottés de nuances tendres, roses épiderines, flamboyantes fournaises de tignasses rousses qui flamment et pétillent, formes menues de bottines, flottaillements bienheureux en des vapeurs d'alcool, senteurs de chair suante mêlée à des parfums de corylopsis, images viandues », que l'auteur déshabille avec une friandise d'anthropophage. c'est un vertige oh les moindres objets tourbillonnent en sarabandes éperdues et grossissent démesurément. une rose rouge est piquée au corsage d'une chanteuse de caféeoncert. il s'agit de rendre intéressante cette fleur sans malice. il y a des procédés pour cela, des thésaurus qui regorgent d'épithètes, de synonymes et de périphrases. voyez le changement à vue et admirez l'habileté de l'opérateur, j'allais dire du fort en thème : la petite rose devient une tâche écarlate; elle s'enfle, grandit, s'allume de rutile- j ments, de « coruscations de rubis », se fait j attirante, obsédante ; les consommateurs, pris, devant leurs bocks, d'une « voluptueuse hypnoblepsie », ne peuvent, en « dévisser leurs regards ». ils hurlent, beuglent, gesticulent et disent de colossales sottises qui les font ressembler à des bêtes de l'apocalypse. m. aurier a dû faire de bonnes études, à l'ancienne mode. n'en doutez pas : cet ait de mettre les mots, à côté des autres, pour l'euphonie, de multiplier les épithètes sensationnelles qui ne correspondent pas à des sensations, de confondre la lettre écrite avec les choses vues, de jeter sur n'importe quoi, pour le plaisir, de 3 vocables embrasés et des phosphorescences d'adjectifs, cela doit tenir à une habitude invétérée du vers latin. m. zola qui est un brave homme au fond, doit se frapper la poitrine, lorsqu'il voit tomber dans cette verbocination forcenée des esprits d'ailleurs rassis, et qui, s'ils suivaient leur pente, seraient pleins de sagesse et de raison. gaston deschamps.	voluptueuse	1	1
lanterne	1891-04-30	1	1	PAG_00000001_TB000136	201	1022	3610	6199	en cette courte folie de luxure il essayait de noyer ses remords, tandis que la voluptueuse lucienne donnait libre cours à toute l'ardeur maladive	voluptueuse	1	1
gil_blas	1891-05-01	1	1	PAG_00000001_TB000153	359	1020	5753	5144	qu'ai-je fait, grand dieu, sans m'en douter ! je pousse au libertinage les jeunes personnes qui tiennent en main des carrés de papier ! je fais frémir et je scandalise les pères impersonnels et indirects. mais-sont-ce bien tous mes crimes ? on m'écrit encore :	libertinage	1	1
gil_blas	1891-05-02	1	3	PAG_00000003_TB000269	878	1063	5707	8116	elle s'était levée en parlant ainsi, et son peignoir entr'ouvert laissait voir sa gorge ronde et nacrée. ses bras, fermes et brillants comme le marbre poli, sortaient des larges manches et montraient le ton ambré et chaud de sa peau, vers l'épaule. ses cheveux erespelés coavraient son dos d'un flot noir. dans ses yeux étincelait un regard victorieux et sa bouche aux lèvres roses souriait d'un air de défi. elle rayonnait ainsi d'une beauté si voluptueuse et si puissante que la mulâtresse, comme devant une idole, se mit à genoux, et courbant sa tête bronzée, avec une dévote adoration, lui baisa longuement son pied nu.	voluptueuse	1	1
siecle	1891-05-02	1	2	Page1_Block25	1830	851	4254	5611	comme une délicate révélation d'incon nus sentiments, comme une voluptueuse griserie de l'âme, égarant jusqu'aux sensations de son esprit embrumé. «... il vous aime !... » et maugiron se dévoilait, non point encore pareil au chevalier des rêves dorés, mais plus jeune, et surtout moins chargé de l'écrasante indifférence dont il la meurtrissait. « il vous aime ! » il lui semblait, dans la résonnance éteinte de ces trois paroles, entendre comme l'écho lointain de trois autres plus douces, et, encore, plus, tendres, murmure si faible que la forme n'en parvenait point nette â l'oreille atten tive de sa tendresse inéveillée. cepen dant, déjà, elle en écoutait, palpitante, le délicieux balbutiement : — je t'aime!... et raoul disparaissait abandonnant, toute entière, la place au chevalier nais sant du songe d'amour. le soir, après le dtner familial, mme chautrain se fit solennelle pour dire : — ecoute, ma fille, il te faut prendre une décision définitive à propos de ce mariage, n'est ce pas m. chautrain ? celui-ci opina. — parfaitement, dit-il. sa femme continua : — c'est demain, l'abbé broussel me l'a dit tout à l'heure, que m. le comte raoul de maugiron doit venir deman der ta main officiellement... que de vons-nous lui répondre? mme chautrain s'était tue : il y eut une pause. simonne leva ses grands yeux pensifs et, à mi-voix : — que j'accepte, dit-elle. d. righe-h. de weindel, [a suffît	voluptueuse	1	1
xixe_siecle	1891-05-03	1	1	PAG_00000001_TB000161	408	1027	4809	6914	le mage nous rapporte quelques-unes des conversations qui se tiennent entre jeunes garçons dans ces asiles de pureté et d'innocence. je ne dirai pas, comme octave feuillet, qu'elles feraient rougir des singes. elles sont d'un érotisme mystique qui me parait bien plus inquiétant.	érotisme	1	1
gil_blas	1891-05-05	1	2	PAG_00000002_TB000226	1144	1046	3684	6885	panouissement splendide de sa beauté, elle le regardait en souriant. elle avait habilement choisi, pour leur première entrevue, une robe très simple. et, ce que ses épaules avaient de voluptueuse rondeur, ce que sa taille montrait de souplesse hardie, la modestie de sa mise le, rachetait. elle lui tendit les mains, il tomba presque à ses pieds, appuyant son front à ses doigts fins et blancs. dans le trouble de cette apparition, il n'avait pas remarqué la pâleur ambrée du visage, encore accentuée par la noirceur des yeux humides, ni le pli passionné de la lèvre duvetée; il n'avait pas été frappé par la violente odeur d'héliotrope qui s'exhalait du corps de lydie. le timbre grave, un peu rauque, de sa voix ne l'effraya pas. il était affolé, ébloui, ensorcelé. il la contemplait, l'admirait, la désirait de toutes les puissances de son être.	voluptueuse	1	1
xixe_siecle	1891-05-06	1	2	PAG_00000002_TB000220	672	1044	3664	8431	georges durois sentit son cœur se serrer violemment. ce luxe, cette ostentation d'une voluptueuse existence, lui firent l'effet d'une profanation. il se mit à songer à cette femme délaissée, à cette créature éclatante de jeunesse, de beauté et de grâce, et il se dit que si emilien eût ■ consacré tout ce luxe, toute cette prodigalité à madeleine, il n'aurait pas le courage de l'en blâmer, car lui, georges, à la tête d'une pareille fortune, aurait mis son bonheur à construire ainsi le sanc tuaire de son amour.	voluptueuse	1	1
gaulois	1891-05-08	1	3	P3_TB00063	1198	782	128	5981	xi (suite) non... pas suttanges. il aurait bien voulu, mais... non... et, si vous voulez toute ma pensée, je la crois honnête, tout à fait... par tempérament. c'est une femme froide et pas nerveuse. elle est coquette un peu... elles le sont toutes; qu'est-ce qu'elles feraient sans cela?... allez, quoi qu'on en dise, elles ont toutes !a même devise : « beaucoup d'appelés, peu d'élus »... pour madame vincelles c'est : pas d'élus du tout, je crois... a sçnôn avis, c'est une vocation manquée de jkëre de famille. oui, je sais vos théories sur la frigidité dés femmes; cependant... mon cher, à mon âge vous aurez mes théories... pauvres créatures ! oh ! oui,elles sont froides... elles sont bien polies aussi de nous laisser croire le contraire... c'est très heureux, parce que, sahs cela, l'amour serait un solo bien lugubre. mais comment dire d'une femme qui n'a pas encore aimé si elle est ou non susceptible de passion ?... dans bien des cas, je vous donne entièrement raison... mais vous expliquez-vous pourquoi, après	frigidité	1	1
justice	1891-05-09	1	2	PAG_00000002_TB000131	698	548	1275	4244	et ils riaient, en véritables enfants qu'ils étaient ; de l'ex-restauratesir ridi- culisé, contrefait par eux à qui mieux mieux. elle imitait son allure à la fois gourmée et doucereuse, ses allongements de bras carressants, d'une sensualité hy- pocrite. elle te montrait's'avançant vers elle, tournant autour de sa chaise en se rapprochant sans avoir l'air d'y toucher, essayant de l'apprivoiser... lit il fallait voir de quelle manière elle le recevait, avec quelle hauteur méprisante elle montrait la répulsion que lui faisaient éprouver ses avances, sa galanterie sé- in le ! comme elle n'avait rien à craindre ici, n'étant plus obligée de se gêner, elle s'en donnait à coeur joie. tout ce qu'elle n'avait pu tui jeter à ia face, tout co qu'elle avait tant de fois ruminé, les injures redites et redites mille fois mentalement pour se soulager; tout cela s'échappait de ses lèvres en flots pressés et sans lin. elle mimait la scène avec uns passion, qui eu arrivait à lui procurer l'illusion et la satisfaction de la réalité.	sensualité	1	1
