work	date	issue	page	block	height	width	hpos	vpos	text	active_words	occurrences_words	unique_words
presse	1845-05-27	1	1	Page1_Block28	1454	1025	65	4454	lady flavy gïenmour était une des plus belles et des plus jolies femmes de l'angleterre, et on le croira sans peiné si l'on veut se souvenir que les reines d'angleterre ont pour habitude de s'entourer (surtout quand elles ne sont pas encore mariées) des demoiselles les plus distin guées de leur royaume par la naissance et la beauté. c'est le cteoix dans le choix. lady gïenmour, brune .comme une,.vénitienne du temps de véronèse, avait des cheveux d'un noir doux et onctueux, , couron nant son front, de comtesse et descendant en grap pes sur ses joues de dix-huit ans. son regard long et fier se perdait quelquefois dans une magnifique indifférence; moins qu'une reine, plus qu'une femme, elle brillait à tra vers une sphère d'idéale grandeur. la supériorité du sang, qui ne peut pasplus se nier que la conscience et l'honneur dans l'ordre moral, éclatait dans la perfection exquise de son profil. il résumait toute la noblesse de ses aïeules. l'œil qui l'admirait volait quelque chose à la sensualité du tact en posant son rayon sur ces lèvres d'un rose chaud et vaporeux. son cou ondoyant, ses'épaules, ses bras étaient si fermes et si éclatans de jeunesse, que la soie et la dentelle qni les touchaient, semblaient avçir une ame et les caresser de leur contact, de leurs plis et de leurs couleurs. lady gïenmour était grande, . belle, mais sans cet excès de majesté qui tue le désir, qui don ne trop au respect pour ne pas ôter à la grâce. par une illusion, par un prestige qui ne s'expriment pas avec les mots beaucoup trop exacts de la langue par lée, on éprouvait, en voyant sa poitrine blanche et demi voilée, l'émotion suave et cbàste que fait naitre une cor beille pleine de fruits et de fleurs qu'on vient de cueillir. ce qui aurait donné un prix extraordinaire à tant de charmés, c'eût été *l'éclair de la passion courant dans ces cheveux, éclatant dans ces yeux, circûleuat dans ces (1) voir la presse du 21 au 25 mai, 7	sensualité	1	1
journal_de_toulouse	1845-06-01	1	2	Block27	0	0	0	0	un soir, le soleil allait dis araitre derrière lesandes; sommets une molle poca , le plus grand volcan de la chaîne des brise descendait sur la plaine pour redonner la vie et la fraîcheur à toute la végétation , brûlée dans le jour par des ardeurs torrides ; on n'entendait alors dans ces soirs majestueux que le bruissement grandi à cause même des obstacles. qui vont du reste, la senora frazia n'en était pas alors à sa première in- lointain des forêts , que le chant d'adieu des petits oiseauxles chandouloureux en trigue ; elle avait brouillé déjà quelques ménages. et, malgré sa dormir sous leur fleur , et que les cris le fooetdn blanc la cochenille, haute position à la véra-cruz, c'était ptutêt une courtisane qu'une sons des nègres cultivant encore sous domenica était nonchalamment la vanille l'indigo on la le ala fille à marier. ce pendant il n' y avait p as de fêtes sans elle : , , p interrogeant à voix basse recherchait pour ses causeries ses talents d'agrément. les hommes assise sous les les caféiers de son habitation , la une femme noire et un autre esclave arrivés tout à l'heure deà ses aimaient son air mélancoliq ue' son regard douloureux' d'où s'é p lacer amoureusement phi ppaient quelquefois des flammes, sa belle chevelure tombant vera-cruz , lorsque henri accourut se femme : e p1roles de sa comme celle des grecques en larges flots sur ses brunes épaules, et côtés , sans avoir entendu ces dernières les deux surtout son pied qui touchait à peine le parquet quand elle dansait vous êtes bien surs que c'est rico ? paroles auxquelles le fandango, la danse la pins voluptueuse des espagnes. ce pied était nègres , en la quittant brusquement avaient répondu par un signe si merveilleux, gn'ayant été mesuré un jour avec un oiseau-mou- de tête. légère émotion, la délai sans que son regard che ' l'oiseau s'était trouvé lus long que lui. reg trahît la plus p ant d'avantages devaient nécessairement frapper la mobile ima- saisit la première la main d'henri . air « quand irons-nous en france, ami, dans cette belle patrie dont gination de notre compatriote ; aussi comme il poussait rudement doute les les choses , devint-il en peu de temps l'heureux favori de cette en- tu me parlais tant autrefois et que tu as oubliée , sans francais sont si oublieux ? chanteresse. pas de leur a celle henri , tu deviens pâle et triste ; es-tu malade '1 l'affreux caartère ombrageux de larpomenica, qui croyait déja ne plusrece climat de la vera-cruz t'est funeste, sans doute ? voir les mêmes soins. non, ma domenica , je tic suis pas malade je suis habitué à elle fit surveiller, par une douzaine de nègres des plus intelliton ciel mexicain ; tiens, vois comme il est beau, quelle magnifique les moindres démarches gents et des plus dévoués, croyait-elle , d'henri ; mais les esclaves, qui aimaient tous leur maitre, s'enten- nuit, que d'azur, que d'étoiles ! oh ! non , je ne suis ni malade ni? dirent pour le protéger contre la jalousie de sa femme et l'avertis- triste ; n'es-tu pas assez charmante pour embellir toutes choses restons encore long-temps sur cette terre bénie où dieu m'a donné salent de ce qui se passait. l'infidèle dut cesser momentanément ses assiduités auprès de la ta beauté. - le médecin de l'habitation m'a dit pourtant qu'il te fallait l'air senora , et, à force de démonstrations d'amour et de dévouement , natal ; et puis moi je voudrais la voir , cette france dont on dit tâcher de regagner la confiance de sa femme. mais cette gêne continuelle , ce mystère qui entouraient sa pas- des merveilles. nous partirons dans quelques- semaines , n'est-ce sion ne firent que l'aiguillonner , et l'imprudent ne put s'empêcher pas ? nous laisserons ici le vieux lopez pour gérer nos plantations. , qui ne demandait pas mieux que d'encourager d'écrire - attendons encore, domenica ; je ne sais vraiment si je pourcette rais supporter les fatigues d une traversée , rico , domestique particulier de darnelal , était chargé de pur- tu es donc malade? » ter les lettres d'amour et d'en rapporter les réponse;. a ce moment le nègre rico passa devant eux avec un paquet	voluptueuse	1	1
constitutionnel	1845-06-02	1	4	Page1_Block7	477	857	3882	1980	spectacles do x juuf. opéra . —robert-lediable. . < ■■ thiitbe-rbahç*is.— l'ecole des femmes, mme deluceone. opém-comiqcb . — une voix, la sirène. stuue. — lansquenet, jeanne, la fomeambute. vaudeville .— le petit poucet.. variétés .- tompouit, le lansquenet, un conte de fées. palais -notal.— l'escadron, la poule, deux papas, le koman. gaité .— tatirâcfl de dieu. t am8kgu30hiqvfi.-—-les ktudi&ns- ■ pobte-saiht-bartik .— la biche au bois. th. de m . coït te .—augusta, mme de uea'is, uaiurka. cirode-oltupiatie.— grands exercices d'équitation. folies-dr abal iqdes.—	coït	1	1
democratie_pacifique	1845-06-02	1	4	PAG_4_TB000017	819	1485	494	4319	à rien n'est oublié dans cette nomenclature obscène. on hésite à indiquer même le titre des matières : de bestialitate, de sodomid, avec ses variétés (nous osons à peine parler latin). de tactibus et aspectibus impttdicis. de impotentid avec la distinction des deux genres, quatuor pro masculis, duo pro feminis, les définitions ; et jusqu'à la pommade pour la guérison (unctionibus). de hermaphroditis avec la définition. de commerciis cum d?mone, de maleficiis. t out s'y trouve : les incubes, les succubes, les nou-eurs d'aiguillette, les sorts, toutes les superstitions du moyen-âge ! puis les matières délicates : de debito conjugali, de tactibus, de peccato once, etc., etc. je ne puis vous dire tout cela, la langue latine accoutumée, comme on dit, à braver l'honnêteté, s'y refuse elle-même. enfin, le chapitre final, en français celui-là, traite de la façon de baptiser l'enfant in ventre matris, de la manière de s'y prendre, de l'instrument convenable, avec des détails ana-tomiques dignes de l'amphithéâtre de l'ecole de médecine. et les commentaires ! et les distinctions subtiles ! et tous les cas analysés des dictionnaires de la débauche et du libertinage !... tout cela dans un style audacieux comme le sujet ! tout cela à l'usage des jeunes prêtres. c'est à n'y pas y croire. heureusement qu'il n'est pas venu à l'esprit de mgr bouvier, pour plus ample instruction, de faire illustrer son ouvrage ; il n'y manque que les gravures.	libertinage	1	1
presse	1845-06-03	1	1	Page1_Block19	3852	922	1978	785	la chambre des députés a voté les quatre prc r miers, les quatre plus important artiele&de la loi sur les- colonie?. nous ne rèaâ&â&- paa. comp te de la discussion, atterifta: qu'il n'y a pas oe discussion. jamais nous n'avons assisté à un spec? tacle plus étrange; jamais plus mauvaise^» n'a été enlevée à l'aide d'expédiens plus ir régulier s. vous croyez peut-être que c'est du projet voté par la chambre des pairs qu il est question aujourd'hui' détrompez-vous ! ce projet-là ne sert que dé cadré à de tout autres dispositions qu'on se garde bien dé soumettre à l'épreuve du scrutin, mais qu'on glisse, comme commentaire obligatoire, par voie de déclarations de tribune et d'engagemens minis tériels. l'autre jour, à la chambre des pairs, m. le baron pasquier faisait, observer avec juste raison, à propos du rapport de m. le comte eoy touchant la conver sion des rentes, queleschambres ne votaient pas sur des principes, mais seulement sur les dispositions précises qui se trouvaient formulées dans les pro jets soumis à leur examen. au palais-bourbon on à changé tout cela ; on vote sur des principes, sur des théories consignées dans un rapport, sur des obligations qu'on impose au ministère et que le ministère subit avec une résignation exemplaire. quant au texte même du projet, c'est ce dont on s'occupe le moins. partisans et adversaires; tout le monde le déclare mauvais. mais il est des gens qui lé votent, parce que, comme nous le disions, à côté de l'œuvre officielle et véritablement législative, il y en a une autre qui se fait en dehors de tout vote, par un concert très habilement ettrèsinconstitu- tionnellement calculé d'interpellations et de répon ses arrangées ad hoc. / -» ainsi,il est bieuévident qù.e !«$ dix-huit amen- demensdem.dega8parin(carilyenavait dix-huit !) n'étaient pas sérieux ou ne tenait nullement à les faire adopter. au contraire ! ces messieurs ont tant de confiance dans leur projet qu'ils sont ve nus, l'un après l'autre, proclagur avec une naïve té adorable qu'y changer un mot, une virgule, ce serait en compromettre indéfiniment le succès. l'uuique but de tous ces amendemens était d'obli ger m. le ministre de la marine à se lever pour di- re : <■ j'aurai soin de faire par ordonnante tout ce » que vous désirez. rapportez-vous-en à moi ; je » serai l'exécuteur obéissant de vos volontés ! » lé rôle de m. le ministre dans cette séance n'a consis té qu'à aivepter des consignes, et nous admirons vraiment l'heureuse abnégation dont il paraît doué. m. de gasparin a donc retiré ses dix huit amen demens. c'est tout simple. ce qui ne l'est pas, c'est la facilité avec laquelle la chambre s'est prêtée à cette tactique. m. berryer, dans un discours éner gique et vrai, a vainement cherché à lui faire com prendre ce qu'il y avait de grave à abdiquer ainsi la plus'tutelaire des prérogatives que la charte lui ait confiées dans l'intérêt des citoyens, à renvoyer à l'ordonnance la solution de questions aussi capi tales que celles qui sont soulevées par l'article 1 er du projet, et qui touchent à ^organisation du tra vail, à l'ordre matériel et moral de;la société colo niale tout entière. m. berryer s'est montré, comme d'habitude, plein de vigueur, d'éloquence, et, plus que d'habitude, il était dans le vrai. eh bien ! rien irya fimtt g^sorf^rdonnaneïrtfùi^irlafese le soin de remanier de fond en comble cette société déjà si troublée. vous verrez dans quelques jours la cham bre se mêler de tout à l'occasion des chemins de fer, s'ingérer dans les moindres détails des tracés, s'occuper minutieusement des plus petites ques tions d'exploitation et d'administration. si on es sayait dé lui faire entendre qu'elle est peu compé tente dans ces questions, dieu sait quelles réclama tions s'élèveraient de tous les bancs ! mais organi ser le travail dans les colonies, régler des rapports qui vont devenir si difficiles entre les maîtres et les esclaves, préparer, comme on dit, l'émancipation, est-ce que ces bagatelles sont digues de l'interven tion parlementaire ? laiisons faire cela aux com mis ae notre intelligente bureaucratie. a merveille ! nous allons vous donner un échan tillon, un seul, de l'esprit qui préside à tout ce dé bat. vous savez qu'un des articles du projet per met aux noirs d'obliger le maître à leur accorder, à leur choix, ou l'ordinaire, c'est à dire la nourri ture de tous les jours, ou la libre disposition .d'un jour par semaine. c'est par le travail de ce jour-là que le. pécule peut légitimement s'amasser. dans l'intérêt même des noirs qui n'auraient pas le sen timent de ce devoir (et malheureusement il y en a beaucoup), il importerait donc que des mesures fussent prises pour que cette, journée, distraite du labeur régulier de l'habitation, ne fût pas consa crée au libertinage et au vagabondage.	libertinage	1	1
debats	1845-06-12	1	1	P1_TB00020	2272	922	1045	4531	considéré comme un crime l'ignoble plaisantérie dont elle venait d'être la victime, et je n'avais pas pensé que le malheur pût avoir des douleurs ridicules qu'un amant ne doit jamais voir. m. deslàurières venait de faire à sa femme plus de mal peut-être qu'il ne lui en avait fait jusque-là. après l'avoir abandonnée à la calomnie et l'avoir jetée à la risée de deux goujats, j'entendais déjà resonner à mon oreille leurs plaisanteries sur l'émoi des domestiques, les avis empressés du docteur et les poses tragiques de m- michel meylan, parce qu'on avait donné a mm» deslàurières un peu de jalap. lorsqué alison m'avait parlé de la lâcheté d'un homme qui torture une femme et qui la tue par le malheur, elle avait oublié de mettre au-dessous de lui l'homme qui l'étouffé dans la fange. le lendemain de ce jour, je reçus un billet de charistié ; il contenait ces mots : « ne venez pas me voir. » je me rendis chez m. bonsenne, qu'elle avait fait avertir ; 'il m'apprit que m. deslàurières n'avait pas reparu chez lui, il m'apprit aussi lo secret de cette ignoble bouffonnerie. m. désiaurières, frappé de destitution et réduit aux restes de là fortune de sa femme, avait pensé qu'il était prudent de se les approprier, et la menace qu'il faisait à charistie de dévoiler le secret de sa naissance était arrivée, à ce qu'il parait, jusqu'aux oreilles de m. de favreuse, qui avait fait dire à m. deslàurières qu'il lui couperait les siennes s'il se permettait de dire un mot qui ressemblât à une révélalion : d'ailleurs, si on se rappelle la correspondance qui m'avait été remise par victor, m. deslàurières ne' pouvait prétendre avoir été trompé; et s'il y avait an crime ou un délit dans la manière dont on avait établi l'état civil de mme deslàurières, son mari en était le premier complicé. . il ne restait donc à ce misérable qu'une chance de pousser sa femme à l'abandon du reste de sa fortune'; cétte chance était de la rendre victime d'un scandale personnel. quoique m. deslàurières eût fait en plusieurs circonstances le rodomont sur l'article de la fidélité qui lui était due, je ne pense pas qu'il y attachât ces grandes idées d'honneur qui décident de la vie d'une famille. d'un autre côté, quoiqu'il eût pu savoir mieux que personne que sa femme avait été la victime d'une machination, et qu'on l'avait jetée à plaisir aux dents do la calomnie, je pense qu'il n'était pas au fond parfaitement sûr d'elle, lui qui vivait parmi des drôlesses qlii, pour une heure de plaisir, eussent jeté par dessus les moulins leur père, leur mari et leurs enfans avec leurs bonûets ; lui qui vivait dans cette bacchanale de libertinage où chacun pouvait compter à peine sur ses doigts les aventures de la semaine, il se disait in petto qu'il ne pouvait pas y avoir une femme qui, délaissée comme l'était la sienne, ne finit par succomber à la tentation de l'amour, et surtout à la tentation bien autrement séduisante de la vengeance. forcé pour ainsi dire à reconnaître qu'aucun de ceux qu'on avait honoré de son déshonneur n'avait eu cette joie, il avait raccroché sa dernière espérance a ma personne.	libertinage	1	1
siecle	1845-06-19	1	1	Page1_Block19	1624	1135	2317	3317	crits, n'en sont pas moins d'uu haut intérêt. parmi les œuvres de u. guiraud, celle qui nous parait la plus capitale est intitulée fume^ ou de rome au'dêsert. le déclin de la civilisation romaine et l'aurore de la civilisation chrétienne brillent dans cet ouvrage des plus vives couleurs. - m. de châteaubriand, dans les martyrs, a mis en présence les .«jeux religions; m. guiraud, dans flavien, a fait contraster les deux histoii res. la sensualité romaine, son cynisme et sa férocité se trouvent ad-; mirablement peintes daus ce tableau, à côté des pures et douces éma nations de l'evangile,que le souffle des tartufes n'avait pas encore eu temps de corrompre. cette large fresque, où deux mondes sont repré sentés, est tracée par m. guiraud avec une grande fermeté de pinceau. _ c'est de c tte œuvre qu'alexandre soumet tira sa tragédie du gladia teur, qui en fut un bàliant reflet, m.ds les conditions du théâtre ne periih-ttaieut pas d 'offrir tonte la réalité, tout l'ensemble de la savant^ et profonde étude de m. gui aud. flavien l'irrésolu, l'homme des épp- aues dedécadeuce et de rénovation, qui fait tout chanceler autour de lui, et la chrétienne néodéinie, faim et charmante enfant d'une si naïve candeur, forment des types adorables qu'on peut ranger à côté ù'eudore et de cymodocce. uu avautane des œuvres de m. guiraud, avantage de plus en plus rare de nos jours, c'est que l'autt ur respecte la morale à l'égal de la littérature, et que môm« dans la peinture de la corruption romaine, son expression est restée chaste et voilée sans rien ôter aux libertés de l'histoire. ses œuvres ont droit d'être admises partout ; elles na> contiennent aucun germe malfaisant; elle sont faites pour élever l'âme, vers le beau, le bien, l'infini. hitoire du peuple de i,ton pendant la révolution française, par m. b alleydier. cette époque de la révolution, toujours si curieuse k étudier en dé tail, présentait à lyon un intérêt des* plus grands. lyon, comme on le sait, a cruellement pris part aux terribles scènes du sanglant drame, qui se passa de 1789 à 179s. des acteurs comme challier, carrier, du bois de crancé, collot-d'herbois méritent d'être examinés de près. ce, travail a été entrepris par m. balleydier, de lyon, écrivain de içéritç, d'un esprit juste et droit. nous avons lu avec un vif intérêt le premier, volume dè cet ouvrage et nous en citerons un passage qui fait bien connaître l'esprit et les mœurs du temps. il s'agit d'une discussion en tre le journalisteifain et un.individu se disant sapeur parisien, qui s'é tait comporté au spectacle d'une manière inconvenante. les formes épistolaires avaient alors le ton d'urbanité que voici : le sapeur écrivait au journaliste : ■ « il faut, jouiyialier, que tu aies bien (le mot est plus .expressif) faim » pour alimenter platement*comme tu le fais a la journée rimbécile et	sensualité	1	1
revue_mondes	1845-07-01	1	152	152	NA	NA	NA	NA	revue des deux mondes ii6 pour cette dernière œuvre les voyageurs tels que swinburne sont excellens ce sont eux qui jettent la lumière la plus calme et la plus vraie avec eux nous pouvons rectiber les jugemens esprits et les araes pondérer les opinions redresser les erreurs et contrôler par l étude des mœurs réelles l analyse de ces produits de la pensée ou de ces conquêtes de la science qui se dirigèrent vers un même but ren versèrent les mêmes idoles et saluèrent la même aurore essayons de débrouiller ce chaos résumonsnous l impulsion première de tout le siècle lui vient de la religion et de la politique soumises au raisonnement individuel cette impulsion part de l angleterre calviniste de 1688 où s établit la tolérance et la soumission du roi à la loi elle enfante sur sa route la révolution américaine elle aboutit enfin à la révolution française prendre le xviii siècle de mesurer la il s agit donc pour com pente sur laquelle entre 1688 et 1789 l europe a été entraînée pendant cet espace de temps la france court à la réforme sociale l angleterre à la conquête maritime et industrielle l allemagne à la réalisation poétique de son génie propre l espagne s agite dans son impuissance l italie dort et fait de la musique et l amérique septen trionale éclot à la vie politique en angleterre de 1688 à 1750 s établit avec le triomphe du puri tanisme de la maison de nassau et de celle de hanovre le premier foyer des idées populaires et philanthropiques ces idées s y réalisent par les banques la caisse les hôpitaux les institutions pour les sourdsmuets la théorie de ces idées d épargne et celle d amortissement populaires puritaines d origine puis sceptiques et semirépublicaines dans l application se répand en france avec bolingbroke et les réfugiés anglais vie de la du mariage de ces théories avec régence naissent les étranges la libre et mœurs de voluptueuse notre xviii siècle  l angleterre après son compromis de 1688 arrive à la conquête de l inde et des mers la france écoute bolingbroke glorifie voltaire et résout par sa révolution les problèmes agités par elle pendant cent empruntés à l angleterre quant à l allemagne restée d abord étrangère au mouvement elle commence par entrer vers 1730 dans une voie de mysticisme protestant elle débute par le piétisme que le docteur schlosser dépeint très bien essaie de se rapprocher de ans et la vie pratique anglaise en suivant le philosophe ïhomasius et bien tôt après cherche la régularité française avec gottsched l élément français est vaincu en allemagne par l importation de l influence an	voluptueuse	1	1
revue_mondes	1845-07-01	1	539	539	NA	NA	NA	NA	colonisation de la guyane française nne de 533 de ces entreprises grandioses qui font époque l état la française est d ailleurs guyane économique on ne peut plus favorable à la conception de m lechevalier les habitans sont si peu nombreux le territoire approprié est tellement restreint que l on conçoit aisément la possibilité de réunir sous une seule direction tous les intérêts de la colonie suivant le recensement de 18il la population sédentaire est de 20753 personnes rins population flottante comprenant les fonc la religieux les militaires de la garnison et les civils et tionnaires donne environ 1250 à 1300 personnes dans le ma groupe des ha bitans sédentaires les libres comptent pour 5746 les esclaves dont nombre décroît chaque année par suite des affranchissemens ou des extinctions ne sont déjà plus que de li997 un tiers de la population est domicilié dans les villes et dans les bourgs les deux autres le disséminés dans les habitations rurales parmi tiers sont la classe qui est en possession delà liberté il y a 1203 individus de la race blanche et 4543 de la race noire les blancs qui sont par rapport aux hommes de couleur dans la proportion de 1 à 4 possèdent néanmoins les des bestiaux c est  trois quarts des terres cultivées des esclaves et  que plupart des nègres réputés libres ne sont que des affranchis abrutis par la fainéantise et le libertinage et retenus par la misère dire la dans un état de prolétariat qui ne de les élève pas beaucoup audessus la servitude sur 5400000 hectares que représente la colonie 1 moins de 12000 sont mis en culture c est environ le dixième des terres acquises par les particuliers le reste du territoire appartient à l état les pro au nombre de 400 environ sont aussi inégales en étendue qu en valeur pour une vingtaine de grandes sucreries qui avec les ateliers forment des domaines considérables on compte un priétés rurales grand nombre de petits champs consacrés à la culture des vivres ou des produits qu on peut récolter sans beaucoup de frais i valeur des terres est établie bien moins d après leur étendue que suivant le genre de préparation qu elles ont déjà subi ainsi l hectare approprié à l exploitation de la canne à sucre vaut 1000 francs cinq fois plus que la môme étendue cultivée en café en cacao en rocou la valeur moyenne que des esclaves est d environ 1300 le capital engagé dans la fr il résulte de cet aperçu colonie n est pas très considérable si l on accepte les comptes annuels établis probablement sur les rapports de 1 ment a ne complcr que déserte on aurait tome xi les régions connues en comprenant la partie complèteune surface beaucoup plus considérable encore 3s	libertinage	1	1
