work	date	issue	page	block	height	width	hpos	vpos	text	active_words	occurrences_words	unique_words
presse_litteraire	1859-04-05	1	14	14	NA	NA	NA	NA	334 la presse litteraire s approcher plus près encore de l idéal qu il entrevoit de la vérité qu il devine ouvrons ces admirables pages de l espoir en dieu que tant u âmes hésitantes pourraient choisir pour symbole je voudrais vivre aimer m accoutumer aux hommes hommes un peu de joie et n y pas trop compter faire ce qu on a fait être ce que nous sommes et regarder le ciel sans m en inquiéter je ne puismalgré moirinftnime tourmente  je n y saurais songer sans crainte et sans espoir et quoi qu on en ait dit ma raison s épouvante de né pas le comprendre et pourtant de le voir qu estce donc que ce monde et qu y venons nous faire si pour qu on vive en paix il faut voiler les deux  je souffre il est trop tard  le monde s est fait vieux une immense espérance a traversé là terre  malgré nous vers le ciel il faut lever les yeux  ses lecteurs d autrefois auraientils soupçonné à travers les emportements de ses débuts une raison si droite un tel souci des hautes croyances un tel besoin d idéal et d infini avec combien de iucide fermeté cet esprit si ébloui d abord par le  vertige de la jeunesse arrive â se poser les redoutables problèmes de nos destinées  a travers les indécisions d une loyale intelligence jamais un goeur plus affamé de la vérité ne s est élancé vers elle avec plus de force et ne l a suppliée plus éloquemment coutage ô poète 1 encore un coup d allé et de cette région déjà si haute mais si tourmentée vous parviendrez audessus des doutes qui vous restent à la clarté sereine au calme danà la vérité à la foi qui vous échappe et dont vous êtes digne par la franchise et la véhémence de vos désirsi a cefte âmecapable d un tel essor et d une intention si droite un secours lui a été refusé dont les plus forts et les plus sages ont besoin le souffle et l appui d une époque moins indécise la lumièe d une conscience publique souienu par une tradition plus pure et plus affermie il eût franchi le dernier degré qui le séparait encore des croyances tfëceâsaires aux grandes inspirations là il auraitpus dés forcés pour l oeuvre nouvelle si glorieusement commencée avec les nuits et l espoir en jheii un autre témoignage nous reste de tout ce qu il a fait de tout ce qu il a souffert pour mériter celte fâvetit si rare d une transformation et d une veine ravivées déchirant témoignageet plus irrécusable dahs sa courte simplicité que cette prière même de vèspoir in dieu i tout le monde a lu avec émotion ce sonnet trouvé à côté de son lit après une nuit de douleur et qui s est gravé dans la mémoire de ses amis comme un testament son effusion dernière c est une pensée religieuse et une larme  j ai perdu ma force et ma vie et mes amis et ma gaieté  j ai perdu jusqu à la fierté oui faisait croire à mon génie quand j ai connu là vérité j ai cru que c était une amie  quand je l ai comprise et sentie j en étais déjà dégoûté et pourtant elle est éternelle tt ceux qui se sont passés d elle icibas ont tout ignoré dieu parle il faut qu on lui réponde le seul bien qui me reste au monde est d avoir quelquefois pleuré ainsi dans sa première effervescence ce libre el charmant esprit à choisi pour son domaine la fantaisie et là passion  il a raillé du fond de sa  voluptueuse indifférence lous les enthousiasmes sévères il est entré dans la poésie avec toutes les grâces hardies avec toute l impétuosité de l adolèscence un prompt succès l encourage dans sa voie elle voilà qui malgré tout par la seulepente de sa noble nature arrive à se faire un tourment dès grandes questions dont il avait souri il dévoile du même coup ses souffrances mortelles et sort espoir infini et semblé terminer son oeuvre et sa vie par cette sublime ël navrante confession il a dit vrai dans ce cri de l âme  son plus grand bien sa plus grande gloire peut être est dans cetlè làrrhë sacrée qui nous livre soit pltls intime secret et dont la pureté rejaillit sur son oeuvre tout entière noble douleur qu il laissa tant de fois éclater et qu il appelle avec tant de juslesse le tourment de l infini i  sachons bien tout le prix de cette religieuse tristesse c est elle à défaut des joies sereines qu apportent les fermes croyances c est elle qui fait notre grandeur elle marque un abîme entre le doute sans issue où s enfermaient les profanes rieprâ du siècle dernier et l incertitude pleine d espoir d où s élance l esprit contemporain  le vieux scepticisme avec ses froides moqueries ne disait pas seulement  la vérité nous est voilée  il semblait dire  nulle vérité n existe le doute moderne dans ses inquiètes ardeurs est un acte immense de désir un généreux appel à l idéal inconnu cette vérité pour lui encore ignorée le poète l adore de toutes ses forces il conjure cet infini de se laisser comprendre   brise cette voûte profonde qui couvre la création  soulève les voiles du monde et montretoi dieu juste et bon l voilà de nôtre temps le cri des âmes les plus découragées  leur scepticisme se résout dans une prière voilà le dbule tel qu il apparaît chez l auteur de rolla des nuits de l espoir en dieu 1  seraitil vrai que les lettres françaises ne doivent plus atteindre les saines régions morales où elles se plaisaient avec corneille et racine ne retrouverontelles jamais ce merveilleux équilibré de l imagination et du goût des inspirations enthousiastes et dé là raison sévère et ces fortes convictions qui fondaient là grandeur du génie sur l énergique droiture de la conscience sommesnous condamnés à redescendre la pente siérile de la licence et de l ironie que la poésie contemporaine dès son premier vol avait hautement dépassée   soyons rassurés messieurs par l exemple même de ce séduisant écrivain si audacieux dans sa fantaisie si emporté vers les brillantes chimères vous venez de l entendre dans ses pages les plus éloquentes il y rend témoignage aux religieuses pensées à ce noble souci de la vérité morale qui survit aux passions et à qui la poésie ne saurait survivre nous donnerons dahs notre prochain numéro le discours de m vitet theatres odéon  le droit chemin comédie en cinq actes en vers par m latour de saintybars  il n y a qu une voie à suivre dans la vie c est celle de l honneur et de la loyauté  telle est iathèse que vient de soutenir victorieusement m latour de saintybars devani le public de l odéonles personnages vertueux sont nombreux dans la comédie nouvelle nous en avons compté jusqu à cinq mais ils sont tous sympathiques et pour arriver à les rendre tels l auteur a fait une grandepreuve de talent le vice en effet est beaucoup plus aisé à peindre que la vertu d ailleurs les caractères vicieux sont également trèsbien réussis et le spéculateur verdelier pourrait bieh n être pas un portrait de fantaisie les personnages qui suivent le droit chemin sont mme la baronne damblars sa fille marie le colonel de marsay m1 verdelier et m bernard l oncle de cette dernière ceux qui s en écartent sont m verdelier et m bonnet  entre ces extrêmes il y a deux hommes inoffensifs le baron damblars et son fils albert le baron excellente nature s est laissé prendre aux belles paroles du spéculateur verdelier et il faut toute l influence de sa femme du colonel de marsay et de m bernard pour l empêcher de tomber dans le précipice albert qui a voulu jouer le rôle de lovelace auprès de mme verdelier est touché de la vertu et des nobles sentiments de l épouse d un homme indigne d elle et il lui prête franchement une assistance pleine de fespectel de dévouement quand le malheur la frappe verdelier l intringant qui a failli ruiner le baron dans ses spéculations véreuses est démasqué  m bonnel jeune viveur qui convoitait la dot demlledarrillars est ëconduit honteusement et le colonel demar  say épouse marie damblars le succès n a pas tr ohipé les espérancesuiib m de la rounat fondait sur le talent de l auteur le droit chemin est une oeuvre remarquable au point de vue de la conception et du style les caracières sont franchement et vigoureusement tracési relui du colonel de marsay surtout l inteiv prétatiort est excellente  m clàrencé dans le rôle de colonel a fait preuve d un talent souple et vrai mme méaest parfaite de distinction dans le rôle de la baronne damblars et m1b mosé charmante d ingénuiiè et de grâce dans celui de marie mm kime éaintléon et faivre contribuent à former un excellent ensemble théâtre lyrique  faust opéra en quatre aâ tes paroles de mm michel carré et jules barbier musique de mgou no d  l oeuvre tant annoncée de m goiinod a enfin vu le jour de la rampe et c est un nouveau et brillant succès pour l auteur le poème de goethe renferme tous les éléments que peut désirer un compositeur  le comique lé gracieux le terrible et le fantastique y ata dent faust est un de c s chefsd oeuvre queiesjafrangeurs ne parviennent pasàrendre ridiculeset j complimentons mm carré et barbier de ce qu ils  n ont pas trop substitué leur imagination à celle  de goethe la nouvelle partition de m gounodest  l oeuvre d un artiste qui possède une science réelle et ne manque pbint d inspiration le second acte surtout est magnifique lé chant des vieillards la valse et la ballade sont d un maître l exécution est fort satisfaisante mme miolancarvalho dans le rôle de marguerite rôle irèsdifférenl de cens qu elle â abordés jusqu ici déploie son admirable talent et sa brillante méthode  elle seule suffirait pour faire le succès de l oeuvre m barbot chargéd un rôle écrasant celui de faust s en tire assez bien et m bal anqué donne un caractère tout à fait satanique au personnage de mepbistophélès les autres rôles sont bien tenus et les choeurs chantent avec ensemble que dire des décorssi non que le théâtrelyrique n a pas voulu être éclipsé en magnificence par la porte saintmartin la mise en scène de faust a dû coûter cher à m carvalho mais ce directeur a prouvé jusqu ici plus d une fois qu il savait placer son argent théâtre impérial bu cirque  nous arrivons un peu tard pourannoncer lestidcès obtenu par les ducs de normandie grande pièce à spectacle par mm cormon et grange deux vétérans dti drame dans laquelle la direction du cirque a déployé de grandes magnificences comme mise en scène de  cors et costumes les ducs de normandie forment un spectacle des plils iutéressants et qui attirera quelque temps la foule ce qui ne veut nullement dire que ce soit le meilleur ouvrage des auteurs a rolet mélanges et nouvelles m de laprade ayant été élu par l académie française à la place vacante par la mort de m_alfred de musset y est venu prendre séance jeudi m mars el a prononcé son discours de réception auquel a répondu m viiet m de laprade est ne a montbrison loire le 13 janvier 1812 il fiiie bonnes études à lyon et débuta en 1839 par u  poème intitulé les parfums de madeleine dont te tour harmonieux et mélancolique indiquait un nouveau disciple de lamartine remontant a i inspirations plus élevées il puisa dans la lecture des livres sacrés des sujets vraiment originauïj	voluptueuse	1	1
siecle	1859-04-14	1	2	Page1_Block16	1366	804	1033	4949	' éphéméridcs. — 1$ avril. 1205.— baudouin, premier empereur latin d'orient, est fait prisonnier par joannice, roi des bulgares, à la s*jte d'un combat eneasê sous lesmurs d'andré nople. l'ex-édmte de; haina'ut- et de îlandrè' avait indisposé lçs grecs depuis le jour où il s'était fait proclamer empereur, après la mort dasaac l'ange et de son fils alexis. affectant pour eux du mépris,- il -les repoussait systématiquement, et se fit ainsi pres que autant d'ennemis que 8e sujets. andrinople s* tant révoltée, il alla mettre le siège devant cette ville ; mais les mécontens appelèrent à leurs secours 1 joan nice, qui vint attaquer l'empereur, le battit'et le fit prisonnier. baudouin, chargé de fers par les bulgares, mourut dans les tortures l'année suivante. 1553. — traité de paix et d'alliance pour quarante ans, signé à moscou \ntre gustave wasa, roi de suède et le czar de uussie, ivan iv vasiliewitch. ce traité fut conclu après quatre ai\s de luttes; avec des succès balancés entre ces deux souverains. • 1685. — mort de thomas olway, poëté anglais, né le 3 mars 1651, dans le sussex. ce poëte, auquel 'ses compatriotes donnent la première place après sha kespeare, était fils d'un ministre de campagne qui ' le destinait à continuer son humble profession ; mais thomas, loin de' répondre , aux vues de son père, se livra tout entier à un libertinage précoce. a vingt ans, il entra comme acteur dans une troupe de co médiens à londres, et bientôt après il obtint. un brevet de cornette dans le régiment de plymouth. incapable de = s'astreindre au' joug de la discipline, olway abandonna la carrière militaire pour tenter, comme .auteur, les chançes hasardeuses du théâtre, et ses pièces furent en général assez goûtées. cepen- i dant, malgré ses succès, il vécut dans la plus pro fonde misère, et mourut à peine figé de 34 ans. -- eugèned'auriae.	libertinage	1	1
monde_illustre	1859-04-16	1	6	PAG_00000006_TB000024	374	1165	1646	2445	dans la tradition française, je rencontre aussi m. cha- plin, avec sa peinture décorative, avec ses femmes dans le brouillard et dans les roses. on n'a pas la touche plus fleurie et plus voluptueuse ; ce n'est pas la grâce antique, qui est pudique et sévère dans sa nudité ; c'est la grâce pourtant, ou plutôt c'est la désinvolture anglaise, si on peut marier ces deux mots1.	voluptueuse	1	1
siecle	1859-04-18	1	3	Page1_Block6	5637	803	909	286	raient un autre avis. la stabilité de la famille et de la propriété sont nécessaires à la liberté; cette stabilité re pose tout entière sur le respect et sur l'invio labilité de l'engagement du mariage. ce res pect et cette inviolabilité existent-ils sérieuse- sement aujourd'hui? evidemment non. gela tient à plusieurs causes, selon m. jules si mon. « les parens songent surtout à la for tune ; les garçons s'accoutument trop à regar der le libertinage avant le mariage comme- une chose indifférente; l'instruction des filles est trop futile, et leur éducation les rend trop étrangères aux devoirs publics et aux ques tions d'intérêt général. » nos mœurs exagè rent l'assujettissement dans les filles, peut- être par compensation, parce qu'elles exagè rent la liberté dans les femmes. c'est le con traire qui serait juste, puisque le devoir de® femmes est d'obéir, et celui des filles de choi sir. avec cét esprit qui n'osé penser, ce cœur qui n'ose sentir, ces yeux qui n'osent voir, les filles sont- sans défense contre leur propre destinée. » m.-jules simon ajoute : «il y a véritablement une tendance très fâcheuse chez les hommes à ne plus vivre avec leurs femmes, èt à passer la soirée^ après les affaires, au club ou à l'estaminet, selon les positions. » • le divorce supprimerait-il tous ces incon- véniens ? rendrait-il les parens moins avides ? émanciperait-il les jeunes filles ? donnerait-il aux maris le goût du foyer domestique ? les plus déterminés partisans du divorce n'en, voudraient point jurer ; jl est probable qu'il aurait des effets tout contraires. la prévision d'une rupture rendrait les parens encore plus désireux d'assurer à leiir fille des avantages matériels plus' solides et plus considérables. qu'importe de faciliter à la jeune fille la li berté de choisir un époux, puisque ce choix cesse d'être irrévocable ; et de restreindre la liberté de la femme mariée, puisqu'elle est maîtresse de se soustraire à cet esclavage par le changement d'époux. quant au foyer do mestique, on ne voit pas comment l'idée de pouvoir à chaque instant y être remplacé par un autre le rendrait plus attrayant au mari. le divorce, dit m. jules simon, , apparût aux premiers législateurs de la révolution française comme une conséquence directe de la déclaration des droits de l'homme. muraire, et pastoret l'envisagèrent comine une suite de la liberté politique. puisque la femme de vait avoir dans la famille les mêmes droits que le mari, il fallait, pour être logique, lui donner aussi des droits dans l'etat. la con vention n'osa pas aller jusque-là ; elle accrut la facilité du divorce à un tel point qu'il fal lut faire des lois pour pousser au mariage; lois inutiles : on fut obligé de revenir-à la lé gislation de 1792, qui bientôt remaniée passa dans le code civil et s'y maintint jus qu'en 1816. « le mariage est un contrat dissoluble par le divorce. » cette définition, qui avait préva lu au sein de l'assemblée constituante, ne nous semble pas juste. le mariage est plus qu'un contrat, c'est un acte qui crée la famil le; la famille créée, il est' impossible dé se soustraire aux devoirs qu'elle impose; si ces devoirs ne sont pas remplis, il n'y a plus de société. que devient l'enfant quand le maria ge a été dissous par le divorce? a quel foyer ira-t-il demander une place? la séparation de corps du moins ne rompt pas les liens qui unissent le père et la mère avec l'enfant, elle ne supprime pas la famille complètement. le plus grand argument que l'on puisse faire va loir contre la séparation de corps, est de trop donner précisément au principe de la famille, en forçant le mari en faveur duquel la sépa ration de corps, a été prononcée, d'accepter comme siens des enfans adultérins, de leur donner son nom et sa fortune. la femme adultère peut même invoquer la naissance de cet enfant pour contraindre son mari à la re cevoir, car l'enfant est à lui d'après la loi : donc, il y a eu réconciliation en vertu de la même fiction légale, et la réconciliation fait cesser les effets du jugement. cela est mons trueux, continue m. julès,simon,- mais ne peut-on pas réformer la lqi et détruire la res ponsabilité du mari, sans rétablir le divorce? une telle réforme ne paraît point imprati cable. cependant m. jules simon ne pense pas qu'on la.trouve suffisante : «je com mencé, dit-il, par avouer deux choses : la première, c'est que l'interdiction complète et absolue du divorce peut très difficilement être maintenue daus'la loi ; la seconde, c'est que, suivant toutes les probabilités, elle n'y sera pas maintenue, etque le jour, où l'influence du catholicisme décroîtra, soit dans l'opinion, soit dans la législation, le divorce sera rétabli. après avoir fait cet aveu, je déclare très hau tement que je regrette d'être obligé de le faire ; que je suis en principe, par conviction et par sentimentf opposé au divorce ; qu'à mes yeux, un des plus beaux dogmes du ca tholicisme, des plus touchans, des plus mo raux, des plus spiritualistes, est celui qui tait du mariage un sacrement, et que le jour où la loi civile aura proclamé la dissolubilité du mariage, cè sera un devoir impérieux et pres sant pour les moralistes d'enseigner aux hom- mes qu'aux yeux de la conscience, et malgré l'impuissance de l'etat, le mariage doit.être considéré coûime indissoluble, » jf. jules simon ne s'exagère-t-il pas un peu les chances pluf» ou moins prochaines, que peut avoir le rétablissement du -divorce ? ces chance?, *au contraire, nous paraissent di minuer de jour en jour. le divorce n'est jamais entré dans nos moeurs, même lors qu'il était autorisé par la loi, et la femme multiyire à toujours été tenue vis-à-vis do	libertinage	1	1
constitutionnel	1859-04-25	1	3	Page1_Block24	1572	831	1760	3029	-l'echo jxgiicole 'a reçu les dépèches suivantes :' :« arras, samedi, <3 avril. — marché assez bien fourni; v;ente\tr&s' active-avec hausse de<50 c. par. lœct. — cours u.25 à i7i251'b#ct. ' , chartres, samedi, 23 ap\'nl. — bon approvision nement; affaires assez actives; hausse sur le blé dp ; sp c.*par hect. et demi! l'avoine a également au g- ■ i njeutû„de 15 c. rar hect. et.deml..' '   t ' dijon, samedi 23 avril.-rmarché faiblement coït .ni eu t;k>,.empressementatu.achats.de fr. 21 a ïf. ! 0 les îoo kil. . • !-. farmts 37 fr. le sac de 125 kil. '* - '• avoines 20 fr. les 100 kil. - marseille, samedi 23 avri^'blé^dispouit'io est toujours en hausse et le livrable sans vendeurs'. on a vendu du marianopoli disponible 31 fi'. io et > de l'alexandrie à- : 25tr. •  . . ' -, i . ; -l'avoine'so prend à 22 fr. les 110 k;et l'orge.i 17 fr. bo les 100 kil. ■ metz, samedi, 23 avri'. — jeudi, il y avait sur le marché 1,064- hectolitres de blé qui se sont ven dus au prix moyen de-18.50 le? 100 kil. aujour d'hui on comptais sur place 978 h. vendus en moyenne 18.40 les iro kil. ■** ' .le cours commercial s'est raffermi. qn tient au jourd'hui à 19 fr. , ' . \ ' , . orléans, samedi 23 avril. — marché faible; ven te difficile et hausse rie ' 50 c. par hect.; prix 23 à 25 fr. l'heet. et demi. ■» ; - décès et inhumations., du 22„avril 1859. , • ' mrne«bern.ird, 89 ans, rue du fg-st-honoré 182. — m. frive, 25 ans, rue royale-'»-!. — m. >l)avid, -42-• ans, rue de chabrol 73.—mme devoyen, 31 ans,rue st-denis 309. — mme toca, 58 ans, rue du fg-st- 1 martin 99. — mlle dieque, 18 ans, rue du fg-st- marun w.-rmmejamqtj if. ^ns,rue vaucapson 2. —m. christophe/66 ans',jtie'-'st-denisî2g8..'-7 mme vei^'q,i)ugourg, 69 ans,'rue î,iontmpi'éncy-2. .—-m- havel^ 68 ans, rue-vieille-dhi'femple îa—m^dela- jnotte, 44 ans, passage maurice l2.-rmme besnier, ■ 56 ans, rue st-sébastien 56.—m. lvuffln, 86 ans,rue •st-pierre 8.— m. durand, 59 ans, ruq^mnoinessg 18.—mme veuve tliévëuin, 72 ans, quai (les célès- tios 20. — mme brémont, 25 ans, rue de seine 83. _ —m. verbaux, q6 ans, rue jacob 20. — ity.no vt^ve	coït	1	1
courrier_gard	1859-04-30	1	3	PAG_00000003_TB000023	955	811	948	192	pas à ressentir la voluptueuse influence de la saison. le dieu malin qui préside aux amours illicites, entraîne ce couple sensible dans une série d’aventures graveleuses auxquelles l’hiver, qui doit calmer leurs amoureuses ardeurs, vient heureusement mettre un terme. sur celle légère donnée, les auteurs des mystères de t eté ont brodé cinq actes des plus amusants, qui ont mis en relief le talent de tous nos comiques et en évidence les charmes et le piquant de nos plus jolies el gracieuses pen-sionnnaires- mille sabords 1 le joli équipage a commander que ce groupe de canolières qui prenait l’autre jour ses ébats sur les bords fleuris qu’arrose notre seine de toile peinte ! on a beau être modiste et avoir quarante-cinq ans, quand on a le désagrément de posséder une femme nerveuse et que l’été nous point de son aiguillon, on ne résiste pas à la tentation de sc mettre en hercule et de faire du trapèze pour s’envoler en compagnie de filles de l’air telles que mmes demonchy, alphonsine el e. gay.	voluptueuse	1	1
le_pays	1859-05-10	1	2	PAG_2_TB000097	416	1022	4756	5895	dans la nuit du 3 au 4, vers une heure et demie du malin. l'ennemi a teîité de construire deux pénis de bateaux en face de frassineto, mais ; s-sailii par le feu de nos batteries il a du renoncer à son projet, et vers ses huit heures du matin, se retirer de nouveau. les reconnaissances faitespdl' les troupes de cazat ont constaté que l'ennemi avait abandonné balzola et plus fard terra-nuova et villa-nuova. nous avons à déplorer la perte de 6 morts et 27 blessés, sous-officiers et so'da's.	pénis	1	1
debats	1859-05-13	1	2	P2_TB00013	992	781	3510	6077	ment doué et dont les premiers ouvrages, de fort bons portraits,' avaient fait naître les plus favorables espérances, en un mot que c'est m. chaplin qui s'efforce de remettre en hopneur un mode de composition et un style qui n'ont pu trouver grâce qu'à une époque où ia ; souveraineté des. courtisanes était généralement reconnue. qu'est-ce' autre- chose eu effet que des pompadour et des du barry qu'il a déguisées en les affublant des attributs de l'astronomie et de la poésie? et nos yeux, accoutumés au coloris vif et brillant de rubens, ainsi qu'aux formes graves des ouvrages de l'antiquité, devront-ils-se familiariser de nouveau avec les teintes blafardes et les afiitudes éternellement voluptueuses des tubeaux de boucher? non, le retour à ce style îst un anachronisme, une fantaisie d'amaeur blasé sur les chefs-d'œuvre, et notis lensons que m. chaplin peut trouver assez le ressources son imagination et dans	voluptueuses	1	1
monde_illustre	1859-05-14	1	11	PAG_00000011_TB000008	422	1100	117	5062	ehe ; a,t1ai. s apathique quand elle aime ? serait-elle rltaot' 1 de ce qu'exige sa nature, si tu n'étais in- constant en le donnant le droit exclusif de l'être ? enfin, i|f;''t*e||e 0? donnant le droit exclusif de l'être? enfin, l'f ferait-elle parade de sa vertu, si elle ? tu redoutes souvent sa haute réputation %uie 1 '^hhète, parce qu'elle t'accuse de libertinage iùlte; alors, au lieu de vertueuse, tu la	libertinage	1	1
