work	date	issue	page	block	height	width	hpos	vpos	text	active_words	occurrences_words	unique_words
echo_feuilletons	1845-01-01	1	446	446	NA	NA	NA	NA	samuellejoâllëier 427  ujuiqiliin  let bords opp osépnèsentant ltune fj h l devee y mais ce fut en vain ique le f ji iuv mimai essaja plusieurs fois dcgnavir eiiiniailndlunelgten enfonçant ses gtpieds dans 11 unnd doiit il était forme vaincu par la jj jlu uouint et épuise déjà par une longue fjui il lt tn allait ainsi battant lanve et ti aînant jniniiu u 11ircraorque celuici cependant m v it i  ousser des cris de détresse aux lnh p iulhf seul dans le silence de la nuit juiijn la montagne atugtmomcnt où il sentait  ri h li îhu et ses mains pies d abandonfr  smnuli rr sputien que lui avait donne la wii m  il luisembld distinguer des sonsjiujjij1 sonsjiujjij1 tiff   v niîniuis a sa piopie qlamcui presque ausjjl un haut dcy pas fpareil au galop d un cheljitnit udie audessus de sa tête pji la 1 lu du fond de la rivière cria une j iijliiut tejlajjge estu homme ou didni iminii se débattant dans l eau je si m jniimp cluetien qui se noie iepondit jmnmiui un acceqt national fort prononce iffiillu lais juifjou musulman mon dejrlat h ti sauver pil ili int ccla l mcbnnu mit pied à teire se miaimt sbn manteau coupa les budcî u nnniitûie 1èt s avançant lesolumcnt sui le ri itflwipi ggi aui isque de s dbirnei à son toui limlitiimité de la couiioicaupduvre naujjfivi dojit u loceursunpspére ranima les forces n mutant il dut jpnes de son hberateui penhsw umps le jcheval gtainsi allège avait atteint gjlfugue de terre à fleur d eau ioù il aborda eshpqi nul jérôme mon patron je vous tienlpvnuoniitendes services que vous venez de hll die icomme il vous plana messire rajïinloiinu d mnrton mdilferent tandis que ffi n ltcuiu ut ses habits ti empes bfl 1 iquesmstants de silence pendant iiil cwauna curieusement l italien et son jmjsi li s étranger lui ditil si j en juge yriitii au mt et au seivice de france a ce ppivrien plus encore au service peikiialesjie ie  i chai les ix  pieu ifoui cela vous porte bonheur el profit  kî be i  parla morbleu iesuis comme une ik je s çounr sur mon dos un kiev1 ll0ur cc m idvs ues espagnes pllon précisémenj labas sur notre dioitc une lumière qui nous promet poui cette nuit un srbriidonf vous avez plus besoin que moi  en même temps les deuivrvoyageuisjenicompagme de leurs montures s dohemineriiîipédestrementà travers champs dans la direction d une maison isolée au bord de la route iquiltconduit d tudela c était une auberge d assez chétive apparence dont l hôte lesaeçut avec un air d embarras et de deùance que justifiaient suffisamment l heure de la nuit et leur tournure un peu suspecte presses par la gtfatigue et par le isommeil ils bornèrent leurs prétentions à une foit maigre collation airosée d un verre de svin du pays et à un grabat qu ils trouvèrent foi t dur et payèrent fort cher le lendemain des l aube du jour les deu voyageurs se remirent en route poui tudela dont ils n étaient plus éloignes que d une journéele plus jeune montait une mule du paysgt achetée à la frontière afin d ainver plus vite a sa destination il paraissait avoir vingtcinq ans au plufc son poui point et ses hautsdechausses de couleui loncee étaient d une étoffe cqmmune les lignes fermes et pures de son visage où régnait une pâleur hdbituelle révélaient une certaine puissance de pensée et une grande eneigie de volonté il s exprimait en français avec pureté l italien par la lieité de son maintien et la n liesse de son costume aurait passe plutôt pour son maître que pour son compagnon déroute il pariait haut et piodiguait les jurements mis à la mode par les jeunes débauches de la cour il y avait tout a la fois du fat et du matamore dans sd peisonne ce qui produisait avec l air modeste du jeune inconnu un contraste non inoins frappant que celui qui résultait de la différence de leuis costumes comme il anive souvent en pareil cas le supeibe cheval non monte parle militaire piaflait et hennissait orgueilleusement tandis que la mule du pauvre voyageur marchait humblement la tête baissée et jetant de temps en temps un rcgdid sournois sur le hamais ibnllant de son voisin la matinée était belle aucun nuage ne paraissait au ciel et l air baigne des premières lueurs du joui avait cette tiédeur voluptueuse et parfumée que l on ne respire que dans les climats méridionaux la route se déroulait au loin dans la vallée fermée au couchant par la chaîne des pyrénées a droite coulait l aragon dont une h	voluptueuse	1	1
echo_feuilletons	1845-01-01	2	449	449	NA	NA	NA	NA	non sans peine le bord opposé présentant une berge assez élevée  mais ce fut en vain que le courageux animal essaya plusieurs fois de gravir ce rempart naturel en enfonçant ses pieds dans le sol humide dont il était formé vaincu par la ferce du courant et épuisé déjà par une longue route il s en ailailninsi battant la rive et traînant son maître à la remorque celuici cependant ne cessait de pousser des cris de détresse auxquels répondait seul dans le silence de la nuit l écho de la montagne au moment où il sentait ses furces le trahir et ses mains près d abandonner le singulier soutien que lui avait do pué la providence il lui sembla distinguer des sons humains mêlés à sa propre clameur presque aussitôt un bruit de pas pareil au galop d un clieyal se fit entendre audessus de sa tête  holà lié du fond de la rivière cria une voix du haut de la berge estu homme ou diakle en personne se débattant dans l eau je suis un pauvre chrétien qui se noie répondit l italien avec un accent national fort prononcé  quand tji serais juif ou musulman mon devoir est de te sauver en disant cela l inconnu mit pied à terre se débarrassa de son manteau coupa les brides de sa monture et s avançant résolument sur le bord de la berge au risque de s abîmer à son tour il lança l extrémité de la courroie au pauvre naufragé dont ce secours inespéré ranima les forces en un instant il fut près de son libérateur pendant ce temps le cheval aiusi allégé avait atteint une langue de terre à fleur d eau où il aborda  par saint jérôme mon patron je vous tiendrai bon compte des services que vous venez de me rendre  comme il vous plaira messire reprit l inconnu d un ton indifférent tandis que l italien secouait ses habits trempés après quelques instants de silence pendant lesquels il examina curieusement l italien et son costume  vous êtes étranger lui ditil si j en juge par votre accent et au service de france à ce que je vois  bien plus encore au service personnel qe sa majesté le roi charles ix  dieu veuille que cela vous porte bonheur et profit   je l espère par la morbleu je suis comme une outre pleine et je sens courir sur mon dos un veut bien vif pour ce beau pays des espagnes j aperçois précisément làbas sur notre droite une lumière qui nous promet pour cette nuit un abri dont vous avez plus besoin que moi  en même temps les deux voyageurs en compagnie de leurs montures s acheminèrent pédestrementà travers champs dans la direction d une maison isolée au bord de la route qui conduit à tudela c était une auberge cassez chétive apparence dont l hôte les reçut avec un air d embarras et de défiance que justifiaient suffisamment l heure de la nuit et leur tournure un peu suspecte pressés par la fatigue et par le sommeil ils bornèrent leurs prétentions à une fort maigre collation arrosée d un verre de vin du pays et à un grabat qu ils trouvèrent fort dur et payèrent fort cher le lendemain dès l aube du jour les deux voyageurs se remirent en route pour tudela dont ils n étaient plus éloignés que d une journée le plus jeune montait une mule du pays achetée à la frontière afin d arriver plus vite à sa destination il paraissait avoir vingtcinq ans au plus son pourpoint et ses hautsdechausses de couleur roncée étaient d une étoffe commune les lignes fermes et pures de son visage où régnait une pâleur habituelle révélaient une certaine puissance de pensée et une grande énergie de volonté il s exprimait en français avec pureté l italien par la fierté de son maintien et la richesse de son costume aurait passé plutôt pour son maître que pour son compagnon de route il parlait haut et prodiguait les jurements mis à la mode par les jeunes débauchés de la cour il y avait tout à la fois du fat et du matamore dans sa personne ce qui produisait avec l air modeste du jeune inconnu un contraste non moins frappant que celui qui résultait de la différence de leurs costumes comme il arrive souvent en pareil cas le superbe cheval noir monté par le militaire piaffait et hennissait orgueilleusement tandis que la mule du pauvre voyageur marchait humblement la tête baissée et jetant de temps en temps un regard sournois sur le harnais brillant de son voisin la matinée était belle  aucun nuage ne paraissait au ciel et l air baigné des premières lueurs du jour avait cette tiédeur voluptueuse et parfumée que l on ne respire que dans les climats méridionaux la route se déroulait au loin dans la vallée fermée au couchant par la chaîne des pyrénées  à droite coulait l aragon dont une li	voluptueuse	1	1
journal_des_feuilletons	1845-01-01	1	54	54	NA	NA	NA	NA	dentelles on eût dit un autel élevé tout d un coup par quelque génie à quelque déesse de l antiquité profane a peine la nouvelle tenture futelle posée que d autres domestiques apportèrent plusieurs tableaux précieux de molles et voluptueuses peintures têtes d anges têtes de vierges  le plus charmant pêlemêle de l amour chrétien et du profane amour  sans compter un christ magnifique trouvé dans l ivoire par quelque artiste de florence sans compter les plus beaux marbres les plus riches porcelaines les plus magnifiques vases d argent sans compter la magnifique pendule qui chantait les heures sans compter les glaces portatives sans compter les épais coussins sans compter tout ce luxe grand et petit noble et frivole enfin ce luxe à part ce luxe de quelques heureux des siècles ce luxe qui est le luxe des rois ou plutôt qui était le luxe des rois luxe de la plus belle époque du luxe le seizième siècle le siècle de françois ier je vous laisse à penser si le jeune comte de rochetaillé fut ébloui à l aspect de ces magnificences qu il n avait vues encore nulle part pas même dans les mille et une nyits cet idéal de l orient notre jeune homme qui se croyait riche n avait jamais pourtant rien vu de si riche même dans ses rêvescequi ajoutait encore à sa stupeur c était la rapidité incroyable de tous ces changements  c était l arrivée spontanée de toutes ces merveilles qui venaient se poser là en même temps et à la fois chacune à sa place et sans confusion comme si elles en avaient reçu l ordre de quelque fée ce qui l étonnait encore c était surtout le zèle et le silence des serviteurs empressés qui avaient envahi cette maison tout d un coup et qui l avaient métamorphosée ainsi en un clin d œil voilà ce qui se passait dans cette chambre à coucher dans les autres parties de la maison la même révolution s opérait presque avec le même silence les marches des escaliers se couvraient de tapis et de fleurs  tous les vieux lits se couvraient de duvet et de linge plus fin que la soie les cuisiniers si longtemps oisifs allumaient leurs fourneaux les buffets se remplissaient de vins exquis toute la maison se remplissait de richesses d éclat de propreté d élégance bientôt le sombre monument fut illuminé du haut en bas et l éclat de mille bougies réverbera sur la place saintmarc ceci dura à peine trois heures au bout de trois heures tout était prêt entièrement  la maîtresse de ce riche palais pouvait venir le comte de rochetaillé restait muet à toutes ces merveilles nul ne lui avait adressé la parole au milieu de ces préparatifs il était si près de la cheminée qu on ne l avait même pas dérangé pour poser le tapis de la chambre un esclave respectueux avait attendu qu il se levât pour remplacer par un sofa oriental le vieux fauteuil sur lequel il était assis puis le vieux fauteuil avait disparu comme les autres rochetaillé croyait alors que la chambre où il se trouvait était complète et il n imaginait pas qu on pût rien y ajouter cependant à chaque instant de nouveaux do mestiques entraient apportant de nouvelles richesses qui trouvaient leur place à çôté de toutes ces richesses l un d eux surtout un homme âgé qui portait un habit de velours noir et sur sa toque une plume noire se présenta tenant à la main un portrait de femme et une épée le vieillard déposa l épée sur le marbre de toilette puis il	voluptueuses	1	1
journal_des_feuilletons	1845-01-01	1	88	88	NA	NA	NA	NA	ses promenades étaient d ordinaire aussi tristes que son intérieur il allait pour ne pas rencontrer des visages froids ou moqueurs parcourir la plage sablonneuse coupée de précipices et habitée seulement par les oiseaux marins  là sa distraction était de déchiffrer des caractères runiques sur les pierres laissées dans ces sables par les danois un jour il se dirigea vers une prairie placée devant la demeure seigneuriale peu éloignée de la sienne  c était la fête du saint de l endroit cette prairie coupée par la petite rivière de liuow et semée de taillis verdoyants était garnie de jeux de bagues de tirs à l arbalète des tréteaux avec des ménestrels et des jongleurs assis sous des bouquets de lilasqui s étaient décidés à porter quelques grappes au mois de juillet des paysans riaient et chantaient en vidant des pots de bière et des outres de vin de france débarquées nouvellement le jeune prêtre éprouva un sentiment d envie la boisson étrangère n avait qu une seule fois satisfait sa sensualité et le souvenir de sa vive saveur tourmenta ses lèvres il voulut goûter aussi de ce vin dont la tiédeur de l air redoublerait encore le charme ne pouvant se mêler aux groupes des paysans il alla se placer après avoir fait les provisions de son festin dans un endroit caché par un angle du jardin du château il s assit sur un tertre de gazon ombragé par des branches d ébéniers qu il arrondit audessus de sa tête et la joie de ce banquet improvisé augmentée encore par de si longues privations et tant de vains désirs ne tarda pas à lui apporter sa légère ivresse il était à son dernier verre quand un archer de la maison de sir amyas pawlet le maître du château et le seigneur du lieu déboucha de la haie et lui demanda brutalement ce qu il faisait en cet endroit wolsey ne répondit rien et pâlit de colère  vous vous êtes établi bien à l aise sur les terres de milord messire abbé reprit l archer en brandissant sa hallebarde comme pour chasser le prêtre celuici saisit l arme et repoussa violemment le soldat le maître du château parut au même moment amyas pawlet était alors âgé de trente ans  il avait passe sa jeunesse dans les camps et venait de les quitter pour recueillir dans la province de suffolk le duché de son père il était beau de figure  mais avec ses cheveux d une couleur ardente sa longue moustache relevée sa taille athlétique et cambrée il semblait que sa beauté fut faite pour le champ de bataille et non pour le salon sir pawlet d un caractère ouvert d un esprit audacieux avait tout le cynisme des vices qui caractérisaient la noblesse dutemps il demanda à l archer des informations sur ce qui s était passé et après les avoir reçues s adressant à wolsey    il paraît messire abbé ditil que vous connaissez mieux votre droit canon que les arrêts de nos maîtres du parlement car vous sauriez qu on ne va pas de son autorité privée s établir sur les terres d un seigneur et couper les arbres de son jardin  a moins répondit l abbé qu on ne suive l exemple de ce seigneur qui en tout lieu se met à l aise comme chez lui et s approprie ce qui est à sa convenance  avec cette différence reprit sir pawlet que le noble ne peut usurper puisque toutes choses lui appartiennent dès qu il peut les atteindre avec son titre ou son épée apprenez cela messire  je n ai pas lu dans la genèse que dieu ait créé le troisièuie jour la terre et ses produits pour les lords de la grand chambre je crois qu il	sensualité	1	1
journal_des_feuilletons	1845-01-01	1	101	101	NA	NA	NA	NA	tentez pas à sa vie il est si facile de tuer  laissez ce vulgaire moyen de répression à ceux qui n en ont pas d autre au service de leur intelligence celui qui tue n a jamais raison aux yeux de la postérité songez d ailleurs que sir pawlet a été mon hôte aux jours de l exil s il vous a persécuté il m a sauvée  oh pardon pardon catherine  j aurais dû m en souvenir qu il vous doive donc la vie dûtil s en servir contre moi v toute circonstance devait servir de prétexte à quelque fête autour d un jeune roi qui ne prenait même de la royauté que les faciles plaisirs qu elle procure wolsey était trop bon politique pour ne pas faire boire et danser sa majesté à l occasion de la haute dignité dont il venait d être revêtu après les cérémonies pieuses les réjouissances profanes il pria donc sa majesté d honorer de sa présence la fête qu il lui préparait dans son magnifique château de namptoncourt ce fut là que sa majesté daigna promettre de porter ellemême à son favori le grand sceau de l état pendant une de ces rares journées de soleil qu on appelle en angleterre glorious day jour glorieux ce palais ouvrit donc toutes ses portes devant henri viii qui arrivait suivi de toute sa cour le maître du lieu s était plu par une recherche de sensualité à varier pour ainsi dire les séjours dans le même séjour le roi fut reçu et complimenté dans une salle d un style majestueux et sévère qui rappelait par le genre de ses décorations l archevêché d yorck sur les lambris le marbre avait imité les productions les plus remarquables de ce riche comté le cardinal proposa ensuite à remi viii de quitter l angleterre et le conduisit dans ce qu il appelait son évêché de badajoz endroit destiné à représenter les deux diocèses qu il possédait en espagne c était une longue galerie soutenue par des arcades de marbre rose et ouverte sur un jardin on était vraiment là dans les campagnes de l estramadure où la terre qui se couvre deux fois de moissons et toujours de fleurs recèle encore des carrières de marbre les quinconces étaient composés d oliviers et d orangers et dans les parterres s épanouissaient toutes les belles plantes d espagne toute cette nature méridionale était protégée par des vitrauy contre la température de ce ciel brumeux et recevait la vie et la chaleur non du soleil mais de l art pendant la journée les femmes de la cour se répandirent dans le parc la plus jeune des dames d honneur la charmante anne de boleyn suivit solitairement un défilé de verdure et arriva comme par hasard devant le bassin d une jolie fontaine elle s y mira s amusant à poser avec complaisance sur son front une branche de chêne qu elle arrondissait en forme de couronne  elle vous irait bien dit alors une voix derrière elle anne se retourna et vit henri viii  sire ditelle en rougissant beaucoup je ne pensais qu à une couronne de feuillage  c est la seule à laquelle une pauvre file puisse prétendre henri sourit de voir comme la jeune fille avouait naïvement sa pensée la plus secrète en voulant la mieux cacher  votre front embellirait toutes les courounes repritil celles des reines comme celles des plus humbles bergères  sire ne flattez pas trop votre sujette les louanges d un prince donnent trop d orgueil  non	sensualité	1	1
journal_des_feuilletons	1845-01-01	1	356	356	NA	NA	NA	NA	savezvous que vous me faites trembler en me parlant avec ce sérieux de dangers et de mort  comment dans notre siècle la passion irait à ce point  vous faites de mme de saldiva une vraie marguerite de bourgogne  avec cette différence pourtant que les fantaisies de celleci ne duraient qu une nuit tandis que vous pâtissez depuis deux ans  dans la peinture la plus monstrueuse des excès de la passion il y a toujours un reflet humain un accent de nature et c est là sans doute ce qui fait le succès de cette terrible fable de la tour de nesle elle est plus vraie qu on ne pense  ces types qui paraissent exagérés à votre société polie et disciplinée sont loin d être sans modèles dans le monde si je pouvais tout vous dire  oh  ditesmoi tout vous pouvez être assuré de ma discrétion don claudio alla écouter à la porte et à la croisée puis revint s asseoir tout près de moi nous étions l un et l autre appuyés les coudes sur la table séparés par la lumière qui éclairait vivement les traits bouleversés du chanoine  vous m accusez peutêtre intérieurement de libertinage et de corruption votre délicatesse s est sans doute blessée plus d une fois du spectacle d un commerce illégitime entre un ecclésiastique et une femme de la société je ne m excuserai pas en prétextant la tolérance de nos mœurs pour ces sortes de relations  vous avez dû vous apercevoir qu il est peu de religieux à la havane qui n entretiennent en ville une ou plusieurs maîtresses et la plupart d entre eux se montrent chez ces femmes sans rougir mais la dépravation d autrui ne doit pas servir de manteau à la mienne et j ose croire que ma conduite serait restée sans reproche si la fatalité n eût conduit cette femme sur mon chemin lorsque j embrassai les ordres j étais plein de piété et d ardeur je voulus d abord être prêtre et j officiai en cette qualité à la cathédrale je fis plusieurs prédications qui attirèrent une grande foule  les dames de la haute société à cause de la parenté et de l amitié qui me lient à beaucoup d entre elles mirent un grand empressement à venir m entendre et je dois dire que je jouis pendant un certain temps d une vogue comparable à celle des plus grands prédicateurs vous connaissez l engouement exalté de nos créoles  à leurs yeux je n étais rien moins qu un nouveau massillon un moderne lascasas mme de saldiva devint une des plus assidues à ces prédications  toujours assise à la même place au pied de ma chaire ses yeux attachés sur les miens dévoraient mes paroles et suivaient les moindres fluctuations de ma pensée je m étais habitúé à là voir et flatté d une attention aussi dévouée aussi persévérante  je lui adressais en quelque sorte à mon insu la plus grande partie de mes oraisons j avais  tonné contre le luxe  mne de saldiva qui déployait alors une opulence princière changea subitement son train de vie cessa de donner des fêles se vêtit de noir et passa ses journées à visiter les hôpitaux et les maisons des pauvres on ne manqua pas de m attribuer ce merveilleux changement et quelques langues malicieuses s empres sèrent d ajouter qu il entrait quelque chose de plus que de la charité évangélique dans l humilité de cette fière personne ainsi que dans les nombreuses aumônes qu elle j répandait autour d elle je repoussai avec incrédulité ces insinuations comme indignesj de la marquise et de moi  pourtant un jour  une pénitente voilée se présenta à men j confessionnel  c était elle mme de saldiva elle demeura longtemps troublée sans pouvoir articuler un mot  on eût même dit jj	libertinage	1	1
