work	date	issue	page	block	height	width	hpos	vpos	text	active_words	occurrences_words	unique_words
croix	1902-07-31	1	3	Page1_Block5	3039	809	172	217	{« ots t fefrjvi e ! )) ' on nous révélait ces jours-ci qu’il existe un foumalehez tes. esquimaux. h en existe, plusieurs chez les apaches. savez-vous la rubrique spéciale qu’un organe ministériel a imaginée pour rendre compte des: attentats contre las écoles et les fournées d’enfants jetés à la rue? ce journal s’inspire dit cri que poussent les: gardiens des musées au moment où ils font; sortir le publie et répète gaiement: a on ferme i on ferme! » nous voudrions que cette bruyante ironie fût plus bruyante encore, et que tous les pères de famille dépouillés du droit de faire élever leurs enfants £ leur guise, toutes les mères occupées j£ disputer leurs filles au ruisseau qui les 1 guette, pussentbondirsous cet outrage sanglant. ah oui! socialistes, mentors du peuple, encenseurs des prajétairés, verseurs de larmes sur le sort des faibles et des petits, ça vous kmuse beaucoup qu’ « on ferme ». c’est excessivement drôle de voit des petites filles jetées. sur le trottoir. c’est un spectacle tout à fait récréatif que celui de ces saintes femmes ignoblement arrachées par la police aux pauvres petits êtres dont elles cultivaient l’esprit avec tant de zèle et l’âme avec tant d’amour! ah t oui i c’est très drôle 1 « on ferme 1 on ferme ! » c’est £ se tenir les côtes ! « on ferme! on ferme t » jamais las classes laborieuses n’ont été à pareille fête et les droits des citoyens mieux sauvegardés. « on ferme! on ferma 1 » ils riaient moins fort, ce* * hommes heureux, lorsque le gouvernement, il yi a quelques innées, fermaient la bourse du travail. le ton bur lequel ils criaient alors :« on ferme i *était tut peu différent. ce n’était pas le rugissement de joie, mais le rugissement de furet».. aujourd’hui, on ne ferme pas les locaux où ce complote la grève générale, où s’organisent les violences systématiques des grèves, où se préparent les émeutes et les:a communes.»de l’avenir. t les locaux qu’on ferme, ce sont ceux où ttne femme en cornette, sur la demande expresse des familles, fait épeler des enfants du peuple, en leur apprenant qu’iis doivent aimer dieu, respecter la propriété, se dévoueràla patrie qu’une de ces saintes filles; par impossible, bit la diabolique pensée de se faire politicienne; -qu’etle revienne dans son école pour y trans- 5 ônner la chaire en tribune, et pour proclamer, à la suite des louise michel.pt des paule minck, ou’il faut « chambarder » là société, spolier ■tous les propriétaires, « crever le paillasson. » fux bourgeois : dès lors, je vous le garantis, fis local ne sera plus de ceux qu’ « on terme ». la police, respectueuse, demeurera à la porte de in salle, et renseignement qu’on y distribuera au peuple sera tenu pour sacré. ùs tout n’est pas dit, ex les ricaneurs n’auront pas le dernier rire. « on n’a que les libertés que l’on prend », a dit un: homme d’etat. ajoutons t «et celles que coït reprend. » les catholiques, à mesure* qa’oa leur prend, sauront reprendre. a mesure qu’on, les fait sortir, ils sauront rentrer. s’il plaît au gouvernement de faire gagner tes fabricants de cire, il ne nous , -est pas défendu de fane gagner les marchands de grattoirs. an hurlement des.sauvages :.«on ferme i on ferme?» les pères de famille, appuyés sur leur droit, sauront opposer le mot d’ordre tenace et général < « on rouvre? on rouvre 1 » ' diego.	coït	1	1
lanterne	1902-07-31	2	2	PAG_00000002_TB000137	684	1026	4656	3385	je me félicitai de ma courageuse persévérance en la voyant réapparaître toute frissonnante dans un ample et long vêtement de soie noire, touchant symbole sans doute de l'ewdeuillement de son cœur et de sa vertu reconnaissante qu'elde gardait fidèle au disparu; soit négligence, soit intime coquetterie, elle nen avait point attaché le col, et, sur le brillant de l'étoffe, les chairs lactescentes de la poitrine resplendissaient : il s'en échappait comme une buée chaude de vie et de sensualité qui synthétisait tout le pouvoir dominateur de la femme, toutes les étranges et diaboiliques perversités de la tentatrice.	sensualité	1	1
debats	1902-08-01	1	3	P3_TB00003	5338	933	1230	263	1 qu'à titre seulement intérimaire, dans une chaire d'un lycée de province, au début du second empire. ce condisciple de m. taine, à l'institution lemeignani fut jules vallès. rien de plus curieux que de reprendre, au sortir de la correspondance, les pages de jacques vingtras, où le maître de pension est peint sous le nom caricaturalement déforme de legnagna. vallès n'a pas l'espirô depuis vingt-quatre heures l'air de la maison, qu'il la hait déjà, de cette violente et implacable haine dont son style au vitriol est comme corrodé. taine écrit à son professeur pour lui annoncer son prix d'honneur au concours général : « sans vous je n'aurais eu ni ordre, ni clarté, ni méthode... » vallès gémit: « comme ce latin et ce grec sont ennuyeux! qu'est-ce. que cela me fait, à moi, les barbarismes et les solécismes ?... et toujours, toujours le grand concours! » de ses professeurs, il crayonne une charge féroce : celui-ci marche en canard, il a l'air de glousser quand il rit. a cet autre, il rêve de prendre les oreilles et de « faire un nœud avec ». enfermés dans la salle de composition du concours, un élève de charlemagne et lui brûlent du punch et grillent des saucisses. il se souvient d'un répétiteur de jauffret qu'il a vu laver son mouchoir dans la seine. a quoi bon composer? « pour être répétiteur, comme cet homme, et devenir laveur de mouchoirs sous les ponts!... » que c'est bien le même homme qui, plus tard, chargé d'une suppléance à gaen, s'amuse à blaguer devant ses élèves stupéfiés : « messieurs, le hasard veut que je supplée votre honorable professeur. je me permets de ne pas partager son opinion sur le système d'enseignement à suivre. mon avis, à moi, est qu'il ne faut rien apprendre, rien de ce que l'université enseigne. je pense être utile à votre avenir en vous conseillant de jouer aux dominos, aux dames et à l'écarté... » tableau! » conclut-il. « le soir même, j'ai reçu mon congé... » et en route, hors de la place où son orguel et sa sensualité saignent trop fort pour 'aboutir, à travers des années de quotidienne colère, au matin sinistre du 18 mars 1871. « alj lons, c'est la révolution ! la voilà donc, la mi; nute espérée et attendue, depuis la première cruauté du pion... voilà la revanche du collège..,» ne riez pas, les dédicaces successives des trois volumes, d'abord «a tous ceux qui crevèrent d'ennui au collège »; puis «a tous ceux qui, nourris de grec et de latin, sont,morts de faim »', et, pour terminer, « a tous ceux qui, victimes de l'injustice sociale, prirent les armes contre ce monde mal fait », jalonnent, comme trois bornes tragiques, le chemin suivi par le fils du paysan, imprudemment éduqué, vers la bande ' imbécile d'utopistes sanguinaires qu'il appelle magnifiquement « la grande fédération des douleurs ». les admirables lettres de stoïcisme résigné du jeune taine marquent la première étape du grand bourgeois français vers cette haute doctrine de défense sociale que son dernier ouvrage a si magistralement ramassée. il n'a eu qu'à creuser 'cette notion antique et vénérable de propriété, et il y a trouvé ce qu'y trouvera tout réaliste sincère, l'abrégé même de toutes les lois de la santé nationale. c'est la différence radicale entre ces deux types d'hommes, qu'en présence de la répartition des biens de toute sorte qui sont le vaste héritage de la civilisation, le révolutionnaire-né dise aussitôt : « pourquoi ces joies à celui-ci, et pas à moi? » et que le conservateur-né réponde : « parce qu'elles sont à lui ». il n'éprouve pas le besoin de justifier un privilège qu'il admet comme la donnée élémentaire et irréductible de la nature sociale. mais précisément parce qu'il attache une importance souveraine à ce droit de propriété, un taine est amené à considérer la vérification stricte des titres qui confèrent ce droit comme la première condition de l'ordre public. quand il attribuait au suffrage universel ce jus utendi et abutendi, il admettait que l'ensemble des acquisitions humaines qui constitue un pays appartenait en toute propriété aux habitants actuels de ce pays. en fût-il ainsi, la majorité n'aurait encore sur la minorité qu'un droit restreint par le droit de propriété de cette minorité. a l'époque même où il acceptait le suffrage universel, m. taine posait fermement cette limite. il écrivait à paradol, peu après le coup d'etat : « remarque pourtant qu'il y a des restrictions à cela, que je les faisais déjà auparavant contre toi, et que je refusais à la majorité le droit de tout faire que tu lui reconnaissais. c'est qu'il y a des choses qui sont en dehors du pacte social, qui partant, sont en dehors de la propriété publique. » cette seule petite phrase enveloppait une condamnation radicale de la tyrannie révolutionnaire. mais est-il même exact qu'un pays soit, dans l'ensemble de ses richesses accumulées, la propriété de la génération présente? dans un passage cité plus haut, on a pu voir quelle valeur m. taine attachait à l'action de léguer. or, le legs, conçu comme un droit essentiel du propriétaire, comporte la faculté de transmettre ce que l'on lègue ainsi, sous conditions. il suit de là que les titres de propriété de la génération présente peuvent être grevés de différentes charges qu'elle n'est pas libre de négliger. les morts ont leur part de propriété dans la propriété des vivants. ceux-ci n'ont le droit de modifier les institutions que ceux-là ont fondées que sous la réserve de respecter lés volontés formellement exprimées des fondateurs. en outre, les.morts n'ont pas seulement légué le résidu de leur effort à tous les vivants actuels, ils l'ont légué à tous les vivants à naître.	sensualité	1	1
temps	1902-08-01	1	2	Page1_Block7	3660	916	1160	566	lîhote discret ...— c’est une chose certaine, mon cher, me âittoolonmès, -qui-parlait voluptueusement fin nez à travers sa pipe : la patrie de l’héroïsme ■estici. c’est prouvé depuis le temps des cami- sards et d’estelle et némorin. lüstelle, némorin et cavalier, le chef des cami- sards, ssrrt ies trois gloires qu’on révère au pied des cévennes, sur les bords des deux gar- dors, celui d’anduze-et-oelui ë’alais. et ne-dites jamais aux habitants de ners, ou de lédignan, ou de savignargues, ou de maillane, qu’estelle et némorin n’ont pas existé. ils ne vous croi- raient,pas et vous passeriez pour un mauvais esprit, capable de tout, même de voter pour le candidat réactionnaire. j’éiais d’autant (moins disposé à-discuter que, dans l’eau jusqu’aux épaules, et nu comme la main, je me trouvais fort affairé à pousser des pieds et du ventre, à travers une mare qui subsistait dans : le lit du gardon desséché, la poche d’un long filet dont touloumès, sur une rive, tirait nonchalamment l’extrémité droite. l’extrémité‘gauche était tenue, sur l’autre rive, par un personnage (dont le nom et l’aspect avaient fait sur moi l’impression la plus profonde. tbu- loumèsime l’avait présenté 'comme ■« le monarque». le ‘monarque portait des espadrilles sur ses pieds sans chaussettes, on vieux pantalon retenu par une ficelle rouge, etsa chemise de flanelle, qui n’était .pas fraîche, n'avaient.plus de boutons. mais il (était rasé de 'frais, et .si miaee, vif et déhanché, dans son indolence, qu’il me fit penser à unlévrier au repos. — gardez-vous, ‘fit-il en tournant vers moi sa bouche fine aux dents très blanches. il y a mn trou au milieu de la mare. ■je plongeai, fier de montrer mes talents -de nageur, m'appliquant à tenir les-plombs du ,fî- leteontre-les galets,-par deux mètres>de«fond.et quand j’eus fait sortir la poche du trou, et >que j’eus pied, je me redressai avec vanité. — tu ne loi ifais ipas seulement mettre les pieds dans l’eau, à ton héroïsme, dis je a tou- loumès. — c’est pour .te faire plaisir, répondit-il. .$a t’amuse de patauger. ■c’est vrai que j’.v allais de toute mon âme de parisien : .il non est pas au monde de plus pure. on m'avait dit qu’au fond -de cette flaque ’se cachaient des brochets gros comme ma jambe, des perches comme mon bras, et même «des bêtes qu’on ne savait pas ce que c’était. » mais sur tout l’eau était bonne.ee qu’on appcllebonne: plus fraîche.que fair, assez tiède pourtant pour ne-pas glacer le corps, et point croupie, parce qu’elle communiquait avec les ‘courants ca- ■eliés qui continuent à filtrer dans -les profondeurs quand’le soleil ’a bu tes rivières -de ta surface. sous mes pieds nus les galets noyés restaient chauds, demeurés en contact avec ceux de la berge, avec les rocs surchauffés des «collines, avec-toute la terre ivre -de soleil. parfois des racines -de saule, souples -et chevelues, s’enroulaient autour de moi, exprès, je l’aurais juré, et j’en frissonnais d’inquiétude et de plaisir. de très petitspoissons, qui n’avaient rien à craindre des larges mailles du piège, et que ce remue-ménage amusait, jout simplement, venaient me picoter les jambes, du .bout de leur tête pointue. et j’étais -heureux comme un sauvage ! voilà -pourquoi je méprisais la paresse de touloumès. avec de voluptueuses lenteurs, ■jlallai ijusqulau bout (de ma tâche- lefiiet attei- gnit l’autre bout ‘de la mare, et nous ramenâmes doucement à terre, en ayant bien soin de tenir les plombs en dessous. '(pêcheur, parle bas ! le roi des mers .ne t’échappera .pasl hurla touloumès). mais il nous échappainsolemment, et.clest.naus qui fûmes attrapés ; sept ou (huit goujons, trois chevesnes, une douzaine et demie d’ablettes : en tout une petite livre de mauvaise blanchaille. c’était pour ce beau résultat que j’avais « pataugé •» pendant une heure. — et les brochets ? et les perches ? .fis-je avec indignation. — tu ne -les a pas vu filer? -dit froidement touloumès. ah l -les crapules l un brochet d’au moins huit livres ! glestta faute : tu (n’as pas su ■bien garder le fond. 3e haussai les épaules sans répondre.	voluptueuse, voluptueuses	2	2
temps	1902-08-01	1	3	Page1_Block2	7614	962	1120	286	cette passion pourïssre d’adolphe thiers l’avocat des aspiration* et'des droits de l’italie ; il le fut en effet à -ce moment-là. la pensée patriotique dominait tontes les autres dans le cœur de cristina belgiojoso et il faut tenir compte de ce fait moral lorsqu’on juge .sa personnalité. un jour, dans une des salles delà chambre ides .députés, a paris, elle improvisa un discours éloquent en faveur de l’italie. cette femme, jeune, belle, diaphane, le front nimbé de taurëole du malheur, hypnotisait ceux .qui l’écoutaient. on aurait dit une sibylle prophétisant l’avenir de la patrie. son étonnante pâleur, cette pâleur qui, seton george sand, « divinise la beauté des femmes », lui donnait quelque chose d’irréel ; elle semblait une vision de l’italie martyre. ce fat par ces moyens qu’elle attira .l’attention de paris et .en conquit l’âme. la princesse belgiojoso commença par fréquenter plusieurs salons importants, enlr’autres ceux du général de la fayette et de mme récamier. mais elle détestait les protections et voulait régner dans son propre royaume. les rigueurs de l’autriche s’étaient adoucies peu à peu; la proscrite re- scev&it de. fargent de milan pelle put alors quitter sa mansarde, prendre un appartement convenable, rue d’anjou, 29, et en ouvrit les portes toutes grandes à ses amis de franco et d’italie. tondu et meublé en velours brun, presque noir, pointillé d’étoiles d’argent, son salon avait l’aspect d’une chambre ardente dont elle semblait ia morte par sa pâleur, qui devenait livide le soir, et son corps émacié. quand les visiteurs de la princesse arrivaient chez elle, ils la trouvaient souvent agenouillée sur son prie-dieu, une tête de mort à ses pieds. mme d’a- goult, qui n'aîmait pas la belle lombarde, — la nature .les avait créées rivales, — .disait d’elle : « bâle, maigre, osseuse, avec des yeux flamboyants, elle jouait au spectre et au fantôme ». certes il entrait un peu de cabotinage dans cette mise en scène, ) maïs ce que ce cabotinage pouvait avoir de mesquin •en lui-même disparaissait dans la grandeur du but poursuivi; cristina belgiojoso voulait, à travers sa personne, frapper l’imagination de la france et ■provoquer la générosité en apitoyant les coeurs sur le martyre de l’italie; et, pour atteindre ce résultat, elle employait les moyens que son cerveau fantaisiste lui suggérait. presque tous les grands écrivams français allaient j chez mme belgioioso; dumas père, victor hugo, j stendhal y étaient assidus. balzac prétend qu’elle servit de modèle à ce dernier pour la duchesse de sanseverina dans la chartreuse de parme. « la duchesse de sanseverina, disait-il, c’est diane avec la volupté de vénus, avec la suavité des vierges de raphaël, avec la passion italienne ». cependant il n'aimait pas la princesse belgiojoso et écrivait à mme hanska en pariant d’elle : •« elle aie bonheur de, me déplaire ». laprade au contraire croyait trouver en cristina « une âme sœur », chateaubriand lui aussi subissait le charme et rendait justice àla valeur du « sphinx lombard ». la maison de mme belgioioso était naturellement •ouverte à tous les proscrits italiens de marque; \ pellegrino rossi mamiani, gioberti, amsii,' mas- sari y venaient souvent. rossini et beliini fréquentaient, leux aussi, ce .salon célèbre. un jour., de passage à paris, camilie de cavour arriva inopinément ■chez la princesse patriote et la trouva faisant tourner des tables. tout oe qui était nouveau et étrange attirait cette imagination fiévreuse, sans cesse prête à s’enflammer. mais si cristina trivulzio prenait feu facilement pour les idées, il n’en était pas de même pour llamour. les nombreuses, passions malheureuses qu’elle iinspira -en sont îa preuve. arsène uoussaye disait d’elle : 'cette grande dame, qui avait tout pour elle, n'était pas bien sûre d’avoir un cœur, car elle n’avait que la passion de l’esprit-, elle voulait bien qu’on se donnât à elle, mais elle ne se-donnait pas. elle servait avec une grâce adorable le festin de l'amour, puis elle s'envolait au moment de se mettre à table. ■alfred de musset «n fit l’expérience. a liane de leurs premières rencontres, raconte m. barbiera, pendant une promenade dans le parc de versailles, la princesse demande au jeune homme de lui réciter des vers. des strophes amoureuses viennent aux lèvres du poète et aussitôt il veut les transfert tner en actes. l’italienne le repousse, il tombe et se blesse. elle le garde chez elle, le soigne et il en devient amoureux. « elle avait des yeux terribles de sphinx, si grands, si grands que je .m’y suis .perdu et ne me retrouve pas. » r ne s’y retrouva jamais, car si elle le soigna tendrement, elle ne lui accorda rien. un autre-poète, henri heine, aurait pu raconter à peu près la môme histoire. il lui écrivait-: « j'embrasse .votre belle main, vous êtes la personne la plus complète que j’aie trouvé* ®ur la terre. » mais il eut plus de bon sens que musset et, comprenant qu’il ne seraitjamais aimé, transforma son amour en amitié. le cas des toux poètes .se renouvela souvent, car cristina belgiojoso .fut tune des grandes coquettes da siècle. en pensant à ce qu’on fit-pour lui plaire, les vers de larochefoucauid : surmmede longueville reviennent à l'esprit: pour mériter son cœur, pour plaire à ses beaux yeux, j’ai -fait la guerre aux rois, je l'aurais faite aux dieux. cependant jeune, libre, imaginative, la princesse cristina ne pouvait rester indéfininientglaciale dans l’atmosphère passionnée qui l’entourait. parmi beaucoup de soupirants éconduits,, «lie distingua françois mignet. malgré son origine populaire, l’historien de charies-quint ressemblait à un châtelain d’autrefnis .avec sa noble figure, sa taille majestueuse, ses façons douces et dignes. entre lui et la belle exilée l’amitié intellectuelle précéda le sentiment plus tendre. la vie les sépara et mme belgiojoso connut d’autres passions, mais ils ne s’oublièrent jamais. mignet, dans sa vieillesse, parlait encore avec attendrissement de la grande italienne que tout paris avait aimée 3 l’on se tromperait donc en accusant mme belgiojoso d'avoir manqué de cœur. certes, tumeur de la patrie et delà grandeur, joint :à un besoin-insatiable d’admiration, furent les véritables dominateurs de sa vie, mais elle connut cependant l’affection et l’amitié. les .soins touchants dont elle entoura la icécité d’augustin thierry en sent la preuve. quand l’ho- mère de l’histoire, aveugle et paralytique, fut-de- venu veuf, elle l'installa dans un chalet de son jardin, et sa sollicitude pour l’ami malade la faisait passer du rôle d’infirmière à-celuide consolatrice intellectuelle et morale. la princesse à cette époque n’habitait plus rue d’anjou, mais rue montparnasse, et s’était réconciliée avec son mari qui occupait le rez-de-chaussée de sa maison. le soir, le prince emilio montait dans le salon de sa femme. toutes les-célébrités musicales de tépoque s’y donnaient rendez-vous : rossini, meyerbeer, chopin. beliini,—le soupir en escarpins—comme —comme l’appelait henri heine, la grisi, mario, th ilborg dœhler et plusieurs autres. on faisait de îa musique, le prince emilio chantait avec sa voix charmante. ce fut l'époque inoubliable -du salon belgioioso. les grands peintres, les écrivains -célèbres, les hommes politiques les plus en vue s’y rencontraient. la diaphane -princesse les retenait sous son charme mystérieux ; elle avait la sensualité de l’âme, cette attirance invincible ! les femmes la subissaient aussi : george sand, lady blessing- ton, mme de boigne furent ses amies. naturellement elle compta aussi plusieurs ennemies dont les plus acharnées étaient ï ja -comtesse merlin, mm® d'agonit, mme de girardin et d’autres, mais le rayonnement de cristina était si puissant qu’il dissipait les -ombres-que la jalousie essayait de répandre sur sa route. in la réconcîliation.des époux belgiojoso .dura autant que leur première lune de miel. un beau jour., paris étonné apprit que le prince emile avait enlevé la belle duchesse de plaisance et que les deux fugitifs s’étaient réfugiés à la villa pliniana sur le lac de gôme. ils vécurent là pendant huit aus, prisonniers volontaires de l’amour. c’était un cas de passion violente, inéluctable; ia blonde anna-maria .fut la première à se lasser de l’extase solitaire. inconsolable amant, le prince. emilio me .se rele va jamais de cet abandon. l’amour l’avait éloigné delà politique, le chagrin ne. devait pas l’y ramener» cette défection do son complice en conjurations sembla décupler l’ardeur patriotique de la princesse cristina. elle pensait, non seulement â la libération de la patrie, mais à -celle des .classes .ouvrières qu’elle voulait sauver.de l’exploitation et de da misère. en 1845, elle fonda à paris un journal italien .sous le titre : .g.azzella xtaliana. rentrée en lombardie pour essayer de recueillir les fonds nécessaires à son entreprise, la misère des paysans l'émeut, elle ouvre des cuisines économiques, .des chauffoirs publics, fonde des écoles enfantines... si la princesse belgiojoso vivait à notre époque, demande m. barbiera,-serait-elle socialiste? et il j dite une lettre d'elle, sans adresse et sans date, ) trouvée ala bibliothèque -nationale de parie, -.où elle écrit que « la société .organisée .telle qu’elle est aujourd’hui est une -protestation éclatante contre la justice de dieu, protestation qu’il est urgent de faire cesser •».. -de temps à -autre, pour se distraire de la vue de tant de misères,, la belle cristina-allait à milan. toujours préoccupée de la -mise en «cène, ua «oir, chez la duchesse melzi. «lie apparat svélae .de	sensualité	1	1
justice	1902-08-02	1	2	PAG_00000002_TB000013	103	550	134	4063	rpudence. le président ëu conseu» au uy> ahent môme où ils prêtaient leur levée i<î© uewclmms, quaitd ils a'ihaimrt en- coït dans la rue, leur iup$>elau	coït	1	1
gil_blas	1902-08-04	1	2	PAG_00000002_TB000018	869	1046	405	6114	paul d'arlao était bouleversé par' l'émotion la plus vive et la plus voluptueuse en même temps. son rêve de la veille, fci brillant. pourtant était indéfiniment dépassé par la réalité de l'heure présente. son orgueil était satisfait. cette carmen idolâtrée n'était-elle pas en effet à lui, bien à lui, toute à lui ? n'était-ce pas pour lui qu'elle, avait déployé tant de grâces et de séductions, qu'elle avait imis tant de douceur dans sa voix et de maëstria dans son jeu ? sous ces poussées de la vanité, sa poitrine se dilatait avec force et une sorte de mépris s'était emparé de lui pour le reste du monde, qu'il dominait de toute la hauteur de	voluptueuse	1	1
