work	date	issue	page	block	height	width	hpos	vpos	text	active_words	occurrences_words	unique_words
gil_blas	1884-09-03	1	1	PAG_00000001_TB000033	2107	1052	1308	3726	on nous dit, il est vrai, que le caractère délictueux d'un écrit tient aux mœurs du temps où il a paru. les libres athéniens, les romains corrompus, les hommes du seizième siècle, enivrés de la renaissance, les gens de la fin du dix-huitième siècle, pleins d'un libertinage d'esprit qui date de la mort de louis xiv, n'étaient pas choqués par des façons de penser et de dire qui blessent nos délicatesses. en ce cas, la doctrine de la justice doit avoir pour base solide la connaissance de nos moeurs. c'est là le nœud et le vif de la question. cette juste connaissance de nos mœurs, l'a t-elle.eue? l'a-t-elle aujourd'hui ? pour le passé, la réponse n'est pas douteuse. depuis la révolution, en matière de répression littéraire, le pouvoir n'a obéi qu'à des considérations de politique. le premier empire laissait vendre au palaisroyal les érotiques du dix-huitième siècle et ne permettait ni de jouer ni d'imprinwr une innocente tragédie d'a. duval, edouard d*ecosse, sous prétexte que cet edouard ressemblait au duc d'enghien. ajoutons de suite que la restauration se hâta. de proscrire la même tragédie : edouard ne rappelait plus le duc d'enghien, mais le duc de reichstadt. l'inter- diction de la dame aux cctmélias, la pour- suite fameuse de madame bovary, furent- elles inspirées par une connaissance exacte des mœurs du second empire? pas un instant. elles servirent un mouvement de la politique de l'empereur, qui faisait des avances au clergé et payait son sacre.	libertinage	1	1
presse	1884-09-03	1	2	Page1_Block30	1330	815	4174	1433	certains députés viennent de l'échapper belle : 1 . un libraire du passage de l'opéra, du nom de ïurmin, qui avait à répondre devant la neuvième chambre d'une accusation de vente do publications érotiques, a failli mettrelës honorables dont je viens de parler dans de très vilains draps. turmin a confessé que les ouvrages qu'il mettait en vente étaient bien érotiques, mais il n'y voit pas d'inconvénient pour la morale, parce que les moins cotés valaient 500 fr. si los tribunaux admettaient ce système de défense, les attentats à la pudeur s'éle- vant au prix de 500 fr. ne seraient plus de$ attentats. quand un original enverrait dix mille francs à l'assistance publique pour avoir le droit de se promener tout nu sur le boulevard, l'académie le désignerait pour lè prix de vertu. les juges n'ont pas donné là-dedans. —11 est-vrai; s'est écrié l'austère tur min, que je vends des livres erotiques et îiiieje les expose à la vitrine de mon ma gasin. mais je ne les vends pas aux pas sants! 11 me faut des renseignements. je ne veux que des clients honorables et je fais des affaires avec beaucoup de députés... si vous voulez leurs noms... le tribunal n'a pas eu cette curiosité et à condamné turmin (peine un peu dure !) à un mois de prison et'500 fr. d'amendé.	erotiques	1	1
petitparisien	1884-09-08	1	3	P3_TB00010	1054	768	886	196	ce n et long est le signe du mérite; de l'intelligence, de la valeur... diable, mais à ce comptelà. les éléphants devraient être les plus hauts placés dans 1 échelle des êtres 1 j»e nez droit indique « l'esprit juste, sérieux. un, judicieux », le net en bee d'aigle. « la propension aux aventures»; le nez fendu révèle « la bienveillance », le net large « est l lndlce d une grande sensualité ». le aez retroussé est ie signe d'un esprit faible, « généralement enjoué, plaisant et folâtre ». ce m. baé, n'est-oo pas, est un homme ingénieux? ojo ce n'est pas tout : il ne s'arrête pas à ia forme seulement, ii tire des conclusions de la couleur du nez. là, il faut avouer que m. buê n'invente ras grand'chose. avant lui, le vieux poète frantis olivier basselin, qui se vantait dêtre beau; .uveur, avait chanté son nés « couleur de rubis ». « rien de ce qui touche 4 l'humanité ne m'est indifférent », disait térence. m. bué estime, lui, que rien de ce qui regarde le nez ne saurait lui être étranger. 11 tire des considérations subtiles de la façon dont on renifle, dont on se mouche, dont on se gratte le nez. autant d'tadications précieuses permettant à doux ûadcés de bien se connaître avant de prononcer le « oui » fatal ! nous livrons lo système pour ce qu'il vaut : chacun peut essayer. toujours est-il que si m. bué développe ses idées sur le nez en une série do conférences, on ne pourra pas dire qu'il n'ait pas prononcé des paroles bien senties l	sensualité	1	1
presse	1884-09-09	1	2	Page1_Block29	1570	796	3390	3343	la coquetterie féminine se trouverait su bitemènt privée d'un de ses principaux en gins de séduction si la guerre avec la chine se prolongeait. il parait, én effet, qu'une des cajiséqusn ces de cette guerre sera dé faire augmenter dans une forte proportion le prix des chè veux. l'importation des cheveux en franco.a une grande importance elle avait été en 1882 de 70,758 kilos; elle s'est élevée en 1883 à 124,71a kilos. or, il paraît que la plus forte partie de ces cheveux provient du céleste-empire. : dire qu'il faut avoir recours à la tête d'un chinois: pour coiffer nos jolies pari siennes ! n'est-ce pas désolant à penser ? un concours de nez vient d'avoir lieu en autriche. cela vous fait rire? on voit bien que vous n'avez pas étudié la nasogràphie. pour les adeptes, il n'est point de pas- sions, de vices, de vertus cachés que ne trahisse à première-vue la simple- inspec tion d'un appendice nasal. lu nez, c'est l'homme. le nez d ; ût êîre le plus long possible ; c'est la marque-du génie militaire : césar, napoléon ont eu de grands nez. . le nez droit dénote l'esprit juste, sé rieux, fin, judicieux et énergique; le nez en bec d'aigle une propension aux aven tures; le nez large, aux narines ouvertes, est l'indice d'une giande sensualité ; le nez fendu révèle la bienveillance^— c'est le nez de saint vincent-de-paul. . le nez arqué et charnu est indice de do mination et de cruauté. catherine de mé-	sensualité	1	1
presse	1884-09-09	1	3	Page1_Block30	1815	816	3368	5025	— cèrtainement... et plutôt deux fois qu'une... pour sa toilette. chupin ne put dissimuler une grimace, et d'un ton d'ébahissement narquois : — eh bien! fit-il, excusez!... il doit avoir la peau propre ! les autres éclatèrent de rire, et le con cierge, après un, regard d'intelligence jeté au domestique, dit entre haut et bas : — uame! c'est «son état à cet homms d'être joli garçon. le grand mot était lâché. désormais chupin était sûr de ce que lui avait fait soupçonner ce logis voluptueuse ment-coquet et ouaté de toutes les recher ches délicates et exquises comme le sanc tuaire d'une idole. pendant qu'on changeait les jardinières, d'ailleurs, et dans l'intervalle des neuf ou dix voyages qu'il avait faits de la porte co chère à l'appartement, chupin avait écouté sournoisement et surpris entre le domesti que et le coneierge des lambeaux de phra ses qui l'avaient singulièrement éclairé. sans compter qu'à tout moment, dès qu'il s'agissait de placer une plante dans un endroit plutôt que dans un autre, le domes tique prononçait, comme un argument péremptoire, que la baronne tenait à ce que cela fût ainsi, ou que la baronnejèrait plus contente de tel arrangementr'ou en core qu'il se conformait aux ordres que lui avait donnés la baronne. d'où chupin, forcément, avait conclu que ces fleurs étaient envoyées par une ba ronne, et qu'elle n'était pas sans quelques droits sur l'appartement... mais comment se nommait-elle?... il manœuvrait assez adroitement pour le savoir, tout en dégustant un verre de vin qu'on lui avait servi, quand on entendit dans la cour le roulement d'une voiturë... — parions que voici monsieur qui arrive, s'écria le domestique en se précipitante la fenêtre...	voluptueuse	1	1
rappel	1884-09-09	1	2	PAG_00000002_TB000041	354	1048	431	6356	le nez droit dénote l'esprit juste, sé, rieux, fin, judicieux et énergique; le nez en bec d'aigle une propension aux aventures; le nez large, aux narines ouvertes, est l'iiidice d'une grande sensualité ; le nez fendu révèle la bienveillance - c'est le nez de saint vincent-de-paul.	sensualité	1	1
matin	1884-09-12	1	2	P2_TB00051	932	760	2519	4576	scarboroug stakes. hermitage égalité, darlington 11/4, north ridings/2. trois partants. wharncliffe stakes. jane shore 7/r, campanile 7)1, southampton 4/7. trois partants. rous plat t. lonely 3/1, chopette coït égalité, lady katherine. dix partants. juvénile stakes. elsie jvlarley 6/1, songstress 9/4, good news 2/1 . sept j artants. portland plate. leeds fraga 25/1, magdalen 5/1. huit partants. selling handicap stakes. coraline l«k, teîel-kebir 7/4, tattoo 2/î. trois partants, j alexandra plate. hauteur 9/2., perdiôa 11, 2/i; ;svveetbread, égalité. trois partants. derniers forfaits raffaello, de tout engagement à verhouse, de l'ayrshire handicap, victorious chief, earl of arran, scottish nobleman, et icingdetout engagement dans le nom de mons. h. lancaster, ou major stapleton. crim tartar, du doncaster, saint-leger. tous les chevaux de sir george chetwynd, sauf quilt de leurs engagements àdoncarter. scot rree, ûé ccsarewitch stakes. j3etting a doncaster ccsarewitch. 1000/so the lambkin, 15/1 sir 1 reuben, 100/6 saiot gati«n, 100/6 stocuiol», 100/6.,	coït	1	1
liberte	1884-09-13	1	2	PAG_2_TB000054	851	1086	2827	3007	tout le prestige qu'on prête en général aux mandarins chinois est éminemment trompeur. inutile de dire que ce magistrat vend au cher denier ses faveurs. du reste, il a lui-même payé pour avoir sa place, et l'autorité qu'il exerce, à ses yeux, n'est qu'un moyen comme un autre de rentrer avec usure dans ses avances et dans ses déboursés. tous ceux qui désirent acquérir ou garder ses bonnes grâces s'empressent d'envoyer des 'cadeaux. c'est encore avec des cadeaux que s'obtiennent toutes les décisions, toutes les tolérances. jamais on ne refusera l'argent, vînt-il des maisons de libertinage pour masquer la prostitution des enfants et l'esclavage des femmes.	libertinage	1	1
petitparisien	1884-09-14	1	3	P3_TB00041	1508	799	2492	533	l»> m tien al' comptant court rrtc*4. oerat«* court ... •   30i0 « *s *5 78 8 v. îo . 00 11 .. .. 1 » •• 4 o,»o |0d 41 *03 do ■bu . &l > .* 5oa . .8 '*** et 5|> „ «0 •• • * s*im»4ô/o 2ii 50 4*8 .. . .2 73 viilofft -603 0<0 5 j | .. -bi £5 ,. — f 4 0 0 m? . 517 4)'7 . .1 50 g a q * 6 50 305 . •• » - 1*75 4 0,0 *24 . 51$ .. t»l .. 418 .. .. . — ff76 4 3| 3 50 517 50 mr ll« 50 toi,. *> iô •  • ftah'iue d» f r.nre . bfruim» <( eenomote • ••  wuflj; dn parts a» p*y»-ba».. ïs-4 »ï0 .. w 30 ®0't m 03; 30 »k • • • j 7î cr40wk»«ei.*'4» preoie»...., i4o.. dfl» .. tïfc m 3 4.. ; sf •• • cr<mït lyonnais........ .5 .. ., créaitmobilier • • ]>o:vit» et compte» eouroet».. 5 ït s0 3 u î5 «85 .. toi,. 558 75 315 .. 040 .. '•01 .. m - 160 .i !» .. • - 5 •• est; j .. .. • - s •• midi tsi .. if!» m il 3 .. tso.. 48 's 5j> . 11®,,. 1884 50 itiw .. ijtl .. 1330 .. • • '* ouest ..... s .s 15 sa £ !» . 1 • •; •• atawau hmn»,*et.......... . — oblimlion... «•• •. coït 1 p. pari tienne ,iu gll..„ • »• •• cortip. triui»*tt«n8ijmr..iî.3 5 •• « cmul dépura -.. s .'. 111 .. m 1907 w 1137 50 u>5 .1 , * « «a 110 bp'» lus» 7s irra .. il 17 a» . ■' m omuibu». e » liciteeçyptwnnu unifiée 15 .... ltafiftuï 0/0...., . •• .. florin or 4 0/0.. 3t>8 50 «6 70 48 s» 303 75 «» 90 88.85 if: o . dette turçine bow..... . .1 f. — tunwmuna ï 10 1» 78 8 30 17) 30 «| 5 i. .. b.nouc ottoman»..........i. . . ■ 50 russe 4 0/0 1007. j. mai 515 .. >m .. 581315 •m <50 .. 1 ,1 .1s 5 . société autrichienne ,j°* 421 5» 028 75 113 75 r>5j 16 4m 50 131 75 630 538 15 488 50	coït	1	1
debats	1884-09-16	1	3	P3_TB00022	3543	791	3428	223	dait compte des inintelligences profondes de ces « bourgeois», et, an lieu d'en sourire, il en saignait. j'imagine qu'un auteur anglais, et qui connaît bien son pays, se figure à l'avance un lecteur et une lectrice qui réunissent à une culture complète et au sens des choses de l'esprit un proiond sentiment de respectabilité. s'il travaille àun roman, il est impossible que la seule idée de ce lecteur et de cette lectrice ne lui interdisent pas les audaces physiologiques, la mise à nu de l'animalité humaine, l'analyse microscopiqu e et misanthropique de la maladie sociale. mais aurait-il par lui-même le goût et la puissance de cette dissection où se complaisait le génie d'un balzac? dans la décente maison qu'il habite à l'extrémité d'un faubourg de londres, marié comme il est le plus souvent, parmi ses filles et ses fils, appartenant à deux ou trois cercles qui lui font une société d'élite, n'ayant aventuré sa jeunesse à travers aucune expérience coupable ou trop dure,, est-il outillé pour concevoir le père goriot, la maison nucihgen ou bien madame bovary et l'amertume charnelle et nostalgique des fleurs du mal ? s'il veut imiter baudelaire, ce sera comme swinburne, en y mêlant l'ardeur d'un paganisme érudit, analogue à celui de la renaissance, qui le transportera presque aux antipodes de son modèle. qu'il est, en revan! che, armé admirablement pour peindre en leur détail les plus fines nuances de la vie morale, pour se configurer des intérieurs de conscience, tout le tableau d'une âme qui cherche à se régler ellemême 1 et qui a mieux réussi dans des peintures de cet ordre que george eliot, par exemple? le romancier que le dix-neuvième siècle anglais peut mettre en regard de notre balzac pour la profondeur de la pensée, la puissance de la création des types, l'originalité de l'observation. je ne serais pas moi-même un homme de lettres français, si je n'avouais que la cousine belle me passe plus près du cœur que silos marner. mais le commencement de la critique consiste à reconnaître que la vie humaine est une chose très complexe et très variée. elle peut être envisagée et peinte de bien des points de vue. il y a des états de l'âme tout troublés par les fièvres de la chair, par les angoisses du conflit social. il est bon que de tels états soient étudiés et montrés, et, par suite, nous devons nous féliciter que notre société existe et qu'elle ait produit balzac et sa descendance. il y a d'autres états de-l'âme, où la sensualité n'a plus sa place et où apparaît l'inquiétude purement morale. il est bon que la société anglaise aboutisse à créer d'excellens peintres de ces sortes de crises. pour reprendre en la modifiant un peu la phrase que dit liamlet à son iloratio : il y a plus de choses entre le ciel et la terre que n'en saurait rêver notre esthétique. c'est pour cela que nous devons nous applaudir qu'il y ait toutes sortes d'esthétiques et toutes sortes de races d'écrivains pour les concevoir, les protéger et travailler au grand œuvre, éternellement pris et repris, de la littérature, ou pour employer un mot plus pédant mais plus précis encore, de la psychologie. paul bourget.	sensualité	1	1
le_pays	1884-09-16	1	2	PAG_2_TB000157	3466	1115	6183	4864	la fête donnée aux tuileries, hier, au bé- * néfice des victimes du choléra, a été favo- « risée par un temps superbe et fréquentée 1 par une foule suffisante. mats si sympathique p que l'on puisse être à l'?uvre, 11 faut recon- jt naître que l'organisation laissait assez à dé- ï sirer, et que l'on y manquait un peu de 1 tenue. ce n'était plus le pittoresque et la jf gaîté de la jolie fête d'ischia, l'an dernier, où \ les tuileries avaient été si lngénleusemeat i transformées. ?g les boutiques n'étaient guèresrangées que if le long de la grande avenue et la fantaisie 11 leur faisait quelque peu défaut. des femmes, ri que nous voulons croire animées des meil- b| leures intentions, passaient au milieu des ii groupes, en vendant des gâteaux : leur cos- il tume n'était pas toujours d'un goût parfait, il ni leurs avances aux passants toujours pleines 11 de tact. aussi les quelques actrices qui u avalent répondu à l'appel du comité avaient- n elles l'air assez dépaysées. il roua a semblé 11 aussi que les parades, faites par certains || jeunes gens qui s'efforçaient d'être joyeux, il pour attirer les spectateurs, eussent gagné à m être mieux préparéee.tout ceci sentait la hâte k et l'inexpérience. v mais ce ne sont là que quelques critiques i nous savons, par nous-même, combien une i fête de charité est chose délicate à ©rganl- i ser, même avec des concours qui fal- i salent défaut au comité d'hier. le principal i est que la recette ait été bonne et puisse | contribuer à soulager le plus grand nombre i possible d'infortunés ! * 1 le grand attrait, et nous dirons la partie r la plus réussie, parce que là on avait affaire v à des gens connaissant leur métier, a été la 1 fête aérostatique. trois ballons se sont enle- i vés. le plus grand, l'albatros, commandé ft par le vaillant capitaine jovls, un aéronaute 1 endiablé, lui avait servi déjà pour sa traver- i eée de la méditerranée. parmi les « ama- i teura » qu'il a emmenés se trouvaient mm. i cio?is hugues et notre confrère le docteur i montn, qui faisaient leurs débuts de naviga' i teurs aériens. , i le second ballon, le plus petit, le vulcain, i qu'a monté m. georges rtbut, qui n'est i pas un inconnu pour nos lecteurs qui i se rappellent peut-être l'ascension dra- i mal1que que fit, dans cet aérostat, à menton, i en compagnie de jovls, un de nos collabora- i teurs. i le troisième, l'aérophile, est do construis- i tlon récente, et tou-t flambant neuf ; il y a i quinze jours, mm. paul arène et boyer de i sainte-suzanne l'avaient inauguré, toujours i avec l'infatigable jovis, le marseillais le plus i remuant et le plus actif qui soit. il était coin- i mandé hier par m. van roosbeck, qui, i le matin, avait orgasme le concours, fort i intéressant, des pigeons-voyageurs. mais 11 était de bien bonne heure et ce « lâcher » a eu surtout pour témoins les membres des sociétés colombophiles et les amateurs.	orgasme	1	1
radical	1884-09-19	1	2	PAG_00000002_TB000213	276	1040	5777	7984	certainement que sourdis manœuvrerait de manière à ce que son client encourût le bagne, l'échafaud .plutôt quet de d'entraver ou.de cice de son libertinage t,. :	libertinage	1	1
rappel	1884-09-21	1	2	PAG_00000002_TB000204	99	1007	5780	2245	le tribunal, aprè3 en avoir délibéré, a coït damné le tailleur f. à un an de prison.	coït	1	1
debats	1884-09-23	1	3	P3_TB00030	2818	794	2635	4009	nous vivons d'admirer, d'espérer et d'aimer (4). le lecteur regarde le titre de l'ouvrage, c'est bien'un livre d'esthétique et non pas un recueil de sermons. il prend le germe et y rencontre dans le début d'un des articles : « la pureté du cœur, la » suppression de toute sensualité de l'es» prit, c'est par là que doit commencer » celui qui veut entrer dans l'ère nou» velle »; et m. sharp n'hésite pas à dire: « si étrange que cela puisse paraître, hommes comme holmanhunt, ros» setti ; et plus tard frederick shields, » ont marché dans les pas et à la suite » de newman, de pusey, de keble (5) ». avons-nous affaire à une réformation religieuse ou à une réformation artistique, à des ministres protestans ou à des peintres? gomment se mouvoir au milieu de ces définitions qui semblent si opposées et dont les unes conviendraient à un fra angeliço, tandis que d'autres ne seraient pas reniés par m. degas? ■ mon avis est que nous avons affaire à des artistes et àde très grands, mais ce 30nt des artistes anglais : c'est dire que pour eux les problèmes de l'esthétique ne, sont pas distincts des problèmes de la conscience. ils entrevoient cette grande loi de tout aft digne.de cé nom, à savoir que peintre ou poète, sculpteur ou prosateur, l'hoinnie ne doit rien produire qui ne lui soit nécessaire, rien qui ne manifeste son impression propre, sincère et directe de la vie. a cause de cela, ils sont réalistes daps leurs études de paysages, de costumes- de types,.de tout le décor visible, maijs en même temps ils sont mystiques, l'impression de la vie intérieure ne doit-elle pas être traduite au même titre que les impressions de la vie extérieure? on raconte,que le maître d'ornans, le puissant courbet, avait coutume de dire: « des anges? est-ce que j'en ai » jamais vus ? » c'est le point de vue du réaliste ordinaire. ecoutez maintenant le prophète du réalisme tel que le comtprend une âme du nord (6) toujours tournée, quoiqu'elle fasse, du côté du monde spirituel; «ne confondez jamais, dit m.ruskin, un mythe avec un mensonge; non, vous devez être très prudent pour fixer le point sur lequel vous pouvez vous permettre de le traiter de fable. prenez comme exemple le plus fréquent, et le plus simple des mythes, celui de la fortune et de la roue. sans doute il n'existe pas dans l'univers un femme réelle, qui tourne une roue de diamans, capable •d'influencer par ses révolutions l'humaine destinée. mais sous cette image n'entrevoyez-vous pas plus clairement la loi du ciel :—il a précipité le puissant de son	sensualité	1	1
justice	1884-09-25	1	1	PAG_00000001_TB000178	808	565	2408	4174	le vide étonnant de cervelle, les fantai- sies absurdes, la luxure sénile de ce man- nequin royal sont étalès sans pitié par l'historien impartial. mais a côté de ce vieux fou qui, dans l'exil, est devenu plus grotesque que tragique, se dresse une fa- mille fatale, toute la nichée maie et femelle de ses maîtresses, qui emplit lu livre do ruis sauvages, de fureurs bestiales, de meurtres sans nom. la sodomie s'y heurte à l'inceste, le vol y coudoie le parricide. c'est haus ulric et christiane, le frére et la soeur, qu'une passion farouche finit par jeter dans les bras l'un de l'autre; c'est franz, trichant au jeu, et condamné à treize mois de prison ; c'est otto, sorte de i bète sauvage, qui se vautre dans la plus énorme crapulerie, traînant partout son «androgame,» saint-amour. remplaçant ensuite « par un sérail do filles do rue l'hermaphrodite, » ramassé toutes les nuits ivre-mort, s'installant des semaines entiè- res dans des maisons aux numéros infâmes; el, finalement, prenant la maitresse de son pére, combinant avec elle l'empoisonne- ment â avorté â du duc, le ratant encore	sodomie	1	1
liberte	1884-09-25	1	3	PAG_3_TB000183	1251	1086	3587	7155	rées de la cour. la. jolie comédie d'etienne fut jouée en français par des amateurs qui s'appelaient le landgrave de fursteaberg, le prince antoine radziwi lt, le comte ferdinand de waldstein, la comtesse mnischack, la princesse thérèse ester-hazi, la comtesse sophie zichy, la princesse marie de metternich, la comtesse marassi, les pria-cesses marie et sophie de lichten s-tein, etc. a la suite de la représentation, il y eut des tableaux vivants figurés par les personnes les plus distinguées de la cour. le tableau principal était la. tente de darius par lebrun. le comte de selloe,ifold représentait. aibert-ie-grand, et la belle comtesse sophie zichy stalira. le baron de ballssct, enthousiasmé, écrit dans ses mémoires : « la scène était héroïque et voluptueuse tout à la fois; tous les visages, toutes les attitudes des personnes placées dans ce tableau vivant avaient l'expression convenable à leur âge, à leur condition et à leur situation. sizi:,>atiib*s elle-même était admirable. »	voluptueuse	1	1
