work	date	issue	page	block	height	width	hpos	vpos	text	active_words	occurrences_words	unique_words
debats	1851-06-24	1	1	P1_TB00014	2641	937	3951	1211	et se retirer dans une espèce d'enclos (cor rai), cù ils se fortifièrent. là on négocia. mais quels négociateurs. maîtres de jà place, le premier soin de ceux qui avaient engagé la iuite avait été de piller les tentes et les boutiques françaises, et de les incendier. ivres de via et oe liqueurs fortes, i's vinrent e isulie eifrir à nos nationaux des conditions honteuses, qu'ils refusèrent. ils ne durent pus alors songer qu'à se retirer, et, se repliant de hauteur en hauteur, tout en continuant de se défendre, ils arrivèrent au placer de saini-audré, après une journée des plus pénibles. » cette situation était très grave; tout faisait craindre que cette malheureuse lutte ne se propageât de placer en placer; le combat se fût aiors .changé en une véritable boucherie, car les français sout naturellement de beaucoup inférieurs en nombre aux possesseurs du pays. stockton était dans ta consternalion; toutes les affaires y étaient suspendues dans la prévision des malheurs que ces évéuemeus ne pouvaient manquer d'amener. » tel était l'état des choses lorsque les faits parvinrent à la connaissance du consul de france à sau- franclsco. m. hilton envoya immédiatement ua exprès au gouvernement de sm-josé pour le prier d» joindre, ses efforts aux siens afin d'arrêter ce conflit, et il expédia en môme temps dans l'intérieur des envoyés porteurs de communications qui suspendirent ies hostilités. » la prompte intervention de notre consul dans cette malheureuse affaire a empêché de grands malheurs. si modération, sa haute raison, l'estime'dont il jouit â san francisco dans tous les rangs de la société, jointes à la profonde connaissance de la langue et des usages du pays qu'il habile, me permettent d'affirmer que l'honneur de représenter la france ne pouvait être confié à de plus digues mains. ii allait partir pour les mines, théâtre du conflit, lorsqu'il reçut la nouvelle du bon eff-t que ses communications avalent produit sur les américains; elles avaient mis fin à la querelle. • pendant la retraite, les français n'ont eu aucune perte à déplorer ; un seul de nos combattans a eu la jambe traversée d'une balle; mais nous avons perdu quelques prisonniers. malheureusement on n'a pas de nouvelles de la plupart de nos compatriotes qui travaillaient seuls ou en petit i-oubre dans des cagnades isolées; le moins que l'on puisse craindre p<mr eux c'est qu'ils aient été dépouillés de tout ce qu'ils possédaient. » les derniers bateaux à vaoeur de stockton oit apporté ces tristes nouvelles ea ram uant un grand nombre de mineurs, car les vagabonds dont je vous parlais plus haut ont prl« goûi au pillage et continuent leurs brigandages ; n s se sont formés en bandes d une vingtaine d'hommes, et. masqués, ils attendent et dévalisent sur les routes les votageurs ans i bien que les mineurs. les américains sont leurs victimes comme nous; ils doivent voir à présent que la lutte n'était point entre eux et nous-mêmes, et qu'il ne s'agit ici que de quelques brigands attaquant des travailleurs paisibles, et qui, d'après le droit naturel, se -ont vus daus l'obligation de repousser ja force par la.force. » m. dlilou part ce soir pour les mines, accompagné des notabilités de l'armée américaine et de la cite. il est bien à désirer que leur prépuce sur les lieux rétablisse entièrement la bonne harmonie entre les citoyens de deux nations faites plutôt pour s'psdmer que pour se combattre, comme il est à désirer aussi qu'ils unissent leurs efforts pour châtier 1-s voleurs de grands chemins, qui sont, à n'eu pas douter, les vérilables et seuls auteurs de ces regrettables évéuemeus. » derbec. »	prépuce	1	1
siecle	1851-06-24	1	1	Page1_Block113	1624	800	4169	5527	.nosnavires. . -».. ■■■ t . . . notre marine fut moins heureuse a chios t cette lie molle et voluptueuse avait préféré aux âpres'bienfaits de ia liberté la vile tran» quitlité dont elle jouissait .sous le joug ottoman^ cette torpeur résignée n'avait pu cependant, en effaçant une solidarité originaire,-écartat d'elle les exactions et les vengeances. lycur- gue logothète crut ; pouvoir entraîner ses ha- bitans dansla cause commune; et descendit sur leurs plages à la tête de 1,800 samiens. le peuple obéit à son appel; les riches et les prft- tres se réfugièrent dans la citadelle avec les turcs; cette démonstration; imprudente devait convertir cette ile féconde en un champ d« carnage. ' . .. ffi'-n le capitan-pacha, dont la flotte, malgré le développement formidable de ses forces^ n'avait essuyé que des échecs 'durant sa campagne dans l'archipel^ parait dans ses eaux le it avril; il va prendre : à thiesmé les hordes impa tientes qui l'attendent,sur la cote poià lesijeter sur cette lie infortunée., la^ jeanm^are^com- mandée par le capitaine de vaisseau de là meit- lerie, so rend immédiatement auprès ducapi- tan-pacba, et invoquant des promesses faites k l'ambassadeur, de ifrance, ïéïlame pour nos( nationaux le respect des personnes et des propriétés , et pour; les grecs le respect des droits de la guerre„.des droits sacrés de'l'hu manité. les assurances les plus favorables ac- cuei lient ces représentations. vaines assuran- cjds ! avec les turcs, i« délite du fanatisme et son cortège de hideuses atrofeités s'abattent sur chios. les consuls européens ont fui ce posté où les appelaient leur3 devoirs ; à peine si ub de nos ageus diplomatiques, m. vigeon, peut, à force de courage, dérober à cette large tnois^ son humaine les malheureux qui'se réfugient dans l'hôtel <fu consulat français où la ffleur- de lys et l 'amaranthe viennent leur offrir l'a sile moins précaire de leurs bords. > > nos bâtimens qui avaient assisté à l'cçuvrtr de destruction devaient assister à la vengeaaœ«i la flotte ottomane, chargéo des richesses 49	voluptueuse	1	1
courrier_gard	1851-06-28	1	2	PAG_00000002_TB000004	467	811	90	1302	que voulez-vous î ii nous jaut du nouveau, ri en fût-il plus au monde ; et toutes les administrations se hâtent à nous donner du nouveau, vaille que vaille, comme ces maraîchers cupides qui apportent du fruit vert au marché pour satisfaire unpeu plus tôt la sensualité inintelligente du consommateur. au lieu du plaisir qu’ils s’en promettaient, ceux-ci se rendent malades, et au lieu d’avancer dans la voie du progrès , comme nous l’espérons, nous retournons en arrière.	sensualité	1	1
le_pays	1851-07-03	1	4	PAG_4_TB000178	255	1014	5934	4095	par m ? g ?u r y-du v i u e fi (le la faculté de paris, etc. menuet ïîhissjjseïisafrse aux personnes atteintes da catarrue de vessie, rétention d'urine, i'krtbs sàm-nales, impuissance, sïpiiilis, onanisme et ses soitï.s. 1 w. in-8, fig.,5 f., franco, 6-50.paris, l'autjuir, r. richelieu, 41. consultations di, 9 h. à midi et de 2 à 5 h. traïtemsnyt et consultations par correspondance tâffra.nchi*.)	onanisme	1	1
siecle	1851-07-05	1	4	Page1_Block54	469	778	1079	5920	cti.vseil mx .feilili's, conserver leur force, iciu fraîcheur; deseguenr elles- mêmes de tous les maux causés par le sarig des menstrues. suppressions, paies couleurs, i>ér les de toute naiure, scrofules, dilformiiû*, phthisia, maladie do la matrice, des nerls,etc.,par lefl' vu- sourd, memb. coït , de l'acad-, elc.i vnl , 2 ti . ezp. franco. chez comon.quai maïaquais, 15, paris. ! i 'mn* f de f0ik s?t>iisr^ ^bitaule, «i éïlblbj uç 4.l épukée \ fk01u, pour l'usage médical, 110 se trouve sue chez royer, ph., 22ô, r. st-41artin.3f. lel[2til.,it. 50 le flacpn.	coït	1	1
