work	date	issue	page	block	height	width	hpos	vpos	text	active_words	occurrences_words	unique_words
courrier_gard	1859-07-05	1	3	PAG_00000003_TB000016	560	812	106	2729	” si cette conjecture était fondée , elle viendrait à 1 appui de cette opinion, que ce fut sous l'empire d hadrien que les bains de nimes acquirent l’importance que témoignent les découvertes modernes , puisque , avant ce prince , le luxe et la vie voluptueuse des romains avaient fait de ces établissements des lieux de débauche où les hommes et les femmes prenaient le bain en commun , tandis qu hadrien défendit rigoureusement ces honteux mélanges , et que, d après spartien : lavacra pro sexibus séparait ; réglement qui tomba bientôt en désuétude après lui , et ne fut remis en vigueur que par marc-aurèle , qui lavacra mixta summavit.	voluptueuse	1	1
presse	1859-07-07	1	3	Page1_Block3	5522	806	850	100	on fit trop plus qu'on-ne saurait penser; semer boucquets, fleurs, verdure passable, el par les lieux ou on devait' passer, sur le pavé on n'épargna pas sable. je n'ai pas besoin, je pense, de faire remarquer ail lecteur intelligent que si je n'altère pas les vers d'andré de la vigne, j'en redresse par-ci par-là l'ortographe farouche. je les saupoudre aussi à la vo lée d'un peu de ponctuation, car l'ortho graphe existait faiblement, et la ponctua tion n'existait pas du tout au quinzième siècle. . cette fête donnée par les turinois ne se composait pas que do fleurs, de bouquets et de verdure, hommage brillant, mais bien vain pour des estomacs labourés, creusés par la marche êt la bise des alpes. . ils avaient du pain et viande expresse, force bufl'ets, tasses et table ronde pour soulager un chacun à la presse et pour donner à boire à tout le monde. et non seulement ils burent et mangè rent ainsi qu'il vient d'être dit par an dré de la vigne, mais ils goûtèrent aus si le plaisir du spectacle. ils jouirent d'u ne représentationdgs sâints-mystèfes qui étaiêntj comme chacun sait, l'unique spectacle du quinzième siècle, spectacle: qui contenait la comédie, l'opéra et le ballet du temps. le roi eut un divertisse ment particulier imaginé pour lui,., et, auquel il parut preudre un vif-plaisir - jamais on ne devinerait quel -fut ce divertissement, le sujet de ce rare spectacle;, jugé digne -d'un roi à la cour d'une grande souyeraine. le sujet était la représentation d'un accouchement/si mulé! la chronique rimée d'andré de la vigne ne laisse pas planer le plus léger nuage d'un doute sur le fait. oui, le spec tacle offert k charles viii, avec taiit.es ses évolutions ét ses péripéties, était un ac couchement. l'accouchée était représen tée par une dés plus belles et des plus qualifiées dames de la cour, d'autres-fem mes non moins belles et non moins quali- fiées allaient la prendre en grand cortège et procédaient ensuite, à tous les détails de la cérémonie. en voici quelques-uns qu'on peut lire : elles choisirent la plus belle: d'enfre'blles ; et sur un hourt (1), en un beau lit couchée, sous couvertures que point n'en est de telles, la firent mettre ainsi qu'une accouchée. d'un fin vejoux craraoisv avait manches pelissonnées de martres zibelines. ses ceuleurs furent violettes et blanches parmi posées bagues de hautes branches. gros diamants, turquoysès, cornalines; pour déeerer ses douleurs féminines, de toutes parts elle était sursemée. (vergier d'honneur.) le 6 septemb-ie, le roi, dit son double historien, quitta turin et s'arrêta quel ques jours à chiesi, où des femmes re nommées pour leurs beautés et leur ga lanterie vinrent le saluer et l'acclamer comme le champion de l'honneur des da mes. le titre est beau, mais je le crois ha sardé: a moins qne le mot honneur ne soit pris daus une acception détournée, mettons opposée. en général, il y a trop de dames, de certaines dames, dans/ce voyagé de charles viii, pour que l'hon neur ai t franchement grand'chose à y voi r. ^rrivé à asti, le champion de l'honneur des dames tomba d'essoufflement; il fut très sériehsemftiïunaîadé. il mit un mn.is à se rétablir. i une fois replacé sur ses jambes dé hé ron et ses larges pieds, il court, plein d'une nouvelle ardeur, à moncalvo, et son- historien, qui le' suit à grands pas, ne manque pas de nous dire dans sa poésie sans ponctuation : . - *• après dîner sans guères chevaucher, tout bellement après 1 arrière-garde, il seu alla pour souper ét coucher, dedans monçal belle et : bonne bourgade.' ; n'omettons pas de dire qu'il était entré dans moncalvo entouré, d'une blanche et rose nuée de jeunés milanaises que ludo vic sforce et beatrix d est lui avaient a-, menées de la capilale de la lombardie pour lui donner comme un avant-goût de î'elégance voluptueuse et suave de leur: cour, où.-il allait, bientôt être introduit à la façon de* rériàhuj-dâns'le : palais d'ar- mide, que tasse n'avait pas encore créé.. parti de moncâl, belle et bonne bour gade, charles viii arriva à casai le 6 oc tobre; casai était alors ju capitale du mar quisat de montferrat. : c'est la première place vers la lombardie, hors du piémont où le roy fut reçu, et on lui fit une entrée hardie - sans gàjpn y fût ni trompé, ni déçu; au fetpmarquis de montserrat étôit , quipour ce temps tut de»bohs.trépassé; mais la marquise souvent y fréquentoit ' pour y prendre du passe-temps assez., -cette marquise de montferrat, qui ai mait à prendre des passe-temps assez, en prit tant avec charles viii dit vaffable, qu'elle se laissa emprunter par lui ou em porter tous ses bijoux, dont la valeur était considérable. entre autre belles,qualités qu'il tenait de son père, charles avait ceile d'emprùnter, jointe a celle de ne jamais rendre, et d'aimer par dessus tout l'es petits ducats et les gros diamants. lien, raffolait. a turin, il engagea les joyaux de la duchesse de savoie pour la somme	voluptueuse	1	1
le_pays	1859-07-09	1	2	PAG_2_TB000195	373	949	5872	7024	?? voici une bague qui vient de rai mère, otrrez-la de ma part à votre coït rageuse enfant. 1 le vieux marin hésita. - i ? cette bague est sans valeur paf elle-même, mais j'espère qu'elle poi ttf bonheur à votre iihe. jeanne. i	coït	1	1
siecle	1859-07-10	1	1	Page1_Block449	1908	824	1772	5100	toutes les lueurs étaient au ciel, laissant l'om bre tfropics à la terre. l'air était tiède par intervalle*, une btise pa resseuse passait, chargée de senteurs tropicali « son souffle faisait crier plaintivement la gi rouette de simt-ildefonse, cette éslis?» gothi que qui fermait la perspective du côté du sud, et dont le minaret pariait encore de la domina tion arabe. ,de temps en femps, au loin'aio, on voyait glisser une lueur, et la voix mono'one des gar das de nuit psalmodiaient ce mot : sertito, qui est devenu leur nom. m fait beau, sereno, toujours beau. chez nous, s'il-y avait des gens chargés comme autrefois de crier le temps qu'il fait..la nui», on les ap pellerait les honimes de la pluie. tout en haut du clo-htr de saint ii 'efonse, un grôiidement sonoie se fit. c'était la vieille horloge qui se mettait en twin de sonner l'heu re. ep'e étuii enrouée et infirme comme zamcfre et moins li.iele que lui, car elle avait rriouré le temps aux musulmans comme aux chrétiens. après un râle préparatoire qui dura uce demi- minuie. elle tinta vois coups fêlés; ce fut com me un signul. a droite, à gauche, devant, der rière, de loin et de près, le s cent et quelques égides de la ville pieuse sonnèrent trois ht ures eu un feu de file irrégu'ier. la voix aigre des (.puts clo hers ne chapel'es grinçait parmi le tonnerre des rour-uais des grandes paroisses, et, pour su coït 1 s trumpes de la cathédrale, de la'cîndiid. do saint-j^.in de dit-u et de la merr ceo, er.tonnërent leurs ennomes stipp éiïien- faires, sonnant un mot rau iue et pro'ongè pour chaqaa coup d' c'o;be. cela dura oix nonnes .minutes, et tous les dormeurs de séviile durent savoir en rêve l'heure qu'il était. denx h mates arrivaient au bo it dala rue des cabalkrizfs (écuries) au momoiit ou thor- icge de sain : lldefonse .s ? ébran!ait. us étaient à pied, tenant leurs chevaux par l i bride. bêtes et gens avaient sur le corps une épaisse coucha de poussière. l'un des nouveaux 3nivans était un cavalier à:la déiiiirohe.jeune el fière: l'autre, un pay.-an à courte tai l i qui, cep-ndant, ne semblai.t man quer ni d'«geité ni de fore. vous tu&iez dit le mnî re eile va'et, sans l'estrèoie-simp'iciti du co-tumc do celui qui, par sa'tour-i'ure et l-i noblesse oe son visage, eût pu pss«,(>r pour un mr-.î:re. i portait, il est vrg^un pourpoint taillé, à la. mode des gentilshommes, mais en gros	coït	1	1
le_pays	1859-07-14	1	3	PAG_3_TB000122	2592	1034	3338	2791	sans parier des atidens* polit cjui, en tant que ''eience. la chimie n'existait r 35 f les modernes n'ont connu qir- fort tard, et dans la seconde moitié du siècle dernier, la véritable nature de l'eau. jusque là on t'avait regardée e,'limj me indécomposable, comme corps élémentaire. aujourd'hui le plus mince écolier en chimie sait qu'ellr' résulte de ia combinaison intinj)c, à poids el à volumes irlégifux. de deux g.:''l parfai terrient définis et connus, î'un qui est le gaz hydrogène, l'autre qui tst le gaz ojy-gène, t'uû qui est h corps le plus combus- tfb)e que nous connaissions, i'autre qui'est t'aient indispensable uu phénomène de là combustion. r ainsi (chllse m erveilleuse et qu'on n'arlmire p<'ut-ét)'e pas assfz!) ce liquide, dont la nature proverbiale est û'êlte 1. nnemi du feu, est composé de deux substances qui, lorsqu'on les a dissociées et qu'on les combiné de nouvoau l'une avec l'autre par la simple approche d'un corps enflammé, dé yeti ,pt'iit, par celle combinaison même, la chaleur la plus intruse qu'' le idj, on ad-ve'saire pn tendu, puisse nous domtthr. r'en n'égale, en effet, p ruii tous les corps coït ibti-, ibit,s dont nous disposons, r été v iion de u-mpéiatitre que l'on obtient en brû'an' le gaz ox-. tçèue pu-r. (pour don ner une i lée de la t liai ur que développe 'a cotnbus'ton de l'hydrogèn, même avne l'oxygène mêlé d'azote, c'est à dire avec l'aie rdu.a:re, il suifira de dire qu 3hki-hrgraùiijties d'eau sont p nés de u a ioü de-gres p r un kii<!gn<ihme de ce gaz, tandis que 78 ki og ft!lttie' d'eau seu-eilit-nl sont élevés à 'a même température , ar un k !o-granimè' de chaibuii ) eîi bien! il ne s'agit plll:;, po r avui; sol'ë là main c-tto source iiiittiei,,se de rlwleür, que ci «épater i un rte l'autre ces deux corps élémentaires c s deux g ï, dont la réunion constitue dans la naiur' le corp:-- df/pflé fan, chimiquement protoxyde d'h!jr.lrnfj'èm. m. illetjr^^iit.-iil c'ia n'est pas faciv ; ou moins ii n'est pas facile de te faire à t-ès-peu ilt> frais., et loui le priib èma est oans i'extrêaie bon marché de* t'opéra ion.	coït	1	1
presse	1859-07-16	1	1	Page1_Block32	1734	792	3326	4826	beau et savant travail. le portrait du doc teur p. ..-est une admirable tète de vieil- i lard. il mériterait de porter éci'it sur son socle lenona d'un philosophe grec ou d'un légiste romain. ' la vénus agreste de m, clère serait ex clue de holympe 'classique, comme en tachée de roture. elevée au' milieu d'un champ, les bergers viendraient l'adorer. — elle est un peu courte, un peq trapue, un peu ronde, mais ces proportions ra- nfassées conviennent à la patronne des rustiques amours. les chairs sont pétries avec uné' sensualité succulente ; la cha leur de la vie renfle mollement ses formes fécondes. la tête rayonne de bonté.— ce n'est ni'l'orgueil sublime des vénus célestes, ni. la volupté' raffinée des a- nadyôm 'ènes; c'est la douceur cordiale d'une bonne déesse.qui habite les lits fi dèles et lès'maisons pleines d'enfants. le faune gymnaste sautant à ealifour chon par cï&ssus un tronc prend un vif et joyeux élan. il y a du gamin'dans ce quart de dieu. son petit corps de bronze pé tille d'accents et de rehauts incisifs.— on ne pouvait mieux rendre la maigreur agile d'un génie sauvage, eousindes chèvres et des cabris.	sensualité	1	1
presse	1859-07-22	1	4	Page1_Block40	288	789	4094	198	-ii ci coucl - nei'uei ides .u- ses frèqosnti-s de la. sfenhte con»titatioii«elle ou aoi'ur'utelle: les moyens degnenson, aussi sua» ptesqu irilaillil>l<ss.employés par m®* lacua' hl- l.ë,sont le-résultat de viu.^t cinq années d «t. ides et d!ol)servations pratiques dans le traitement spécial de cas alfeetions.—m' laciiapbllh re« coït tous les jours, de 3 a 5 heures, 5 son cabinet, s7,r. du monthabor. près les tuileries, à paris. «.	coït	1	1
presse	1859-07-23	1	2	Page1_Block19	1791	788	886	4793	ne garde au chic, ce singe du talent qui le contrefait et le joue si bien. le mcneu de loups, de m. maurice sand, est encore un conte noir pittoresquement mis en scène. — le vieux sorcier, souf flant dans son biniou, marche dans la plaine nue en tête d'une bande de loups ensorcelés par son instrument. ils ont des oreilles, ces ventres affamés,, car leurs y eux brillent et leurs queues frétillent—-la lune se masque d'un nuage noir et se ça? che derrière un dolmen pour ne pas voir cette scèné diabolique. — celà est très simple et -très effrayant. m. amauryduval a exposé dés portraits d'un crayon élégàntetlàrge.m zilaamërman a reproduit là-'ronde de nuit, ^ de rem brandt, et le repas de la garde civique, de vanderheldt, avec, plus de patience'que de fermeté. — on ne saurait, trop louer les copies d'après raphaëlet'quintin me-, tsys, ,de mm. didron et vibert. — que dé lielles gravures on ferait sur ces beaux dessins ! • m. eugène lami est toujours le maître de l'aquarelle, vive,' galante, mondaine, egratignée d'une main qui vient de quit ter son gant paille. quel joli libertinage de pinceau ! quelétincellement spirituel ! rabelais parle de mots gelés qui tout d'un coup dégèientet éclàtent.'a voir les aqua relles de m. lami, vous diriez les mille, zigzags et les mille saillies d'une conver- sation parisienne fixées sur le ? papier par un procédé . mystérieux.' — ses vingt sujets iirés des osuvves d'alfred de mus- sel es 'sont uu i'avias»	libertinage	1	1
siecle	1859-07-24	1	3	Page1_Block17	6795	849	2625	200	l'administration de la iiibïiothèque ste ge- - nevièvefâ r< irii^ à la mai-ie, et pour le même objet. 165 fr. 40 c., souscfïplion du personnel de , la dibliothèque. ' i — le concours d'harmonie écrite et d'accom pagnement pratique a eu lieu mercredi au . conservatoire impérial de ijnusiqne. en voici le résultat : 1 prix, m. tjiémer j 2 prix, m. ro flue5;'1 > w accessit, m; bernardet ; 2° accessit, m. à. duyernoy ; 3° accessit, m. hess. ces lauréats sont: tous les cinq e lèves de m. françois ba^in. — hier, à minuit, lé thermomètre centigrade de la maison de l'ingéniour chevallier, opticien, marquait 17 degres 8 dixièmes au-dessus de zéro ; aujourd'hui, à 6 heures, du matin, 17 de- r-és 4 dixièmes; à midi, 22 degrés 0 dixième; 2?ha^rfis, 22 degrés 6 dixièmes: •  > — le crime affreux commis, il y a quelques mois, rue de la hoquette/viçnt de recevoir.ce matin son expiation. ; -.- nos lecteurs se rappellent que deux individus portant le costume de garçons bouchers s'é- (aient présentés au domicile des époux colom be, maîtres bouchers, ét, pour arriver à la per pétration d'un vol, avaient assassiné la domes- tiquei le3 auteurs de ce crime, millard et flenret, « avaient été condamnés à mort par la cour d'as sises de la seine; mais, plus tard, fleuret, h -qui on voulait tenir compta de la franchise de ses aveux, et qui montrait des sentimens de re pentir, obtint une commutation de paine. au jourd'hui millard devait donc seul monter sur l'échafaudi ce matin, h cinq heures et demie, le direc teur du dépôt des condamnés, m. l'abbé hugon, aumônier de la prison, et le chef de la police de sûreté, entraient tous trois dans la cellule de millard, et lui annonçaient que l'heure était ve nue de subir k sentence de mort prononcée contre lui. millar&eut quelques tressaillemens nerveux, et montra une émotion qu'il fut quelques ins- tans à maîtriser. comme yerry, il ne voulut pas d'abord recevoir les consolations du prêtre, mais il finit par se calmer et prêia l'oreilla aux paroles de consolation de l'aumônier. dès ce moment, il parut tout à fait résigné, et su bit sans rien dito les apprêts de la funèbre toi lette. a six heures sonnadt, le patient arrivait au pied de l'échafaud, et, après avoir embrassé le crucifix, il se livrait -aux exécuteurs. quelques secondes après, justice était faite. un concours nombreux de spectâtours envi ronnait l'instrument du supplice. — dimanche dernier, m. y. étant à siint- ouen, voulut sa baigner dans la seine. ne sa chant pâli nager* il choisit l'endroit çùil y avait le moins, d'eau ; mais à paine étaitril descendu dans la rivière qu'il fut entraîné par le courant. les cris pe désespoir de sa femme furent heu reusement .entend us d'un jeune homme qui se trouvait non loin de ute$e jeter à la nage, re joindre m. y.. , le sfflsir au moment même où il allait disparaître et le ramener sain nt sauf sur la bergo fut pour ce jeune homme l'affaire de quelques minutes. l'auteur de ce trait do dévouement est le nommé paul camille, âgé de , t3 ans; peintre sur porcelaine. —avant-hier, vers les deux heures:de l'après- midi, un jeune homme d'une trentaine d'an nées, qui suivait les bords du canal, s'arrête tout à coup en s'sppuyant contre un arbre, lire de sa poche un canif qu'il ouvre avec précipita tion et semblait vouloir s'en si rvir contré lui lorsqu'il chancelle et tombe. plusieurs perspn- nes qui l'avaient vu faire accourent alors au près de lui ; on s'informe de ce qu'il a,.et, pour toute réponse, l'inconnu fait-entendre dessons inarticulés en mettant les inaips à son col. « cet homme a eu trop chaud, et il a un coup do sang,mit alors un des assistans qui demeute à côté; je sais ce que c'est, et j'ai ce qu'il faut -chez moi ; vite un coup de .main gour xen- ièvor,îi n'y â pas de fémps à per.îrë i » aussitôt on emporte chez l'obligeant voisin le malade, auquel on mot des compresses de vinaigre sur la tête el des sinapismes aux jambes, ne sorte qu'en moins de dix minutes il avait repris ses sens et.se trouvait hors de danger. ce jeune homme, qui est le nommé adolphe x... r commis negociaut, avait ou en 'offet telle ment chaud ce jour là, que son sanar avait tout a coup reflué, vers la gorge. compre nant l'imminence du danger, le sieurx... avait saisi son canif avec l'intention de se saigner, lorsque la force du mal l'ompêçha de mettre son proiet à exécution, fort heureusement pour lui, car il risquait oe s'estropier. quoi qu'il ep soit de l'intensité de la chaleur à paris, nous n'avons pas du ijiomë à redouter, comme dans certaines contrées, les transitions ubi es du température. uu .de nos. amis, ox- cuirassier dans l'armée bf igo, nous racontait à ce sujot qirun jour.à btugi-s la chaleur était si fotte vers mi«li que-l'on eunt obligé de relever les factionnaires à chaque heure, do peur d'in- ^solation : or. cp même jour, la température é'ai,t tellement changée vers le soir, que lus soldats de faction grelottaient sou h1 urs manteaux. — l'excès de la chaleut a ofc-sionné des dé- rangemens de cerveau < h z beaucoup de per- sonnrs. déjà plusieurs de c s > a^ ont été signa lés; hier; dans la journée, do. ii- comt'.tutionnel, deux encore ont eu lieu : ver.-, irois heure* du matin, rue neuve-montmorency, io sieur j..., principal locataire de la maison qu'il habite, 1 s'est to veille et poussait les cris : a l'assassin !- ii esf-sorti do son sppar.ement sans être habillé et s'est enfui dans l« tue. l'etfroi était répandu dans la maison, et les agei.s, avertis par les cris, se sont mis à la poursui s du steur j... ils ont pu le rejoindre rue rte g-t m mont, n'ayant plus qu'un lambeau, de clr misa sur lui. dans sa fuite, il s'o-t fait d'ass ,j z graves blessures: il a été reconduit à sojn doum ne. oii un médecin a été appelé pour lut donner les soins que ré clamait sa position. ~*a--petf-prts-?i la mémo heure, le nommée..., marehaud des -quatre saisons, rue du fau bourg-saint martin, atteint subitement d'alié nation, s'est emparé do trois couteaux très af- fil s e t s'est mis à poursuivre sa femme, vou lant la tuer. aux cris de cette malheureuse, les ag o us et les voisins se sont emparés do cet hom- rr-o. /ini « été mené au p jsto de policade lasec- tiou do airaîb 'urg. ■ — un assassinat a eto commis dans la com mune de vauroux, sur la per.'onue de la dàrae dutour, âge d 62an< le. m<md« coït ) femme faisais dit lo journal de l'oise, une tournéo dans les pays vo;ai;s pour y ton ire .'es l.robis. l'assassin franaa. à l i porte 00 1a dameduiour, et, «'assurant qu'elle était b't:ii seule, iui asséna ,snr -la têio do vigoureux coups bftton qui la firent tomber baigfite dans noa sang, puis il la ]« ta dans l* foyor de !» cheminée, ou .un reste oe f< u lui lir-jl i une partie do unis et un côte de la -ligure. l'nut' j ur de te ortni-.r.\:ro'io, après avoir foui il'; i -s tiroirs «ic r 1:; i juh meuble de la pauvre ctuuou;;r*', s'i lit ut en aoandonnant sur la route'on b<it'vi en«'îng'unté sii^i par la justiçe comme p.e.e à conviction. — on lit dans le journal à'inire-el-loirs du 22 j jiliet: un troisième orage, accompagné d'une véritibie teinpèto, a éclaté dans la nuit dernière et èroit/isioiiue des dommages assez considéra bles (iaus nos campagnes; où un grand nombre u'arbn s ont fxé arrachés et brisés. mais l'évé nement le plos deplorabje a é;é incontestable- iii >n' celui q'ii est arrivé dans la commune de lange-sis, où le pont suspendu qui relie les deux rives de da loire a éié ( oinpleieme&t dé truit. yoici 1 s rer.seiijnernons qui ^nous sont donnés sur ce sinistre : ■ vers minuit et demi, un charretier de la pa peterie da m. lentiiigiïe, à mania y, le nommé auguste roy, traversait le pont, lorsqu'il vit tomber.sur uno des pi'es un globe de feu qni se dirigea lo long des chaînes tie suspension. aus sitôt il sentit la fablier s aflais^er sous lui, fut précipité avec sa charrette dans la loire,s# -jar- yjnt fieureuscment à se cramponner aux chaî nes. a ses cri», les frères désiré et auguste saget, ainsi qu • 1« seu<- pitvre €nrgeau, accoururent et parvinrent ô ^auver l« i.tiacretier et '0 the- yal. immédiat.' m nt averti, le maire de langeais s', nuiri-.-si u''arii\or, mais u u eu 1 , qu à constater le maiheuc qui ve nait n'arriver. informé par-b télégraphe, lo prefet, l'ingé nieur en cht-c de couiaine, m. michaud, colonel de gendarmer,e, tt le commandant bourdii.orj	coït	1	1
le_pays	1859-08-05	1	2	PAG_2_TB000056	662	1058	2525	2869	s le cor.. s fut revê u d'en uniforme com-i p!et,_san» omettre son chapeau et ses bot-1 tes; it fut alors placé dans ie .cerc'jed chi-i unis avec six ou huit ma eias couverts de i s .ie et très-riches et une pi,(jv sion de di-1 vers oujets à i'usege du défunt. le couver-2 cie fut lixé et le tout est maintenant confié i à la garde de ses 1 lorn,'sthldes, en atï.en-dant une occasion pour tu,- uanspc'rt'-i dans le nor ?. de nombreux officiers chinois ont montré b' aucoup de respect et de regrets s our ie défunt. le pius grand ordre n'a pas c-^é de rêgtx-r et ou n'a f..it aucune obj. cuon à la prépuce des étiangets.	prépuce	1	1
courrier_gard	1859-08-11	1	1	PAG_00000001_TB000080	140	809	996	4052	les deux ravissantes femmes formaient un groupe adorable. elles causaient à demi-voix ct leur babil vibrait sur le coeur d’octave comme une voluptueuse harmonie.	voluptueuse	1	1
courrier_gard	1859-08-18	1	2	PAG_00000002_TB000099	427	819	2856	3107	llparait que ce rappel à l’ennui et aux incommodités inséparables du bien conjugal, atteignit un but tout contraire à celui que s’était proposé l’orateur, puisque, du temps d’auguste , le libertinage avait tellement corrompu la jeunesse, que le célibat était devenu à la mode. pour obvier au mal qui était la suite de cette dépravation , l’empereur employa tous les moyens qui étaient en son pouvoir; il établit des peines contre les célibataires, et, dans le but de les stygmatiser en quelque sorte . par un espèce d’exposition publique, il leur assigna une place particulière dans les spectacles.	libertinage	1	1
