work	date	issue	page	block	height	width	hpos	vpos	text	active_words	occurrences_words	unique_words
univers_illustre	1884-03-29	1	14	PAG_00000014_TB000016	415	970	423	2542	enfin, tout ce que la plus molle et la plus voluptueuse paresse peut imaginer était rassemblé dans les salons de mon hôte ; et, du reste, en ces climats, il est une sensation pénible qu'éprouve tout homme habitué à cette vie engourdissante, lorsqu'il s'agit d'exécuter le moindre mouvement, pour sortir de l'assoupissement, sorte d'ivresse où il se plonge avec délices.	voluptueuse	1	1
gil_blas	1884-03-29	1	1	PAG_00000001_TB000171	256	1042	5880	4972	— conte si tu veux, animal, ça m'assoupira délicieusement, répondit l'antique marin, en égratignant voluptueuse ment des angles de ses coudes et de ses fesses le cuir de son fauteuil.	voluptueuse	1	1
gil_blas	1884-03-30	1	1	PAG_00000001_TB000075	486	1029	2524	8698	le cadre est vraiment féerique, le spectacle étrange, vertigineux, original. les diamants resplendissent. c'est une symphonie de couleurs, un scintillement de pierreries, une irradiation de beautés et de voluptueuses splendeurs qui rappelle les fêtes drantan et dont nous reparlerons demain, car la fête commence juste au moment où nous mettons sous presse.	voluptueuses	1	1
lanterne	1884-03-30	1	4	PAG_00000004_TB000009	577	1025	1388	856	« ie la cicatrisation de la déchirure herniaire est possible, puisqu'elle se produit chaque jour par la seule action du bandage chez les jeunes sujets et même chez des individus de vingt et trente ans ; elle est possible, puisque la hernie que nous portons tous avant notre naissance, pendant la vie embryonnaire, alors que le testicule traverse pour descendre à l'extérieur les parois musculaires du ventre, persiste rarement chez l'enfant qui vient au monde et que le plus souvent elle est guérie auparavant par occlusion naturelle du canal ; 2 dans ces cas, la nature, pourvu qu'elle soit entourée de conditions favorables, fait seule les frais de ce	testicule	1	1
gil_blas	1884-04-01	1	3	PAG_00000003_TB000088	260	1047	2527	5033	cet aimable chevalier de faublas, un peu fou, très tendre, sincèrement épris, avec une pointe du libertinage particulier à son époque « est, selon lui, un des héros calomniés où plutôt incompris de notre littérature.	libertinage	1	1
matin	1884-04-01	1	4	P4_TB00021	860	628	2148	247	que nous portons tous avant notre naissance, pendant la vie embryonnaire, alors que le testicule traverse pour descendre-à l'extérieur les parois musculaires du ventre, persiste rarement che2 l'enfant qui vient au monde et que le plus souvent elle est guérie aumrnmnt par occlusion naturelle du cunal ; 2° dans ces cas, la nature, pourvu qu'elle soit entourée de conditions favorables, ■ fai t seule les frais de ce travail cicatriciel ; 3* le moyen qu'elle emploie est l'affront men; des parois du canal, puis leur agglutination par l'intermédiaire p'une sécrétion plastique qui finit par s'organiser. » mais pourquoi la nature n'agit-eile pas en toute circonstance comme elle 'le fait simplement dans le bas âge, par exemple, et ensuite dans l'âge adulte? c'est que, plus tard, l'anneau, tiraillé par le poids dù paquet intestinal,a perdu	testicule	1	1
radical	1884-04-01	1	1	PAG_00000001_TB000164	123	1025	4706	8520	gilbert se figura, enivré sans doute par cette voluptueuse pression, qu andrée,	voluptueuse	1	1
gil_blas	1884-04-03	1	1	PAG_00000001_TB000166	569	1032	4744	2850	le ciel avec toutes les pudeurs d'une colombe, qui ne laisse pas approcher ses ailes ; et lorsqu'il eût été si doux do se jeter goulûment sur les petites mains à ongles roses, dont les doigts recourbés formaient mille voluptueuses fossettes, au lieu de les barbouiller de baisers il fallait les regarder avec un air d'indifférence, ainsi que le col mignon se perdant dans les sinuosités blanches des rondes épaules.	voluptueuses	1	1
gil_blas	1884-04-08	1	1	PAG_00000001_TB000064	523	1032	2525	3670	et puis après les féeriques enchantements de la fête d'arsène houssaye, il est bien difficile de retrouver ailleurs les chuchotants marivaudages des dominos mystérieux, les tentations voluptueuses et les décevantes promesses des jolies femmes qui chantaient si bien cette nuit-là, avenue das champs-elysées, les chansons amoureuses de la jeunesse et du printemps. , ,	voluptueuses	1	1
matin	1884-04-08	1	4	P4_TB00013	865	624	2153	261	que nous portons tous avant notre naissance, pendant la vie embryonnaire, alors que le: testicule traverse pour descendre à l'extérieur les parois musculaires du ventre, persiste rarement chez l'enfant qui vient au monde et que le plus souvent elle est guérie auparavant par occlusion naturelle du canal ; 2° dans ces cas, la nature, pourvu qu'elle soit entourée de conditions favorables, fait seule les frais de ce travail cicatriciel; 3 0 le moyen qu'elle emploie est l'affrontement des parois du canal, puis leur agglutination par l'intermédiaire d'une sécrétion plastique qui finit par s'organiser. » mais pourquoi la nature n'agit-elle pas en toute circonstance comme elle le fait simplement dans le bas âge, par exemple, et ensuite dans l'âge adulte ? c'est que, plus tard, l'anneau, tiraillé par le poids du paquet intestinal, a perdu	testicule	1	1
xixe_siecle	1884-04-10	1	2	PAG_00000002_TB000194	402	1029	3729	7068	plus irritants et plus séducteurs les uns que les autres ; ils augmentaient toujours d'intensité et d'expression, avec une science si raffinée de tous les frissons de la chair, que la vibration voluptueuse se transmettait directe de la jeune femme au jeune homme.	voluptueuse	1	1
xixe_siecle	1884-04-11	1	2	PAG_00000002_TB000183	409	1034	2581	8496	il frissonnait lèntement,comme au sortir d'un cauchemar, se murmurant des mots étranges que personne ne comprenait autour de lui, balbutiant une langue inconnue avec une douceur voluptueuse et paraissant chercher quelque chose qui lui manquait.	voluptueuse	1	1
rappel	1884-04-12	1	3	PAG_00000003_TB000072	1692	1015	1315	7100	cette petite bohémienne avait de la gazelle, de la hyène et de la bacchante ; on voyait en elle je ne sais quelle rébellion sauvage qui effrayait; mais comme ses yeux vdè jeune tigresse captivaient son monde ! monstre charmant.qui cachait la femme et qui répandait déjà des séductions violentes, parsescheveux tordus eu serpent, par ses regards allumés, par les cartons ardents de ses lèvres sur de petites dents aiguës de bèlç féroce, par sa voix e&aude de. contralto ; mais elle était inconsciente de cette action voluptueuse ; d'ailleurs elle ne fra,p$ait ainsi les sens qu'au moment où elle chantait ses chansons. au repos, c'était plntù[, une mignon dépaysée; sa figure) s'adourcissant sous un vague sourire d-3 candeur, prouvait bien vite qu'il y avait en elle une enfant sous la comédienne improvisée. si je dis la comédienne, c'est que déjà cette fillette avait tontes les ressources d'une artiste qui a étudié les éloquences du gseste, de l'attitude et de la ligure. elle se campait en petite fille du cid, elle mettait le poing sur la hanche comme une forte en gueule de molière, elle débitait des gauloiseries avec la bouche gouaill euse des parisiennes de montmartre.	voluptueuse	1	1
xixe_siecle	1884-04-12	1	2	PAG_00000002_TB000149	582	1030	2626	8649	un calme profond lui coulait peu à peu dans les veines et dans le cœur, chassant les impures pensées et les brûlures voluptueuses des baisers de la bayadère. il lui semblait revivre dans une atmosphère nouvelle et les souvenirs sensuels le visitaient moins souvent. lentement le temps usait la sensibilité exagérée de ses nerfs, à mesure que ses membres reprenaient leur saine vigueur d'autrefois.	voluptueuses	1	1
xixe_siecle	1884-04-12	1	2	PAG_00000002_TB000152	332	1035	3708	6714	plusieurs fois il rencontra marianne rabergin ; la passion de son adolescence lui rentra au cœur, toute neuve, envahissant son cerveau de ses tendres effluves, chassant la sensualité et ramenant l'amour vrai.	sensualité	1	1
gil_blas	1884-04-15	1	2	PAG_00000002_TB000214	474	1050	3801	8714	le monde n'était plus pour elle cet en-, droit bienheureux et féerique, où lui venait, elle ne savait alors comment, une voluptueuse exaltation de l'être. aujourd'hui elle se rendait nettement compte que cette exaltation était faite avec des musiques, des lumières, des fleurs, des reflets dad.s des glaces, des propos équivoques, des verres de punch.	voluptueuse	1	1
matin	1884-04-15	1	4	P4_TB00011	626	746	1723	621	< i° la cicatrisation de la déchirure herniaire est possible, puisqu'elle se produit chaque jour par la seule action du bandage chez les jeunes sujets et même chez des individus de vingt et trente ans ; elle est possible, puisque la hernie que nous portons tous avant notre naissance, pendant la vie embryonnaire, alors que le testicule traverse pour descendre à l'extérieur les parois musculaires du ventre, persiste rarement chez l'enfant qui vient au monde et que le plus souvent elle est guérie auparavant par occlusion naturelle du canal; 2° dans ces cas, la nature, pourvu qu'elle soit entourée de conditions favorables, fait seule les frais de ce travail cicatriciel; 3° le moyen qu'elle emploie est l'affrontement des parois du canal, puis leur agglutlna-	testicule	1	1
liberte	1884-04-18	1	3	PAG_3_TB000198	118	1013	5822	9238	tnsens)b)usateur duchesne. ? extractïoa etpoaq de pénis sa/is - douleur, l'ua lafayotto) l.5.	pénis	1	1
debats	1884-04-23	1	4	P4_TB00045	2408	800	3573	831	avis divers marienbad (bohème) erfs fcranz-joseph », dans une vallée environnée de montagnes boisées ne s'ouvrant que vers le sud (628 métrés au-dessus du niveau de la mer), parfaitement abritée, charmantes se prolongeant à plusieurs milles dans les bois de haute futaie des hauteurs, avec trois vastes maisons de bains d'eau minérale, de marais (moorbader), à douches et gazeux, -ainsi que sept sources médicamenteuses, est le par excellence des eaux froides. le kreuzàrunnen et le les plus énergiques des sources de de soude connues, sont d'une efficacité unique dans les diverses affections morbides des voies digestives et urinaires, des organes sexuels de la femme, les souffrances de l'âge de retour, les troubles de l'alimentation, comme douleurs rhumatismales, excès , diabète, etc. l' ambrosiusbrunnen (eau minérale la plus riche en fer de l'allemagne), et le carolinenbrunnen sont des eaux essentiellement thérapeutiques. la s'emploie avec succès dans les affections chroniques des voies respiratoires. la est un agent des plus efficaces dans les catarrhes chroniques des voies urinaires, etc. les bains de marais de marienbad sont les plus de tous les bains martiaux de ce genre connus. la ville renferme des hôtels etmaisons meublées élégamment aménagés, un bureau de poste, et douane, cabinet de lecture avec un grand choix de volumes. trois concerts chaque jour par la«curcapelle», concerts fréquens,ainsi que bals, et réunions dansantes, représentations théâtrales tous les jours. eglises catholique romaine, et anglicane; services religieux russe et suédois, synagogue. durée de la saison : l« r mai a fin septembre. affluence annuelle de 14,000 (non compris les touristes et passagers). toutes les eaux minérales étrangères dans les de buveurs. l'expédition des eaux qui ne se fait qu'en bouteilles de verre 3/4 de litre, du sel des sources, des pastilles préparées avecce sel, ainsi que du limon, est par l'lnspection des eaux, laquelle fournit gratuitement, de môme que les dépôts, des relatives au mode d'emploi. administration communale.—inspection des eaux malliendad dépôt à paris, ch. m. a. adam, suc, 29, michodière. gjtnbriq. de 1 ordre, de gde ville p. paris, dem. f commanditaire av. 200,000 f. p. acquérir autre fabque analog. de la place à céder p. cause d. veuv. affaires des 2 usines 550.000 f. réf h. ligne. gar 1 hypoth. s. im. int. assuré 5 0/0 et 10 0/0 de bén net agence de l'lndustrie, 82, r. d'hauteville. baccalaureats. institution lelarge, 20, rue gay-lussac, paris.» en 1882-83, l'lnstitution a fait recevoir 156 élèves. cours spéciaux pour la session de juillet-août. titres livrables de suite ch. monïeaux fils et ce, 15, b. montmartre obligations csïiï*»! rentes françaises, chemins de fer	sexuels	1	1
echodeparis	1884-04-24	1	2	Page1_Block53	1998	787	3434	2107	-f # t w t7® */ *'p) oiïl' î' la .gravure ne montré pâé même leà seins dëcouv'erts 1 àe ia feihme. <311'à-t-fille doné dè provocant,'dû lic'enéiehx. ? !i -'j'  ,1 ' ' s h 1j . ' !i ' î f< li i . i/( j gela fait-il venir: de coupables peaséps^j ., s . ! car c'est'la ^ué^erait' lé* dêïityasiib l'exhibition d'une image sui'-è'xkîitatit olfi-v mgination et îè»- sén§..l3r. le dessin in criminé n'éveme chez lespectatencaucun désir, auoune idée - r yoj,uptuçu^p a < auqu^e pensée,impure. , , qtfil ën'est'kutremfeïit, *mèéfeieurs^ ide certaines .œuvre- du xyih 8 ' siècle,' -par «xeniple l'^ue dirait le'tribunal* de quel ques tableaux de^wattçau, fle- bouaher, de baudoin, de qreuze, de^^ragonard'? tenez, l' embarquement pour 'çy^èvf entre autres,: regardez dans fôuiïjagë à.^oite,, e't vous y a^ercevi-ëz 'tm priâpe monsxmëux. voilà, poiïr- watteauj bou clier'a déshabillé ! ia tfemme'boïn'mb aucun péintrfe' n'a' fait : , .« ! la ! volupté;- disent mm; l de l '<broncotirtj l «'est tout l'idéal de boucher »; etquatatîà feaudoini» son gen dre, il me suffira de rappeler qu'on l'a surnommé le crébtihon de la peinture. greuze n'a pas fait que la cruche cassée : »> 'ttiut cïhe&^gr-euwij dlbentnefldorejimh. 3e gonfcourt,' concourt à rimtatwoi se^p suelle. les posep sont faciles,$ba.gdoi>* nébs, les gorges s'avancent t .provocante?», serrées^., » et mm. degonc.ûurt ( ajoutpnt ; « chez greuze,. le libertinage se vdfle i chez fragonarci,, il '-s'étale. » ( fr,agbnart. est, en otfet, le peintre ërdtltfruo' 'par lcellence: ■' ■ t 0 - ' ' •' ' ' i j i ' )'i .■! :>f ■ quelques-uns fles'tahlpau* de cep mal, très sont dans nojs musées* prjçsewe |tom? ^ont reproduits.-par la,, grav uçe ,va-t-on doue'fermer-nos musées ï va.-r%-on donc interdire la reproduction de oesv'œuvres ? on n'j a jamais singé,-j'iînagi'aë i nou's rie ' sommes,plus au temps où^ ie 'fameux vicomte sosthène de ' lia rochefo&c&uld faisait allonger les 'jupes i-desr ^anâeuses et .couvrir d'une fâuiul, de jvigneles ,(sta+- tues ides jardina publiqs. . , ■ ,	libertinage	1	1
echodeparis	1884-04-25	1	1	Page1_Block40	1593	784	2526	4987	le génie du'poète rendait tout cela.vi* vant et présent ; les mots brillaient sur la page.commeces pierres sans montureque ijugentlesjoaillierssurdupapier.vraiment elle pouvait -être' fièro, la femme aux genoux de qui* l'on jetait ces richesses. 'fallait-il-qu'elle fût aimée, puisque, mal gré la curiosité de ces fêtes, le poète ne songeait qu'à elle, mourait de ne pas la voir: « oh ! cette nuit, j'étais avec toi sur le grand divan de la rue de l'arcade. tu étais nue, tu étais folle, tu criais de joie sous mes caresses, quand je me suis ré veillé en sursaut, roulé dans un tapis sur ma terrasse, en pleine nuit d'étoiles. le cri du muezzin montait d'un minaret voi sin en claire et limpide fusée voluptueuse plutôt que priante, et c'est toi que j'en tendais encore en sortant de mon rêve... » quelle force mauvaise le poussait donc à continuer sa lecture malgré l'horrible jalousie qui blanchissait ses lèvres, con tractait ses mains? doucement, câline- ment, fanny essayait de lui reprendre la lettre ; mais il la lut jusqu'au bout, et après celle-là une autre, puis une autre, les laissant tomber au fur et à.mesurè avec un détachement de mépris, d'indif férence, sans regarder la flammé qui s'avivait dans la cheminée aux effusions lyriques et passionnées du grand poète. et quelquefois, dans le débordement de cet amour exagéré'à la température afri caine, le lyrisme do l'amant s'entachait de quelque grosse obscénité de corps de garde dont auraient été surprises et scandalisées les lectrices mondaines du livre, de l'amoiir , d'un spiritualisme	voluptueuse	1	1
supplement_figaro	1884-04-26	1	1	PAG_1_TB000031	1161	784	152	5994	j'ai souvent entendu stigmatiser dans mon enfance, la scène de chérubin, dé- guisé en femme par la comtesse et par suzanne, comme'un tableau de pur libertinage qui révoltait la délicatesse des honnêtes gens. aujourd'hui nous sommes bien blo.sés sur tout cela. en sommes-nous plus vicieux? question périlleuse que je ne cherche pas à trancher. j'aurais peut-être répondu affirmativement avant d'avoir fait une expérience récente, qui m'a permis de constater combien est forte la puissance neutralilisante de l'habitude contre les excitations matérielles des jeux de la scène. j'ai vu, cette année même, au lyceumthéâtre de londres, joués par irving et ellen territt, les personnages de roméo et de juliette avec l'ardeur sensuelle que comportent et qu'autorisent les développements ardents d'une passion fougueusement italienne. le baiser sur 'a bouche de la scène du bal, le désordre significatif des deux amants dans la ,chambre nuptiale, derrière le balcon, présentent des images bien autrement lascives que je badinage des deux femmes avec le petit page chérubin; cependant les ieunes demoiselles anglaises	libertinage	1	1
supplement_figaro	1884-04-26	1	1	PAG_1_TB000079	1875	776	3408	1670	t ll nous avons annoncé, avant-hier, la mort de la comtesse douairière gilbert de voisins, si longtemps applaudie sous le nom de taglioni. voici sur* la grande danseusequclqtiea pages empruntées à un livre de charle de boigne, intitulé petits mémoires de l'opéra, qui fourmille d'anecdotes fort amusantes sur le monde des coulisses d'il y a-trente ans. qu'une danseuse, il y a trente ans, ait pu faire dans ta danse une. révolution qui dure encore aujourd'hui, c'est déjà quelque chose d'étonnant; mais que cette danseuse, cette grande révolutionnaire ait été une femme mal faite, bossue même, sans beauté, sans aucun de ces avantages extérieurs et éclatants qui commandent le succès 1 voilàce qui tient du prodige, et voilà ce que nous avons vu, de nos propres yeux vu 1 c'est que marie taglioni était plus qu'une danseuse, la plus parfaite qui ait jamais paru sur les planches de l'opéra, c'est qu'elle était la danse elle-même. correcte sans roideur, aérienne sans efforts, voluptueuse et chaste, toute de grâce et de poésie, sa danse parlait à l'âme, tandis que la vieille danse, ne parlait pas mêmeauxsens,et ne s'adressait qu'aux yeux. avant taglioni, la danse n'était qu'un métier, le métier de sauter le plus haut possible, de pirouetter comme un toton. elle paraît, et le métier devient un art, la vieille école s'ecroule; flore et zéphire disparaissent, le ballet entre dans un monde nouveau, dans le monde idéal des fées, 'des lutins et des génies.	voluptueuse	1	1
siecle	1884-04-26	1	3	Page1_Block11	6951	821	1784	341	' que les autres ont résisté pendant tout ce laps de temps à l'intoxication. quant à la liqueur d'absinthe et à l'es sence d'absinthe, elles déterminent chez ces animaux dès phénomènes convulsifs comparables à ceux de l'épilepsie. quelles sont les modifications que l'al cool subit dans l'économie? c'est ici que nous entrons dans le domaine de la théo rie et des hypothèses. m. dujardin-beau metz soutient qu'une fois ingéré dans l'organisme il y est comburê et qu'il subit, par suite de cette combustion, ude série de transformations plus ou moins profondes qui en font un aliment d'épar gne à petite dose et un poison à dose éle vée. mm. perrin, duroy et lallemand prétendent, au contraire, que l'alcool tra verse l'économie sans y subir aucune transformation et qu'il est éliminé en nature, après avoir, toutefois, quand il a été pris en excès, causé de sérieux dé sordres, surtout du côté du système ner veux. pour ces savants, l'alcool n'est pas un aliment d'épargne dans l'acception propre du mot, mais il possède la pro priété de ralentir l'activité nutritive ; c'est ainsi qu'il sou ient les forces et s'op pose à l'amaigrisseaient. de quel côté est 11 vérité, ou du moins la plus grande somme de vérité? je me garderai bien de me prononcer à cet égard, et cela avec d'autant plus de rai son qu'un de nos plus savants chimistes, m. berthelot, a déclaré que la question éttit on ne petit plus difficile à résoudre. ce qu'il y a de certain, c'est que l'eau- de-vie pure, lien rectifiée, prise à petite dose, est un tonique, un reconstituant, et qu'il n'y a aucun inconvénient à en faire un usage modéré ; mais méfiez-vous dés alcools impurs, de ceux surtout de grains, de fécules et de pommes de terre. c'est la conclusion la plus importante et la seule pratique a déduire de toutes les recher ches dont je viens de parler. d r m. d. — lettre de la province (correspondance particulière cl% siècle.) le colmatage de la crau marseille, 24 avril. aujourd'hui, le conseil général dos bou- ches-du-rhône s'est occupé du colmatage de la crau. en traversant, en chemin de fer, la partie du département située entre les.alpines et l'étang de berre, après les stations d'arles et do miramas, il n'y a pas de voyageurs qui n'ait remarqué, des deux côtés de la voie, ausi loin que la vue peut s'étendre, un vaste champ pierreux où coït à grand'peine un gramen pâle et desséché. ce steppe désolé, tout couvert de galets 3 , c'est la grau, acampesttido e secarouso, l'immenso grau, la crau pérouso, a dit mistral. oa va fertiliser la crau par le colmatage. c'est à l'aide des limons de la durance qué la crau sera colmatée. l'accomplissement de cette œuvre a déjà tenté bien dos esprits. ai-je besoin de vous rappeler qu'au seiziè me siècle un ingénieur célèbre, adam de craponne, avait cherché à utiliser les li • mons iertiles de la durance pour la trans formation en prairies de cette terre stérile de la crau, terram horrid-am, comme l'appe lait strabon. il importe, en effet, de remar quer que le canal de craponne fut, dans l'es prit de son créateur, un canal de colmatage et non un canal d'irrigation. ce n'est qu'après la mort de l'ingénieur adam qu'on détourna le canal de sa destination primiti ve, au grand détriment de la région qu'il était destiné à régénérer. les choses restè rent en l'état jusque dans ces derniers temps. cependant, en 1862, des études sérieuses fu rent entreprises par m. nadault debuffon et continuées par les ingénieurs de l'etat. on créerait un canal de colmatage débi tant 80 mètres cubes par seconde, avec june prise sur la rive gauche de la durance, à^_ 600 mètres en avant de malemort. ce canal se dirigeant, de ce point, sur la trouée de lamanon, longerait la limite est de la crau pour contourner le périmètre des marais de fos. le tronc commun de ce canal alimen taire aura près de 20 kilomètres; il sa divise en canaux secondaires, destinés à amener les eaux limoneuses sur la crau et dans les marais qu'on veut arriver à combler. la section et la pente du canal sont déter minées de façon à assurer aux eaux une vitesse moyenne de 1 m. 25 par seconde. les ca naux secondaires, au nombre de douze, au ront ensemble une longueur da 20,000 mè tres ; ils desserviront douze bassins de 400 mètres, dont chacun sera divisé en trois compartiments se remplissant alternative ment tous les trois jours. des dispositions très étudiées assureront l'écoulement à la mer des eaux de colature. telle est l'écono mie générale du projet dont l'estimation est de 16 millions, qui permettrait de colmater et de combler près de 5,00q hectares de ma-: rais. pour faciliter l'exécution de cette œu- yre utile, l'etat accorderait une concession de 99 ans et une garantie d'intérêt au taux 'de 4 0/0 pendant 20 ans du capital néces saire à l'exécutio a des travaux ainsi qu'à l'achat des terrains à colmater ou à assainir. le tout est estimé 30 millions,. la transformation de la cirai? en prairies et en terres arables sera pour la.provence et môme pour la vallée du rhône tout en tière une 'opération des plus fructueuses et. qui augmentera dans de grandes proportions la richesse de notre région. mort de m me taglioni ainsi qi!3 je vouki i'ai télégraphié ce ma tin, là célébré danseuse, marie taglioni, veuve gilbert desvoisins, est morte à mar seille à l'âge de quatre-vingts ans passés. on l'a enterrée ce matin, sans grande pompe ; elle appartenait au {suite protestant. depuis plusieurs années, la taglioni s'é tait retirée chez son fils, m. le comte gilbert desvoisins, qui a épousé, à marseille, mlile ralli, fille de m. fialli, le richissime négo ciant hellène. c'est à la campagne ralli, au prado, auprès de son fils et de sa belle-fille, que la créatrice de la sylphide et de tant d'autres ballets fameux, il y a cinqijante ans, a rendu le demie? soupir. sa fille, la comtesse desvoisins, a épousé le prince alexandre troubetskoï, ancien consul gé néral de russie. la taglioni notait pas ^ic'ae. son mari, m. (îilbert defvoisins, ijnçien ' çonsul de france à ligueras .avait dépenséunegrande partie de la fortune de la danseuse, qui per dit le reste en 1870, dans la débâale d'une maison de banque < où elle avait placé ses <•— a _ soixante ans passés, elle donnait, à londres, des leçons de aantscj » £jâbt iîlvis rien de ses palais de venise ni de * es viilas du lac de côme, * elle a succombé, ici à un refroidissement. quand elle s'alita, il y a huit jours à peine, elle disait que c'était la première fois depuis plus de trente ans qu'elle faisait appeler ttù médecin. très gaie de caractère, elle portait admirablement son âge, et l'on n'eût pas dit	coït	1	1
