work	date	issue	page	block	height	width	hpos	vpos	text	active_words	occurrences_words	unique_words
temps	1890-01-02	1	2	Page1_Block20	7762	940	3992	341	romanesques, les romanciers d’aujourd’hui prétendent à l’épithète de scientifiques et les exemples sont nombreux des écrivains qui, comme mm. claretie et ernest daudet vont avec succès d’un genre à l’autre. et aussi bien, c’est presque le même public qui lit les uns et les autres. ceux qui cherchent dans les romans des documents d’histoire contemporaine ne pourront se dispenser de lire les livres dont suivent les noms : histoire de la chanson populaire en france, par tiersot; histoire et diplomatie, par le duc de broglie ; y empereur guillaume ii, par edouard simon: en alger, par cunisset-garnot; par de saint-victor; le journal d'un de paris pendant ta révolution française, par h. monin ; tunis et ses environs, par charles la bohème du travail, par j. barberet; de la porcelaine tendre de sèvres, publiée par la maison quantin, avec de magnifiques en couleurs ; le paris, de a. vitu, qui est comme une illustration de la grande année qui s’achève; y histoire de la civilisation française et y histoire de la civilisation contemporaine en france, deux encyclopédies d’une haute portée philosophique, par alfred rambaud; le pape de demain, par jean de bonnefon, un livre de production hardie dont s’est ému le monde ; washington et son œuvre, par masseras; athènes, par marius fontanes; les courses de taureaux, par armand dayot ; le troisième de y empire des czars et les russes, par ; mémoires des autres, par jules ; 1789 et 1889, par emile ollivier; uranie, par camille flammarion; le voyage en zigzags de deux jeunes français en france, par gaston bonnefont, un livre ingénieux d’étrennes, tout désigné pour les futures distributions de prix et qui promènera les jeunes lauréats de sur les routes pittoresques de leur pays. le dernier étage de la tour — le plus étroit, le plus élevé, car c’est de là que l’on regarde à vol d’oiseau, que l’on fouille l’horizon, que l’on perce les nuages, c’est le plancher de la et de la philosophie. voici quelques noms choisis dans ce bataillon sacré des sages qui habitent au-dessus des passions dans l’éther: les questions de morale pratique, par francisque bouiller, une belle étude des altérations du sens moral, de la fausse conscience, du mensonge et de l’hypocrisie ; le sixième tome des monographies professionnelles, par ; y introduction à l'élude des races humaines, par de quatrefages ; y automatisme psychologique, par pierre janet; y art au point de vue par guyau, une des dernières de l’éminent écrivain, publié avec une introduction de m. fouillée; la bataille le premier volume des comptes rendus de philippe gille ; le traicté de l'economie politique d’antoine de montchrétien, publié avec une préface de m. funck-brentano; une étude de morale et d’esthétique sur par un fervent du poète ch. de pomay- rûls; uno histoire de tn.. peinture militaire en france, par arsène alexandre; la philosophie de platon, par alfred fouillée; la. france criminelle, par henri joly; emile augier, par ed. paille- ron ; erasme, par emile amiel ; la quatrième série des impressions de théâtre, de notre ami jules lemaître ; le quatrième volume de littéraire, par paul ginisty ; les mille et une nuits du théâtre, par auguste vitu (7 e série) ; remarques sur l'exposition du centenaire, par le vicomte de vogüé ; histoire des jouets et des jeux d'enfants, par edouard fournier ; les notes sur le théâtre contemporain, par emile faguet ; au fil des jours, par henri chantavoine. enfin, notes et souvenirs, par ludovic halévy, que je cite ici pour finir, car ce petit livre me bien résumer dans leurs tendances les penchants de l’esprit moderne qui sont critiques, philosophiques et romanesques. pour les événements artistiques de ces six derniers mois, la liste n’en est pas longue : l’exposition a tiré tout à soi. nous avons eu pourtant en juillet la vente secrétan, la autour de y angélus de millet, adjugé 534.000 francs. puis quelques érections de statues : celle de raspail à paris, de paul bert à auxerre, une réduction de la liberté de bartholdi sur le pont de grenelle ; ce pendant que, comme toutes les années, les élèves du conservatoire déclamaient racine et molière devant leurs jurys habituels, et que les prix de rome exposaient leurs toiles à l’ecole des beaux-arts... en août, la nouvelle sorbonne a été sous la présidence de m. fallières et m. gréard a prononcé en cette occasion un beau discours auquel le ministre a répondu. en octobre, on a dédié à bastien-lepage un monument à damvilliers, et mme pommery, de reims, a offert au louvre les glaneuses, de millet, pour nous consoler de la perte de yan- gelus. enfin, l’inauguration du musée des dit musée guimet, et les installations de neuville sur la place wagram et de balzac à tours sont d’hier. on ne peut prétendre à relever tous les événements qui ont défrayé depuis six mois la verve des chroniqueurs et des de journaux illustrés. je cite les plus saillants : en juillet, l’explosion de saint-etienne, qui a été l’occasion d’un si beau mouvement de charité de la part des abonnés et lecteurs du temps ; les courses de taureaux et la entre la société protectrice des animaux et les partisans de la mort dans le cirque, par l’interdiction du préfet de police ; le bal des exposants au palais de l’industrie. en août, l’arrivée du shah de perse et les fêtes données en son honneur ; la cérémonie patriotique de la translation au panthéon des cendres de lazare carnot, de la tour-d’auver- gne, de marceau et de baudin ; la visite de dinâh-salifou, émir des nalousà l’exposition; le verdict de la haute cour qui condamnait mm. boulanger, rochefort et dillon à la dans une enceinte fortifiée ; la d’une fédération universelle des étrangers et français ; la visite à l’exposition. en septembre, l’exécution de 1 '-ode de mme augusta holmès en faveur des victimes d’anvers. en octobre, la cérémonie officielle de la des récompenses au palais de sous la présidence de m. carnot, d’un bal à l’elysée, en l’honneur des le 6 novembre, l’exposition universelle était définitivement close, et si l’on cherche quels sujets ont rempli dans les journaux la colonne devenue vacante, on n’y lit plus que les « théâtres », « crimes » et « pâtes » ; la lutte pour la vie, de m. alphonse daudet, le procès du docteur cassan, celui de dauga, la malle de millery et l’«.influenza» ont occupé toute l’attention publique. au dehors, quelques aventures royales : des mariages, des morts, des pertes de trônes. en juillet, le petit roi alexandre de serbie a été sacré ; au mois d’août, la princesse louise de galles a épousé lord fife ; l’empereur françois-joseph, accompagné de son présomptif, l’archiduc a été saluer l’empereur guillaume à berlin. et pendant ces politesses de rois, 30.000 ouvriers des docks de londres entraient en grève et, sur le petit théâtre haïtien, le hippolyte battait à plates coutures le président légitime. en septembre, la hollande a célébré par des réjouissances populaires le dixième de la petite princesse wilhelmine et du cimetière français de a été l’occasion d’une démonstration de la russie en faveur de nos soldats. enfin, l’année 1890 verra une nouvelle inaugurée. presque à la minute où le duc de bragance était proclamé roi de sous le nom de carlos i er une révolution chassait du brésil l’empereur dom pedro, le renvoyait en europe avec sa dynastie. et maintenant le douloureux inventaire des morts. sans doute, ils nous sont nés cette ceux qui répareront un jour ces brèches ; mais nous ne les devinons pas dans leurs ; leur venue ne saurait nous consoler de tant de départs; dans ces balances, il semble que les pertes dépassent toujours l’avoir. en juillet : le comte de bouillé; le sculpteur jules etex ; m. bocquet, externe à l’hôtel-dieu, victime de son devoir professionnel ; le duc de clermont-tonnerre, ancien ministre delaguerre et de la marine sous charles x. en août : le général cousin-montauban, comte de palikao ; le baron de witte ; félix pyat ; mme la maréchale canrobert ; m. guilbert, cardinal archevêque de bordeaux; damala; villiers de llsle-adam. en septembre : le docteur maurice perrin, président de l’académie ds médecine: maurice sand; jules prével.	érections	1	1
echodeparis	1890-01-03	1	3	Page1_Block13	6823	1009	4054	224	des trapèzes protestaient de leur rigidité dei lignes droites contre ces débauches de courbes.  un luxe de modes voyantes parait les loges et la galerie, complétant par , l'apparat des toilettes la riche, polychromie des reflets. surplombant un bar du promenoir, une niche recelait lé .groupe de torchestre; et des blocs de musique cuivrée s'en écroulaient, fracassés, pour s'émietter sur la piste. là, haute sur un courrier galopant, une écuyère-crevait de tout son corps les virginités blanches de successifs cerceaux, de papier d'où elle -sortait, attifée un. insjtarît d'une cojlefette vite dépassée. a- distance,-un clown*'au bonnet pointu, à la robe brodée dé dessins emphatiques, imitait ; - avec des sauts de grenouilles l'exercice dé la ballerine et parodiait son geste comme un perroquet le verbe humain. il salua son départ de pirouettes cocasses et lui fit cortège de ses ■ cabrioles jusque sa sortie de l'arène. comme le programme annonçait les exer cices de miss claricia, un jeune homme ouvrit la porte de la seule loge vide et s'y installa. offensé d'abord par la brutalité des éclats, il obligea ses regards à discerner, à travers la première sensation d'un confus brouillard , lumineux, l'entrée de la trapéziste. sur la salutation des sonorités allègres, elle entrait en effet, avec le pas gêné de l'être ailé qui marche; immédiatement céinturée, ùne corde, la hissa verticalement au plus haut trapèze. là sise, elle s'y trouva chez soi ; elle sourit à. .• l'espace sans filet, au- dôme vitreux qui seul lui interdisait l'envolée dans les ciels, , aux humains tassés en bas. elle leur adressa de la main quelques signés : puis, d'une volte sou daine, elle préluda. suspendue par les pieds, elle accueillit l'arrivée d'un autre trapèze qu'elle happa des dents, et elle se trouva pro jetée sur une-plate-forme correspondante ; elle en bondit pour insérer-ses jambes dans les jarretières improvisées de déux anneaux vo lants, dont elle sé libéra en atteignantrîla pre mière barre. et des trapèzes aux plates-cormes,, des tremplins aux anneaux, elle évoluait, à l'aise dans l'aircomme un nageur dans l'onde, se maintenant comme un corps immatériel, menaçant la piste d'une chute soudaine et aspirant au dôme par une ascension imprévue, ondant et virant parles espaces familiers, pla nant au-dessus de l'enceinte aux têtes éba hies comme un oiseau libre au-dessus d'un, troupeau captif. le jeune homme s'émerveillait des parabo les décrites parce corps savant; il tressaillait- de terreur voluptueuse dans la seconde où la femme traversait le vide ; il admirait les des sins que traçaient ses gestes, l'écriture figura tive de ses mouvements, les contournements* harmonieux des formes mouvantes et cette grâce dans le péril oublié. eclair rose et gira toire qui sinuait dans le poudroiement de la mauve lumi'ère. il s'extasiait à nouveau de vant les ondulations qui avaient séduit sa pas sion des courbes rythmiques, devant les allu res de dominatrice des airs qu'il avait adorées chez cette gymnasiarque, et il s'enorgueillis sait de cette conquête comme un mortel aimé d'une déesse ; car cet être supraterrestre qui, exaltait dans l'air le poème de son corps s'hu manisait d'amour pour lui, car ces bras qui comme des ailes, s'essoraient dans un ciel d'apothéose, se nouaient le soir en colliers pour son cou. près lui, des spectateurs appréciaient à voix haute le charme de miss claricia ; son égoïsme en souffrit, comme si le privilège de l'admirer lui fût exclusif. mais les causeurs se commu niquèrent leur goût pour la gymnaste, les es poirs de rapports que leur conférait leur porte- monnaie et présumèrent, en termes équivo ques, les bénéfices spéciaux de sa possession. se nommer, les frapper au visage, cela surgit impérieusement dans l'esprit du jeune homme. pour se maîtriser, il voulut considérer la convoitise de ces goujats comme flatteuse à son amour-propre d'amant. mais dans les veux d'autres voisins, il crut deviner la même ardeur;, dans leur conversation, il supposa le mêmes aveux. il ressentit pour la première fois l'impression qu'on lui volait quelque chose. pâle, il-regarda. accoudés aux rebords des.loges, encastrés dans leurs fauteuils, accotés aux encoignures, des hommes dardaient sur sa maîtresse des regards de conquête ; et ces regards la bu vaient, la souillaient, la dévêtaient pour brûler sa nudité d'une robe de luxure tissée avec le feu de leurs désirs et l'impureté de leurs con voitises. il crut voir leurs mains tremblotter dans un prurit de caresses, leurs corps vibrer à l'attente des étreintes, leurs lèvres ébaucher des baisers. et il fut accablé sous l'effroyable et expiatrice jalousie des hommes qui expo sent aux foules les aimées de leur être. dans son hallucination, il eût voulu provo quer personnellement tous les spectateurs et cravacher leurs faces de boucs, mais une pensée soudaine lui rafraîchit le cœur. sans , doute elle, la fidèle amie, sauvait son corps des atteintes infâmes ; dans l'insoucieuse séré nité de son eurhythmie, elle ne rêvait qu'à éployer ses chairs en écharpe lumineuse et qu'à affirmer sa souveraineté dans l'atmos phère soumise à son poids léger; à lui seul elle réservait le don de sa beauté. et comme un tonnerre d'applaudissements, qui retentit ainsi qu'un battement d'innombrables ailes, s'écroula sur sa rêverie, il leva la tête pour étayer sa confiance dans la rassurante-pensée. mais miss claricia, rétablie sur le trapèze prodiguait aux spectateurs l'offrande amou reuse de son sourire, et ses bras s'arrondis saient en des envois de baisers. elle répondait donc à l'élan érotique de ces gens, elle s'asso ciait à eux pour le bafouer, l'insulter, le trom per; ses gestes leur promettaient l'abandon de sa personne; oui,.les directions de son corps dans l'espace tendaient vers eux; ses projec tions visaient leurs bras prêts àse refermersur elle ; elle le trahissait avec eux tous, dans la li béralité d'une universelle prostitution. dans, cette vision exaspérée, elle était la destinataire des péchés d'une foule, l'impériale et lascive courtisane des époques abolies, offerte à l'as souvissement des ordures d'un peuple. _ et, comme pour défier sa complaisance,, devant cette honte, voici qu'elle se donnait par ses baisers. accrochée par les dents à un câble, elle al lait «'élever jusqu'à la coupole : le.jeune homme sortit de la loge, aborda l'entrée des écuries, avisa lè.mâtde départ des cordages, se glissa derrière le garde municipal et les écuyers absorbés par l'attention, et là, il usa d'un menu canif de poche. alors, dans le si lence soudain de l'orchestre, parmi l'effroi des spectateurs accourus, des valets de cirque ; empressés, miss claricia s'abattit du cintre sur la piste, pendant que le justicier imaginaire considérait avec une conscience introublée l<s cadavre de cette femme infidèle. georges vanor.	voluptueuse	1	1
liberte	1890-01-04	1	1	PAG_1_TB000111	241	3189	478	6724	:! :: := z 8sis îs ::! îïî? ,:i .«s :: « :! rp? .rr.:, |û |.. l'y; ,. m0s-sfïx- f* .1:92 fc0j - ;; [i ; ; i 1 s f.'-im f. ?? '? 25. - 3 j 4 b. sô; 40 k v, -*** * * ; j. juin-cl. ?? ??? ??i *nrto ,, ^(331 no ?? *? ?? ?? bous trenienalrôs*»» j 140 14-0 ?* 0ù lo <» m o. fo:<c .ob ïlt d o\t.g. cpt odo - , od.) l'ù \ «>oo lo * l ,.0 ? ? , miues du lautiuin. k panama % 0/ .. ». % .. 0-j m ?? :':1\£1)11 indcetrieu et coït cpt i 5583 .. 585 ..j s8s ........mines de maïaaano..' 1075 ?? w .. <> y  ?' ranllma - 5 q 7*1 40 ^ ^ ..	coït	1	1
lanterne	1890-01-05	1	1	PAG_00000001_TB000025	518	1035	1375	2413	tantôt avec une fièvre croissante de couler dans la glaise, d infiltrer dans le marbre la sensualité native qui t alpitait sous cette chair souple et satinée, de rendre la beauté glorieuse, la jeunesse intacte de ce modèle qui lui rappelait les déesses des cultes abolis. elle revivait plus troublante sous les doigts du sculpteur avec des hanches larges qu'aucune meurtrissure ne bleuissait, avec son ventre poli aux reflets mystérieux ùo le nombril	sensualité	1	1
temps	1890-01-05	1	2	Page1_Block13	5595	979	3081	318	merveilleuse izel, en qui la nature atteint les finesses de la statuaire florentine. ce couple exquis promène son ardente lune de miel à bayreuth dans une des saisons théâtrales à wagner et que m. péladan compare à la trêve de dieu qu’inventa la charité catholique au moyen âge. là, le désir d’izel et d’adar, exalté par le mysticisme sensuel du duo de tristan et yseult, se déchaîne comme un mal divin, éclate en crises nerveuses, devient un nirvana d’amour, un érotisme bouddhique, une eutha- nésie. toute cette partie du livre est d’un mystique dont le sens est exprimé par une sorte d’hymne d’une poésie étrange et profonde, qui célèbre la réhabilitation de la chair. je le morceau, non point dans son entier, mais en supprimant quelques formes trop à la langue de m. joséphin péladan et qui eussent embarrassé des lecteurs mal car les mages ont cela de terrible que leurs œuvres sont ésotériques et ne veulent être comprises que des initiés. voici ces stances en prose : o chair calomniée, chair admirable et triste, étroite compagnonne de notre cœur dolent, dolente comme lui — plus que lui pitoyable, ô toi qui si tu n’es que d’un jour, si tu n’es que d’une heure, glorieux est ce jour, féconde cette heure... ce sont les yeux qui lisent les symboles avant l’esprit... ce sont les mains qui peinent et qui prient. ce sont les pieds qui montent. tu m’as faite malheureuse, dieu juste, fais-moi grande : le beau pour moi, c’est le salut. c’est affaire à m. péladan d’accorder la de la chair avec la doctrine qu’il professe. je n’ai qu’à signaler mélancolie de cette prose d’artiste et de poète. après la saison de bayreuth, adar et izel vont chercher à nuremberg les impressions du passé. là, dans cette ville où le temps semble s’être arrêté et qui montre intactes les formes de la vie familière et bizarre des aïeux, l’attitude d’izel n’exprime plus l’idéalisme le pur bronze florentin se déhanche comme ces figurines de dinanderie du siècle, qui, dans leur ingénuité font la joie des amateurs. une nuit, au clair de lune, comme il rêvait à sa fenêtre, le docteur sexthental a vu sur un mur l’ombre d’un joli bas de jambe, pendant qu’izel sa jarretière. il n’y a pas grand mal si l’on considère seulement l’âge et la figure du docteur, qui s’est desséché dans les bouquins. mais ce qui donne à l’aventure une gravité singulière, c’est que meister sexthental est un mage très puissant qui, maître des éléments, peut à son gré quitter son corps visible et « en corps astral » les murs les plus épais. or, l’ombre d’un pied sur le mur l’a d’amour. comme incube il satisfera sa passion. gn-sait qu’une fcmme ne peut pas se défendre d’un incube. izel succombe dans des brasinvisibles. désormais l’infâme docteur sex^ thentalestentreelle et cet adar qu’elle aimait si éperdument. je ne vous dirai pas comment adar trouve dans les sciences magiques le moyen de tuer l’incube aux pieds d’izel. ayant ainsi vengé son honneur, il croit avoir reconquis sa femme. mais l’occulte le possède tout entier. penché sans cesse sur ses fourneaux, il dans des recherches sans nom, la soif de connaître le dévore. izel délaissée se détache de lui. etranger à tout ce qui l’entoure, il l’œuvre, quand tout à coup il apprend qu’îzel, lasse de sa solitude et de son abandon, est prête à se donner à un amant dont elle est adorée. cette fois adar se réveille. il renonce à la science pour retourner à l’amour. il va s’efforcer de reconquérir izel, tandis qu’il en est temps encore. il invoque une dernière fois les esprits de l’air, que son art tenait asservis, mais c’est pour qu’ils l’aident à regagner cette épouse qu’il a perdue par sa faute, dont en ce moment il guette la venue et qu’il vient surprendre comme un amant furtif. je transcris cette magnifique invocation tout entière. la page est presque sans tache : o nature, mère indulgente, pardonne j ouvre ton sein eu fils prodigue et las. j’ai voulu déchirer les voiles que tu mets sur la douleur de vivre, et je me suis blessé au mystère... œdipe, à mi-chemin de deviner l’énigme, jeune faust, qui regrette déjà la vie simple et du cœur, j’arrive repentant, réconcilié, ô menteuse si douce ! fais ton charme, produis les mirages ; je viens m’agenouiller devant ton imposture et demander ma place de dupe heureuse. vous, forces sidérales ui m’avez obéi, ariels, mes hérauts, je viens vous élivrer. j’abdique le pentacle auguste du ma double étoile est éclipsée; vous êtes libroe, pnnmp.s, sylphes, ondins et salamandres. une dernière fois, servez: celui qui voua, lihèro, elémentals, larves de mon pouvoir 1 avant de vous dissoudre, un verbe, un verbe encore ! sylphes nocturnes, phalènes du désir, agacez- la du velours de vos ailes, celle qui va venir... rosée de minuit, humidité des fleurs, de l’eau, fluence du nuage et buée de la lune! o douce pollution de la nature en rêve, baptise de désir celle qui va venir ! cette invocation ne vous rappelle-t-elle pas les adieux de prospero au monde magique? «vous, elfes des collines, des ruisseaux, des lacs dormants et des bosquets... et vous, petits êtres, qui au clair de lune tracez en dansant des qui laissent l’herbe amère et que la brebis ne broute pas, et vous dont le passe-temps est de faire naître à minuit les champignons... lorsque je vous aurai ordonné de faire un peu de musique céleste pour opérer sur les sens de ces hommes, je briserai ma baguette de je l’enfouirai à plusieurs toises sous la terre, et plus avant que n’est encore descendu la sonde, je plongerai mon livre sous les eaux. » ces livres de m. joséphin péladan, il faut les prendre pour ce qu’ils sont, des féeries sans mais pleines de poésie. ces féeries parfois bien compliquées ; elles manquent de naïveté, de candeur, de bonhomie. c’est la faute de l’auteur qui est éloquent et à l’excès. c’est aussi notre faute. un mer-' veilleux plus simple nous semblerait insipide, et l’on nous ennuierait si l’on nous contait aladin, par exemple, ou les trois calenders borgnes	érotisme	1	1
presse	1890-01-10	1	1	Page1_Block24	1631	924	1139	1168	peuple ou qui ont mission de. lui parler, les bons usages'et les convenances veulent qu'ils chantent des hymnes devant l'arche, qu'ils dansent au besoin, tout en étant renseignés sur le vide du meuble sacré. il le sait bien, m. constans, ils le savent bien, tous ces danseurs du palais-bourbon, que leurs formules démocratiquex sont de pures apparences ; ils se rient dé la volonté nationale ; leurs génuflexions, dans les con cours agricoles, aux érections de statues, de vant les électeurs, ne sont que simagrées. comme ils les tournent en ridicule, dans l'in timité de leurs somptueux hôtels, ces mots cabalistiques qui sont pourlafrance, toujours généreuse, toujours confiante, synonymes d'émancipation et de bonheur. soit 1 mais on ne trompe longtemps un peuple avec des phrases et des attitudes. l'opinion comprendra bien vite que les prin cipes réels de cette majorité sont ceux qu'elle affecte dans ses actes publics. m. constans invente chaque semaine quelque façon de té moigner son mépris pour le suffrage univer sel ; peu lui importe ! il n'a souci que de sa fortune personnelle et va la compléter dans ce merveilleux gouvernement d'algérie. mais de ses clients, de tous <■ ns parlementaires dont il est le sauveur, le chef, la gloire, qu'ad- viendra-t-il ? bientôt le peuple voudra faire rentrer dans la pratique du gouvernement ces théories dé mocratiques, maîtresses du cœur de l'im mense majorité des français et dont nos ra- di'co-opportunistes ont fait des formules vides et, dans l'intimité, un objet de dérision. maurice barres.	érections	1	1
