work	date	issue	page	block	height	width	hpos	vpos	text	active_words	occurrences_words	unique_words
echodeparis	1896-02-28	1	2	Page1_Block2	5293	863	181	101	i obs qu'on voyait,à seulement les fixer, 1 battre des ailes et frémir dans leur corse let qui avait l'éclat dur et transparent, d'une pierrerie. et dans cette fête d'inten ses couleurs, le brodeur -de bêtes avait affirmé sa force de conception, son acuité dans le voir, le sentir et le souffrir par un symbolique combat dont lalégende brodée en un coin de la soie disait le sujet et qui s'intitulait : « la femme et le monstre ». imaginez, en un fond de val du pays jaune où court une rivière sous des pê chers en fleurs, un crépuscule mauve où flottent des poudres de brique rose et d'ardoise violette. le soleil rouge, sombre, et dans la terreur de la nuit qui s'ap- 'proclie la campagne est muette. de l'eau dormante où tremblent les reflets du ciel,- elle est sortie nue, la baigneuse dont les robes s'étalent parmi les roseaux de la rive. avant qu'elle ait pu les saisir, le monstre a surgi et déjà ses tentacules, sur sa chair, courent dans le mourant crépuscule où, par un bizarre efîet de perspective les ombres se lèvent, ils luttent, la f emme et lemonstke; elle, gracile avec son épiderme ombré de pâle or, ses tétins durs,, ses fines jambes. ses yeux ont peur, sa bouche qui semble sourire est crispée, son nez frémit. et lui, tout à la fois horrible et charmant, l'enlace souplement avec une force, câline et pa tente qui sait qu'elle vaincra. il la presse, l'amollit, la trouble. une sensualité dou- iaureuse s'éveille au fond de son effroi, fcar ee n'est pas pour la meurtrir qu'il a déployé, lui, ses mille bras menaçante, ses griffes carnassières. il la caresse, et la berce et rien de dur ne se lit aux ■replis de son visage qui semble un faciès d'homme étiré, aplati en forme d'éven tail et où des yeux s'ouvrent profonds et lumineux, vagues en ce moment de la langueur souffrante, du désir acre de pos session qui font trembler sa croupe et sa poitrine. il est haut, couleur d'ombre et ses tentacules s'enroulent maintenant au tour du féminin corçs en anneaux imbri- sables et doux. tout a l'heure ilsrouleront sur l'herbe. le soleil mort aura noyé dans l'eau assoupie son dernier reflet et, dans cet apaisement momentané des choses, e lle , qui aura, cédé, subira ces caresses du monstre et ses cris feront croire que, là-bas comme ici, la douleur et la volupté ; ne sont qu'une même chose : délicieuse, amère et triste. .... hélène acheva de ranger l'atelier, puis vint s'asseoir à la table de lewis, soageuse.tout près, on entendait le batte ment sourd d'un maillet de sculpteur dres sant une armature. les grelots d'un ca mion dans une. rue proche, sonnaillaient. assourdie, la voix d'un peintre chantant une romance norvégienne berçait la rêve rie dolente de madame hélène . —beau ciel crispé du soir orageux, le fjord pâle—t'offre, immobile et solitaire et irisle —comme un miroir ami à ion rêve désolé l le cœur navré, la jeune femme écou tait. sle songea ; .—c'est en vain..que je l'aime... il ne s'en apercevra jamais... quelle folie!.„ puis ses yeux: errèrent du plafond vitré aux murs et des murs à la table. quelques minutes, eile lutta contré la tentation de lire une lettre, un coquet chifion de papier : rose au monogramme d'or embaumant le liias. aia fin, die céda, lut. d'un bond, elle fut debout, indignée, en larmes 1 levris avait une maîtresse., sa meilleure amie à elle... henriette)... la naïve et jolie henriette qui lui témoignait tant de tendresse, recevait toutes ses confidences. — c'est par moi qu'il l'a connue... c'est affreux i... sanglotante, elle fut au divan, s'y cou cha. sa pauvre tête s'égarait. elle souffrait d'une de ces souffrances nerveuses -qui livrent au fouet cinglant de la douleur toutes les parcelles de l'être et, anéantie, il lui semblaitvoir les choses, autour d'elle, tournoyer et s'effondrer. cramponnée des deux mains au coussin sur lequel reposait sa tête, elle fit un effort pour dominer son trouble,.son malaise, se lever, appeler au secours. elle ne put, le soleil ardent qui du vitrage tombait sur le plancher semblait avoir pénétré. se3 veines et, mèléà son sang, courait par toute sa chair. elle n'eut plus conscience ni du liea ni de l'heure et, dans l'épouvante ■ d'une vision irréelle, se tordit :... — ....le monstre-était là qu'elle vou lait fuir, guetteur et sournois, feignant le sommeil. le sable sous ses pieds était fin. une brisé parfumée soufflait. le ciel s'arrandissait immense et tout autour d'elle il y avait de l'eaa, des herbes et des fleurs, puis plus loin quelques bouquets d'arbres. comme elle détournait les yeux, cher-, chsnt par où s'échapper, le monstre .s'a vança, tendit vers «lie-deux souples tenta cules. elle voulut crier, mais cet enlace ment lointain la charmait déjà, doux et humain comme^i des doigts eussent pris sa taille. remuée de désir et tremblante de peur, elle se débattait. sa résistance- devenait douloureuse, ses forces s'épui saient et le monstre, lui, s'acharnait, len tement faisait la conquête de sa chair, po sait sur sa bouche quelque chose de tiède et de frémissant qui ressemblait à des lè vres, et peu à peu elle le sentait s'appro cher, l'envelopper.. fondue en lui mainte nant, elle ne savait plus qui la possédait ni tru elle était. par tous ses nerfs, par toutes ses papilles, surhumainement, elle '	sensualité	1	1
gil_blas	1896-02-29	1	2	PAG_00000002_TB000007	468	1025	564	3175	partout et toujours des nudités en des poses voluptueuses décorent les murs, depuis la grande galerie à cheminée monumentale, au plafond z, peint, avec deux lustres de cristal, jusqu'aux parois de l'escalier imitant des treillages couverts de fleurs, aux boudoirs du premier étage, aux chambres du second, au cabinet de travail où il y a une nymphe, de baudry, et où travaillaient des secrétairesfemmes. hier encore miss milton.	voluptueuses	1	1
gil_blas	1896-02-29	1	3	PAG_00000003_TB000251	210	1023	1483	6980	qu'à présent et combien différent, hélas, de la couche basse,, voluptueuse où il trouvait hier encore une condescendante hospitalité !	voluptueuse	1	1
siecle	1896-03-01	1	2	Page1_Block21	5142	798	3478	1376	premières représentations vaudeville. ». manette salomon - pièce, . en neuf tableaux, tirée du rom an d'edmond e.t jules de concourt. . .. .  ; dans la galerie des femmes des ; goncourt parmi les renée mauperin, les soeurs philo- mène, les madàmes. gervaisais,.manette-salo-{ moir occupé line place à part. comme sa sœur en liitéràtnre marthe mancel, —' la m^ùvaisej créature q*ui mange la cérvelle et iléyorp le talent de saint charles t)einailly, journaliste et martyr, — edmond et jules' de : goncourt; l'ont fignolée cette manette, sécheuse de pein- tres. avec un luxe de détails, une perfection de ciselure ou il y a presque du' génie, u&ù il; y a du moins le géijie de la haine... _ , quelle haine ? --- la misogynie romanîiqijp, cette intime exécration de là femme comfnune à presque tpus les ^oùvrièrs dti .papier ,noirci,' dé 1820 à is70, c'ést ! -à-dirê peîà.daij t un plein demi-siècle,-mélange singulier composé d'élé ments disparates : un idéalisme très pur, une jalousie très vaine, la crainte des souillures matérielles, une colère envi^se contre la beauté réalisée, tangible, spontanée,, qui n'a qu'à paraître pour vaincre,'pour fdre oublier les plus admirables poèmes, pour éclipser.les madones les plus éthérése, les vénus les plus radieuses : enfin et surtout l'infatuation du mandarinat esthétique, l'idée fixe que le pro ducteur, * romancier, damaiurge, màsseur de 'glaise autour d'une armature en fil de fer ou videur .de vessies sur une toile apprêtée est un être à la fois délicat et -sacro saint ; que. les; femmes, doivent accepter sa tendresse avec,.un : respect ému, collaborer à ses manifestations voluptueuses .avec un recueillement inquiet, — et se dérober, s'évanouir au moment précis où, l'hygiène étant satisfaite, trop de bonheur -pourrait f riuiré à l'équilibre intellectuel. 1 des kleptomanes, des voleuses d'inspira-; tion, d'énergie, de volonté, que les misérables, exigences ds la nature ne permettent pas de' supprimer mais qu'il faudrait fouiller au sor-, tir dé l'alcôve et contraindre à des restitutions; cérébrales, telles appar'aisèent les - femmes' aux frères de goncourt qui ont poussé jusqu'à l'extrême, jusqu'à l'abstlrdë lë taisonnement .romantique. et marthe mancel mèné le lit térateur charles demailly ati cabanon par'de petits chemins qui ne sont pas semés de pri--. mevères; et manette salomon réduit au gâ-: tisme lé pèintre coriolis. elles sont rosses, comme on dit dans le répertoire moderne, d'une rosserie tragique, épique, presque in vraisemblable, rosses à mériter les traitements les plus sauvages, les épithètes les plus na turalistes. en vo,ulez-voua des sales bêtes? il n'y apas autre chose dans la féminité des gon court, j'entends la féminité qui s'humanise aveq ces, créatures surhumaines : le gendelet- tre ét le barbouilleur d« panneaux. ' ' • ' cette conception a- vieilli'. les* générations nouvelles, assèz égoïstes et intro-contemplati- ves, n'ont peut-être pas voué aux femmes'u'ne tendresse bien profonde. au moins trouve raienttelles puéril de ies haïr, de les maudire, de les traiter en dalilas coupeuses de criniè res. mais un ridicule révolu ne fait pas né cessairement une littérature périmée. si co riolis nous parait trop veule, manette salo mon, la juive réfléchie (d'ailleurs elle serait aussi bien catholique ou protestante ; la per sistance dans l'étroltesse de vues ne relevant d'aucune religion), ce bourreau méthodique, la femme qui asservit l'homme et l'annihile avec une àprete de comptable, reste une des fortes créations du roman moderne, et les di recteurs du vaudeville n'ont pas formulé? un problème indifférent eiv se demandant ce qu'elle donnerait au théâtre. —: voyons ce qu'elle a donné. * f premier tableau ; le labyrinthe du jardin des plantés.'personnages : le peintre corioiis, un créole, voluptueux et sentimental'; ëon confrère garnotéllev'ùn ficeletif adroit voué à la gloire 1 bourgeoise èt à l'institut ; son insé parable anatole,un vieux rapin resté fidèle à là blague; enfin un esthéticien amateur, chassa- gnol, qui rédige tout haut des articles pour « r.eyues graves ». on parle dessin, physiolo gie; peinture — et anatole montré aùx ba dauds le panorama de paris, du pied ' du cè dre de jussieu. de manette, pas un'mot; ? deuxième tableau : l'atelier de coriolis, manette vient de poser.. elle part, n'étant en core pour coriolis qu'un modèle. -arrivée d'anatole, de chassagnol et degarnotelle.on parle peinture, physiologie, anatomie. dé manette, un demi-inot : « tiens, la manette, le modèle ordinaire de buchelet... une jolie préparation. » ' troisième tableau : même décor. manette est devenue la maîtresse de coriolis, mais elle n'a pas voulu quitter son métier de modèle- or coriolistëxige toute à lui. il est crùëlle- m'ent jaloux des peintrès cliez qui elle va se déshabiller pour le bon niotif ; .il là supplie de ne plus poser; elle résiste, puis cède. « a une condition... il faut vous engager à deve nir très prochainement un grand, un 'très grand péintre...sinon,jè reprends ma liberté.» quatrième tableau : toujours; l'atelier.corio- lis est maintenant sinon un grând p'eintré', 'd.u moins un artiste cotéj pourtant manette né tient pas sa promesse^ elle va poser en ville, clandestinement.coriolis la surprend, scènes, reproches ; manëtté fait son; paquet pour s'en aller.''de ; son baluchon tbn^be un seqijin. coriolis rëconnait uné breloque qu'il à per due il y, a belle lurette. cétte croix de m'a mère .convertit. manette. :. « cë.vsequ}n jbli-l souvent,' î^ien sbu'véûf j'ai pensé' qïïé vêtait	voluptueuses	1	1
lanterne	1896-03-03	2	3	PAG_00000003_TB000036	413	1014	289	6167	.-sur un socle en velours grenat, légère, aérienne, lancée dans un envolement d'hirondelle, une danseuse en cire, les lèvres roses et souriantes, les yeux pénétrés d'une délirante langueur, les ailes du nez exprimant la sensualité et le plaisir, semblait tournoyer follement d'une valse frénétique, et sa taille fine et cambrée retenait à peine une jupe de gaze diaphane,	sensualité	1	1
gil_blas	1896-03-04	1	1	PAG_00000001_TB000169	452	1031	5696	4556	eh bien, il en faut rabattre, renan n'a pas eu de passions bibliographiques. il n'y a pas trace dans sa bibliothèque de sensualité intellectuelle ni même de simple fantaisie. ce n'est pas le chanoine, c'est le bénédictin qui l'a composée, ou plutôt c'est le petit sulpicien de jadis, grondé par ses professeurs d'être avec excès laborieux, comme s'il était besoin de tant de doctrine et d'habileté pour devenir un saint.	sensualité	1	1
siecle	1896-03-04	1	3	Page1_Block13	2512	794	978	4006	arsène h0ussaye sàthedij pour la dernière fois, nous avons gtfavi l'esealiermonumental de l'hôtel de l'ave- hué phê3lmî,tïumôincnroï[ 'sonmâîtrë sltait le 1 quïttër poûr jamais. malgré les tentures de dçuil-décorant lé seuil de ta porte ogivale, rétrécissant le large vèsli- bùle «ù le jour-pénétrait à peine, ta maison,- que. tant de joie avait animée dans les années écou lées, n'avait pas le sombre aspect des demeures désolées où la mort est entrée, farouche et crlielle, semant lés désespoirs indicibles et les douleurs éperdues. un recueillement silencieux et: doux était sur la foule qui se pressait dans les appartements ; -une tristesse apaisée, en face de cette mbrt hçureùse d'un vieillard heureux, et lai façade dè l'hôtel, avec ses hautes fenêtres aux. stores de %oie pftîe, avec ses émaux bleus et les fesïonè de-seulpture courant légèrement, le long dès corniches, conservait au milieu de' cet appareil funèbre, son cachet d'élégance distin guée fet fine, d'un temps disparu. • - à l'intérieur^ lés fleurs naturelles avaient em baumé i'air d'udi délicieux parfum où les lilas, lçfe roses, les. .vidlettes, les mimosas mariaient, leiirs aroifies. un charme d'une exquise douceur naissait de cet encens. et partout, sur les mar ches de llescalier, au tapis ouatant les pas, sur le$ parquets <dêé antichambres,-, sur les étoffes d^s meubles nlêmes, c'était une pluie de pétales tombés 1& [comme d^s .larmes odoriférantes et parsemant de notes tendres le chemin fleuri par ott -devait passer; une dernière fois ce grand amoureux pour qjii,les roses furent sans épines. . èt dans ia haîite galerie, où les stores légers laissaient' passer à flot la lumière, les grandes dalmes deâ autres'siècles dans leurs cadres fanés qiie les ans avaient noircis sans atténuer la fràlcheur de leur visage d'adorées des époques lointaines, les princesses, les marquises et les duchesses poudrées et mouchetées avaient dans lenrs prunelles un regard de douceur,semblait-il, pdur celui qui reposait là encore un instant près d'èlles, entre les hautes flammes des cierges, pdur ce poète qui avait fait revivre leur vi# de plaisirs et d'amours-, et dont les yeux,, si souvent, s'.étaient posés sur leurs yeux fixes, comme pour cherdhèr lë sëcrlt perdti de leiirs séductions. çùis, dans cette galerie souriante où tant dé fois je ni'étais trouvé, $on pas aux années loin taines, célébrées 1 par d'autres, où la vie de fête joyeuse éveillait l'écho sonore des lambris, mais plus récemment, en ces dernières années, silen- cièuses et douces, années de repos où le vieillard féyivait par 1 lit pensée les souvenir» d'une vie qui eh évoquait tant; j'eus tout à coup, brusque ment, la vision vitace de la dernière entrevue, il y a 'qûeéîues semaines ^ peine. ï'étaas'en admiration' devant là mervéilléùse? léda, mourântô de passion sous les baisers du cygne, cette toile voluptueuse et sensuelle qui forçait le regard, quand arsène houssaye était	voluptueuse	1	1
figaro	1896-03-05	1	1	Page1_Block17	4450	815	90	1400	• m. crispi est démissionnaire. mais il n'est pas encore certain qu'il se résigne à'abandonner le pouvoir. il cède à la pression des événements, mais il ne con sidère assurément pas chute comme définitive. ;  quelque éloignement que nous inspi- 'ypnt sa politique et ses procédés de gou vernement, nous ne pouvons nous dé- feodre id'-ùne sbrte d'admiration pour ce 1 ùtfëûr 'achar{i&,.dqtit tin désastre for midable n'àbat 'ni le courage ni la fierté. si cet homme audâoieux et plein de res-' sources avait été nais par lès destins à la tête, d'une nation /rjche de. traditions et d'épargne, s'il-âvâit occupé la place d'un gladstone ou,d'un bismarck, il eût .peut- être dominé monde ; en tout cas, il ejit essayé de-le b6uleverser.| . . ;get hommage rendu à la vigueur d'un tempérament exceptionnel, nous n'en sommes que. pluè à l'aise pour .flétrir et ppur dédiorer- les erreurs de sa politique- la responsabilité des.-événements d'hier, qu!on éssaye injustement de rejeter sur le général baratieri, lui incombe tout éntière et pour d,es raisons sans répli que. son système de suppression de ren seignements, de : falsification de dépê ches, son. incroyable dédain pour les rïianifesta,tions de l'opinion publique, font conduit à considérer une entreprise nationale comme une entreprise privée. l'aventure africaine était le coup de dés sur lequel se jouait l'avenir de sa dictature. il ne souffrait, pas d'intermé diaire entre lui et le destin. ,les ; journaux, même bassement asser vis, l'eussent éclairé par les observations da bon. sens, s'il avait souffert qu'on les renseignât, d'une façon-même discrète. le courant naturel du sentiment public se. serait établi entre son ministère et la masse souffrante du peuple italien, si des informations sincères avaient seule ment petmis de soupçonner la gravité dés situations que l'onîcachait. m. crispi ne, l'a pas compris, et c'est en cela sur tout qu'il est coupable, lui, l'ancien libé ral, l'ancien adversaire du système poli- paipiies-bôurton? ue r ^açles, luisi'ancien révblûtionriairé. 1 ; ■ pomme un joueur ^uiépuise jusqu'au bout les chances de sa fortune, il a ris qué, sur une opération militaire, non seulement l'existence du ministère qu'il préside, mais la popularité de la dynas tie de savoie. h'a perdu. les détails de la défaite sont encore plus navrants que nc*us ne l'imaginions hier : du corps im- pcfsant commaùdé par le général bara tieri, il ne re6te plus, à vrai dire, que des débris: qn n'exagère rien en affirmant que depuis la grande guerre de 1870, aucune'action militaire engagée, dans le monde, n'a eu ce développement et cette importance, m; crispi. a donc perdu.' mais va-t-il paysfr2cle: veut-il % le mot que m. de bfsmârclca appliqué, peut-être injuste ment,'à m. emile ollivier serait ici de ciïftohstance, si nous supposions à m. crisplun. cœur sensible, on pourrait lui dire qu'il ne trouvera jamais assez de 4aymesfcour déplorer le mal qu'il a fait à son pays. mais ce n'est pas un être senti- jnèntal. - la chambre italienne se réunit aujour d'hui. elle aurait à porter un jugement qqe tous les peuples d'europe ont déjà rehdui mais les intrigues de cet incorri gible conspirateur enveloppent déjà de léûr trame compliquée la conscience des députés qui sont appelés à se prononcer sur les faits et sur les hommes. il n'est pas sûr que lo roi, s'inspirant de l'inté rêt de la dynastie, fasse taire les scru pules,qui 1',ont porté, jusqu'à présent, à sqbir un ministre qu'il n'aime pas. wous assistons. , doiic au dernier acte d-ûn drame poignant dont le dénouement péut influer d'une manière décisive sur les destinées contemporaines de l'europe. c'est le sort de la triple alliance qui se décidera demain à montecitorio. quoi «qu'il én soit, les français n'ont pas à s'é- mpuvoir des décisions 1 qui seront prises. il leur suffit de ies surveiller. ; , pénis guibertj	pénis	1	1
